iso_code,title,description,pubDate
us,Caution And Care: A Book On V.D.; Social Responsibility Straightforward Descriptions ,,1980-12-22T05:00:00+0000
us,Providence Coach Decries 'Violent Aspects' of College Basketball; Princeton Days Recalled Wooden's Suggestion Supported First N.C.A.A. Game in Japan Bowie Paces Kentucky ,,1980-12-22T05:00:00+0000
us,Market Place; Technology Stock Strength ,,1980-12-22T05:00:00+0000
us,Iran's Terms: Price Is $460 Million for Each Hostage; No Valuation on Shah's Property $4 Billion 'Guarantee' Demanded,,1980-12-22T05:00:00+0000
us,No Tram Makes an Island Feel Unto Itself; Neighbors Exchange Rumors 'I Don't Think Outsiders Understand' Buses 'Totally Undependable' A Tramless Isle Feels Unto Itself ,,1980-12-22T05:00:00+0000
us,Only the Best Gold Items Selling Well This Year; Volatile Prices Only the Best Gold Items Selling Well This Year 'Nice Stocking Stuffers' ,,1980-12-22T05:00:00+0000
us,"Clippers 117, Pistons 97",,1980-12-22T05:00:00+0000
us,'BREAKER MORANT' ON THE MORALITY OF WAR,"''Scapegoats of the Empire'' is the title of a book by someone who survived the affair on which ''Breaker Morant,'' a new Australian movie with a dependably old-fashioned manner, is based. The drama takes place in 1901, in South Africa, at the end of the Boer War. The action is confined almost exclusively to a trial, the outcome of which is a fait accompli. The mood of it recalls military drama of the 1950's, like Terence Rattigan's ''Ross.'' In this case, the gears move almost automatically. There's nothing unexpected here, but neither are there omissions of anything an audience might anticipate. As based on Kenneth Ross's play, ''Breaker Morant'' is a shapely and orderly kind of drama. Its greatest strength is that it delivers what it promises. ",1980-12-22T05:00:00+0000
us,BRITISH COLUMBIANS DECIDE TO WITHHOLD A TAX FROM OTTAWA; 2 Companies Told Not to Pay Levy on Natural Gas--Wealth of the Provinces Is at Issue Move by Saskatchewan Possible British Columbia Moves to Withhold an Energy Tax From Ottawa Country Is Deeply Divided ,,1980-12-22T05:00:00+0000
us,Relationships; Trauma Of Holiday Family Gatherings ,,1980-12-22T05:00:00+0000
us,3 Cold Soldiers in Salvation's Service; In Training to Lead the Good Fight Concern Over 'Material Things' Salvation Has a Chilling Aspect Burning Devilish Effigies Brasses vs. the Brassy A Long Day Ends ,,1980-12-22T05:00:00+0000
us,15 Vehicles in Pile-Up on Coast,,1980-12-22T05:00:00+0000
us,Sports Today; FOOTBALL HARNESS RACING HOCKEY JAI-ALAI THOROUGHBRED RACING ,,1980-12-22T05:00:00+0000
us,New Police Complaint Unit In Chicacgo Quits in Quarrel; Criticism Was Immediate ,,1980-12-22T05:00:00+0000
us,"Princeton Conquers Colgate Five, 75-42",,1980-12-22T05:00:00+0000
us,Skepticism Over 'Peak' in Rates; Fall Last Week Yields No Clues Fall in Money Supply Not Enough Market Gains Last Week Questions About Depth of Drop ,,1980-12-22T05:00:00+0000
us,"Patriots Win, but Now Need Charger Loss; Field Goal and a Safety Other Possibilities ",,1980-12-22T05:00:00+0000
us,Article 2 -- No Title,,1980-12-22T05:00:00+0000
us,"Out-of-State Liquor Sales Rising, Connecticut Tax Aides Complain",,1980-12-22T05:00:00+0000
us,Hallie Caren Boorstyn Wed To Stewart David Friedman,,1980-12-22T05:00:00+0000
us,Obituary 5 -- No Title,,1980-12-22T05:00:00+0000
us,Radio; Music Talk Events/Sports ,,1980-12-22T05:00:00+0000
us,Text of the Iranian Response to the U.S. on Terms for Release of the Hostages; SECTION ONE STEPS TO BE TAKEN BY THE U.S. GOVERNMENT: SECTION TWO STEPS TO BE TAKEN BY THE GOVERNMENT OF THE ISLAMIC REPUBLIC OF IRAN ,,1980-12-22T05:00:00+0000
us,ABROAD AT HOME Ghosts,,1980-12-22T05:00:00+0000
us,Controversial Film Will Be Telecast,,1980-12-22T05:00:00+0000
us,Cheevers of Bruins Has Appendectomy,,1980-12-22T05:00:00+0000
us,Galicia Picks Autonomy But the Turnout Is Low,,1980-12-22T05:00:00+0000
us,Switch to Solar Heat Supported,,1980-12-22T05:00:00+0000
us,Fire in Vermont Capital Destroys State Offices and a Liquor Store,,1980-12-22T05:00:00+0000
us,Deserted Villages Are Testimony to Salvador's Woe; Villages Are Abandoned Carols in the Plaza Refugees Occupy Classrooms ,,1980-12-22T05:00:00+0000
us,Jury Acquits Ex-Georgia Official Of Slaying a Political Opponent,,1980-12-22T05:00:00+0000
us,"'GUARANTEES' ASKED; Iran Proposes U.S. Create a Bank Fund to Cover Frozen Assets New Element in Negotiations Unacceptable, Muskie Says TEHERAN'S DEMANDS COME TO $24 BILLION Liberals Are Isolated $10 Billion for Shah's Wealth 'We'll Keep Them 10 Years' Hostages Reported in Hotels ",,1980-12-22T05:00:00+0000
us,"They're Mass-Producing Hand-Painted Clothes; 50 Employed Steadily 50,000 Sasson Sweatshirts ",,1980-12-22T05:00:00+0000
us,"Pay Rise Called Dissatisfying Victory for U.S. Judges; Automatic Increases Rejected $120,000 for Chief Justice Increases in Resignations ",,1980-12-22T05:00:00+0000
us,More Java Slide Victims Found,,1980-12-22T05:00:00+0000
us,Rachelle Neuren Is Bride Of Bennett Jay Shatkin,,1980-12-22T05:00:00+0000
us,"Chiefs 38, Colts 28",,1980-12-22T05:00:00+0000
us,Afghans to Settle in U.S. With Help of New Rules,,1980-12-22T05:00:00+0000
us,Union Battling 'Tough Man' to Organize Perdue Chicken Pluckers; Country's Largest Union Teamsters' Efforts Rebuffed Perdue Sees 'No Effect Yet' High-Speed Production Lines Militant Workers Kept Out,,1980-12-22T05:00:00+0000
us,"The Dance: Mimi Garrard's Shapes, Props",,1980-12-22T05:00:00+0000
us,Export-Credit Talks Fail,,1980-12-22T05:00:00+0000
us,Seahawks 0-8 at Home,,1980-12-22T05:00:00+0000
us,Concert: 3 Presentations of 'Messiah',,1980-12-22T05:00:00+0000
us,Well Rid of a Meddlesome Law,,1980-12-22T05:00:00+0000
us,The City; Cuomo Discounts Running for Mayor Sanitation Chief Seeks Inspectors Goldin Audit Alleges Waste of Police Time Mental Test Ordered For Murder Suspect,,1980-12-22T05:00:00+0000
us,Duquesne Club Admits Woman Broker,,1980-12-22T05:00:00+0000
us,"Bucks 123, Rockets 91",,1980-12-22T05:00:00+0000
us,Weekend's Sales Level Is Weak; Key Shopping Period Shows Buyers' Caution 'Cut Down Everything' Weekend's Sales Level Is Weak Early Price Cuts ,,1980-12-22T05:00:00+0000
us,U.S. HOPES ARE DIM; Muskie Declares Terms Are 'Unreasonable'-- Impasse Reached Relations Would Be Restored MUSKIE SAYS DEMAND IS NOT ACCEPTABLE U.S. Proposals Described Foresees an End to Crisis Little Room for Flexibility ,,1980-12-22T05:00:00+0000
us,Norwegian Arrives in Moscow,,1980-12-22T05:00:00+0000
us,India Oil Accord,,1980-12-22T05:00:00+0000
us,The Cardiac Champions; The Cardiac Champions ,,1980-12-22T05:00:00+0000
us,Area Cleared as Truck Leaks Gas,,1980-12-22T05:00:00+0000
us,Around the Nation; 1 Dead and 7 Injured in Fire At Trapp Lodge in Vermont Lawyer for Iranian Student Hails Not-Guilty Verdict Labor Dept. to Modify Rules On Alien Medical Workers Leaders of Union Unhappy Over Pact With Continental ,,1980-12-22T05:00:00+0000
us,CORRECTIONS,,1980-12-22T05:00:00+0000
us,Iran Says Hostages Are in Hotels,,1980-12-22T05:00:00+0000
us,Outdoors: Nature Is A Christmas Gift,,1980-12-22T05:00:00+0000
us,Dec. 31 Jazz on Public Radio,,1980-12-22T05:00:00+0000
us,"The E.P.A. Gets Tough On Waste; E.P.A. Starts Enforcing Stringent Waste Rules Covers 100,000 Facilities Loop of Accountability Midnight Dumping ",,1980-12-22T05:00:00+0000
us,Weekly 'Lotto' Numbers Drawn,,1980-12-22T05:00:00+0000
us,Hussein Urges 'Fresh' U.S. View,,1980-12-22T05:00:00+0000
us,Rights Dispute Closes Musical,,1980-12-22T05:00:00+0000
us,U.N. Session's Feat: No Namibia Action; Notes on the U.N. ,,1980-12-22T05:00:00+0000
us,Gianettino Lands Boeing Computer,,1980-12-22T05:00:00+0000
us,EXECUTIVE CHANGES,,1980-12-22T05:00:00+0000
us,About Washington; Taking a Seat for a New Adventure ,,1980-12-22T05:00:00+0000
us,Loughery Resins as Nets' Coach and Aide Takes Over; MacKinnon In Charge of 12-23 Team 'Philosophical Difference' Loughery at Practice Loughery Quits as Nets' Coach Influence on Rules Players Praise Loughery Loughery's Coaching Record ,,1980-12-23T05:00:00+0000
us,BUSINESS Digest; Companies Markets International The Economy Today's Columns,,1980-12-23T05:00:00+0000
us,Tamco Enters Curtiss-Kennecott Fray; Curtiss-Kennecott: Tamco Enters Fray Kennecott Critical of Tamco Details of Tamco Offer,,1980-12-23T05:00:00+0000
us,Russians Assail Norway on Arms Stockpile; Aim Is to Give Norway's Viewpoint ,,1980-12-23T05:00:00+0000
us,"Tar Heel Freshman Sinks Knights, 71-64",,1980-12-23T05:00:00+0000
us,Output Cut Set For U.S. Autos,,1980-12-23T05:00:00+0000
us,Observatory Chief Is Asked to Resign,,1980-12-23T05:00:00+0000
us,U.S. TELLS OF WORRY OVER HOW HOSTAGES ARE BEING TREATED; SOME OF 52 MAY BE IN PRISONS State Department Moves to Rebut Iran's Assertion that Captives Are in Luxury Conditions Iranian Reports Are Contradicted U.S. Expresses Concern Over Hostages' Treatment Some Families Oppose Demand ,,1980-12-23T05:00:00+0000
us,Deere Increasing Tractor Production,,1980-12-23T05:00:00+0000
us,May and Prudential in Venture; Real Estate Holdings ,,1980-12-23T05:00:00+0000
us,FOREIGN AFFAIRS A Modest Success,,1980-12-23T05:00:00+0000
us,Nets Show Surprise At Move; No Contract Talk ,,1980-12-23T05:00:00+0000
us,Perkins Sees a Future As He Looks at the Past,,1980-12-23T05:00:00+0000
us,The Doctor's World; When Does Loss of Time Result in a Loss of Life?,,1980-12-23T05:00:00+0000
us,'Heaven's Gate' Is Re-Edited By Cimino for Future Re-Release; Shortens Some Scenes Based on Historical Incident,,1980-12-23T05:00:00+0000
us,Radio; Music Talk Events/Sports ,,1980-12-23T05:00:00+0000
us,Tie to Reagan May Win Koch a White House Key; Declines to Name Contacts ,,1980-12-23T05:00:00+0000
us,Sports Today; BASKETBALL HARNESS RACING HOCKEY JAI-ALAI THOROUGHBRED RACING ,,1980-12-23T05:00:00+0000
us,Jim Valvano: Return of a Native Son; His Heart's in New Rochelle Given Two Cars ,,1980-12-23T05:00:00+0000
us,CURRENCY MARKETS Dollar Declines Sharply On Falling Interest Rates,,1980-12-23T05:00:00+0000
us,Union Oil of Canada Faces Cash Squeeze,,1980-12-23T05:00:00+0000
us,"Haig, And Reagan's Mandate",,1980-12-23T05:00:00+0000
us,Israeli Cabinet Opposes Golan Annexation Move,,1980-12-23T05:00:00+0000
us,Flames Conquer Rangers; Lever Tallies for Flames ,,1980-12-23T05:00:00+0000
us,PRE-1956 HUNGARY LIKENED TO POLAND; Budapest Trade Union Official Sees Similar Disregard by the Party for Needs of the Workers Previous Polish Unrest Recalled Some Autonomy Gained After '56 Locomtive Plant Converted ,,1980-12-23T05:00:00+0000
us,Leaders Pay Homage at Kosygin's Bier; Homage Counteracts Speculation Swept Clean for Politburo ,,1980-12-23T05:00:00+0000
us,Life on St. Helens,,1980-12-23T05:00:00+0000
us,"Hondurans Chafe as Graft, but Little Else, Thrives; If Election Resolves Nothing Bypassed by Political Violence No Issue in Corruption Militant Students Splintered ",,1980-12-23T05:00:00+0000
us,American Selects New Pratt Engine,,1980-12-23T05:00:00+0000
us,$60 Million Lent To Pacific Gas Co.,,1980-12-23T05:00:00+0000
us,Wells Fargo Bank Cuts Prime to 20 % From 21%,,1980-12-23T05:00:00+0000
us,Norfolk & Western Files Takeover Bid,,1980-12-23T05:00:00+0000
us,Obituary 2 -- No Title,,1980-12-23T05:00:00+0000
us,Science Watch; Puffin Prospects Improve Balloon Aids Weather Watch Attractively Matched Pairs ,,1980-12-23T05:00:00+0000
us,Soprano: Regine Crespin,,1980-12-23T05:00:00+0000
us,"Fire Safety in New Buildings; Expense of Firefighting Devices, Combustibility Of Interior and Lax Codes Are Called Obstacles News Analysis Cutting Corners Recent Fires Raise Issue of Building Safety Rigorous Model Code Smoke and Toxic Fumes How Intake System Works",,1980-12-23T05:00:00+0000
us,Bridge:; Seedings by Players Prove Accurate in Regional Event Psychic Bid Overcome ,,1980-12-23T05:00:00+0000
us,The Cabinet Christmas Tree,,1980-12-23T05:00:00+0000
us,"'AYATOLLAH' PATROL IS WELCOMED HOME; 6,000 Greet Nuclear Battle Group in Norfolk as Vessels Return From Indian Ocean Duty 'A Merry Christmas' Role in Iranian Crisis ",,1980-12-23T05:00:00+0000
us,Tarnower Witness Bolsters Case Against Fight for Gun; Questioned About Distances Partial Disagreement Witness in Tarnower Trial Bolsters Case Against Struggle for Weapon Other Shots Accounted For ,,1980-12-23T05:00:00+0000
us,Cooper Increases Crouse-Hinds Bid,,1980-12-23T05:00:00+0000
us,COMMODITIES Grain Closes Mixed; Cotton Futures Rise; Cotton Prices Rise Spot Commodity Index,,1980-12-23T05:00:00+0000
us,BRIEFS,,1980-12-23T05:00:00+0000
us,The U.N. Today; GENERAL ASSEMBLY,,1980-12-23T05:00:00+0000
us,Donors Increase Amount of Gifts To Help Neediest Fight Inflation; A $50 Increase HOW TO AID THE FUND,,1980-12-23T05:00:00+0000
us,Guests in Eglevsky 'Nutcracker',,1980-12-23T05:00:00+0000
us,Avalanche Kills 2 in France,,1980-12-23T05:00:00+0000
us,CORRECTIONS,,1980-12-23T05:00:00+0000
us,2 S.I. Fugitives Recaptured,,1980-12-23T05:00:00+0000
us,Patrick To Coach All Year; Team Has Right to Know Patrick Coach for Season A Gold-Medal Team,,1980-12-23T05:00:00+0000
us,Viruses Lurking in Cells Suspected as Cause of a Host of Diseases; Hidden Viruses Suspected in Host of Diseases The Dementia of Aging A New Crop of Virus Particles ,,1980-12-23T05:00:00+0000
us,"Virginia 103, Baltimore 62",,1980-12-23T05:00:00+0000
us,Songwriter Royalties To Rise; Record Concerns Protest Decision Royalties Now 6% of Costs ,,1980-12-23T05:00:00+0000
us,United Nations Jeane Jordan Kirkpatrick; Carter Policy Called Unclear Effort to Reclaim Party Doctorate on Peronist Movement ,,1980-12-23T05:00:00+0000
us,Seafood Union Indicted for Payoffs,,1980-12-23T05:00:00+0000
us,G.M. Cuts Car-Loan Rate,,1980-12-23T05:00:00+0000
us,Port Policeman Is Slain in Jersey By Man He Asked Not to Smoke; Wearing Bulletproof Vest Policeman Slain in Jersey City in Fight on Smoking ,,1980-12-23T05:00:00+0000
us,EARNINGS,,1980-12-23T05:00:00+0000
us,Future Missile 'Boom Towns' Alarm Utah Residents; MX 'Will Destroy This Culture' 'Sponge' for Nuclear Attack 'All the Toys' They Can Buy 'People Think It's Un-American' ,,1980-12-23T05:00:00+0000
us,Crocker's Holders Clear Midland Bid,,1980-12-23T05:00:00+0000
us,Energy James Burrows Edwards,,1980-12-23T05:00:00+0000
us,Output of Steel Drops by 1.6%,,1980-12-23T05:00:00+0000
us,Syrians Fight Lebanese Christians for the Second Day East of Beirut,,1980-12-23T05:00:00+0000
us,COMPANY NEWS A. & P. Posts Loss; Beatrice Net Up 5.2%; Beatrice Foods ,,1980-12-23T05:00:00+0000
us,Interior James Gaius Watt; Opposition to Selection ,,1980-12-23T05:00:00+0000
us,Bush Makes Appeal to Minorities,,1980-12-23T05:00:00+0000
us,I.B.M. Discloses Protest,,1980-12-23T05:00:00+0000
us,French Defense Minister Named,,1980-12-23T05:00:00+0000
us,Obituary 5 -- No Title,,1980-12-23T05:00:00+0000
us,Agriculture John Rusling Block; An International Role Took Over Farm in 1960 Farming Runs in Family Early Appointee of Governor ,,1980-12-23T05:00:00+0000
us,Dividends,,1980-12-23T05:00:00+0000
us,"Jeane Kirkpatrick on Democracy and Foreign Policy; Creating Democracy Carter's Foreign Policy Autocrats, Right and Left Third World Policy On Being a Democrat On the Republican Party Latin America ",,1980-12-23T05:00:00+0000
us,"Erhardt, Patera Given New Pacts",,1980-12-23T05:00:00+0000
us,"Duke 88, Pennsylvania 82",,1980-12-23T05:00:00+0000
us,Advertising; Avenue To Cross The Nation Meredith's Autry Moves To the Business Side Smith/Greenland Lands Ovaltine Products Account Arthur Kramer Secures Part of the Nikon Business Soap Opera Digest Family Circle Book Unit To Supply Cable TV Series Auditors Promoting Importance of Audits Children's TV Series Is For Sale or Barter People ,,1980-12-23T05:00:00+0000
us,Incomes Keep Pace With Prices; Massachusetts Settles With U.S. In Dispute Over Offshore Drilling Argument for More Protection Marine Sanctuary Designation ,,1980-12-23T05:00:00+0000
us,Voluntary Agencies' Anti-Hunger Role,,1980-12-23T05:00:00+0000
us,General Instruments Net,,1980-12-23T05:00:00+0000
us,Obituary 3 -- No Title,,1980-12-23T05:00:00+0000
us,World Gold,,1980-12-23T05:00:00+0000
us,Don't Recognize Hanoi,,1980-12-23T05:00:00+0000
us,EDUCATION Coaching On S.A.T.'s May Mean Up to 20 Points; Coaching on S.A.T May Mean 20 Points Higher Increases Noted A 50-Hour 'Plateau' Critics Suggest Name Change ,,1980-12-23T05:00:00+0000
us,Crime Termed 'Berserk' in Miami; Refugees and Drugs Blamed in Part; Crime Is Said to Have 'Gone Berserk' in South Florida Numerous Reasons Billion-Dollar Drug Traffic Unemployment and Poverty Police Recruitment Problems ,,1980-12-23T05:00:00+0000
us,Stage: Tragedy and Fable From Depression Era; Slayers of Goliath Evil and the System ,,1980-12-23T05:00:00+0000
us,Theater: Classic 'Front Page' Revived; A Reporter's Dream ,,1980-12-23T05:00:00+0000
us,Housing and Urban Development Samuel Riley Pierce Jr.; Frequent Choice of G.O.P. A Search by Reagan Aides Background as Republican,,1980-12-23T05:00:00+0000
us,News Summary; International National Metropolitan,,1980-12-23T05:00:00+0000
us,Dukes in Lead of 'Frankenstein',,1980-12-23T05:00:00+0000
us,"Market Place; Cooper, Crouse And Internorth ",,1980-12-23T05:00:00+0000
us,Obituary 1 -- No Title,,1980-12-23T05:00:00+0000
us,U.S. SETTLES DISPUTE OVER OFFSHORE OIL; Pact to Allow Exploration and Save Georges Bank Fishing Ground Personal Incomes Rise ,,1980-12-23T05:00:00+0000
us,NOTES ON Fashion; Ralph Lauren Has New Line: 'Roughwear' ,,1980-12-23T05:00:00+0000
us,Dance: Movement Research in Concert,,1980-12-23T05:00:00+0000
us,Quit the Haggling With Iran,,1980-12-23T05:00:00+0000
us,Around the World; Peking Paper Blames Mao For the Cultural Revolution Opposition Parties in India Assail Arrests of Politicians President of New Junta Installed in El Salvador Marcos Orders Abolition Of Military Tribunals Lisbon Leader Designates A New Prime Minister ,,1980-12-23T05:00:00+0000
us,Rozelle Seeks Ways To Break Deadlocks,,1980-12-23T05:00:00+0000
us,Jim Walter Net Off,,1980-12-23T05:00:00+0000
us,Letters; Portman's Christmas Present Misguided Threats To 'Punish' Moscow Perilous False Ceilings Our Questionable Transport Advances Let Student Power Protect the Schools Wrong Weapon to Fight Inflation D'Amato in Action The Authenticity and the Integrity of John Lennon's Protest ,,1980-12-23T05:00:00+0000
us,Iraq Is Reporting Seizure of Third Of Iran Oil Area; Official Maps Show Troops In Province of Khuzistan Bridge Attacked During Crossing Iraqi Maps of the Front ,,1980-12-23T05:00:00+0000
us,Jack Cole's Growing Bookstore Empire; Canada's No. 1 Chain Setting Sights on U.S. Chain Does Not Advertise U.S. Locations Harder to Find ,,1980-12-23T05:00:00+0000
us,Warning Issued on Oxygen Kits,,1980-12-23T05:00:00+0000
us,Pope Asks for Hostages' Release But Does Not Specify Americans,,1980-12-23T05:00:00+0000
us,Iranian Renews Threat of Trials For the Hostages; Official Warns of Action if U.S. Balks at Demands No Official Response Received IRAN SAYS HOSTAGES COULD FACE TRIALS Terms Initially Set by Parliament ,,1980-12-23T05:00:00+0000
us,Seagram Gets Cash For Takeover Bids,,1980-12-23T05:00:00+0000
us,The City; Groug in Bombing An Unfamiliar One Three Men Indicted In Banker's Murder Boulevard Proposal Gains Support ,,1980-12-23T05:00:00+0000
us,About Education; 'Elitism' Charged In Debate Over Washington School ,,1980-12-23T05:00:00+0000
us,"Brown, Carey's Counsel, Quitting To Return to State Court Bench; Praise Is Reciprocated ",,1980-12-23T05:00:00+0000
us,O.E.C.D. Sees Eased Recession; O.E.C.D. Sees Recession Easing in First Half of '81 ,,1980-12-23T05:00:00+0000
us,BUSINESS PEOPLE; President at Sprague Given Second Post Chief Executive's Duties Added For American Cigar's President Sikorsky Executive Gets New Assignment ,,1980-12-23T05:00:00+0000
us,GOING OUT Guide; SING FOR SUPPER HOUSE CALL GIVEAWAY ,,1980-12-23T05:00:00+0000
us,Car Buyers Find Prices a Shock; Shrunken Discounts Car Buyers Find Prices a Shock Uniform Discounts the Goal ,,1980-12-23T05:00:00+0000
us,City Negotiating To Keep a Plant For South Bronx,,1980-12-23T05:00:00+0000
us,Teamster Group Warns Of Presser-Reagan Link,,1980-12-23T05:00:00+0000
us,"Robert E. Kintner, Ex-Head of ABC and NBC, Dies; Produced Growth in Companies Father Was an Educator War Ended Partnership Joined Johnson Administration",,1980-12-23T05:00:00+0000
us,Shipping/Mails; OUTGOING,,1980-12-23T05:00:00+0000
us,Obituary 6 -- No Title,,1980-12-23T05:00:00+0000
us,3 Men Stabbed to Death On Streets in Midtown,,1980-12-23T05:00:00+0000
us,4 Children Are Killed In 2 Blazes at Homes As Parents Are Away; Apparently Not Arson,,1980-12-23T05:00:00+0000
us,Chrysler Union Rejects Pay Freeze; Plans Talks With U.S. Loan Board; Chrysler Union Bars Pay Freeze Cuts for 'K' Car Due ,,1980-12-23T05:00:00+0000
us,JAPAN ARMS BUDGET IS SHY OF U.S. HOPE; Washington Had Sought Increase Big Enough to Finish 5-Year Program 12 Months Early Strong Pressure From the U.S. American Pressure Resented ,,1980-12-23T05:00:00+0000
us,Falcon Tickets Sold Out,,1980-12-23T05:00:00+0000
us,Money,,1980-12-23T05:00:00+0000
us,727's Mysterious Cross-Country Flight Ends on L.I.; Mysterious 727 Turns Up at an L.I. Airport ,,1980-12-23T05:00:00+0000
us,Obituary 4 -- No Title,,1980-12-23T05:00:00+0000
us,"Fairfield 65, Seton Hall 63",,1980-12-23T05:00:00+0000
us,Television,,1980-12-23T05:00:00+0000
us,Q&A,,1980-12-23T05:00:00+0000
us,Symphony Space Concert To Offer Chamber Music,,1980-12-23T05:00:00+0000
us,"Chargers Beat Steelers, Win Division Title; Fouts Tops 300 Benirschke Ties Club Mark",,1980-12-23T05:00:00+0000
us,Dressing Up and Staying at Home; Doing Double Duty A Delicate Print ,,1980-12-23T05:00:00+0000
us,Nissan Tie With VW,,1980-12-23T05:00:00+0000
us,EXECUTIVE CHANGES,,1980-12-23T05:00:00+0000
us,"Notes on People; Princeton Past and Present, but Not Future for Goheen A Christmas Recipe Favored by Henry VII Mitch Miller to Return to Television G.O.P. Keeps Javits Suite Another Reagan's Plans ",,1980-12-23T05:00:00+0000
us,A Thousand Knitters Flourish; More Classic Types ,,1980-12-23T05:00:00+0000
us,"Ben Weingart, Focus of a Battle In Court on Saving His Life, Dies",,1980-12-23T05:00:00+0000
us,Trustee Named in School Dispute; To Oversee Annex Closing Court Action May Be Sought ,,1980-12-23T05:00:00+0000
us,Sonatrach Sets British Deal,,1980-12-23T05:00:00+0000
us,Sports of The Times; Ferragamo And His War With The Rams ,,1980-12-23T05:00:00+0000
us,A CABINET DESIGNEE TELLS OF OLD INQUIRY; Donovan Says Company's Records Were Checked by Federal Jury ,,1980-12-23T05:00:00+0000
us,Israelis Protest 'Unfriendly Act' Of U.N. in Allowing Hunger Strike,,1980-12-23T05:00:00+0000
us,Town in Poland Wins Meat Ration Increase After Workers' Sit-In,,1980-12-23T05:00:00+0000
us,Books of The Times; Animated Cartoon Playing the Game ,,1980-12-23T05:00:00+0000
us,Events Today; Theater Music Dance Cabaret ,,1980-12-23T05:00:00+0000
us,Obituary 7 -- No Title,,1980-12-23T05:00:00+0000
us,"When Art Imitates Life, Controversy Arises in Art and Legal Circles; A Rare Case Reproduction in a Magazine 'It's an Immediate Issue' ",,1980-12-23T05:00:00+0000
us,Public-Private Enterprise,,1980-12-23T05:00:00+0000
us,Excerpts From News Conference With Reagan's Cabinet Choices,,1980-12-23T05:00:00+0000
us,"After 150 Years Of Discovery, Royal Society Still Expands Its Horizons; At 150, Royal Society Expands Group Began With Dinners Relics Are Displayed ",,1980-12-23T05:00:00+0000
us,Strike on West Bank Continues,,1980-12-23T05:00:00+0000
us,"Notre Dame 69, Valparaiso 56",,1980-12-23T05:00:00+0000
us,Theater: A Caribbean 'Marriage Proposal'; A Caribbean Chekhov ,,1980-12-23T05:00:00+0000
us,Corporate Reports,,1980-12-23T05:00:00+0000
us,Tax Ruling On Banks Draws Fire; Tax-Exempts as Collateral ,,1980-12-23T05:00:00+0000
us,Doctors Learn Respect For the Money Cure,,1980-12-23T05:00:00+0000
us,"Staten Island 86, Queens 71",,1980-12-23T05:00:00+0000
us,Christmas Myths Possess Potent Magic for Children; Christmas Myths Hold Potent Magic for Children Changes With Fortunes ,,1980-12-23T05:00:00+0000
us,Talking Business; New Approach To Hierarchy ,,1980-12-23T05:00:00+0000
us,Waste Management To Acquire EMW,,1980-12-23T05:00:00+0000
us,Directors Approve A.F.C. Buy-Out,,1980-12-23T05:00:00+0000
us,Letter: On American Trade; Erosion of U.S. Competitiveness Abroad ,,1980-12-23T05:00:00+0000
us,"BLACK AND A WOMAN ARE AMONG 5 NAMED TO REAGAN CABINET; PIERCE IS CHOSEN H.U.D. CHIEF Dr. Kirkpatrick for U.N., Edwards, Watt and Block for Energy, Interior and Agriculture Prominent Candidates Not Chosen Haig and Donovan in Attendance Woman and a Black Are Among 5 Additions to Reagan's Cabinet No Culpability, Haig Asserts Block News Conference Tomorrow Experience in Nuclear Energy Best for the Money Is Goal ",,1980-12-23T05:00:00+0000
us,Niatross Transfer Upheld By N.J. Supreme Court,,1980-12-23T05:00:00+0000
us,Three Buy Block Of Filmways Stock,,1980-12-23T05:00:00+0000
us,Spanish Area Votes Unenthusiastically for Home Rule; 71 Percent Favor Home Rule ,,1980-12-23T05:00:00+0000
us,Satellite Photograph,,1980-12-23T05:00:00+0000
us,Loss of Aid Threatens Project to Save Brooklyn Jewish; Says Deficit Has Not Been Cut ,,1980-12-23T05:00:00+0000
us,Leftist Guerrillas in El Salvador Attack Military Base Near Capital,,1980-12-23T05:00:00+0000
us,"A Troubled Season in Toyland; Heated Rivalry, Buyer Caution Depress Profits Electronic Games A Troubled Season for Toy Makers From $25 to $9 No Trust in Talking Machines ",,1980-12-23T05:00:00+0000
us,View From the Lab: Prospects Are Glum; For Engineers Glum View From the Engineering Lab Demand-Pull Enrollments ,,1980-12-23T05:00:00+0000
us,Dow Soars 21.59 on Cut In Prime; Wells Fargo at 20 %; Bill Rates Fall; Bonds Gain Prime Rate Defined Dow Soars 21.59 on Cut in Prime ,,1980-12-23T05:00:00+0000
