iso_code,title,description,pubDate
us,Officials Suspect 2 Casino Unions In Jersey Have Underworld Ties; Control by Crime Feared Officials Suspect Two Casino Unions in Jersey Have Links to Organized Crime 'Back Door' Vulnerable Union Official Convicted Union Chief Defends Aides Local 30 Linked to Crime Unionist Guilty of Assault Union Posts Held Legally ,,1980-12-01T05:00:00+0000
us,Radio; Music Talk Events/Sports ,,1980-12-01T05:00:00+0000
us,Books of The Times,,1980-12-01T05:00:00+0000
us,Marin County Aid Group Looking Past Golden Gate; Children of Divorced Parents Faculty Sabbatical Program,,1980-12-01T05:00:00+0000
us,Obituary 2 -- No Title,,1980-12-01T05:00:00+0000
us,"Nets Beaten by Sonics, 113 to 89",,1980-12-01T05:00:00+0000
us,ABROAD AT HOME Another Noble Cause?,,1980-12-01T05:00:00+0000
us,"Arthur Meyer Brandel, 67, Dead; Ex-Correspondent for The Times",,1980-12-01T05:00:00+0000
us,Auto Exports Slow in Japan,,1980-12-01T05:00:00+0000
us,Boxer Collapses in Vegas Fight,,1980-12-01T05:00:00+0000
us,Toronto Financier: Quietly Profitable; Toronto Financier: Quietly Profitable Profitable Holdings ,,1980-12-01T05:00:00+0000
us,Obituary 4 -- No Title,,1980-12-01T05:00:00+0000
us,Obituary 1 -- No Title,,1980-12-01T05:00:00+0000
us,"Build for Safety, Car Makers Urged; Attitude on 'Ceilings' ",,1980-12-01T05:00:00+0000
us,"U.C.L.A., in a 94-81 Victory, Impresses Losing Notre Dame Coach; Sanders and Foster Stand Out A Surge by Oregon State Indiana, Ohio State and Iowa Win Decided to Hold Him Out Syracuse Defeats Columbia",,1980-12-01T05:00:00+0000
us,Marriage Announcement 3 -- No Title,,1980-12-01T05:00:00+0000
us,Treasury Financings Set; TAXABLE TAX-EXEMPT ,,1980-12-01T05:00:00+0000
us,Relationships; Imagining How You'd Feel as the Other Sex ,,1980-12-01T05:00:00+0000
us,Piano Recital: Barenboim,,1980-12-01T05:00:00+0000
us,Stake: 'Perfectly Frank' Hails Loesser; A Mam and His Music ,,1980-12-01T05:00:00+0000
us,"Bethpage High Wins Football Title, 32-21",,1980-12-01T05:00:00+0000
us,Television,,1980-12-01T05:00:00+0000
us,"FEW FACES ARE LEFT FROM 'CLASS OF '65'; Big Group of Democrats Who Won Congressional Seats in 1964 Has Now Dwindled to 12 12 Remain in 97th Congress 'A Great Sense of Direction' 'Now, It's Far More Complex' Cabinet Post and Governorship ",,1980-12-01T05:00:00+0000
us,Mideast Children's Art,,1980-12-01T05:00:00+0000
us,Letters; The Trouble With a U.S. Assault on Rent Control How Insurers Invite Arson What Conservatives Think of Women To Combat Recidivism Reagan's Timely Message for Seoul When American Church Leaders Buttress P.L.O. Terrorism ,,1980-12-01T05:00:00+0000
us,"Quietly, She Makes History as a Caribbean Leader; Oratorical Skills Pay Off Attack and Counterattack ",,1980-12-01T05:00:00+0000
us,NATURAL GAS ROUSES OPTIMISM ON OUTPUT; But Skeptics Doubt Future Supply as Pricing Conflict Builds Up Natural Gas Stirs Optimism; Skeptics Question Availability Other Sources of Fuel Decline of Gas Reserves Gas Found in Many Regions Looking Toward Final Year ,,1980-12-01T05:00:00+0000
us,Pro Soccer Owners Seek to Consolidate; Move in Right Direction Three Franchises Are Moved ,,1980-12-01T05:00:00+0000
us,"Sabres 4, Rockies 1",,1980-12-01T05:00:00+0000
us,"Outdoor: Tolstoy, for the Hunter Who Has Everything",,1980-12-01T05:00:00+0000
us,Jersey to Get Analysis Of Toxic-Waste Drums,,1980-12-01T05:00:00+0000
us,Body of a Young Woman Is Found Washed Up on Long Island Beach,,1980-12-01T05:00:00+0000
us,Marriage Announcement 4 -- No Title,,1980-12-01T05:00:00+0000
us,Drug Smuggling Surges on Gulf Coast; Many Miles to Patrol More Automatic Weapons ,,1980-12-01T05:00:00+0000
us,Confusing Phone Calls Replayed From Night of Tarnower Murder; Jealous Act or Accident? Heard Sound of Shot Another Call Coming In ,,1980-12-01T05:00:00+0000
us,Around the Nation; U.S. Official Urges Suit Over Charleston Schools Bodies of 4 Hikers Found Near Trail in Coast Park Bay State Legislature to Get Plan to Avert Transit Halt Black Hebrew Sect Is Said To Be Suspected in Thefts,,1980-12-01T05:00:00+0000
us,"College Football Season Rated High, but With Unsavory Echo; No Punishments Announced Honor Student in High School Bryant and the Tide Faust Replaces Devine U.C.L.A. Triumphs In Mirage Bowl, 34-3 ",,1980-12-01T05:00:00+0000
us,Chargers Upset Eagles,,1980-12-01T05:00:00+0000
us,"Sports News Briefs; Miss Heiden's Mark Eclipsed in Norway Miss Mandlikova Wins Aussie Title Buehning Topples Vilas by 7-6, 6-4 Mayer Takes Final Japanese Gymnast Wins 4 of 6 Events ",,1980-12-01T05:00:00+0000
us,Dave Anderson The All-Pro In a Shadow,,1980-12-01T05:00:00+0000
us,New-Car Supplies Build Up; Supply of Subcompact Cars Builds Up ,,1980-12-01T05:00:00+0000
us,Farm Product Prices Higher,,1980-12-01T05:00:00+0000
us,The Region; 39 Pickets Arrested At Nursing Home L.R.S. Investigating Claims of Exemption L.I. Man Arraigned On a Murder Charge Mrs. Grasso Finishes One Part of Therapy Marchers Oppose Toxic-Waste Plant ,,1980-12-01T05:00:00+0000
us,The U.N. Today; GENERAL ASSEMBLY ,,1980-12-01T05:00:00+0000
us,Unfinished Transportation Bills,,1980-12-01T05:00:00+0000
us,Reagan's Brain Trust: Font of Varied Ideas; Unofficial Brain Trust Reagan Brain Trust Draws on Font of Varied Ideas The Enemy Is 'Them' ,,1980-12-01T05:00:00+0000
us,Indigent Mexicans Ready Source for Plasma Clinics at Texas Border; Hospitals Pay $20 a Pint 'Not Our Problem' No Certain Hepatitis Test The 'Border Draculas',,1980-12-01T05:00:00+0000
us,"In Spite of the War, Complex Ties Bind Iranians and Iraqis; Diplomats Trailed by Officers Overland Traffic Continues ",,1980-12-01T05:00:00+0000
us,Securities Group Leader,,1980-12-01T05:00:00+0000
us,GOING OUT Guide; HOME SWEET HOME NATURE ON PARADE ,,1980-12-01T05:00:00+0000
us,"Bulls 122, Lakers 108",,1980-12-01T05:00:00+0000
us,"ITALY ENDS SEARCH FOR THE SURVIVORS; Quake Teams Now Stress Shelter, Clothes and Food for Victims Firemen Searching for Bodies Italians End Search for Quake Survivors and Stress Aid for the Homeless Family of 7 Sleeping in Car ",,1980-12-01T05:00:00+0000
us,Tax Relief Plan Is Said to Benefit Luxury Housing; Goldin Calls for Limiting Residential Abatements Urges Shift in Concentration Loss of Commercial Space Noted Goldin Calls Use of Tax-Relief Plan For Luxury Housing 'Troublesome' Manhattan Leads in Conversions Expanded Over the Years ,,1980-12-01T05:00:00+0000
us,Shipping/Mails; OUTGOING ,,1980-12-01T05:00:00+0000
us,Satellite Photograph,,1980-12-01T05:00:00+0000
us,To Protect the Abused,,1980-12-01T05:00:00+0000
us,"Steelers Defeat Dolphins, 23-10; Bahr Kicks Three Field Goals Blount Returns Fumble 33 Yards Steelers Statistics ",,1980-12-01T05:00:00+0000
us,"Vikings 23, Saints 20",,1980-12-01T05:00:00+0000
us,Pauline N. Landau Becomes a Bride,,1980-12-01T05:00:00+0000
us,Maintaining a Minimum,,1980-12-01T05:00:00+0000
us,"Paul W. Connelly 3d, an Executive Of Investment Banking Concern",,1980-12-01T05:00:00+0000
us,COMPANY NEWS Ashland's Future May Not Be in Oil; Competitive Edge Sought In Diversity Specialized Products Changing Situation Internal Shifts ,,1980-12-01T05:00:00+0000
us,A.G.O.P. Leader Cites Practicality Of 'Jewish Seat'; Clark Weighs Strategy for Race Against Moynihan 'Deciding Vote' in Elections ,,1980-12-01T05:00:00+0000
us,Police in an Indian State Accused of Blinding Prisoners; 'We Will Not Spare You' ,,1980-12-01T05:00:00+0000
us,Cabaret: Billy Daniels at Marty's,,1980-12-01T05:00:00+0000
us,"Bucs 20, Packers 17",,1980-12-01T05:00:00+0000
us,"The City; Cardinal Announces New War on Drugs Bronx Boy, 15, Held In Four Project Fires 14 Injured in Fire",,1980-12-01T05:00:00+0000
us,"Rams Get 510 Yards, Routing Jets by 38-13; Jets Routed by Rams Jets-Rams Summary Jets Statistics ",,1980-12-01T05:00:00+0000
us,"49ers 21, Patriots 17",,1980-12-01T05:00:00+0000
us,Britain Tests Computer Wares; British Counterpart Britain Set to Test Its Computer Wares Competition Gears Up,,1980-12-01T05:00:00+0000
us,"New Haven Line Fares Lower, Starting Today",,1980-12-01T05:00:00+0000
us,Le Carre's New Spy Novel Headed for TV; Dec. 28 Fund-Raiser To Star Lou Rawls Arts Cable-TV Service Will Begin Next Monday Messages on Arts For Schools Planned ,,1980-12-01T05:00:00+0000
us,"Elizabeth Shoumatoff, 92, Dead; Painted Portraits of 2 Presidents",,1980-12-01T05:00:00+0000
us,"Holiday's Travelers Rush Slowly As Air and Land Routes Back Up; Extra Buses, Extra Lines Holiday Travelers Rush Home Slowly in the Traffic ",,1980-12-01T05:00:00+0000
us,Puerto Ricans' Backers Protest,,1980-12-01T05:00:00+0000
us,"Flames 4, Jets 1",,1980-12-01T05:00:00+0000
us,BUSINESS Digest; Energy The Economy International Today's Columns ,,1980-12-01T05:00:00+0000
us,How to Donate to Italian Quake Relief Efforts,,1980-12-01T05:00:00+0000
us,POL POT AIDE CALLS FOR WORLD SUPPORT; Ieng Sary Says the Regime Ousted in Cambodia Has Abandoned Its 'Socialist Revolution' Details of New Program Listed Good Things and Errors ,,1980-12-01T05:00:00+0000
us,Marriage Announcement 2 -- No Title,,1980-12-01T05:00:00+0000
us,Japan TV Exports,,1980-12-01T05:00:00+0000
us,CREDIT MARKETS Inflation Hopes vs. Rate Climb; Optimism Curbs Yields for Bonds Rates May Rise Somewhat Insulated ,,1980-12-01T05:00:00+0000
us,Sports Today; FOOTBALL HARNESS RACING HOCKEY JAI-ALAI THOROUGHBRED RACING ,,1980-12-01T05:00:00+0000
us,Second Body Is Found in Gulf of California Search,,1980-12-01T05:00:00+0000
us,"Around the World; Left Gains, Giscard Set Back In 7 French By-Elections Second Eritrean Group Hails Sudanese Truce Plan Israeli Is Given Life in Jail For Kidnapping and Murder Japanese Researchers Sail Across Pacific to Chile ",,1980-12-01T05:00:00+0000
us,"Bengals 20, Chiefs 6",,1980-12-01T05:00:00+0000
us,Article 1 -- No Title,,1980-12-01T05:00:00+0000
us,About Washington; Sketching the Lines of Power No Prodding Is Needed Ex-Notre Dame Lineman Advice to Newcomers ,,1980-12-01T05:00:00+0000
us,Obituary 3 -- No Title,,1980-12-01T05:00:00+0000
us,Dividend Meetings,,1980-12-01T05:00:00+0000
us,Town Seeking Homes For Its Parking Meters,,1980-12-01T05:00:00+0000
us,Robin G. Schiff Is Bride of Robert B. Anesi Kathy L. Kutner Wed to Jack R. Friedman,,1980-12-01T05:00:00+0000
us,Changes in Leadership Expected in Warsaw After Key Party Talks; Power Struggles Under Way ,,1980-12-01T05:00:00+0000
us,Advertising; Campari Faces the Bitter Truth New Study Ranks Goals Of Corporate Ad Strategy Traveling Found to Be Habit-Forming People,,1980-12-01T05:00:00+0000
us,Strike Imminent at 4 Hospitals,,1980-12-01T05:00:00+0000
us,Zungul Scores Four As Arrows Triumph,,1980-12-01T05:00:00+0000
us,"Bucks 107, Celtics 105",,1980-12-01T05:00:00+0000
us,"National Review, at 25, Celebrates Dual Victory; Conservatism at the Crossroads Unifying the Right A Dual Victory Is Celebrated By a Magazine Watching a Godchild ",,1980-12-01T05:00:00+0000
us,Jockey Killed in Fall,,1980-12-01T05:00:00+0000
us,Naipaul Reviews His Past From Afar; 'Half-Made Societies' ,,1980-12-01T05:00:00+0000
us,"Clippers 120, Warriors 100",,1980-12-01T05:00:00+0000
us,Events Today; Music Cabaret ,,1980-12-01T05:00:00+0000
us,Folk: Weavers Sing Again,,1980-12-01T05:00:00+0000
us,Chess:; Tungsram Was a Workshop For Fans of Queen's Indian Picnic at Hanging Pawn ,,1980-12-01T05:00:00+0000
us,Merchants Propose a New Ban on Street Peddlers,,1980-12-01T05:00:00+0000
us,The Senate's Message to Itself,,1980-12-01T05:00:00+0000
us,Engineers and Naturalists Fight Over Work on Inlet; Access to Trawlers' Ports 'So-called Stabilization' ,,1980-12-01T05:00:00+0000
us,Cardinals Set Back Giants By 23-7; Cardinals Set Back Giants by 23-7; Friede Is Lost to Knee Surgery,,1980-12-01T05:00:00+0000
us,Mrs. Paul O'Dwyer Dies During a Visit to Ireland,,1980-12-01T05:00:00+0000
us,The Offshore Bankers Have Landed,,1980-12-01T05:00:00+0000
us,"Jordan to Let Reagan Act, Then Judge Him on Rights; Reagan's 'Historical Position' Equality 'by Conservative Means' ",,1980-12-01T05:00:00+0000
us,Theater: 'The Slab Boys'; Young Hope Stalled,,1980-12-01T05:00:00+0000
us,Landscapes on L.I.,,1980-12-01T05:00:00+0000
us,Obituary 8 -- No Title,,1980-12-01T05:00:00+0000
us,A Village in India Prospers Because of Reformer's Zeal; Need for Community Feeling One Landlord Is Won Over Laughing at Intimidation Just a Crate on Stilts,,1980-12-01T05:00:00+0000
us,West German Merger Is Set,,1980-12-01T05:00:00+0000
us,Port Police Kill an Unarmed Man,,1980-12-01T05:00:00+0000
us,Paris Politics: Strains Divide 2 Top Figures; Outline of 29 Priorities Muscular Economic Policy Kingly Figure With Power ,,1980-12-01T05:00:00+0000
us,Tin Treaty Talks Resuming Monday,,1980-12-01T05:00:00+0000
us,"Donald P. Hertzog, 54, Is Dead; General Tax Counsel for Texaco",,1980-12-01T05:00:00+0000
us,"Manhattan, Queens Tourney Victors",,1980-12-01T05:00:00+0000
us,Lifeshares in Bid,,1980-12-01T05:00:00+0000
us,Fans to Protest Moving Of the Restless Raiders; A Spate of Last-Minute Heroics ,,1980-12-01T05:00:00+0000
us,Washington Watch; Farm Lobby's Gasohol Victory A Fresh Monetary Team A New Foreign Trade Zone? Auto Import Restraints Briefcase ,,1980-12-01T05:00:00+0000
us,Marathon to Devoe,,1980-12-01T05:00:00+0000
us,"Dorothy Day, Catholic Activist, 83, Dies; Theologically Traditional 'A Christian Revolution' Opposed Class Politics Emphasis Changed Over the Years Nonviolence Stressed 'The First Hippie' Found Appeal in Slogan Met Leon Trotsky Beginning of The Worker ",,1980-12-01T05:00:00+0000
us,News Summary; International Persian Gulf Crisis National Metropolitan,,1980-12-01T05:00:00+0000
us,ESSAY Reading Brezhnev's Mind,,1980-12-01T05:00:00+0000
us,Obituary 5 -- No Title,,1980-12-01T05:00:00+0000
us,Consumer Nations Draw on Oil Stocks; Drawing on Oil Stocks Gasoline Stocks Fall Saudi on Oil Prices,,1980-12-01T05:00:00+0000
us,3 Children in Iran Hurt As Car Bomb Explodes,,1980-12-01T05:00:00+0000
us,Williams Pulls Off a Sly Turnaround,,1980-12-01T05:00:00+0000
us,Caribbean Democracy,,1980-12-01T05:00:00+0000
us,5 Killed as Small Planes Collide Over a Resort in South Carolina,,1980-12-01T05:00:00+0000
us,U.S. Funds for Quake Aid Likely,,1980-12-01T05:00:00+0000
us,Brooks Atkinson Honored by O'Neill Committee; Also Given a Serenade 'Kept Things on the Level' ,,1980-12-01T05:00:00+0000
us,A KEY REAGAN AIDE SAYS TALKS ON ARMS ARE 'POSSIBLE' SOON; Meese Asserts Discussions With Russians Could Begin a Few Weeks After Inauguration Warns Against Moves on Poland Reagan Aide Calls Talks 'Possible' ,,1980-12-01T05:00:00+0000
us,EXECUTIVE CHANGES,,1980-12-01T05:00:00+0000
us,Costly Turnovers Haunt Bills and Lead to a 28-24 Defeat by Colts,,1980-12-01T05:00:00+0000
us,Banks Merge Upstate,,1980-12-01T05:00:00+0000
us,Rise of Young Officers Dims Fate of Seoul Dissident; Case Has Aroused Wide Interest Officers Fear Showing Weakness 'Young Officers' Play Key Role Chun No Longer Commands Troops Victims of Bad Information ,,1980-12-01T05:00:00+0000
us,SEPARATISM GROWS IN WESTERN CANADA; Upsurge of Support Is a Measure of Discontent With Policies on Energy and Constitution Trudeau Acted on His Own 'Lunatic Fringe' Is Respectable Moved Called a Coup d'Etat,,1980-12-01T05:00:00+0000
us,Obituary 7 -- No Title,,1980-12-01T05:00:00+0000
us,Saudi to Use Gas Fuel,,1980-12-01T05:00:00+0000
us,Sporting Gear; Shock-Absorbing Tennis Shoes Kite-Like Flying Device Shotgun Cleaning Kit ,,1980-12-01T05:00:00+0000
us,Desire to Be Unique--a Universal Goal; An Aversion to Uniforms When the Quest Begins ,,1980-12-01T05:00:00+0000
us,"Suns 117, Rockets 114",,1980-12-01T05:00:00+0000
us,"Haiti, Facing Economic Crisis, Arrests Major Critics; Stirring Up Trouble 'A National Shame' ",,1980-12-01T05:00:00+0000
us,Obituary 6 -- No Title,,1980-12-01T05:00:00+0000
us,Uruguayan Voters Appear to Reject Constitution Proposed by Military; Government Does Not Concede Uruguay's Voters Seem to Reject Proposed Constitution Freely Elected Congress ,,1980-12-01T05:00:00+0000
us,Iraq Denies Iranian Capture Of an Oil-Loading Terminal,,1980-12-01T05:00:00+0000
us,"Islanders Extend Streak, 7-3, as Kallur Gets 3 Goals and Goring 2; Backhanders Beat Plasse ",,1980-12-01T05:00:00+0000
us,Short Stints in Executive Suites; New Recruits May Feel Most Vulnerable Short Stints in Executive Suites 'Harder to See' Outsiders' Flaws Land Posts of Similar Rank,,1980-12-01T05:00:00+0000
us,BUSINESS PEOPLE Toro Chief Believes Steel Plan Is 'Viable',,1980-12-01T05:00:00+0000
us,Weekly 'Lotto' Numbers Drawn,,1980-12-01T05:00:00+0000
us,"Commodities; Lead, Zinc Welcome Winter ",,1980-12-01T05:00:00+0000
us,Marriage Announcement 1 -- No Title,,1980-12-01T05:00:00+0000
us,New Goldman Partners,,1980-12-01T05:00:00+0000
us,REVITALIZATION PLAN TROUBLING MIDWEST; Leaders Fear That Tax Incentives Suggested by Reagan Could Result in Plant Closings Rehabilitation Aid Sought Movement Within Region 'Enterprise Zone' Proposal ,,1980-12-01T05:00:00+0000
us,Power Authority Calls for Hearing On Plan to Send M.T.A. Electricity,,1980-12-01T05:00:00+0000
us,"Browns Turn Back Oilers, 17-14, Capitalizing on Five Turnovers; Oilers Statistics ",,1980-12-01T05:00:00+0000
us,Jamaica Aid Talks Reopening; I.M.F. to Outline Austerity Needs For New Leader Reluctance by Banks I.M.F. to Reopen Aid Talks Soon With Jamaica Higher Quota Backed ,,1980-12-01T05:00:00+0000
us,Market Place; Union Pacific's Oil Belt Report ,,1980-12-01T05:00:00+0000
us,Question Box,,1980-12-01T05:00:00+0000
us,"Laotian Buddhist Monk Finds a 'Heaven' in Rye; 'I Have Found Heaven' Teacher and Counsellor, Too Escape From Communists ",,1980-12-01T05:00:00+0000
us,Bridge:; Recent World Title Contest Helped by Lemaitre's Input 18 Pairs Bid Game Two Pairs Reach Six No-Trump ,,1980-12-01T05:00:00+0000
us,Police Link Stolen Car To Robbery in Newark In Which Officer Died,,1980-12-01T05:00:00+0000
us,TV: Sally Kellerman In Miss Parker's 'Blonde',,1980-12-01T05:00:00+0000
us,Notes on People; Bassist Faces Challenge So Much for Stardom A Few Words From the Vice President-Elect Lease of a Lincoln to Fill a Tall Mayoral Order Javits States an Ambition: Lunch With Nixon,,1980-12-01T05:00:00+0000
us,Article 2 -- No Title,,1980-12-01T05:00:00+0000
us,Middle School Teaches Manly Art of Infant Care; Week-by-Week Account ,,1980-12-01T05:00:00+0000
us,"Falcons 10, Redskins 6",,1980-12-01T05:00:00+0000
us,Dr. Laura Kushner Married To Dr. Elliot D. Rosenstein,,1980-12-01T05:00:00+0000
us,"SAUDI ARMY LEADER DISPATCHED TO SYRIA OVER JORDAN CRISIS; SPEAKS TO ASSAD AND ARAFAT Damascus Reported to Move New Division to Frontier, and Both Sides Alert Reserve Units Syria Said to Move More Troops 'Hideouts Will Be Destroyed' A SAUDI ENVOY SEES ASSAD IN DAMASCUS Syria and Iraq at Odds",,1980-12-01T05:00:00+0000
us,Japanese Relaxing Law On Trade and Exchange,,1980-12-01T05:00:00+0000
us,Belgian Triumphs In Women's Judo,,1980-12-01T05:00:00+0000
us,Vivian Kahane Is Bride Of Barry Martin Cooper,,1980-12-01T05:00:00+0000
us,What Is on Trial in South Korea,,1980-12-01T05:00:00+0000
us,Homewood Buying Shares,,1980-12-01T05:00:00+0000
us,Michael: Swift Trip Up the Ladder; Michael: Swift Trip Up the Ladder ,,1980-12-01T05:00:00+0000
us,Nine Are Injured When City Bus Rams Subway Pillar in the Bronx,,1980-12-01T05:00:00+0000
us,MOSCOW POLICE BAR SCIENTISTS' MEETING; Jewish Scholars Who Lost Posts Are Prevented for a 2d Week From Going to Seminars Police Decline to Answer ,,1980-12-01T05:00:00+0000
us,City College Women Beaten by Lehman,,1980-12-01T05:00:00+0000
us,Klansman Backs Survival Camps That Teach Warfare to Children; Other 'Survival Camps' Small Klan Group Marches,,1980-12-01T05:00:00+0000
us,"Julia Reynolds, Widow Of Metals Firm Founder",,1980-12-01T05:00:00+0000
us,Sports World Specials; Rocky Picasso Diminished Returns 30 Years After Without a Prayer ,,1980-12-01T05:00:00+0000
us,North Stars Top Rangers By 5-3; North Stars 'Luckier' Rangers Score First Stars Set Back Rangers Rangers Scoring ,,1980-12-02T05:00:00+0000
us,Appeals Court Backs Settlement In Dispute Over H.L. Hunt Estate,,1980-12-02T05:00:00+0000
us,Reagan's Advisers Urged to Avoid Public Comments on Foreign Policy,,1980-12-02T05:00:00+0000
us,COMPANY NEWS; 3 Gas Concerns Plan Easy Coast Pipeline Tosco's Fuel Prices To Rise by 3 Cents Chromalloy to Sell Part of Its Business Reeves to Purchase A Book Marketer Messerschmidt Bid Approved in Bremen New Schering Unit Mazda Raises Prices Jersey Court Blocks Kennecott Offer Cutbacks at BL Unit ,,1980-12-02T05:00:00+0000
us,Obituary 8 -- No Title,,1980-12-02T05:00:00+0000
us,Obituary 3 -- No Title,,1980-12-02T05:00:00+0000
us,More Holes Appear In Jet Offensive Line,,1980-12-02T05:00:00+0000
us,Radar Trouble Blamed In Airliner's Near-Crash,,1980-12-02T05:00:00+0000
us,'Gas-and-Go' Leaves Fewer Who Tow; Trucks Are 'Spread So Thin' Checks of Cars in California Problems Getting to Work,,1980-12-02T05:00:00+0000
us,Inquiry Asked by Judge Who Had Suspect as Guest; Brooklyn Judge Seeking Inquiry On Night's Stay 'Judicial Temperament' Cited ,,1980-12-02T05:00:00+0000
us,Notes on People; Some Federal Judges Fail to Embrace a Precedent 2 Writers Hospitalized Reagan Double 'Retires' Serkin at Carnegie Hall ,,1980-12-02T05:00:00+0000
us,Rich and Poor Nations Seem to Fail to Set Up Global Economic Talks; 'We Can't Bridge the Gap' Imaginative Zeal,,1980-12-02T05:00:00+0000
us,"Turkey Holds 5,850 'Anarchists'",,1980-12-02T05:00:00+0000
us,CORRECTION,,1980-12-02T05:00:00+0000
us,A Tax-Reform Plan,,1980-12-02T05:00:00+0000
us,Three Women in Ulster Join Prisoners' Hunger Strike,,1980-12-02T05:00:00+0000
us,Begin Bars Pro-P.L.O. Conference by Israeli Arabs,,1980-12-02T05:00:00+0000
us,Fewer Dividend Rises,,1980-12-02T05:00:00+0000
us,Corporate Reports,,1980-12-02T05:00:00+0000
us,Bronfman Case Figure Paroled After 3 Years,,1980-12-02T05:00:00+0000
us,U.S. Files Lawsuit Accusing Yonkers Of Segregation in Housing and Schools; Suit's Future Uncertain ,,1980-12-02T05:00:00+0000
us,How Chicago Red Squad Sabotaged 60's Dissidents; Details of Activities Emerge Abolition of Red Squad 'Very Little Basis in Fact' Injunction Against Police ,,1980-12-02T05:00:00+0000
us,Obituary 6 -- No Title,,1980-12-02T05:00:00+0000
us,Hartford Suburb Sued,,1980-12-02T05:00:00+0000
us,Georgia's Coach Eyes Auburn Job,,1980-12-02T05:00:00+0000
us,The Region; Appeals Court Clears Radio-TV Coverage 4 Children in Family Die in Camden Fire Gov. Grasso Leaves Hartford Hospital ,,1980-12-02T05:00:00+0000
us,"Bunker Ramo Changes Its Tune; Still a Target, Company Is Now a Suitor Bunker Ramo Changes Its Tune Lines of Business AT A GLANCE ",,1980-12-02T05:00:00+0000
us,Construction Outlays Sluggish in October; Slow Activity Noted Figures for Housing ,,1980-12-02T05:00:00+0000
us,Market Place; Advantages Of Consistency ,,1980-12-02T05:00:00+0000
us,COMMODITIES; Gold Prices Up Slightly; Silver Futures Mixed Spot Commodity Index,,1980-12-02T05:00:00+0000
us,The Morse Mime Theater: A Day in New York's Life; Dance Theater of Harlem To Open 6th Season Jan. 3 Toast to City's Towers ,,1980-12-02T05:00:00+0000
us,The City; Inquiry on Shooting At Bus Terminal Near-Miss Reported By British Concorde Driver Hurt as Bus Hits Times Sq. Pole City Honors Hogan With a Street Name,,1980-12-02T05:00:00+0000
us,Dividends,,1980-12-02T05:00:00+0000
us,"Robert T. Lansdale, Ex-Welfare Director For New York State",,1980-12-02T05:00:00+0000
us,Reagan Adviser Says He Expects Javits to Get Post; Suggested for U.N. Post D'Amato Not at Party ,,1980-12-02T05:00:00+0000
us,Haiti Attributes Arrests To a 'Communist' Plot,,1980-12-02T05:00:00+0000
us,The U.N. Today,,1980-12-02T05:00:00+0000
us,Giraffe in Tokyo Zoo Dies at 31,,1980-12-02T05:00:00+0000
us,Gleams of Found-Art Jewelry,,1980-12-02T05:00:00+0000
us,Velasquez Fourth Jockey To Reach $50 Million Mark,,1980-12-02T05:00:00+0000
us,CORRECTION,,1980-12-02T05:00:00+0000
us,Head of Riot Panel Says Study Won't Be Heeded,,1980-12-02T05:00:00+0000
us,High Court to Rule on Legality of Male-Only Draft; View of Lower Court,,1980-12-02T05:00:00+0000
us,Dooley Considers Auburn,,1980-12-02T05:00:00+0000
us,Obituary 5 -- No Title,,1980-12-02T05:00:00+0000
us,"Around the Nation; Massachusetts Legislature Meets on Transit Crisis Piece of Missing Helicopter Found on Grand Bahama Four Persons Are Injured In Residential Explosion Sprinklers Weren't Required At Hotel, Opinion Asserts",,1980-12-02T05:00:00+0000
us,Obituary 1 -- No Title,,1980-12-02T05:00:00+0000
us,Radio; Music Talk Events/Sports ,,1980-12-02T05:00:00+0000
us,Iran Litigation: Fees in Millions; Iranian Litigation: Legal Fees in Millions A Difficult Relationship Boudin Hired by Bank Markazi The Opposing Argument ,,1980-12-02T05:00:00+0000
us,I.M.F. Sets Loan Rise; I.M.F. Set To Expand Its Lending Greater Access to Credits ,,1980-12-02T05:00:00+0000
us,Bonn Envoy to East Germany,,1980-12-02T05:00:00+0000
us,RUSSIANS VISIT SYRIA FOR PACT CEREMONY; They Will Put Treaty Into Force and Discuss Mideast Since Border Tension Involving Jordan Reassurance for President Assad ,,1980-12-02T05:00:00+0000
us,Stroh Makes Bid For Schaefer Stock,,1980-12-02T05:00:00+0000
us,Tarnower's Housekeeper Kept Records on All Visitors; Records Closely Held Questions About Vacations ,,1980-12-02T05:00:00+0000
us,Brooklyn Man Convicted in Blaze In Which 6 Firefighters Died in '78; Worst Since 1966 ,,1980-12-02T05:00:00+0000
us,Heisman Trophy Won by Rogers; Four Quarterbacks Trail Heisman to Rogers The Heisman Trophy Voting,,1980-12-02T05:00:00+0000
us,Sutton-Astros Meeting Set,,1980-12-02T05:00:00+0000
us,"Thomas B. Slate, Inventor, at 99; Developed Dry Ice Commercially",,1980-12-02T05:00:00+0000
us,Talking Business/with McDonald of the White House Staff; Management Tips for Reagan ,,1980-12-02T05:00:00+0000
us,Free Festival of 7 Italian Films Opens Today at Public Theater; The Other Programs ,,1980-12-02T05:00:00+0000
us,CREDIT MARKETS; 6-Month Bills Rise to 14.55% Little Fed Activity Wisconsin Utility Issue ,,1980-12-02T05:00:00+0000
