iso_code,title,description,pubDate
us,Article 2 -- No Title,,1980-12-08T05:00:00+0000
us,ESSAY Reagan's Mr. Clean,,1980-12-08T05:00:00+0000
us,Music: 'Ein Heldenleben',,1980-12-08T05:00:00+0000
us,Louisville's Early Slide Dims Title Dreams; 6 Other Top 20 Teams Lose Returned Guard Aids Deacons ,,1980-12-08T05:00:00+0000
us,City All-Stars Win,,1980-12-08T05:00:00+0000
us,G.&W.-Munsingwear Link,,1980-12-08T05:00:00+0000
us,Obituary 6 -- No Title,,1980-12-08T05:00:00+0000
us,Market Place; Bullish Outlook For Stocks 'Cablemania' ,,1980-12-08T05:00:00+0000
us,TV Reprising Beverly Sills' Farewell Gala; 'Tales of Hoffmann' On WNEW-TV Jan. 4 ,,1980-12-08T05:00:00+0000
us,GOING OUT Guide; THE STEBER TOUCH WALKING GUITAR POETS FROM FRANCE ,,1980-12-08T05:00:00+0000
us,The Region; Englewood Nurses End Long Strike Lack of County Aid For Transit Alleged Museum Oil Painting Stolen in Hartford Indian Point 3 Plant Faces 2-Week Delay,,1980-12-08T05:00:00+0000
us,Acquitted Officer Is Offered Job,,1980-12-08T05:00:00+0000
us,"Thankful Students Aid Neediest; Foundation Gives $5,000",,1980-12-08T05:00:00+0000
us,Bell Issue Dominates Offerings,,1980-12-08T05:00:00+0000
us,'Jazz Alive at Y': James Moody,,1980-12-08T05:00:00+0000
us,Squash Racquets To Jane Giammattei,,1980-12-08T05:00:00+0000
us,"Buses Work Best As a Form of Art; An Appraisal New City Bus Is Best as Art, Not as Transit ",,1980-12-08T05:00:00+0000
us,COMPANY NEWS Saudis Back Ashland Refinery; Lubricating Oil Plant to Be Built ,,1980-12-08T05:00:00+0000
us,Sporting Gear; Cassette Player for Joggers Help in Ski Maintenance Ski and Boot Carriers ,,1980-12-08T05:00:00+0000
us,Psychoanalysts Gather for Tribute to Marianne Kris; Development of Clinical Work Father Was a Pediatrician Preferred Seminars to Lectures ,,1980-12-08T05:00:00+0000
us,Bet-a-Million Steinbrenner,,1980-12-08T05:00:00+0000
us,Issue and Debate Does the President Need More Science Advisers?; The Background For Committee's Revival Against Science Panel The Outlook ,,1980-12-08T05:00:00+0000
us,Pop Piano: Mickey Gilley,,1980-12-08T05:00:00+0000
us,Warrant Tied to 5-Year Note,,1980-12-08T05:00:00+0000
us,Former Ally of Castro Calls for a U.N. Investigation of Hunger Strike,,1980-12-08T05:00:00+0000
us,Obituary 5 -- No Title,,1980-12-08T05:00:00+0000
us,Radio,,1980-12-08T05:00:00+0000
us,Dance: Cachat Company,,1980-12-08T05:00:00+0000
us,PARKING REGULATIONS,,1980-12-08T05:00:00+0000
us,Forging a 4-Year Plan,,1980-12-08T05:00:00+0000
us,"At 36, Cazzie Russell Is Still Holding Court as a Professional",,1980-12-08T05:00:00+0000
us,BUSINESS Digest; The Economy Companies International Today's Columns ,,1980-12-08T05:00:00+0000
us,Check for a 'Dead' Man,,1980-12-08T05:00:00+0000
us,COMPANY NEWS; National Medical's Acquisitions To Steer Its Growth in '80's Looking to the Next Decade Sizing Up Company's Future ,,1980-12-08T05:00:00+0000
us,Chemical Arms Production in U.S.: Test for Reagan; Argument Against Production,,1980-12-08T05:00:00+0000
us,Cancellation Weighed On a 200-Bus Contract,,1980-12-08T05:00:00+0000
us,Pat Ewing Puts Up His Line of Defense; Pat Ewing: A Blue Chip Star Puts Up His Line of Defense ,,1980-12-08T05:00:00+0000
us,Notes on People; Forbes Turns the Tables and Lampoons the Lampoon Settlement of Suit Reached on 3 O'Keeffe Paintings Research Grant Set Up in Gower Champion's Memory St. Louis Symphony Judges Its Applicants Sight Unseen ,,1980-12-08T05:00:00+0000
us,"In Propaganda War, Iraq's an 'Infidel,' Iran a 'Racist'; Religious Theme in Iran Focus Is Hussein in Iraq Some Opposition in Military ",,1980-12-08T05:00:00+0000
us,"Play: New Fuller Drama, Zooman and the Sign'; The Wages of Violence ",,1980-12-08T05:00:00+0000
us,"C. Michael Paul, a Philanthropist, Financier and Oil Man, Dies at 78; Joined Army at Age 15 Sold War Bonds in Shipyards",,1980-12-08T05:00:00+0000
us,FEDERAL COMMISSION SUPPORTS AMNESTY FOR ILLEGAL ALIENS; WORK PERMITS IDEA REJECTED Civil and Criminal Penalties Urged for Any Employers Who Hire Unauthorized Foreigners Work Permits Rejected Federal Commission Backs Amnesty for Illegal Aliens ,,1980-12-08T05:00:00+0000
us,Drugged Man's Release Is Laid to Overcrowding,,1980-12-08T05:00:00+0000
us,Wedding in Capital For Alice Tetelman,,1980-12-08T05:00:00+0000
us,"Debris of Fire-Damaged Pier Is Dumped Into the East River; Crew Leveling Pier Dumps Debris, Seemingly Illegally, Into East River ",,1980-12-08T05:00:00+0000
us,DEEP-SEA ORGANISMS ARE RETRIEVED ALIVE; Provide Scientists With New Data On Nature of Life Processes in Ocean's Deep Chasms Several Small Animals Recovered Bacteria to Be Studied ,,1980-12-08T05:00:00+0000
us,A Fable,,1980-12-08T05:00:00+0000
us,Obituary 1 -- No Title,,1980-12-08T05:00:00+0000
us,Question Box,,1980-12-08T05:00:00+0000
us,Syria and Jordan Still Poised on Border; Saudis' Mediation Bid Between Neighbors Seems to Be Failure Bitter Enemy of Assad ,,1980-12-08T05:00:00+0000
us,EXECUTIVE CHANGES,,1980-12-08T05:00:00+0000
us,"For Dwayne Johnson, Pursuit Continues",,1980-12-08T05:00:00+0000
us,"SALVADOR'S MILITARY OUSTS CHIEF LIBERAL FROM RULING JUNTA; Colonel, Who Led '79 Coup, Forced Out in 300-to-4 Army Vote-- Other Changes Predicted U.S. Mission Begins Task Salvadoran Military Ousts Liberal Member of Junta Slain Nun Honored in Cleveland ",,1980-12-08T05:00:00+0000
us,"The Editorial Notebook Watch the Bureaus, Not the Cabinet; Special Interests Know Which Jobs Hold The Levers of Power ",,1980-12-08T05:00:00+0000
us,New Wave of Cuban Refugees Is Termed 'Blessing' for Miami Area; 'A Taste of Home' ,,1980-12-08T05:00:00+0000
us,"Rangers Win, 5-4, for 3d in Row And 5-2-1 Record Under Patrick; Flyers 4, Rockies 2 Rangers Scoring",,1980-12-08T05:00:00+0000
us,Concert: Renaissance England Recaptured by Dessoff Choirs,,1980-12-08T05:00:00+0000
us,Certificate Rate Curb Set,,1980-12-08T05:00:00+0000
us,Tighter Heating Oil Supplies Expected,,1980-12-08T05:00:00+0000
us,Events Today; Music ,,1980-12-08T05:00:00+0000
us,IRANIAN JUDGE QUITS IN TORTURE SCANDAL; Ayatollah Who Ordered Hundreds to Die Was Criticized for His Role in Narcotics Drive A Deputy From Qum ,,1980-12-08T05:00:00+0000
us,Satellite Photograph,,1980-12-08T05:00:00+0000
us,"Sipe, on 30 Completions, Helps Browns Overtake Jets by 17-14; Sipe Sets Club Record Bad Bounce for Leahy Todd Hits Lam Jones Browns Infiltrate Jet Secondary ",,1980-12-08T05:00:00+0000
us,BREZHNEV STARTING VISIT TO INDIA TODAY; Moscow Is Expected to Seek More Backing From Gandhi Regime on International Issues No Major Change Foreseen New Peace Initiative Possible ,,1980-12-08T05:00:00+0000
us,"Redskin Passing Jolts Chargers; Vikings 21, Bucs 10 Cards 24, Lions 23 Bengals 34, Colts 33 Chiefs 31, Broncos 14 TV Game Cutoff Upsets Fans ",,1980-12-08T05:00:00+0000
us,"Goldin Criticizes Boiler Inspection By a City Agency; Safety Checks Inadequate, Two-Year Inquiry Finds Charged With Negligence ",,1980-12-08T05:00:00+0000
us,"RUSSIANS ARE READY FOR POSSIBLE MOVE ON POLAND, U.S. SAYS; WHITE HOUSE ISSUES WARNING But Senior Aides Say There's Still No Evidence the Kremlin Has Decided on Intervention Carter Confers With Advisers 'They Are Now Ready to Move' U.S. Says Soviet Is Ready for Possible Move Into Poland ",,1980-12-08T05:00:00+0000
us,EQUALITY DISRUPTS NICARAGUAN HOMES; New Regime's Decree of Women's Rights Undermines Tradition of Domination by Men Relationships Collapse A Revolutionary Role 'We're Revaluing Ourselves' ,,1980-12-08T05:00:00+0000
us,Shipping/Mails; OUTGOING ,,1980-12-08T05:00:00+0000
us,News Summary; International National Metropolitan,,1980-12-08T05:00:00+0000
us,BUSINESS PEOPLE; Chubb's President Is Elected Chief New Hudson-Shatz Head Joining Solid State Sheikdom Reports 'Major' Oil and Gas Find ,,1980-12-08T05:00:00+0000
us,Reagan Refuses To Give Answers On Cabinet Jobs; Says That He Is Planning Statement for This Week A Leisurely Schedule ,,1980-12-08T05:00:00+0000
us,Military Survey Finds Decline in Use of Hard Drugs,,1980-12-08T05:00:00+0000
us,Not a Super Fund,,1980-12-08T05:00:00+0000
us,Volcano Spews Steam and Ash,,1980-12-08T05:00:00+0000
us,SOUTHWEST FARMERS OPPOSING MX SITES; Throngs at Air Force's Hearings Express Fears of Losing Land or Being Soviet Targets Missile Shell Game Defense Projects Nearby Land-Taking Involved,,1980-12-08T05:00:00+0000
us,Article 1 -- No Title,,1980-12-08T05:00:00+0000
us,"Cowboys Down Raiders, 19-13, Clinch Playoff Spot",,1980-12-08T05:00:00+0000
us,"Saints, Ahead by 28, Beaten in Overtime",,1980-12-08T05:00:00+0000
us,Iran and Irag Report Raids on Waterway Oil Facilities,,1980-12-08T05:00:00+0000
us,Soviet Arms Technology Has Shown Steady Gains; The Soviet Military: Its Power and Limits Less Sophisticated Systems Missile Accuracy Improved Soviet Arms Technology Has Shown Steady Gains Speed in Developing Aircraft Variations on the MIG Earlier MIG-25 Estimates Revised T-62 Had Longer Hull,,1980-12-08T05:00:00+0000
us,Gov. Grasso Cancels Appearance Scheduled for Quake Relief Fund,,1980-12-08T05:00:00+0000
us,Around the Nation; Providence Fails to Reach Agreement With Strikers Few Gains Found for Blacks In Governments in South Author Reports Agreement On Paying of Libel Award Solar-Powered Plane Fails In Its 6th Arizona Flight Parents Who Defied Court On Son's Care Will Give Up ,,1980-12-08T05:00:00+0000
us,The Many Shapes of Chocolate; Charge Card and Calendar Where to Look ,,1980-12-08T05:00:00+0000
us,"Chrysler To Petition U.S. Again; Political Shift, Slow Sales Spur Doubt on Future Wants More Concessions Chrysler to Seek More Aid From U.S. ",,1980-12-08T05:00:00+0000
us,Bossy Gets No. 28 in Islanders' 5-3 Triumph; Kallur First to Score Goalie Caught Again by Bourne ,,1980-12-08T05:00:00+0000
us,Moynihan Rejects Role for Arafat,,1980-12-08T05:00:00+0000
us,ABROAD AT HOME A Step For Justice,,1980-12-08T05:00:00+0000
us,E.J. Davis Is Married to Bertram Holman,,1980-12-08T05:00:00+0000
us,Harvard Black Studies Head Seeks Wider Program; Changes in Department ,,1980-12-08T05:00:00+0000
us,Yamani Backs Price Freeze; Meeting to Be Held ,,1980-12-08T05:00:00+0000
us,Acting President at The Citadel Named by Board to Be New Chief,,1980-12-08T05:00:00+0000
us,Boston Resumes Transit Services Under Aid Plan; But New Worries Loom as $41 Million Is Approved Lawsuits Threatened Long Live the New M.B.T.A. New Spending Controls ,,1980-12-08T05:00:00+0000
us,City Budget Agency Orders 40% Cut in Capital Outlays; Spending Exceeding Expectations Current Year Not Affected,,1980-12-08T05:00:00+0000
us,Chess:; Why Let History Lead You If It's Never Found a Way? ,,1980-12-08T05:00:00+0000
us,Dole Advises Reagan to Declare A National Economic Emergency,,1980-12-08T05:00:00+0000
us,Zwi Kanar to Give Mime Solos,,1980-12-08T05:00:00+0000
us,Foreign Banking Rush To Luxembourg Wanes; 'Offshore' Bank Boom Levels Off ,,1980-12-08T05:00:00+0000
us,"Sports News Briefs; Pam Shriver Loses To Wendy Turnbull Palmer, in Playoff, Wins Seniors Golf Spiess Ski Victor; Canadians Strong Giant Slalom Event Won by Miss Nadig Whippany Park, Bergen Catholic Win Marathon to Molnar Indiana Triumphs ",,1980-12-08T05:00:00+0000
us,HOW TO AID THE FUND,,1980-12-08T05:00:00+0000
us,Businessman Who Aided Garwood Plans to Testify at Court-Martial; Faces Life Imprisonment Government Plans to End Its Case ,,1980-12-08T05:00:00+0000
us,Obituary 4 -- No Title,,1980-12-08T05:00:00+0000
us,Law Students Delay Newark's Anti-Peddler Drive; 'Recognized Occupation',,1980-12-08T05:00:00+0000
us,Help the Urban Poor Escape,,1980-12-08T05:00:00+0000
us,U.S. and China Forging Close Ties; Critics Fear That Pace Is Too Swift; Reagan Advisers Are Divided U.S. TIES TO PEKING CONTINUE TO EXPAND Military Sales to China Chinese Buy U.S. Computers 'Almost Like Talking to an Ally' Vance Has Word of Caution ,,1980-12-08T05:00:00+0000
us,"Advertising; Cable TV's Ad Hour Has Come Small Spenders Are Interesting, Too Peter Rogers Drops Danskin Account Magazine for Good Skates ",,1980-12-08T05:00:00+0000
us,44 Arrested in Raids On Alleged Bet Ring,,1980-12-08T05:00:00+0000
us,Bills Win in Overtime on Mike-Mayer's Field Goal; Worried About His Center ,,1980-12-08T05:00:00+0000
us,Israel Cracking Down on Foreign Reporters Covering West Bank Clashes; Air Let Out of Tires ,,1980-12-08T05:00:00+0000
us,A New Generation's Views On Loving and Working; No Pledge of Fidelity Divorce Had an Effect ,,1980-12-08T05:00:00+0000
us,Brazil Reins In Its Economy; Brazil Moves to Rein In Economic Growth Officials Seek To Halve 8% Growth Rate More Than 10 Percent of Income ,,1980-12-08T05:00:00+0000
us,McGraw Agrees on 4-Year Phils' Contract,,1980-12-08T05:00:00+0000
us,Two Injured in L.I. Motel Blaze,,1980-12-08T05:00:00+0000
us,Arrival of U.S. Airliner Is China's First Since '49,,1980-12-08T05:00:00+0000
us,Immigration Opponents Disrupt an Indian State,,1980-12-08T05:00:00+0000
us,"Clippers Win, 98-95, As Nets' Rally Fails; Lakers 113, Jazz 100 Bullets 113, Celtics 103 Suns 106, Warriors 88 ",,1980-12-08T05:00:00+0000
us,14 Avant-Garde Dancers To Present New Works,,1980-12-08T05:00:00+0000
us,"Bears Defeat Packers, 61-7",,1980-12-08T05:00:00+0000
us,The Shaming of Indonesia,,1980-12-08T05:00:00+0000
us,5 Performers Honored by Kennedy Center; Two-Hour Program 'A Tremendous Mix' ,,1980-12-08T05:00:00+0000
us,Article 5 -- No Title,,1980-12-08T05:00:00+0000
us,Obituary 2 -- No Title,,1980-12-08T05:00:00+0000
us,Dance: Deborah Gladstein,,1980-12-08T05:00:00+0000
us,"Ed Hickey, 77, Basketball Coach",,1980-12-08T05:00:00+0000
us,"Rona Stein, Economist, Wed to Edward Kerman",,1980-12-08T05:00:00+0000
us,Suite Vs. Sweat,,1980-12-09T05:00:00+0000
us,Obituary 10 -- No Title,,1980-12-09T05:00:00+0000
us,Liberal Groups Report Surge Since Reagan Election; Surge of Involvement Many Fears Are Voiced Victories Seen as Vulnerable The Human Rights Amendment ,,1980-12-09T05:00:00+0000
us,Dividends,,1980-12-09T05:00:00+0000
us,Lennon Known Both as Author And Composer; Never Lost Sight of Dream Influenced by U.S. Rockers Songs of Conflict and Confusion Married Miss Ono in 1969 ,,1980-12-09T05:00:00+0000
us,Soviet Cites Oil Data Lack,,1980-12-09T05:00:00+0000
us,Soviet Armed Services Showing Weaknesses In Several Key Areas; The Soviet Military: Its Power and Limits Last of three articles. Soviet Armed Forces Show Weakness in Many Key Areas Afghanistan Seen as Example Reluctance to Attack Afghans Breakdown of Deployment Soviet Troops Well Trained Maintenance Is Centralized Birth Rate Is Declining Navy and Air Force Problems ,,1980-12-09T05:00:00+0000
us,Supreme Court Roundup HUSTLER PUBLISHER WINS OHIO-CASE PLEA; Justices to Determine if Flynt Was Unfairly Singled Out to Face Obscenity Prosecution Selection of the Case Lawyer's Speech Extradition Process Children's Rights,,1980-12-09T05:00:00+0000
us,B.& W. Expanding Barclay Cigarette,,1980-12-09T05:00:00+0000
us,"Saudi Prince Flies to Pakistan, Reportedly to Discuss Troop Deployment",,1980-12-09T05:00:00+0000
us,REAGAN PLANS DRIVE FOR TRANSITION AID; Republicans Need $1 Million More To Cover Record Operations Volumes of Information Reagan Plans Fund-Raising Effort For Record Transition Operations Fund Will Be Audited Doubts on Value Expressed ,,1980-12-09T05:00:00+0000
us,Conagra Lists Costs For Banquet Foods,,1980-12-09T05:00:00+0000
us,Delta Delays Choice On Engine Producer,,1980-12-09T05:00:00+0000
us,"Richard Ellington, a Radio Writer; Detective Stories Published ",,1980-12-09T05:00:00+0000
us,Du Pont to Buy Medical-Isotope Research Concern,,1980-12-09T05:00:00+0000
us,FOREIGN AFFAIRS Le Roi Sans Couronne,,1980-12-09T05:00:00+0000
us,A 3d Lion Cub Found; A.S.P.C.A. Picks It Up,,1980-12-09T05:00:00+0000
us,Q&A,,1980-12-09T05:00:00+0000
us,Judge Declines to Punish Parents in Laetrile Case; Father Apologizes to Judge Dispute Over Couple's Action ,,1980-12-09T05:00:00+0000
us,"Dolphins Win in Overtime, 16-13; Dolphins Win In Overtime ",,1980-12-09T05:00:00+0000
us,"Liv Ullmann: From Toronto, With 'Love'; Anthology of Nine Stories ",,1980-12-09T05:00:00+0000
us,Israeli Committee Ponders Trial For Minister of Religious Affairs,,1980-12-09T05:00:00+0000
us,Obituary 2 -- No Title,,1980-12-09T05:00:00+0000
us,"U.S., Algeria in Gas Talks",,1980-12-09T05:00:00+0000
us,The U.N. Today; GENERAL ASSEMBLY ,,1980-12-09T05:00:00+0000
us,Obituary 3 -- No Title,,1980-12-09T05:00:00+0000
us,Local Debut a Loss For Miss Lieberman,,1980-12-09T05:00:00+0000
us,Output of Steel Declines 0.6%,,1980-12-09T05:00:00+0000
us,TASS ASSERTS UNIONS ARE HURTING POLAND; Non-Communist Groups Accused of Counterrevolutionary Acts Openly Harmful to State Kania Got Support Last Week Crackdown by Poles Is Possible Incident at Plant Is Cited ,,1980-12-09T05:00:00+0000
us,Royal Ballet Is Coming in June,,1980-12-09T05:00:00+0000
us,It's Greek to Us,,1980-12-09T05:00:00+0000
us,3 Quake Victims Lived On Wine and Peppers,,1980-12-09T05:00:00+0000
us,"EAST GERMANS ASSAIL ACTIVISTS IN POLAND; In Harshest Remarks So Far, They Accuse Labor Union Factions of 'Confrontation' With Party Factory Managers 'Removed' Praise for Moscow Meeting",,1980-12-09T05:00:00+0000
us,Market Place; Municipal Bond Opportunities ,,1980-12-09T05:00:00+0000
us,Detective Says Jean Harris Told of Shooting Tarnower; Both Sides Gain Support Bouquet on Headboard ,,1980-12-09T05:00:00+0000
us,Testimony Suggests Flaw in Helicopter on Iran Raid; Defendant Declines to Comment Blades Filled With Nitrogen Indicator Turns Black ,,1980-12-09T05:00:00+0000
us,Pope Prays for Homeland,,1980-12-09T05:00:00+0000
us,Student Marketing,,1980-12-09T05:00:00+0000
us,CREDIT MARKETS 6-Month Bills Near March Highs; Key Rates Dearth of New Issues Muni Yields at All Time Highs ,,1980-12-09T05:00:00+0000
us,Radio; Music Talk Events/Sports,,1980-12-09T05:00:00+0000
us,Tower Will Reorganize Panel on Armed Services,,1980-12-09T05:00:00+0000
us,Tenneco May Buy Houston Oil; Tenneco May Take Over Houston Oil for $2 Billion,,1980-12-09T05:00:00+0000
us,Nuclear Plant Delay,,1980-12-09T05:00:00+0000
us,Spanish Leader to Visit Basques,,1980-12-09T05:00:00+0000
us,Jakarta Ending Foreign Famine Aid to Annexed Land; Population Has Fallen Opposition to Annexation Response to 2 Raids Appeal to Aid Agencies ,,1980-12-09T05:00:00+0000
us,OPEC Speaks Directly to Press; Silent on Key Issues ,,1980-12-09T05:00:00+0000
us,"Crowds of Lennon Fans Gather Quickly at the Dakota and Hospital; Some Crying, Some Silent 'Always Hoping to Meet Him' 'Talked About Good Things' A Quietly Placed Flag ",,1980-12-09T05:00:00+0000
us,Communication Satellite Placed In Stationary Orbit Over Equator,,1980-12-09T05:00:00+0000
us,"CURRENCY MARKETS Dollar Gains Broadly, But Falls Against Yen; Pound Is Off in New York ",,1980-12-09T05:00:00+0000
us,Heinz Posts Earnings Rise,,1980-12-09T05:00:00+0000
us,The Region; Cooke Sets Up Panel On Court Conditions 6 Policemen Indicted In Two Guys Thefts Chiropractor Slain In East Farmingdale Rail Delays in Jersey Woman Convicted Of Planning Robbery,,1980-12-09T05:00:00+0000
us,New York Coke Keeps Wine Units,,1980-12-09T05:00:00+0000
us,Obituary 8 -- No Title,,1980-12-09T05:00:00+0000
us,"Stage: Echo of Vietnam, 'How I Got That Story'; Two With Many Faces ",,1980-12-09T05:00:00+0000
us,Ex-Rams Aid Bills' Strategy; Haden's Version Differs Viking Lead Is Shaky ,,1980-12-09T05:00:00+0000
us,Hynes Promises Strict Discipline Under Fire Code; Says He Will Close Stores for Persistent Violations Overcrowding and Locked Exits ,,1980-12-09T05:00:00+0000
us,"15 GOVERNORS WANT SHIFT BY DEMOCRATS; At Political Meeting, They Pledge to Direct the National Party to Focus More on States Byrne Would Support Clinton ",,1980-12-09T05:00:00+0000
us,TV: 'Steve Allen Hour',,1980-12-09T05:00:00+0000
us,Arrow Stock Tumbles As Staff Sets to Rebuild,,1980-12-09T05:00:00+0000
us,A Doubled Coal Output Questioned; Study for I.E.A. Doubts Demand Reagan Transition Group Pleased A Doubled Coal Output Is Questioned ,,1980-12-09T05:00:00+0000
us,Export Credit Warning,,1980-12-09T05:00:00+0000
us,Hussein Says Iraqis Have Purposely Slowed Offensive,,1980-12-09T05:00:00+0000
us,"Solomon M. Strausberg, Headed Interboro Movie Theater Circuit",,1980-12-09T05:00:00+0000
us,ZIMBABWE OFFICIAL RELEASED BY COURT; He Is Found to Have Committed Murder in Shooting of White Farmer but Is Then Freed No Interference From Premier Attack on Army Outpost ,,1980-12-09T05:00:00+0000
us,15 Players Are Dealt; Cards Get Fingers; Knepper to Astros; Building for a Contender 15 Players Traded by 4 Teams ,,1980-12-09T05:00:00+0000
us,Books of The Times; Unfamiliar Vacationers Death Seems Benign ,,1980-12-09T05:00:00+0000
us,Advertising; Ramada Increasing Budget Ogilvy & Mather Adds Danskin Account Kurtz & Tarlow People Addenda ,,1980-12-09T05:00:00+0000
us,"Guy W. Calissi, 71, Retired Judge And a Jersey Prosecutor, Is Dead; College Scholarship Yielded Byrne Made 1970 Appointment",,1980-12-09T05:00:00+0000
us,Article 1 -- No Title,,1980-12-09T05:00:00+0000
us,Legacy of Greatness for 76ers; Past Greatness a Goal for Present 76ers A Series of Moves ,,1980-12-09T05:00:00+0000
us,Board Declares Ship Lost at Sea,,1980-12-09T05:00:00+0000
us,Michel of Illinois Elected House's Republican Leader; Lott and Kemp Win Posts Hatch Sees Progress Southern Democrats Gain,,1980-12-09T05:00:00+0000
us,"EDUCATION Enrollment May Not Fall, After All; Enrollment May Not Fall Children Follow Their Parents The Impact Will Vary Has Saturation Been Reached? ",,1980-12-09T05:00:00+0000
us,SOVIET ASSAILS UNION; U.S. Aides Say a Move Into Poland May Be Masked as Military Games Groundwork for Intervention Troops Prepared to Move U.S. Officials Report A Callup of Reservists In Soviet Bloc Nations,,1980-12-09T05:00:00+0000
us,"3 Vice Presidents Stepping Down at Ford Foundation, in Major Shift; Svirdoff Says Move 'Evolved' ",,1980-12-09T05:00:00+0000
us,Stocks Found to Regain Small Investors' Favor; Stocks Found to Regain Small Investors' Favor Capital-Gains Tax Factor Decline for New England ,,1980-12-09T05:00:00+0000
us,Mourners at Hasidic Funeral Honor a Shopkeeper Who Was Slain in Queens,,1980-12-09T05:00:00+0000
us,Heralding the Christmas Season,,1980-12-09T05:00:00+0000
us,Wiretap Case Involving Nixon Is Argued Before Supreme Court,,1980-12-09T05:00:00+0000
us,"De Paul Trounces Northern Illinois; L.I.U. 90, C.W. Post 76 Texas A & M 75, Sam Houston State 58 Wagner 89, Southampton 64 Michigan 98, Akron 69 Arguello May Bow Out Of Title Bout With Kenty ",,1980-12-09T05:00:00+0000
us,City Issues a Warning On Kerosene Heaters,,1980-12-09T05:00:00+0000
us,Gala Preview Party At Met for Robes Of Ching Dynasty; Mysterious and Strange ,,1980-12-09T05:00:00+0000
us,Reactor Owner Seeking $4 Billion From the U.S.,,1980-12-09T05:00:00+0000
us,Sharing Cheer With the Neediest,,1980-12-09T05:00:00+0000
us,"Rangers Reactivate Talafous, Drop Nethery",,1980-12-09T05:00:00+0000
us,Articles About Possible Cabinet Nominees Raise Questions on Journalistic Standards; 'Gamesmanship and Politics' Few Details on Those Named Items Not Quite News,,1980-12-09T05:00:00+0000
us,News Summary; International National Metropolitan ,,1980-12-09T05:00:00+0000
us,"A Widow, 81, Copes With Fixed Income And Sense of Pride; Buys Carrots but No Zucchini Widow, 81, Finds Own Ways to Cope With Fixed Income Studying Freud and Jung 'Would Not Ask for Help' Stays Home at Night Would Like to Work Again 'All the Lights and a Star' ",,1980-12-09T05:00:00+0000
us,Fokine Choreographic Art at Astor Gallery,,1980-12-09T05:00:00+0000
us,World Gold,,1980-12-09T05:00:00+0000
us,Salyut Repairs Made,,1980-12-09T05:00:00+0000
us,EXECUTIVE CHANGES,,1980-12-09T05:00:00+0000
us,U.P.S.'s Challenge in Germany; Faster Service Offered Mercedes Trucks Purchased German Labor Concerned ,,1980-12-09T05:00:00+0000
us,"$100,000 Onassis Prize Going to South African",,1980-12-09T05:00:00+0000
us,COMPANY NEWS Kennecott's Chairman Accused By Curtiss-Wright in Lawsuit,,1980-12-09T05:00:00+0000
us,Iraqis Say Objective Is Attained,,1980-12-09T05:00:00+0000
us,Obituary 9 -- No Title,,1980-12-09T05:00:00+0000
us,Growing Presence of Synanon Stirs Resistance in Arizona Town; Letters to Newspaper Emphasis of Group Shifts Dederich Decision on 'Home' ,,1980-12-09T05:00:00+0000
us,Obituary 11 -- No Title,,1980-12-09T05:00:00+0000
us,Listening to the Solar System Say Goodbye,,1980-12-09T05:00:00+0000
us,Giants Land Under Emergency Conditions; Loss of Pressure Cited Plane Trouble for Giants Who's No. 1--at Quarterback?,,1980-12-09T05:00:00+0000
us,"Theater: 'Butterfingers,' A William Gibson Spoof; Pageant Parody ",,1980-12-09T05:00:00+0000
us,OPEC Officials Differ on Prices,,1980-12-09T05:00:00+0000
us,Around the Nation; Appeals Court Dismisses Suit Over Nixon's Profits Ruling on a Bid by Sinatra For Casino Post Is Delayed Hundreds Restock Stores After Threat on Poisoning T.V.A. Halts Shipments To Avert Union Violence,,1980-12-09T05:00:00+0000
us,Decontrol Gas Now,,1980-12-09T05:00:00+0000
us,Cabaret: Tyler on Saxophone,,1980-12-09T05:00:00+0000
us,Television; Morning ,,1980-12-09T05:00:00+0000
us,Amex to Add 5 Puts,,1980-12-09T05:00:00+0000
us,Obituary 6 -- No Title,,1980-12-09T05:00:00+0000
us,Rock: The Skids From Scotland Play at Hurrah,,1980-12-09T05:00:00+0000
us,Cello: Teraspulsky Plays,,1980-12-09T05:00:00+0000
us,Warning Shots Fired by Israelis To Quell Protests in West Bank; News Agency Photographer Held ,,1980-12-09T05:00:00+0000
us,"Letters; A Perfect Republican Program Called CETA The Danger Embodied By the Moral Majority Let Freedom Return to the Highways America Is Failing Its Line Soldiers Runyon's Tip Unindicted Boss of the 'Gang of Four' Edward I. Koch, B.A. ",,1980-12-09T05:00:00+0000
us,"The War, and Oil Prices",,1980-12-09T05:00:00+0000
us,John Lennon of Beatles Is Killed; Suspect Held in Shooting at Dakota; Wife Reported Unhurt John Lennon Shot to Death; Suspect Is Seized at Dakota Obtained Autograph Earlier 'Crouching in Archway' Continued to Write Songs Emblem of the 60's ,,1980-12-09T05:00:00+0000
