iso_code,title,description,pubDate
us,GOING OUT Guide; INDIANS ENERGY TALKERS ,,1980-12-15T05:00:00+0000
us,"Joel Le Theule, French Official Since Late 50's; Served as Information Secretary ",,1980-12-15T05:00:00+0000
us,One-Time Pirate Isles Caught in a Latin Tug-of--War; 'Strange and Insolent' An Apology in Reverse ,,1980-12-15T05:00:00+0000
us,Shoppers Fail To Use a Mall Without Cars; An Air of Serenity ,,1980-12-15T05:00:00+0000
us,CORRECTIONS,,1980-12-15T05:00:00+0000
us,More Grumman Buses Could Be Sidelined on Coast; Narrow Choice of Buses 16 Serious Breaks Found ,,1980-12-15T05:00:00+0000
us,Ship Captain Commits Suicide,,1980-12-15T05:00:00+0000
us,"Around the Nation; Report Urges Early Action To Reduce Cancer Fatalities Tax Agents Make 9 Raids On Chicago-Area Gambling Drug Concern Will Pay $765,000 in Sex-Bias Case",,1980-12-15T05:00:00+0000
us,Question Box,,1980-12-15T05:00:00+0000
us,Marriage Announcement 1 -- No Title,,1980-12-15T05:00:00+0000
us,Obituary 11 -- No Title,,1980-12-15T05:00:00+0000
us,New Air Shuttle Delayed,,1980-12-15T05:00:00+0000
us,Faithful Contributors Give Again To Neediest in 69th Year of Drive; HOW TO AID THE FUND ,,1980-12-15T05:00:00+0000
us,The Line on Dallas' Larry Cole: The Master of the Unexpected,,1980-12-15T05:00:00+0000
us,Iran Aide Says Quick U.S. Action Might Free Hostages by Christmas; Iranian Note Expected Soon 'Basically Positive' Syrian Leader Is Said to Intervene Iran Says Carter Loses Interest ,,1980-12-15T05:00:00+0000
us,2 Are Killed and 2 Seriously Hurt In Crash on West Side Highway,,1980-12-15T05:00:00+0000
us,COSTA RICA FINDING THE FIESTA IS OVER; After Striving to Advance Equality Nation Faces Major Crisis-- People Are Disbelieving President Loses Ground Possibility of Riots Raised Election Campaign Begins Early,,1980-12-15T05:00:00+0000
us,Italy Finds No Clues in Terrorist Abduction; A Flag in the Background Magistrates Oppose Negotiations ,,1980-12-15T05:00:00+0000
us,"At Last, Saints March In, 21-20; Time Runs Out for Jets, Giving Saints Their First Victory, 21-20 Saints-Jets Summary Scoring Jets Notes Jets Statistics ",,1980-12-15T05:00:00+0000
us,Economic Imperatives,,1980-12-15T05:00:00+0000
us,Shipping/Mails; OUTGOING,,1980-12-15T05:00:00+0000
us,Sporting Gear; Angled-Arc Tennis Racquet Ice Skates Without Laces Attire for Bicyclists ,,1980-12-15T05:00:00+0000
us,A Bad Spell For the Bills,,1980-12-15T05:00:00+0000
us,The Spirit Of the Age,,1980-12-15T05:00:00+0000
us,BUSINESS PEOPLE; Standard & Poor's Names New Chief Klockner's Man in U.S. Ohio Bank Picks Head ,,1980-12-15T05:00:00+0000
us,City to Split Up Contract For Street Light Repairs; Few Bids Submitted City to Split Contract for Repairs Of Street Lighting to Trim Waste No Parts in Stock Profits Called Exorbitant Pressure Is Put on Contractors ,,1980-12-15T05:00:00+0000
us,Sports Today,,1980-12-15T05:00:00+0000
us,Obituary 3 -- No Title,,1980-12-15T05:00:00+0000
us,'Med Fly' Again Endangers California's Billion-Dollar Fruit Crop; Other Areas Taking Action 'A Constant Threat',,1980-12-15T05:00:00+0000
us,Prayer Urged in Atlanta Deaths,,1980-12-15T05:00:00+0000
us,"'TELL ME A RIDDLE,' AGED PAIR'S LOVE STORY","IF you're suffering from holiday depression, rest assured that somebody out there understands: ''Tell Me a Riddle'' is the second slow-death movie to open here in as many days, and chances are it's about people who feel worse than you do. Here, as in ''Tribute,'' someone is mortally ill and trying to make sense of life while there's still time. Otherwise, there's no comparison between the two films, since ''Tribute'' is awash in false sentiment and ''Tell Me a Riddle'' is a slow, restrained, dignified effort. ''Tell Me a Riddle,'' which was directed by Lee Grant, opens today at the 68th Street Playhouse. ",1980-12-15T05:00:00+0000
us,Approval of Taylor Voiced by Perkins,,1980-12-15T05:00:00+0000
us,Former Textile Workers Approve a $5 Million Pact; Dispute Began in 1956 'Paralyzed the Town' ,,1980-12-15T05:00:00+0000
us,San Francisco Wins N.C.A.A. Soccer Title,,1980-12-15T05:00:00+0000
us,Sales Flat For Many Retailers; Holiday Season Finds Shoppers In Frugal Mood Looking for Bargains First Holiday Shopping Slow in Many Cities Strong Fur Sales Noted Downward Trend in Chicago ,,1980-12-15T05:00:00+0000
us,Cooper Board Approves Plans,,1980-12-15T05:00:00+0000
us,Bridge:; Commercial League Boasts 50 Years of Significant Play ,,1980-12-15T05:00:00+0000
us,The Pros Aren't Passing on Lomax; The Pros Aren't Passing On Portland State's Lomax ,,1980-12-15T05:00:00+0000
us,Obituary 5 -- No Title,,1980-12-15T05:00:00+0000
us,Salt on Roads: Use Continues Despite Alarms; Health Problems Are Cited ,,1980-12-15T05:00:00+0000
us,Notes on People; A Cast of Stars in a Supporting Role Reagan's Son Has a Few Choice Words for Carter Florida's New Chancellor of Higher Education Pakistan Honors the Widow of Slain U.S. Ambassador Vandals Take a Toll on Town's Gesture for Hostages ,,1980-12-15T05:00:00+0000
us,A Reporter's Notebook: Haitians' Season of Terror,,1980-12-15T05:00:00+0000
us,Policeman Is Wounded During Flushing Chase,,1980-12-15T05:00:00+0000
us,Group Purchases Town In Arizona at Auction,,1980-12-15T05:00:00+0000
us,Soviet Nuclear Blast Indicated,,1980-12-15T05:00:00+0000
us,Libel Case Stirs British Review Of Press Curbs; A Question of Religion ,,1980-12-15T05:00:00+0000
us,Television,,1980-12-15T05:00:00+0000
us,"Film: 'Tell Me a Riddle,' Aged Pair's Love Story; The Summing Up ",,1980-12-15T05:00:00+0000
us,Outdoors: Being Guided to the Waterfowl,,1980-12-15T05:00:00+0000
us,Restored Merchant's House Is Toast of a Victorian Fete; Furnishings of the Past,,1980-12-15T05:00:00+0000
us,Obituary 13 -- No Title,,1980-12-15T05:00:00+0000
us,Atlanta's Jenkins Survives the Crunch,,1980-12-15T05:00:00+0000
us,Lennon's Accused Slayer Ends 2-Day Hunger Strike at Rikers Island,,1980-12-15T05:00:00+0000
us,Cheryl Crawford Up in Lights; Her Decisive Influence 'Porgy' Brings Success Friendship Endures '50 Years of Tap Dancing' At 92d St. Y Next Sunday ,,1980-12-15T05:00:00+0000
us,Seoul Extends Credit to Jamaica,,1980-12-15T05:00:00+0000
us,Obituary 12 -- No Title,,1980-12-15T05:00:00+0000
us,Obituary 2 -- No Title,,1980-12-15T05:00:00+0000
us,BUS DELAYS ARE DUE TODAY IN NEW YORK; COULD GO ON WEEKS; 637 New Buses Laid Up for Repair --M.T.A. Is Trying Stopgap Steps to Speed Service Cracked Frames Found Travelers Are Cautioned New York Faces Weeks of Delays In Its Bus Service ,,1980-12-15T05:00:00+0000
us,The City; Abrams to Press Con Ed on Refunds 2 Robbers Escape From Prison on S.I. City Leaders Urge Strict Gun Controls Dog Patrols Begin On Subways Today ,,1980-12-15T05:00:00+0000
us,Silent Tribute to Lennon's Memory Is Observed Throughout the World; Largest Group in Central Park Silent Tribute to Lennon's Memory Throughout the World A Sea of 'V's' Few Medical Emergencies ,,1980-12-15T05:00:00+0000
us,Norway Business Tax Cut,,1980-12-15T05:00:00+0000
us,"Greek Premier Making a Mark After 7 Months; Deterring a Socialist Victory Peaceful Rally, Then Violence Warning by the Premier",,1980-12-15T05:00:00+0000
us,Time Right for Costly Watches; 'An Investment in Time' Boom in Costly Watches ,,1980-12-15T05:00:00+0000
us,Radio; Music Talk Events/Sports ,,1980-12-15T05:00:00+0000
us,Article 1 -- No Title,,1980-12-15T05:00:00+0000
us,A Message From Reagan Is Taken to Middle East,,1980-12-15T05:00:00+0000
us,"On Howard, a Class Guy",,1980-12-15T05:00:00+0000
us,Entertainment Events; Film Music Dance Cabaret ,,1980-12-15T05:00:00+0000
us,Stop Funding Artistic Circuses,,1980-12-15T05:00:00+0000
us,Obituary 8 -- No Title,,1980-12-15T05:00:00+0000
us,Advertising; Pre-Merger Account for McGrath Business Bureau Reports on Ad Claims Montcalm Moves Into Science Fiction Personnel Shifted At McDonald & Little J & B in Jewish Media Where the Money Goes An Ad Strategy For Post-TV Era,,1980-12-15T05:00:00+0000
us,Aoki of Japan Beats Irwin by 7 Strokes,,1980-12-15T05:00:00+0000
us,Treasury Borrowings To Be Heavy This Week,,1980-12-15T05:00:00+0000
us,Islanders Win on 3d Bossy Goal As Jets Tie 'Futility' Mark at 27; Jets' Personnel Decimated 'Too Hard' on McVie Islanders Scoring ,,1980-12-15T05:00:00+0000
us,FARMERS IN POLAND GATHER TO ORGANIZE UNION OF THEIR OWN; STRIKES CALLED A POSSIBILITY Church Steps Up Appeal for Unity to Guard 'Freedom' of Nation and Orders a New Prayer Common Sense of Gravity Repository of Polish Nationhood Polish Farmers Meet to Organize Their Own Union Supreme Court to Hear Appeal ,,1980-12-15T05:00:00+0000
us,Obituary 6 -- No Title,,1980-12-15T05:00:00+0000
us,"Letters; The Symbolic Illusion of Rent Control Before Decontrol New York's Leaders In Electricity Waste As Guns Keep Killing To Spend an Evening at the Museum Arson, Insurance and Misinformation The Perils of Jake Garn David Rockefeller's Misguided Support of Argentina's Government ",,1980-12-15T05:00:00+0000
us,The Theater: Toby Robertson's 'Pericles'; The Bard Inside Out ,,1980-12-15T05:00:00+0000
us,Obituary 4 -- No Title,,1980-12-15T05:00:00+0000
us,Jehovah's Witness in Court Suit Over Munitions Job; Problem for Justices Just a 'Personal' Reason 17-Year-Old Challenge An 'Unscriptural' Practice Search for Vacant Jobs ,,1980-12-15T05:00:00+0000
us,Obituary 10 -- No Title,,1980-12-15T05:00:00+0000
us,"Erving and 76ers Wear Down Nets, 114-107; O'Koren Held to 2 Points Lakers 122, Warriors 113 Blazers 116, Suns 110 Bucks 115, Spurs 98 ",,1980-12-15T05:00:00+0000
us,Town's Former Tax Official Goes On Trial in Death of Political Foe,,1980-12-15T05:00:00+0000
us,New Stocks Drawing Intense Investor Interest; 'Biggest Year Since 1972' Investors Snap Up New Stocks The Rush to Convertibles ,,1980-12-15T05:00:00+0000
us,Shelter Ethics Divide Auditors; Violation of Ethics Shelter Ethics Divide Auditors Commission Payment Included ,,1980-12-15T05:00:00+0000
us,BLACK REPUBLICANS MEET REAGAN AIDES; Conservatives for Lower Minimum Wage and End of Rent Control --Hear Pledge on Posts Speculation About Cabinet Job 'Pays to Stay Disadvantaged' Rent Control Criticized ,,1980-12-15T05:00:00+0000
us,Concert: Youth Symphony Plays Beethoven,,1980-12-15T05:00:00+0000
us,Chevrolet Dealers Seek Aid,,1980-12-15T05:00:00+0000
us,Oregon Stores Seek Restitution From Shoplifters; One Man Files Suit ,,1980-12-15T05:00:00+0000
us,High Interest Rates Threaten Companies' Solvency; Signs of Easing Are Unclear Slowing of Cash Flow Attracted by High Yields Heavy Credit Burden ,,1980-12-15T05:00:00+0000
us,"Musical: 'Onward Victoria,' A Woman's Freedom Fight; Feminism, 1871 Style ",,1980-12-15T05:00:00+0000
us,Concert: The Musica Aeterna,,1980-12-15T05:00:00+0000
us,State Aid Drawing Crowded Field To 1981 Race for Jersey Governor; $5 Million Estimate Discarded State Aid Leads to Crowded Race for Jersey Governor Many Test the Waters ,,1980-12-15T05:00:00+0000
us,"Rangers Miss Chances, Lose to Hawks, 2-1; Rangers Scoring Bruins 7, Kings 1 Flyers 5, Blues 4 ",,1980-12-15T05:00:00+0000
us,Curiosity and Hope Lead Many to See Welch Loot; Suspected for Several Years Almost Half Identified Discouragement Was Evident Stories on Accused Burglar ,,1980-12-15T05:00:00+0000
us,Obituary 9 -- No Title,,1980-12-15T05:00:00+0000
us,"Friendship: A Fact of Life for Toddlers, Too; Challenging Assumptions Theoretical Model 60 Families Observed",,1980-12-15T05:00:00+0000
us,2 Nazis Arrested in Los Angeles On Suspicion in Synagogue Fire,,1980-12-15T05:00:00+0000
us,"Around the World; 3,000 Rioters on Rampage In Downtown West Berlin Israel's Rules for Reporters In Occupied Areas Revised British Observer Detained As Guyanese Vote ",,1980-12-16T05:00:00+0000
us,COMPANY NEWS Berkeley Co-op Now Placing Emphasis on Its Profitability; Group Dates to 1937 ,,1980-12-16T05:00:00+0000
us,Fair Pay in Washington,,1980-12-16T05:00:00+0000
us,"Dental Research Finds Surprises In Cheese And Sugar; Dental Disease: Sugar, Cheese Cause Surprises Fluoride Helps Good Bugs Drive Out Bad A Vaccine Against Decay ",,1980-12-16T05:00:00+0000
us,Policeman Is Critically Wounded And Arresting Team Shoots Man; Not Wearing Vest ,,1980-12-16T05:00:00+0000
us,"Belated Birthday Party for Koch Brings in $300,000 for Re-election; An Early Choice ",,1980-12-16T05:00:00+0000
us,Obituary 7 -- No Title,,1980-12-16T05:00:00+0000
us,"TV: 'Blinded by Light,' Movie on Religious Cult",,1980-12-16T05:00:00+0000
us,Ex-Im Bank Faces '81 Loss,,1980-12-16T05:00:00+0000
us,A.M.C. to Vote On New Financing,,1980-12-16T05:00:00+0000
us,"ANGUS CAMPBELL, 70; SOCIAL RESEARCHER; Professor at U. of Michigan Led in Studies of Racial Issues, the Voter and Quality of Life Studies on Racial Problems Happiness in America ",,1980-12-16T05:00:00+0000
us,Russian Aides Express Reluctance on Arms Talks,,1980-12-16T05:00:00+0000
us,House Backs Spending Bill After Adding Pet Provisions,,1980-12-16T05:00:00+0000
us,EDUCATION $63 Million Aimed at Programs For Students Who Are Left Back; $63 Million Committed To Aid Pupils Left Back The Districts May Object One Promising Program ,,1980-12-16T05:00:00+0000
us,Decongesting Manhattan,,1980-12-16T05:00:00+0000
us,Article 3 -- No Title,,1980-12-16T05:00:00+0000
us,Obituary 1 -- No Title,,1980-12-16T05:00:00+0000
us,Obituary 8 -- No Title,,1980-12-16T05:00:00+0000
us,Soviet Obliquely Suggests Patient Stand on Poland,,1980-12-16T05:00:00+0000
us,YUGOSLAVIA IS ALERT BUT CALM ON POLAND; Officials Assail 'Outside Pressure' but Shortages of Goods Seem to Be More Worrisome Reaction Sounds Like Tito's Gold Watch Was Crushed ,,1980-12-16T05:00:00+0000
us,Meredith Names Unit President,,1980-12-16T05:00:00+0000
us,Dow Drops 5.55 as Rally Fades; Meeting Set for Friday ,,1980-12-16T05:00:00+0000
us,"Armistead L. Bradford, Ex-Aide of United Press",,1980-12-16T05:00:00+0000
us,A.F.C. Playoff Spots Undecided as Season Enters Final Week; Breaking the Tie ,,1980-12-16T05:00:00+0000
us,All-Round Athlete Now in New York Spotlight; David Mark Winfield Man in the News Football 'Wasn't My Game' Phone Calls to St. Paul Articulate and Generous .276 Last Season,,1980-12-16T05:00:00+0000
us,Order to Compare Census Lists Upheld,,1980-12-16T05:00:00+0000
us,Restrictions in Services For the Elderly Projected,,1980-12-16T05:00:00+0000
us,Film: 'Empire of Passion',,1980-12-16T05:00:00+0000
us,Builder of Buses Says City Roads Cracked Frames; Builder of Buses Says City's Roads And Overloading Cracked Frames Jersey Reconsiders Purchase Problems Found in Illinois ,,1980-12-16T05:00:00+0000
us,Book Critics Circle Lists Nominees for Its Awards; FICTION GENERAL NONFICTION POETRY CRITICISM ,,1980-12-16T05:00:00+0000
us,"CURRENCY MARKETS Dollar Falls, Gold Rises On News of Rates and Oil",,1980-12-16T05:00:00+0000
us,How the Shoreham Reactor's Costs Soared; Reason for a Change of Mind Estimated Saving in Oil 'A Masterpiece' Worst Was Yet to Come Approval Awaited ,,1980-12-16T05:00:00+0000
us,The D.&H.'s Fight for Survival; The D.&H. Fight for Survival Low-Interest Loans Sought Recession a Setback ,,1980-12-16T05:00:00+0000
us,Bus Riders Adapt to a Shortage of Transportation,,1980-12-16T05:00:00+0000
us,FOREIGN AFFAIRS Diplomatic Jitters,,1980-12-16T05:00:00+0000
us,East Germany Restricting Troops; Passes for Married Soldiers ,,1980-12-16T05:00:00+0000
us,Nuclear Power Cost Estimate,,1980-12-16T05:00:00+0000
us,Eastern Air And Braniff Hold Talks; Merger Study By 2 Carriers Called a Surprise Washington's Approval Needed Two Motivations Suggested Braniff Link to Eastern ,,1980-12-16T05:00:00+0000
us,Avoiding a Hard Line On the Cubans,,1980-12-16T05:00:00+0000
us,Ram Aide Said to Get Warning; Forced to Resign Post ,,1980-12-16T05:00:00+0000
us,Obituary 10 -- No Title,,1980-12-16T05:00:00+0000
us,Dividends,,1980-12-16T05:00:00+0000
us,"Recital: David Singer, Clarinetist",,1980-12-16T05:00:00+0000
us,CORRECTIONS,,1980-12-16T05:00:00+0000
us,THRONGS EXPECTED AT GDANSK MEMORIAL; Ceremony Today Will Mark Deaths of Workers in 1970 Uprising Monument to Be Unveiled At Polish Shipyard Today Strikes Ended in Settlement ,,1980-12-16T05:00:00+0000
us,"Dependents of Informer Criticize Government Protection Program; 3,500 Witnesses in Program Physical Security Provided",,1980-12-16T05:00:00+0000
us,Canada Holds Gas Price Line,,1980-12-16T05:00:00+0000
us,Q&A,,1980-12-16T05:00:00+0000
us,Inquiry Clears Rowe in Slaying of Civil Rights Worker; Present at Liuzzo Shooting Conflicts in Stories ,,1980-12-16T05:00:00+0000
us,Migrants' Suit for Safety Rules Opens; Attacked by Industry 'Industry Does a Good Job' ,,1980-12-16T05:00:00+0000
us,"Gaming Unit Sums Up Objections To Bally Casino, Citing Crime Ties; Manufacturer of Slot Machines Testimony About Reputation ",,1980-12-16T05:00:00+0000
us,Letters; The Yet-Untriggered War Powers Provision Leaky Water Systems in Need of U.S. Help A Legislator Vindicated Lindsay Achievements And Koch Propaganda The Proper Transport Of Deer Carcasses To Let the Handicapped Use Mass Transit ,,1980-12-16T05:00:00+0000
us,L.I. Man Given 20 Years For $6.8 Million Tax Evasion,,1980-12-16T05:00:00+0000
us,British Factory Output Off 1%,,1980-12-16T05:00:00+0000
us,City Looks to Port Agency for Bridge Repairs; City Seeks Pact for Port Agency To Supervise Repair of Bridges Port Agency Has Mellowed Repairs Now Lagging ,,1980-12-16T05:00:00+0000
us,Tentative Pact Reached At Continental Airlines,,1980-12-16T05:00:00+0000
us,Science Watch; New Insights on Huge Moon Encouraging Stair-Climbing ,,1980-12-16T05:00:00+0000
us,Poisonous Giant Hogweed Takes Hold in New York; Hogweed Takes Hold ,,1980-12-16T05:00:00+0000
us,"Cattle Herds Shrink, Indicating Price Rise",,1980-12-16T05:00:00+0000
us,Art: The Picassos Beneath the Picasso,,1980-12-16T05:00:00+0000
us,Corporate Loans Soar at Banks; Uncertainty Complicating Factor Corporate Loans Soar At Commercial Banks Diminished Liquidity Cited Bond Volume Slowed ,,1980-12-16T05:00:00+0000
us,Pardee Threatening to Quit,,1980-12-16T05:00:00+0000
us,"Gregg, Race Driver, Dies",,1980-12-16T05:00:00+0000
us,Books of The Times,,1980-12-16T05:00:00+0000
us,The South Africans and Mr. Reagan,,1980-12-16T05:00:00+0000
us,"Mets Acquire Jones For Pacella, Moreno; Hope to Sign Staub; Cy Young, Then Arm Trouble 'Ready to Go' A Gamble Worth Taking Staub Would Add Power",,1980-12-16T05:00:00+0000
us,Auto Sales Down 7.1%; Auto Sales Of Dec. 1-10 Down 7.1% Rebate Ads Delayed ,,1980-12-16T05:00:00+0000
us,The City; Film Makers Sued On Guardian Angels Koch Signs Taxi Bill 9 Persons Listed As Illegal Dumpers $210 Million Sought By Brooklyn Couple ,,1980-12-16T05:00:00+0000
us,F.D.A. Warns Against Chinese Herbs,,1980-12-16T05:00:00+0000
us,COMPANY NEWS; Chrysler Aid Linked To Reagan's Assent Fresh Economies Asked U.A.W. Talks Due Today Bankers Cool to Proposal Japan Trade Deficit Britain to Lift Fiber Curb ,,1980-12-16T05:00:00+0000
us,Columbia Association Honors L.I. War Hero,,1980-12-16T05:00:00+0000
us,Snow Falls on the City; 4 to 6 Inches Expected,,1980-12-16T05:00:00+0000
us,Corporate Earnings,,1980-12-16T05:00:00+0000
us,2 Men Charged In Hired Killing Of Bank Official; 2 Held in Riverside Drive Slaying in Suspected Plot Began to Have Doubts 'Old-Fashioned' Way ,,1980-12-16T05:00:00+0000
us,Dog Patrols Put Teeth Into Subways Crime Fight; 'Will He Bite?' Very Little Crowd Training ,,1980-12-16T05:00:00+0000
us,U.S. Panel to Study Charges Of Oil Thefts From Indians; 2-Million-Acre Reservation Thefts Are Said to Continue ,,1980-12-16T05:00:00+0000
us,New York State Electors Meet and Officially Pick Reagan and Bush,,1980-12-16T05:00:00+0000
us,Money,,1980-12-16T05:00:00+0000
us,OPEC MEETING ENDS WITH SIGN OF ACCORD ON $2-TO-$3 OIL RISE; INCREASE IS CONSIDERED MILD New Level Likely to Raise Gasoline Prices by a Cent a Gallon-- Pact a Victory for Cartel Saudis Took First Step OPEC Conference Ends; $2-3 Price Rise Reported ,,1980-12-16T05:00:00+0000
us,Koch Revises Support of Westway; Will Offer a Cheaper Plan Today; Koch Backs Off Support for Westway and Will Offer a New Plan Today Worried About Subways ,,1980-12-16T05:00:00+0000
us,Sports of The Times; 'We'll See How Good I Am Now' ,,1980-12-16T05:00:00+0000
us,Obituary 9 -- No Title,,1980-12-16T05:00:00+0000
us,Tenor: Peerce Marks a Jubilee,,1980-12-16T05:00:00+0000
us,Colombian Jet Hijacked And Flown to Panama,,1980-12-16T05:00:00+0000
us,Jury Gets Case of Officer Accused Of Cover-Up in Miamian's Death; Admission Led to Prosecutions ,,1980-12-16T05:00:00+0000
us,Music: Christmas Spirit at Boston Pops,,1980-12-16T05:00:00+0000
us,Woody Allen Switching to Orion After 10 Years at United Artists; Commitment to Orion Team ,,1980-12-16T05:00:00+0000
us,U.S. Challenges Abscam Reversal; A Motion to Dismiss F.B.I. Agent Is Termed a Liar ,,1980-12-16T05:00:00+0000
us,"REAGAN IS REPORTED READY TO NAME HAIG SECRETARY OF STATE; Also Expected to Pick James Watt, a Wyoming Conservative, to Head the Interior Dept. Lobbied for Commerce Group Haig and Lawyer From Wyoming Said to Be Choices for the Cabinet ",,1980-12-16T05:00:00+0000
us,Iranian and Iraqi Armies Fight for Strategic Highlands; Iraq Reports Crushing Attack,,1980-12-16T05:00:00+0000
us,FRANCE OPENS DRIVE AGAINST ALCOHOLISM; Wine Lobby Is Expected to Resist Plan for Big Price Increase-- Educational Effort Is Set Drinking Starts in Cradle Wine Consumption Is Dropping ,,1980-12-16T05:00:00+0000
us,Koch Introduces Plan to Update Tax Abatements; Special District Proposed From 28th to 86th Sts. Imposing a 'Minimum Tax' 'No Need to Overbait Hook',,1980-12-16T05:00:00+0000
us,Iran to Issue 'Final' Hostage Reply; Bani-Sadr Stresses Assets' Return,,1980-12-16T05:00:00+0000
us,Notes on People; White House Decides on a Yuletide Political Cease-Fire Simon Demonstrates How to Give Away $1.2 Million What Goes With Bartosiewicz? Tobias Governor News From Down on the Farm at U.S. Naval Academy ,,1980-12-16T05:00:00+0000
us,U.N. Vote Calls for Sanctions on Israel; P.L.O. Notes Some Progress Little Impact Foreseen U.S. Declines to Speak ,,1980-12-16T05:00:00+0000
us,Israeli Prices Rise 9% in Month,,1980-12-16T05:00:00+0000
us,F.T.C. Wins High Court Appeal In Suit by Socal to Block Inquiry; Political Pressure Alleged 'Threshold Determination' Bankrupt Railroad Airline Advertising Filter Directors Accused ,,1980-12-16T05:00:00+0000
us,"Aurora Will Be Man-Made, As Scientists 'Tickle' Space; Scientists Will 'Tickle' Magnetic Field The Russians Try Hard More Countries Join In ",,1980-12-16T05:00:00+0000
us,Article 1 -- No Title,,1980-12-16T05:00:00+0000
us,"Unbeaten U.C.L.A. Wins Fifth, 69-62; Indiana 65, Oral Roberts 56 Drexel 80, St. Francis 57 Old Westbury 69 City College 67 U.S.M.M.A. 65, Union 63 ",,1980-12-16T05:00:00+0000
us,The Region; Jersey Bids Industry Cut Use of Water Amtrak Is Accused On Rail Car Upkeep 11% Rate Rise Urged For Con Edison ,,1980-12-16T05:00:00+0000
us,The Blouse: Symbol of Outrageous Femininity; Frothy Aurora Around the Neck Grandeur When It Is Warranted ,,1980-12-16T05:00:00+0000
us,Obituary 4 -- No Title,,1980-12-16T05:00:00+0000
us,Events Today,,1980-12-16T05:00:00+0000
us,"Not Jungles, Not Guns Stop Brazil's Census Takers; Political Manipulation Charged President Begins Count ",,1980-12-16T05:00:00+0000
us,Ashland Plans Unit To Lift Gas Ratio; Shell to Proceed On Recovery Plan ,,1980-12-16T05:00:00+0000
us,Trial of Peoples Temple Member On Murder Charge Is Set for May,,1980-12-16T05:00:00+0000
us,Bridge:; Book Shows How Experts Use Modern Bidding Ideas One-Level Suit Response ,,1980-12-16T05:00:00+0000
us,"Irving M. Bunim, 79; Author and Lecturer About Jewish Subjects",,1980-12-16T05:00:00+0000
us,Encore for Carradine,,1980-12-16T05:00:00+0000
us,A Reporter's Notebook: The Gloom in Bucharest,,1980-12-16T05:00:00+0000
us,Article 2 -- No Title,,1980-12-16T05:00:00+0000
us,'EMPIRE OF PASSION',"EMPIRE OF PASSION,'' which opens today at the Public Theater, is the latest film by Nagisa Oshima, the Japanese director who three years ago startled quite a few people, including United States Customs inspectors, with the undisguised eroticism of ''In the Realm of the Senses,'' a movie whose two lovers carried their obsession with sex to an all-consuming conclusion. ''Empire of Passion'' is a far more gentle, infinitely more romantic, movie in which the obsession is not only sex but also the love that encompasses it.",1980-12-16T05:00:00+0000
us,A Merry Momentum,,1980-12-16T05:00:00+0000
us,"With High Hair and New Wave, a 60's Look Returns; Hair Spray Is Back ",,1980-12-16T05:00:00+0000
us,Obituary 2 -- No Title,,1980-12-16T05:00:00+0000
us,"Mary Cantwell, Writer and Editor, Named to Times Editorial Board",,1980-12-16T05:00:00+0000
us,Coal Import Rise Seen in Europe and Japan; Bottlenecks at U.S. Ports Dredging of Ports Still Debated ,,1980-12-16T05:00:00+0000
us,Market Place; Ethical Drugs' Stock Behavior,,1980-12-16T05:00:00+0000
us,Canadian Takeovers Are the Talk of the Town; Toronto Is Talking Takeover ,,1980-12-16T05:00:00+0000
us,Yanks Sign Winfield for Up to $25 Million; $1.5 Million for First Year Winfield Becomes Yankee Praise for Jackson Yankee Free Agents,,1980-12-16T05:00:00+0000
us,"COMMODITIES Grains, Livestock, Sugar And Coffee Climb Limits; Cattle on Feed Lots Down ",,1980-12-16T05:00:00+0000
us,Michaels Plans Bold Offense in Finale; Players Feel Depressed Buttle Is Angry Shea Record for Absentees ,,1980-12-16T05:00:00+0000
us,Cosmos Reacquire Iarusci of Diplomats,,1980-12-16T05:00:00+0000
us,"COMPANY NEWS; Hobart Is Stalked By Canadian Pacific Docutel Agreement Parker International Acquired by Grace Sceptre, Kaiser Oil Study Joint Venture Mapco Bid Response Freeport, McMoRan Report Merger Plan Publisher Wooed General Mills Net Shows 36.5% Rise U.S. Steel Revising Pollution Accord Morton Acquisition ",,1980-12-16T05:00:00+0000
us,Obituary 5 -- No Title,,1980-12-16T05:00:00+0000
us,China's Army Grumbles Over Loss of Political Power; A Powerless General ,,1980-12-16T05:00:00+0000
