iso_code,title,description,lang_tranlation,title_translated,description_translated,pubDate
pt,Brasil criou em Fevereiro número recorde de empregos formais,"O Brasil criou 431.995 empregos formais em Fevereiro, um númerorecorde para um mês desde que há registos, graças a um impulso no setor deserviços, anunciou ontem o Governo.O volume de empregos criados na maior economia da América Latinafoi mais do que o dobro do registado em janeiro e 40% maior do que no mesmo mêsdo ano passado, segundo dados do Ministério do Trabalho.O setor dos serviços foi responsável por mais de metade dos postosde trabalho criados (254.812), seguido pelo comércio, co",en,Brazil created in February record number of formal jobs,"Brazil has created 431,995 formal jobs in February, a number for one month since there are records, thanks to an impetus in the outcoming sector, the government announced yesterday. The volume of jobs created in Latin America's largest economy more than double the registered in January and 40% higher than last month, according to data from the Ministry of Labor. (254,812), followed by trade, co",2025-03-29 04:00:00
pt,Myanmar eleva balanço de vítimas do sismo para 694 mortos e 1.670 feridos,"O forte sismo de magnitude 7,7 que atingiu o centro de Myanmar (antiga Birmânia) na sexta-feira matou 694 pessoas e feriu outras 1.670 no país, informou hoje a junta militar no poder, num novo relatório revisto consideravelmente em alta.",en,"Myanmar lifts the balance of earthquakes to 694 dead and 1,670 injured","The strong earthquake of magnitude 7.7 that hit the center of Myanmar (formerly Burma) on Friday killed 694 people and injured 1,670 in the country, today the military junta in power reported in a new reviewed report considerably on the rise.",2025-03-29 03:58:09
pt,"Moradora encontra e acolhe pastor alemão perdido na região do Taveirópolis, Caiçara","O tutor do animal pode entrar em contato com Nathalie, pelo 67 99891-5641, mediante provaOriginalmente publicado em Moradora encontra e acolhe pastor alemão perdido na região do Taveirópolis, Caiçara, Conteúdo original de Jornal Midiamax | Notícias de Campo Grande e Mato Grosso do Sul.",en,"Resident finds and welcomes German pastor lost in the Taveirópolis region, caiçara","The tutor of the animal can contact Nathalie at 67 99891-5641, through aoriginal proof published in a resident finds and welcomes German pastor lost in the Taveirópolis region, Caiçara, original content from Midiamax newspaper | News from Campo Grande and Mato Grosso do Sul.",2025-03-29 03:42:59
pt,Japão envia condolências às famílias das vítimas em Myanmar e Tailândia,"O primeiro-ministro japonês, Shigeru Ishiba, enviou as suas condolências às famílias das vítimas do forte sismo que atingiu Myanmar, antiga Birmânia, e a vizinha Tailândia, matando pelo menos 150 pessoas, informou o seu gabinete no sábado.",en,Japan sends condolences to victims' families in Myanmar and Thailand,"Japanese Prime Minister Shigero Ishiba sent his condolences to the families of the victims of the strong earthquake who hit Myanmar, former Burma, and neighboring Thailand, killing at least 150 people, said his office on Saturday.",2025-03-29 03:31:01
pt,Defensoria consegue liberdade para homem preso indevidamente por mais de três meses,"Caso teve início quando um preso progrediu para o regime semiabertoOriginalmente publicado em Defensoria consegue liberdade para homem preso indevidamente por mais de três meses, Conteúdo original de Jornal Midiamax | Notícias de Campo Grande e Mato Grosso do Sul.",en,Defensoria gets freedom for man improperly arrested for more than three months,"If it began when a prisoner progressed to the semi -open regime pubinally published in Defender's Office gets freedom for man imprisoned improperly for more than three months, original content of newspaper Midiamax | News from Campo Grande and Mato Grosso do Sul.",2025-03-29 03:25:54
pt,"Estrela da Amadora-Sporting, 0-3 (destaques)",Gyökeres de uma ponta à outra,en,"Amadora-Sporting Star, 0-3 (Highlights)",Gyökeres from end to end,2025-03-29 20:21:00
pt,EM DIRETO: a análise de Rui Borges à vitória do Sporting na Amadora,"Gyokeres bisou de penálti, Geovany Quenda fez grande golo",en,Live: Rui Borges's analysis to Sporting's victory in Amadora,"Gyokeres scored penalty, Geovany Quenda scored great goal",2025-03-29 20:21:00
pt,200 concessionários da Tesla em todo o mundo alvo de protestos,,en,200 Tesla dealers around the world targeted by protests,,2025-03-29 20:20:00
pt,Nuno Espírito Santo sorri nos penáltis e está nas 'meias' da Taça,Nottingham Forest eliminou o Brighton nos penáltis.,en,Nuno Espírito Santo smiles in the penalties and is in the 'socks' of the cup,Nottingham Forest eliminated Brighton in penalties.,2025-03-29 20:19:44
pt,Viana do Castelo simulou acidente,Mês da Proteção CivilO conteúdo Viana do Castelo simulou acidente aparece primeiro em O MINHO.,en,Viana do Castelo simulated accident,Month of Civilo Protection Content Viana do Castelo simulated accident appears first in O Minho.,2025-03-29 20:19:03
pt,Taça de Inglaterra: NES acaba com enguiço de 34 anos do Forest!,Equipa do treinador português volta às meias-finais da Taça de Inglaterra mais de três décadas depois,en,England Cup: NES ends with Forest 34 years old!,Portuguese coach team returns to the England Cup semi-finals more than three decades later,2025-03-29 20:18:48
pt,"Estrela da Amadora-Sporting, 0-3 (crónica)",Leão castiga autoflagelação,en,"Estrela of Amadora-Sporting, 0-3 (Chronicle)",Lion punishes self -flagellation,2025-03-29 20:18:21
pt,Proença agradece apoio... que Fernando Gomes diz que não deu,Antigo presidente da Federação reage a declarações do sucessor e garante que não quer intervir no processo eleitoral da UEFA,en,Proença thanks support ... that Fernando Gomes says he didn't give,Former President of the Federation reacts to declarations of the successor and guarantees that he does not want to intervene in the Electoral Process of UEFA,2025-03-29 20:18:00
pt,Sporting vence na Amadora e retoma liderança isolada,"O Sporting venceu hoje em casa do Estrela da Amadora por 3-0, em jogo da 27.a jornada da I Liga de futebol, resultado que lhe permite voltar à liderança isolada, mas com mais um jogo.Num jogo em que até estava a sentir dificuldades para ultrapassar a defesa contrária, o Sporting, que somou o quarto triunfo consecutivo para o campeonato e estava a jogar com mais uma unidade desde os 34 minutos, depois da expulsão por segundo amarelo de Gustavo Montoia, chegou à vantagem apenas aos 52, numa grand",en,Sporting wins in Amadora and resumes isolated leadership,"Sporting won today at the 3-0 star of Amadora star in a match of the 27th Journey of the First Football League, a result that allows him to return to the isolated lead, but with another game. In which she was even having trouble over the opposite defense, Sporting, who added the fourth consecutive triumph for the championship and was playing with another 34 minutes after the expulsion of Gustavo's second yellow expulsion. Montoia, reached the advantage only at 52, in a grand",2025-03-29 20:16:43
pt,Estreia do Vasco no Brasileirão contra o Santos terá show de luzes inédito,"A torcida vascaína terá um motivo a mais para comparecer em peso a São Januário neste domingo (30), na estreia do Vasco no Campeonato Brasileiro contra o Santos. O clube cruzmaltino apresentará o novo sistema de iluminação do estádio, fruto de uma parceria com a empresa Silicon, especialista em iluminação de grandes arenas esportivas. Para [...]O post Estreia do Vasco no Brasileirão contra o Santos terá show de luzes inédito apareceu primeiro em Gazeta Esportiva.",en,Vasco's debut in Brasileirão against Santos will have unpublished light show,"The Vasca fans will have one more reason to attend São Januário in weight this Sunday (30), at Vasco's debut in the Brazilian Championship against Santos. The Cruzmaltino club will present the new stadium lighting system, the result of a partnership with the company Silicon, specializing in lighting of large sports arenas. For [...] Vasco's debut post in Brasileirão against Santos will have unpublished light show first appeared in Gazeta Esportiva.",2025-03-29 20:16:17
pt,Geovany Quenda ampliou assim a vantagem do Sporting na Reboleira,Português respondeu da melhor maneira a uma assistência de Gyokeres.,en,Geovany Quenda thus expanded Sporting's advantage in the Reboleira,Portuguese responded to the best way to assist Gyokeres.,2025-03-29 21:17:04
pt,Rapaz assassinado com seis facadas pelo ‘amigo’ no Portal Caiobá é identificado,"O suspeito foi preso em flagrante ainda durante a madrugadaOriginalmente publicado em Rapaz assassinado com seis facadas pelo ‘amigo’ no Portal Caiobá é identificado, Conteúdo original de Jornal Midiamax | Notícias de Campo Grande e Mato Grosso do Sul.",en,Boy murdered with six stabbed by the 'friend' on the Caiobá portal is identified,"The suspect was arrested in the act still at dawn in -lawnly published in a boy murdered with six stabbed by the 'friend' on the Caiobá portal is identified, original content of newspaper Midiamax | News from Campo Grande and Mato Grosso do Sul.",2025-03-29 21:17:03
pt,Leixões ainda assusta mas Benfica não compromete meia-final,Encarnados vencem jogo 1 da meia-final do campeonato,en,Leixões still scares but Benfica does not compromise semi-final,Incarnates win game 1 of the championship half-final,2025-03-29 21:16:46
pt,Veja fotos de Real Madrid x Leganés pela 29a rodada do Campeonato Espanhol,O post Veja fotos de Real Madrid x Leganés pela 29a rodada do Campeonato Espanhol apareceu primeiro em Gazeta Esportiva.,en,See photos of Real Madrid x Leganés for the 29th round of the Spanish Championship,The post see photos of Real Madrid x Leganés for the 29th round of the Spanish Championship first appeared in Gazeta Esportiva.,2025-03-29 21:16:15
pt,"Luís Silva. ""Sentimos muita gente a tentar apoiar o Sporting a vencer""",O Sporting venceu o Estrela Amadora por 3-0 e retoma a liderança do campeonato.,en,"Luís Silva. ""We feel a lot of people trying to support Sporting to win""",Sporting beat Estrela Amadora 3-0 and resumes the lead of the championship.,2025-03-29 21:15:45
pt,21h. Ana Abrunhosa: “PNS não tem obrigação de incluir nas listas do PS nomes do Governo de Costa”,"A também candidata à Câmara de Coimbra realça que o secretário-geral do PS deve até imprimir uma marca própria no partido. E ainda, Jair Bolsonaro recusa pedir asilo político nos Estados Unidos.",en,21h. Ana Abrunhosa: “PNS has no obligation to include in the PS lists of the Costa Government”,"Also candidate for the Chamber of Coimbra emphasizes that the PS secretary general must even print a brand of his own. And yet, Jair Bolsonaro refuses to ask for political asylum in the United States.",2025-03-29 21:15:38
pt,Reabertura da Igreja de Santa Rita com missa do Bispo do Funchal,"Após pedido de ajuda aos fiéis para reabilitação da Igreja Paroquial da Vitória, a Paróquia de Santa Rita, recebe este domingo o Bispo do Funchal para uma missa.Em Fevereiro, anunciavam que o tecto da Igreja já estava concluído e estariam na segunda fase, o arranjo do chão da Igreja que estava a levantar. Decorreu um peditório das missas que reverteria para as obras, tendo a Paróquia pedido ajuda com um IBAN (PT50 0018 0008 0103 8545 0206 3) da Fábrica da Igreja da Vitória.A missa a ser celeb",en,Reopening of the Church of Santa Rita with Mass of the Bishop of Funchal,"After requesting help to the faithful to rehabilitate the Parish Church of Vitória, the Parish of Santa Rita, receives this Sunday the Bishop of Funchal for a Mass. In February, they announced that the church ceiling was already completed and would be in the second phase, the arrangement of the church floor that was lifting. A peditory of the masses that would revert to the works, having the parish requested help with an IBAN (PT50 0018 0008 0103 8545 0206 3) of the Church of Vitória. The Mass to be celebrated",2025-03-29 21:12:28
pt,Vânia Jesus será candidata às legislativas,"O PSD-Madeira já apresentou os seus candidatos às eleições legislativas regionais de 18 de Maio. Pedro Coelho encabeça a lista social-democrata, numa equipa que aposta na continuidade, mas também na renovação de rostos.Ao lado do cabeça de lista seguem-se Vânia Jesus, Paulo Neves, Bruno Sousa, Ana Cristina Monteiro e Bruna Perry. Estes são os nomes que representam o PSD-M na corrida eleitoral, numa tentativa de reforçar a sua posição na Assembleia Legislativa da Madeira.A principal novidade em",en,Vânia Jesus will be a candidate for legislatures,"The PSD-Madeira has already presented its candidates to the Regional Legislative elections of 18 May. Pedro Coelho heads the social democratic list, in a team that bets on continuity, but also in the renewal of faces. The side of the head of the list follows Vânia Jesus, Paulo Neves, Bruno Sousa, Ana Cristina Monteiro and Bruna Perry. These are the names that represent the PSD-M in the electoral race, in an attempt to reinforce its position in the Legislative Assembly of Madeira.",2025-03-29 21:11:33
pt,Julio Iglesias sofre de doença grave,"""Da cintura para baixo tenho 500 anos"", revela o cantor espanhol.",en,Julio Iglesias suffers from severe illness,"""From the waist down I am 500 years old,"" reveals the Spanish singer.",2025-03-29 21:11:05
pt,"Fábio Ronaldo: ""Até à expulsão estávamos confortáveis, a ameaçar...""","Jogador do Estrela da Amadora analisou a derrota na Reboleira (0-3), este sábado, em declarações à Sport TV.",en,"Fábio Ronaldo: ""Even the expulsion we were comfortable, threatening ...""","Amadora star player analyzed the defeat in the Reboleira (0-3) this Saturday, in statements to Sport TV.",2025-03-29 21:08:54
pt,Gyokeres bisou de penálti na Reboleira e Rúben Lima acabou expulso,Sueco já tinha descontado no arranque da segunda parte.,en,Gyokeres scored penalty in the reboleira and Rúben Lima was expelled,Swedish had already discounted in the start of the second part.,2025-03-29 21:21:53
pt,"E. Amadora-Sporting, 0-3 Mais um dia banal na vida de Gyokeres: as notas dos jogadores do Sporting","Mesmo sem fazer uma exibição tão pujante quanto já se viu - em inúmeras ocasiões -, Gyokeres assinou dois golos e uma assistência na Amadora, e já só está a um tento do registo de golos da época passada",en,"E. Amadora-Sporting, 0-3 another banal day in the life of Gyokeres: the notes of Sporting players","Even without making a display as powerful as it has been seen - on countless occasions - Gyokeres has signed two goals and an assist in the amateur, and is only one goal of last -season goals.",2025-03-29 21:21:11
pt,Ana Abrunhosa: “Pedro Nuno Santos não tem obrigação de incluir nomes do Governo de Costa” nas listas às legislativas,"Ana Abrunhosa, ex-ministra da Coesão Territorial e candidata à autarquia de Coimbra, diz que o secretário-geral do PS deve até imprimir uma marca própria no partido.",en,Ana Abrunhosa: “Pedro Nuno Santos has no obligation to include names of the Costa Government” in the lists to legislatures,"Ana Abrunhosa, former minister of territorial cohesion and candidate for the autarchy of Coimbra, says the PS secretary general must even print a brand of his own.",2025-03-29 21:20:17
pt,Kris Meeke vence o Rali do Algarve,"Em termos de campeonato, Kris Meeke, que somou a segunda vitória consecutiva, lidera o Campeonato de Portugal de Ralis",en,Kris Meeke wins the Algarve Rally,"In terms of championship, Kris Meeke, who added the second consecutive victory, leads the Portuguese Championship",2025-03-29 21:18:29
pt,Geovany Quenda ampliou assim a vantagem do Sporting na Reboleira,Português respondeu da melhor maneira a uma assistência de Gyokeres.,en,Geovany Quenda thus expanded Sporting's advantage in the Reboleira,Portuguese responded to the best way to assist Gyokeres.,2025-03-29 21:17:04
pt,Rapaz assassinado com seis facadas pelo ‘amigo’ no Portal Caiobá é identificado,"O suspeito foi preso em flagrante ainda durante a madrugadaOriginalmente publicado em Rapaz assassinado com seis facadas pelo ‘amigo’ no Portal Caiobá é identificado, Conteúdo original de Jornal Midiamax | Notícias de Campo Grande e Mato Grosso do Sul.",en,Boy murdered with six stabbed by the 'friend' on the Caiobá portal is identified,"The suspect was arrested in the act still at dawn in -lawnly published in a boy murdered with six stabbed by the 'friend' on the Caiobá portal is identified, original content of newspaper Midiamax | News from Campo Grande and Mato Grosso do Sul.",2025-03-29 21:17:03
pt,Leixões ainda assusta mas Benfica não compromete meia-final,Encarnados vencem jogo 1 da meia-final do campeonato,en,Leixões still scares but Benfica does not compromise semi-final,Incarnates win game 1 of the championship half-final,2025-03-29 21:16:46
pt,Veja fotos de Real Madrid x Leganés pela 29a rodada do Campeonato Espanhol,O post Veja fotos de Real Madrid x Leganés pela 29a rodada do Campeonato Espanhol apareceu primeiro em Gazeta Esportiva.,en,See photos of Real Madrid x Leganés for the 29th round of the Spanish Championship,The post see photos of Real Madrid x Leganés for the 29th round of the Spanish Championship first appeared in Gazeta Esportiva.,2025-03-29 21:16:15
pt,"Luís Silva. ""Sentimos muita gente a tentar apoiar o Sporting a vencer""",O Sporting venceu o Estrela Amadora por 3-0 e retoma a liderança do campeonato.,en,"Luís Silva. ""We feel a lot of people trying to support Sporting to win""",Sporting beat Estrela Amadora 3-0 and resumes the lead of the championship.,2025-03-29 21:15:45
pt,21h. Ana Abrunhosa: “PNS não tem obrigação de incluir nas listas do PS nomes do Governo de Costa”,"A também candidata à Câmara de Coimbra realça que o secretário-geral do PS deve até imprimir uma marca própria no partido. E ainda, Jair Bolsonaro recusa pedir asilo político nos Estados Unidos.",en,21h. Ana Abrunhosa: “PNS has no obligation to include in the PS lists of the Costa Government”,"Also candidate for the Chamber of Coimbra emphasizes that the PS secretary general must even print a brand of his own. And yet, Jair Bolsonaro refuses to ask for political asylum in the United States.",2025-03-29 21:15:38
pt,Melhores momentos da vitória do Vasco sobre o Santos pelo Brasileirão,Melhores momentos: Vasco 2 x 1 Santos (Brasileirão)O post Melhores momentos da vitória do Vasco sobre o Santos pelo Brasileirão apareceu primeiro em Gazeta Esportiva.,en,Best moments of Vasco's victory over Santos for Brasileirão,Best moments: Vasco 2 x 1 Santos (Brasileirão) The post best moments of Vasco's victory over Santos by Brasileirão first appeared in Gazeta Esportiva.,2025-03-30 23:49:33
pt,Homem com histórico de violência doméstica é esfaqueado pela sobrinha da esposa,"Agressor já havia sido denunciado em 2023 e 2024 por violência doméstica contra a esposa, mas continuava retornando para a casaOriginalmente publicado em Homem com histórico de violência doméstica é esfaqueado pela sobrinha da esposa, Conteúdo original de Jornal Midiamax | Notícias de Campo Grande e Mato Grosso do Sul.",en,Man with a history of domestic violence is stabbed by his wife's niece,"Aggressor had already been denounced in 2023 and 2024 for domestic violence against his wife, but was still returning to the house published in a man with a history of domestic violence is stabbed by his wife's niece, original newspaper content Midiamax | News from Campo Grande and Mato Grosso do Sul.",2025-03-30 23:49:00
pt,Brazão lamenta desatenção do Santos em derrota contra o Vasco: “Não pode”,"Gabriel Brazão, goleiro do Santos, não escondeu seu descontentamento com o Peixe, sobretudo no segundo tempo, na derrota contra o Vasco. A equipe paulista sofreu uma virada por 2 a 1, em São Januário, pela estreia no Campeonato Brasileiro. No segundo tempo, acho que a gente não entrou em campo. Faltou muito, a gente tem [...]O post Brazão lamenta desatenção do Santos em derrota contra o Vasco: “Não pode” apareceu primeiro em Gazeta Esportiva.",en,Brazão regrets inattention from Santos in defeat against Vasco: “Can't”,"Gabriel Brazão, goalkeeper of Santos, did not hide his discontent with the fish, especially in the second half, in the defeat against Vasco. The São Paulo team suffered a 2-1 turn in São Januário for the debut in the Brazilian Championship. In the second half, I think we didn't get on the field. Missed a lot, we have [...] Post Brazão regrets inattention of Santos in defeat against Vasco: ""can not"" appeared first in Gazeta Esportiva.",2025-03-30 23:48:05
pt,"Ana Raquel confidencia-se a Hugo Oliveira: ""A pessoa não acerta""",Ana Raquel explicou ao noivo porque motivos estava no Casados à Primeira VistaCasados à Primeira VistaSICHugo OliveiraAna Raquel,en,"Ana Raquel confides to Hugo Oliveira: ""The person does not get it right""",Ana Raquel explained to the groom because motives were in married at first glance at first sightSichugo Oliveiraana Raquel,2025-03-30 23:42:47
pt,Veja golaço de Álvaro Barreal contra o Vasco,Confira o gol de cobertura do Santos na primeira rodada do Brasileirão.O post Veja golaço de Álvaro Barreal contra o Vasco apareceu primeiro em Gazeta Esportiva.,en,See goal from Álvaro Barreal against Vasco,Check out Santos' coverage goal in the first round of Brasileirão. The post see goal from Álvaro Barreal against Vasco first appeared in Gazeta Esportiva.,2025-03-30 23:37:35
pt,"Octávio Machado: ""Jogo da época? Pode estar a pensar no 3.o lugar...""","Comentador da CMTV considera ""pequeno"" o discurso de André Villas-Boas que afirmou que o Clássico diante do Benfica é o jogo da época para o FC Porto.",en,"Octávio Machado: ""Game of the time? You can be thinking about the 3rd place ...""",CMTV commentator considers the speech of André Villas-Boas who said the classic against Benfica is the game of the time for FC Porto.,2025-03-30 23:33:09
pt,"Ricardo Tavares: ""Se os adeptos estiverem atentos, não se reveem nestas declarações do FC Porto""",Comentador da CMTV defende que clássico pode nem ser decisivo para o Benfica.,en,"Ricardo Tavares: ""If adherents are attentive, they do not review in these statements of FC Porto""",CMTV commentator argues that classic may not even be decisive for Benfica.,2025-03-30 23:30:17
pt,Exigências em conluio,Trump e Putin procuram a capitulação da Ucrânia.,en,CONLUCTURE REQUIREMENTS,Trump and Putin seek the capitulation of Ukraine.,2025-03-30 23:30:00
pt,A imigração nos programas eleitorais,"Para concluir que André Ventura é traste, basta ouvi-lo falar de imigração.",en,Immigration in electoral programs,"To conclude that André Ventura is fret, just hear him talk about immigration.",2025-03-30 23:30:00
pt,Maré branca sempre a subir,"Está a chegar a todos os mercados, a todos os consumidores, a atomizar (e a armar) os gangs, a financiar guerras, a desafiar a ordem pública e política de vários países.",en,White tide always climbing,"It is coming to all markets, all consumers, atomizing (and arming) gangs, financed wars, challenging public order and political order from various countries.",2025-03-30 23:30:00
pt,Israel ataca Beirute pela segunda vez desde cessar-fogo no Líbano,"O exército de Israel atacou hoje os subúrbios da capital do Líbano, no segundo ataque deste tipo desde o cessar-fogo alcançado em novembro.",en,Israel attacks Beirut for a second time since ceasefire in Lebanon,The army of Israel today attacked the suburbs of Lebanon's capital in the second attack of this type since the ceasefire reached in November.,2025-04-01 04:10:50
pt,Força-tarefa do Corcovado promete aumentar segurança para visitantes,"A força-tarefa inclui as diferentes instituições responsáveis pela visitação e estrutura do Alto CorcovadoOriginalmente publicado em Força-tarefa do Corcovado promete aumentar segurança para visitantes, Conteúdo original de Jornal Midiamax | Notícias de Campo Grande e Mato Grosso do Sul.",en,Corcovado task force promises to increase security for visitors,"The task force includes the different institutions responsible for the visitation and structure of the High Corcovadooriginally published in Corcovado Task Force promises to increase security for visitors, original content of newspaper Midiamax | News from Campo Grande and Mato Grosso do Sul.",2025-04-01 04:04:47
pt,Marine Le Pen falha as presidenciais de 2027?,"A líder da União Nacional foi condenada em tribunal e fica 5 anos impedida de se candidatar a cargos públicos. É uma decisão definitiva? Cátia Bruno, editora de Internacional, é a convidada.",en,Marine Le Pen fails the presidential 2027?,"The leader of the National Union was sentenced in court and is 5 years prevented from running for public office. Is it a definitive decision? Cátia Bruno, editor of Internacional, is the guest.",2025-04-01 04:04:02
