iso_code,title,description,lang_tranlation,title_translated,description_translated,pubDate
de,Cooper Koch turtelt mit Freund Stuart bei den GLAAD Awards,"Cooper Koch (28) und Stuart McClave strahlen vor Glück – und das nicht nur sprichwörtlich. Bei den diesjährigen GLAAD Media Awards im luxuriösen Beverly Hilton Hotel im kalifornischen Beverly Hills erschienen die beiden Turteltauben zusammen auf dem roten Teppich und ließen es sich nicht nehmen, ihre Zuneigung öffentlich zu zeigen. Vor den Augen zahlreicher Fotografen teilten der ""Monster: Die Geschichte von Lyle und Erik Menendez""-Star und sein Freund liebevolle Küsse aus und begeisterten mit ihrer harmonischen Ausstrahlung.",en,Cooper Koch turtles with friend Stuart at the Glaad Awards,"Cooper Koch (28) and Stuart McClave shine from happiness - and not just literally. At this year's Glaad Media Awards in the luxurious Beverly Hilton Hotel in Beverly Hills, California, the two Torteltauben appeared together on the red carpet and did not miss the opportunity to show their affection publicly. Before the eyes of numerous photographers, the ""Monster: The History of Lyle and Erik Menendez"" star and his friend out loving kisses and delighted with their harmonious charisma.",2025-03-28 22:30:00
de,"Tupperware wagt es, in Europa neu zu starten","Ein französischer Unternehmer möchte die amerikanische Marke Tupperware wiederbeleben. Cédric Meston kaufte die französische Niederlassung von Tupperware, die er auf LinkedIn bekannt gab. Wiederbeleben Sie Tupperware erneut Meston verhandelt immer noch Lizenzen für den Umsatz in Europa, und Deutschland ist ebenfalls da. Tupperware verkaufte seine Waren hauptsächlich im direkten Verkauf. So nutzte „Berater“ häufig ihre ...",en,Tupperware dares to restart in Europe,"A French entrepreneur wants to revive the American brand Tupperware. Cédric Meston bought the French branch of Tupperware, which he announced on LinkedIn. Riding Tupperware again Meston is still negotiating licenses for sales in Europe, and Germany is also there. Tupperware sold its goods mainly in direct sale. So ""consultant"" often used their ...",2025-03-28 22:29:13
de,Künstliche Intelligenz: Musk legt Nachrichtendienst X mit seiner KI-Firma zusammen,"Elon Musk zufolge hat seine KI-Firma xAI den Nachrichtendienst X per Aktiendeal übernommen. Daten, Infrastruktur und Mitarbeiter sollen zusammengeführt werden.",en,Artificial intelligence: Musk puts news service X together with his AI company,"According to Elon Musk, his AI company Xai has taken over the intelligence service X per share deal. Data, infrastructure and employees are to be merged.",2025-03-28 22:29:06
de,"Tahs Kampfansage: ""Wir reden schon über die Meisterschaft""",Macht Bayer Leverkusen das Meisterrennen nochmal spannend? Durch den Sieg über Bochum rückte die Werkself über Nacht drei Punkte an den FC Bayern heran. Jonathan Tah schickte nach der Partie eine Kampfansage gen München.,en,"Tah's declaration of war: ""We are already talking about the championship""","Does Bayer Leverkusen make the master race exciting again? Due to the victory over Bochum, the Werkself came to FC Bayern overnight. Jonathan Tah sent a declaration of war after the game.",2025-03-28 22:29:04
de,Warum alle über Meghans neues Foto flüsterten,"Herzogin Meghan (43) ist immer gut für eine Überraschung. Am Montagabend (24. März) gab die schöne Frau von Prinz Harry (40) ihr rund 2,6 Millionen Fans auf Instagram einen sehr privaten Einblick. „Jeder Tag ist eine Liebesgeschichte“, schreibt Herzin Meghan ein Foto, das sie mit zwei der drei wichtigsten Menschen in ihrem Leben zeigt: Lilibet ...",en,Why all whispered about Meghan's new photo,"Duchess Meghan (43) is always good for a surprise. On Monday evening (March 24), the beautiful woman of Prince Harry (40) gave her around 2.6 million fans on Instagram a very private insight. ""Every day is a love story,"" writes heart Meghan a photo that she shows with two of the three most important people in her life: Lilibet ...",2025-03-29 03:38:11
de,Uli Hoeneß kauft Aktien an der Genossenschaft,"Gegensätze ziehen an. Und so kann die Verbindung zwischen Bayern Münchens Ehrenpräsident Uli Hoeneß mit dem FC St. Pauli erklärt werden. Vor mehr als zwanzig Jahren wurde der damalige Bayern -Manager, der zuvor vom „Bonzenverein“ vertreten worden war, ein Unterstützer des FC St. Pauli, der vom Niedergang bedroht wurde. Im Juli 2003 startete FC Bayern ...",en,Uli Hoeneß buys shares in the cooperative,"Opposites attract. And so the connection between Bavaria Munich's honorary president Uli Hoeneß with FC St. Pauli can be explained. More than twenty years ago, the then Bayern manager, who had previously been represented by the ""Bonzenverein"", was a supporter of FC St. Pauli, which was threatened by the decline. FC Bayern started in July 2003 ...",2025-03-29 03:37:08
de,Trump plötzlich bereit für neue „Deals“ - Schon wieder Zoll-Zick-Zack!,Was für ein Zoll-Zick-Zack! Donald Trump stellt neue Deals in Aussicht.,en,"Trump suddenly ready for new ""deals""-a customs-zigzag again!",What a customs zigzag! Donald Trump promises new deals.,2025-03-29 03:36:33
de,Großdemo in Istanbul für inhaftierten Bürgermeister Imamoglu,Die Proteste gegen die Inhaftierung des wichtigsten Erdogan-Rivalen reißen nicht ab - ebenso wie die Festnahmen von Regierungskritikern und Journalisten. Nun steht eine große Kundgebung bevor.,en,Large demo in Istanbul for detained mayor Imamoglu,The protests against the detention of the most important Erdogan rival do not tear off - as well as the arrests of government critics and journalists. Now there is a big rally.,2025-03-29 03:34:00
de,"Abi 2025: Der Jahrgang, den es (fast) nicht gibt",Heuer werden deutlich weniger Schülerinnen und Schüler in Bayern über den Abiturprüfungen brüten als sonst. Wegen der Umstellung von G8 auf G9 fehlt fast ein kompletter Jahrgang.,en,ABI 2025: The year that (almost) does not exist,"This year, significantly fewer pupils in Bavaria will breed over the Abitur exams than usual. Because of the change from G8 to G9, almost a complete vintage is missing.",2025-03-29 03:33:19
de,Vom Mond angeknabbert: Partielle Sonnenfinsternis begonnen,"Berlin - Heute bietet der Himmel ein besonderes Schauspiel: Wer eine Sofi-Brille hat, kann seit dem frühen Mittag zusehen, wie der Mond sich vor die Sonne schiebt.",en,Nibbled by the moon: partial solar eclipse began,"Berlin - Today the sky offers a special spectacle: If you have a sofi glasses, you have been able to watch the moon push in front of the sun since early noon.",2025-03-29 03:33:00
de,Partielle Sonnenfinsternis - Was macht das Wetter?,"Berlin - Zur Mittagszeit bietet der Himmel ein besonderes Schauspiel: Wer eine Sofi-Brille hat, kann zusehen, wie der Mond sich vor die Sonne schiebt. Vorausgesetzt, das Wetter spielt mit.",en,Partial solar eclipse - what does the weather do?,"Berlin - Heaven offers a special spectacle at lunchtime: if you have a sofi glasses, you can watch the moon push in front of the sun. Provided the weather plays along.",2025-03-29 03:33:00
de,Partielle Sonnenfinsternis nur teilweise sichtbar,"Berlin - Wenn sich der Mond vor die Sonne schiebt, bietet der Himmel ein besonderes Schauspiel. Dafür muss allerdings das Wetter mitspielen. Wo war das Spektakel am besten zu sehen?",en,Partial solar eclipse only partially visible,"Berlin - When the moon pushes in front of the sun, the sky offers a special spectacle. However, the weather has to play along. Where was the spectacle to be seen best?",2025-03-29 03:33:00
de,Alle Infos & Aufstellungen zum 27. Spieltag - Das ist Kompanys neuer Abwehr-Plan!,Nach der Länderspielpause ist vor der Bundesliga! Hier gibt’s alle Infos & Aufstellungen.,en,All information,After the international break is before the Bundesliga! Here is all information,2025-03-29 03:32:46
de,Partielle Sonnenfinsternis - Was macht das Wetter?,"Zur Mittagszeit bietet der Himmel ein besonderes Schauspiel: Wer eine Sofi-Brille hat, kann zusehen, wie der Mond sich vor die Sonne schiebt. Vorausgesetzt, das Wetter spielt mit.",en,Partial solar eclipse - what does the weather do?,"At lunchtime, the sky offers a special spectacle: if you have a sofi glasses, you can watch the moon push in front of the sun. Provided the weather plays along.",2025-03-29 03:32:36
de,Hands-on-Mentalität: Proaktivität steigert Karrierechancen,"Proaktiv im BerufDas Portal für Arbeitgeberbewertungen Glassdoor beschreibt das Konzept der ""Hands-on-Mentalität"" als eine Erweiterung der Praxisorientierung. Auf ihrer Website begründet das Unternehmen, dass sich der Begriff zwar mit Praxisorientierung ...",en,Hand-on mentality: Proactivity increases career opportunities,"Proactive in the Profess The Portal for Employer Reviews Glassdoor describes the concept of ""hands-on mentality"" as an expansion of practical orientation. On its website, the company explains that the term is with practical orientation ...",2025-03-29 05:19:00
de,"Polizei Rostock: Unfälle, Verbrechen, Vermisstenmeldungen – aktuelle Meldungen aus der Region (29.03.2025)","Ob Verkehrsunfälle, Sperrungen, Vermisstenmeldungen, Gewaltdelikte oder anderweitige Verbrechen. Aktuelle Polizei- und Verkehrsmeldungen aus Rostock finden Sie ab sofort rund um die Uhr auch in unserem Liveticker.",en,"Rostock police: Accidents, crimes, missing persons - current reports from the region (29.03.2025)","Whether traffic accidents, closures, missing persons, violent crimes or other crimes. Current police and traffic reports from Rostock can now also be found around the clock in our live ticker.",2025-03-29 05:18:28
de,Mehr als 1000 Tote nach Erdbeben in Myanmar,"In Myanmar ist die Zahl der Toten nach dem schweren Erdbeben der Stärke 7,7 nach offiziellen Angaben auf mehr als 1000 angestiegen. Die Militärregierung des südostasiatischen Landes sprach am Samstag von 1002 Toten und 2376 Verletzten. Im Nachbarland Thailand starben nach vorläufigen Angaben rund zehn Menschen. In beiden Ländern könnte die Opferzahl noch deutlich ansteigen.",en,More than 1000 deaths after earthquake in Myanmar,"In Myanmar, the number of deaths after the severe earthquake of the strength 7.7 has increased to more than 1000 according to official information. The military government of the Southeast Asian country spoke on Saturday of 1002 deaths and 2376. According to preliminary information, around ten people died in the neighboring country of Thailand. The number of victims could still increase significantly in both countries.",2025-03-29 05:18:19
de,Taylor-Swift-News: Aktuelle Meldungen im Newsticker (Stand: 29.03.2025),"Für alle, die auf der Suche nach den neuesten Informationen über Taylor Swift sind, bietet unser Newsticker eine umfassende und aktuelle Berichterstattung. Hier sammeln wir kontinuierlich alle relevanten News und halten Sie über alles Wissenswerte rund um die Künstlerin informiert.",en,Taylor Swift News: Current reports in the Newsticker (as of 29.03.2025),"For everyone who is looking for the latest information about Taylor Swift, our Newsticker offers comprehensive and current reporting. Here we continuously collect all relevant news and keep you informed about everything you need to know about the artist.",2025-03-29 05:18:14
de,Betreiber für Café im Jenischpark gesucht – zu diesen Bedingungen,Ausschreibung für verrottetes Gewächshaus ist endlich da. Was investiert werden muss und warum eine Zwischenlösung gefordert wird.,en,Operator for café in the Jenischpark wanted - on these conditions,Tender for rotted greenhouse is finally here. What needs to be invested and why an interim solution is required.,2025-03-29 05:18:00
de,Bahnhofsplatz in Münster wird umgestaltet,Die Münsterer Gemeindevertreter haben eine Umgestaltung des Bahnhofsvorplatzes mit einem Wasserspiel beschlossen.,en,Bahnhofsplatz in Münster is being redesigned,The Münster municipal representatives decided to redesign the station forecourt with a water feature.,2025-03-29 05:18:00
de,"Polizei Hannover: Unfälle, Verbrechen, Vermisstenfälle – aktuelle Meldungen aus Stadt und Region (29.03.2025)","Ob Verkehrsunfälle, Sperrungen, Vermisstenmeldungen, Gewaltdelikte oder anderweitige Verbrechen. Aktuelle Polizei- und Verkehrsmeldungen aus Hannover finden Sie ab sofort rund um die Uhr auch in unserem Liveticker.",en,"Police Hannover: Accidents, crimes, missing persons - current reports from the city and region (29.03.2025)","Whether traffic accidents, closures, missing persons, violent crimes or other crimes. You can also find current police and traffic reports from Hanover around the clock in our live ticker.",2025-03-29 05:17:46
de,Brand im Naturpark Lüneburger Heide ausgebrochen,In der Lüneburger Heide stehen 2.000 Quadratmeter Wald in Flammen. Die Feuerwehr hat ein brennendes Auto als Brandursache ausgemacht.,en,Fire broke out in the Lüneburg Heath Nature Park,"In the Lüneburg Heath, 2,000 square meters of forest are on fire. The fire brigade has identified a burning car as the cause of the fire.",2025-03-29 05:17:05
de,"Gesunde Haut und Haare: Hausmittel aus Küche – natürlich, ohne Chemie",Eine gute Körperpflege erfordert keine teuren Drogerieprodukte. Mit alltäglichen Zutaten aus der Küche stellen Sie Ihre eigenen Pflegeprodukte her.,en,"Healthy skin and hair: home remedies from kitchen - of course, without chemistry","Good body care does not require expensive drugstore products. With everyday ingredients from the kitchen, you produce your own care products.",2025-03-29 05:17:00
de,Skispringer Daniel Tschofenig ist erstmals Gesamtsieger der Weltmeisterschaft – Wintersportarten,"Planica, der Nachfolger von Stefan Kraft als Gesamtsieger bei der Skissprung World Cup, heißt in jüngster Zeit Daniel Tschofenig. An seinem 23. Geburtstag setzte der Carinthian am Freitag den Sieg des großen Kristallballs beim Weltcup -Finale in Planica fest. Sein letzter verbleibender Herausforderer um den Ball, Jan Hörl, belegte den achten Platz. Domen Prevc gewann ...",en,Ski jumper Daniel Tschofenig is the first overall winner of the World Cup - winter sports,"Planica, the successor to Stefan Kraft as overall winner at the World Cup ski jump, is recently called Daniel Tschofenig. On his 23rd birthday, Carinthian set the victory of the big crystal ball at the World Cup final in Planica on Friday. His last remaining challenger around the ball, Jan Hörl, took eighth place. Domen Prevc won ...",2025-03-29 05:16:04
de,Erdbeben in Myanmar: Frau bringt mitten im Chaos ein Baby zur Welt,Eine 36-jährige Thailänderin bekam bei einer Evakuierung in Bangkok plötzlich Wehen. Sie war zum Glück in guten Händen.,en,Earthquake in Myanmar: Woman brings a baby to the world in the middle of chaos,"A 36-year-old Thai woman suddenly got labor when evacuation in Bangkok. Fortunately, she was in good hands.",2025-03-29 20:20:46
de,Sind Osterkalender die Fortsetzung der Adventskalender?,"Die Industrie will uns ein neues Ritual andrehen: Osterkalender, die nach dem Vorbild des Adventskalenders funktionieren. Unsinn – oder eine schöne Idee? Die Kolumne „Modeerscheinung“.",en,Are Easter calendar the continuation of the advent calendars?,"The industry wants to turn us on a new ritual: Easter calendar that works based on the example of the advent calendar. Nonsense - or a nice idea? The ""fashion phenomenon"" column.",2025-03-29 20:20:11
de,MBC bleibt Kandidat für die Playoffs,Der überragende Michael Devoe führt die Weißenfelser zum zweiten Auswärtssieg in Oldenburg in der Geschichte des Vereins. Die Gäste sind nervenstark von der Freiwurflinie.,en,MBC remains candidate for the playoffs,The outstanding Michael Devoe leads the Weißenfelser to the second away win in Oldenburg in the history of the association. The guests are nerve -wracked from the free wire line.,2025-03-29 20:20:08
de,Sané überragt gegen St. Pauli: Bayern zittert sich zum Sieg,Bayern siegt gegen St. Pauli. Leroy Sané glänzt mit einem Doppelpack und führt den Rekordmeister nach holprigem Start zum Erfolg.,en,Sané is overrun against St. Pauli: Bavaria trembles to victory,Bavaria wins against St. Pauli. Leroy Sané shines with a double pack and leads the record champion to success after a bumpy start.,2025-03-29 20:19:23
de,Sané überragt gegen St. Pauli: Bayern zittert sich zum Sieg,Bayern siegt gegen St. Pauli. Leroy Sané glänzt mit einem Doppelpack und führt den Rekordmeister nach holprigem Start zum Erfolg.,en,Sané is overrun against St. Pauli: Bavaria trembles to victory,Bavaria wins against St. Pauli. Leroy Sané shines with a double pack and leads the record champion to success after a bumpy start.,2025-03-29 20:19:23
de,Sané überragt gegen St. Pauli: Bayern zittert sich zum Sieg,Bayern siegt gegen St. Pauli. Leroy Sané glänzt mit einem Doppelpack und führt den Rekordmeister nach holprigem Start zum Erfolg.,en,Sané is overrun against St. Pauli: Bavaria trembles to victory,Bavaria wins against St. Pauli. Leroy Sané shines with a double pack and leads the record champion to success after a bumpy start.,2025-03-29 20:19:23
de,Sané überragt gegen St. Pauli: Bayern zittert sich zum Sieg,Bayern siegt gegen St. Pauli. Leroy Sané glänzt mit einem Doppelpack und führt den Rekordmeister nach holprigem Start zum Erfolg.,en,Sané is overrun against St. Pauli: Bavaria trembles to victory,Bavaria wins against St. Pauli. Leroy Sané shines with a double pack and leads the record champion to success after a bumpy start.,2025-03-29 20:19:23
de,Sané überragt gegen St. Pauli: Bayern zittert sich zum Sieg,Bayern siegt gegen St. Pauli. Leroy Sané glänzt mit einem Doppelpack und führt den Rekordmeister nach holprigem Start zum Erfolg.,en,Sané is overrun against St. Pauli: Bavaria trembles to victory,Bavaria wins against St. Pauli. Leroy Sané shines with a double pack and leads the record champion to success after a bumpy start.,2025-03-29 20:19:23
de,Sané überragt gegen St. Pauli: Bayern zittert sich zum Sieg,Bayern siegt gegen St. Pauli. Leroy Sané glänzt mit einem Doppelpack und führt den Rekordmeister nach holprigem Start zum Erfolg.,en,Sané is overrun against St. Pauli: Bavaria trembles to victory,Bavaria wins against St. Pauli. Leroy Sané shines with a double pack and leads the record champion to success after a bumpy start.,2025-03-29 20:19:23
de,Sané überragt gegen St. Pauli: Bayern zittert sich zum Sieg,Bayern siegt gegen St. Pauli. Leroy Sané glänzt mit einem Doppelpack und führt den Rekordmeister nach holprigem Start zum Erfolg.,en,Sané is overrun against St. Pauli: Bavaria trembles to victory,Bavaria wins against St. Pauli. Leroy Sané shines with a double pack and leads the record champion to success after a bumpy start.,2025-03-29 20:19:23
de,MDR feiert heute Abend 50 Jahre Jubiläum!,"Karat: Die legendäre East -Band wird vom MDR geehrt Wie bereits berichtet, wird der MDR heute Abend einen neuen Film der 50-jährigen Karriere von Band Karat erinnern. Wir finden: Aufregende Informationen werden bekannt gegeben. Wir freuen uns bereits auf den Dokumentarfilm über die legendäre East-Band: Text drücken Das Band der Band im Jahr 1975 in ...",en,MDR celebrates 50 years of anniversary this evening!,"Karat: The legendary East band is honored by the MDR as already reported, the MDR will remind a new film of Band Karat's 50 -year career tonight. We find: exciting information will be announced. We are already looking forward to the documentary about the legendary East band: Text press the band of the band in 1975 in ...",2025-03-30 23:48:09
de,"Tomodachi -Leben: Wo Träume wahr werden, kommt für den Schalter und Japan ruht – der Hype ist größer als der um den Nintendo Switch 2",Im Rahmen des letzten Nintendo Direct wurde nach über zwölf Jahren ein Nachfolger des Tomodachi Life angekündigt. Dies sollte für den Switch im Jahr 2026 erscheinen. Möge das Chaos beginnen Der letzte Nintendo Direct for the Switch am vergangenen Donnerstag hatte einige Überraschungen. Aber einer von ihnen wurde in Japan besonders gut aufgenommen: die Fortsetzung ...,en,Tomodachi life: Where dreams come true comes for the switch and Japan -the hype is greater than that around the Nintendo Switch 2,"As part of the last Nintendo Direct, a successor to the Tomodachi Life was announced after over twelve years. This should appear for the switch in 2026. May chaos begin the last Nintendo Direct for the Switch last Thursday had some surprises. But one of them was particularly well received in Japan: the sequel ...",2025-03-30 23:44:13
de,Stream heute Abend: Der Beginn einer der größten Science-Fiction-Serien der letzten 15 Jahre lang garantiert! – Kinonachrichten,"Die dystopische Saga begann 2012 – und immer noch nicht vorbei, denn Ende 2023 gab es eine weitere Rolle mit „The Ballad of SongBirds & Snakes“. Auf Netflix können Sie heute (wieder?) Den Beginn dieser Erfolgsgeschichte sehen. Die Buchserie wurde bereits massiv verkauft, und dann wurde die Filmadaption auch zu einem gigantischen Erfolg: Als der ...",en,Stream this evening: the beginning of one of the largest science fiction series for the past 15 years guaranteed! - cinema news,"The dystopian saga started in 2012 - and still not over, because at the end of 2023 there was another role with “The Ballad of Songbirds",2025-03-30 23:37:07
de,Osterzgebirge: Zwei Menschen sterben bei Wohnhausbrand in Mittelsachsen,In einem Einfamilienhaus nahe der tschechischen Grenze in Sachsen ist ein Feuer ausgebrochen. Zwei Menschen sind in den Flammen gestorben. Die Ursache des Brandes wird untersucht.,en,Easter Mountains: Two people die at home in Central Saxony,A fire broke out in a single -family house near the Czech border in Saxony. Two people died in the flames. The cause of the fire is examined.,2025-03-30 23:37:00
de,Nintendo bringt Mii-Avatare mit neuen Anpassungsoptionen zurück,"Tokio / München (It Boltwise) -Nintendo hat die Rückkehr der beliebten Mii-Avatare mit der jüngsten Ankündigung als Teil des Switch Direct angekündigt. Diese Egos des digitalen Zeitalters, die erstmals in der Wii -Ära eingeführt wurden, erhalten jetzt ein wichtiges Update: Sie haben jetzt Ohren. Die Mii-Avatare von Nintendo, die seit ihrer Einführung während der Wii-Ära ...",en,Nintendo brings Mii-Avatare back with new adaptation options,"Tokio / Munich (IT BoltWise) -Nintendo has announced the return of the popular Mii -Avatars with the recent announcement as part of the Switch Direct. These egos of the digital age, which were first introduced in the Wii era, are now getting an important update: they now have ears. The Mii-Avatare from Nintendo, which has been ...",2025-03-30 23:27:12
de,Luxus-Resort soll zwangsversteigert werden - So rutschten die Geissens in die Millionen-Krise,Die Geissens im Visier der französischen Steuerfahnder. Bei BILD packt ein Insider aus.,en,Luxury resort is to be auctioned off-so the Geissens slipped into the million crisis,The Geissens in the sights of the French tax investigators. An insider unpacks with BILD.,2025-03-30 23:26:58
de,Die Ursache für „Let’s Dance“ -Katastrophe? Diego Pooth lässt Ekat blinken: „Liebe dich nicht!“,"29.03.2025 20:38 19: 521 Die Ursache für „Let’s Dance“ -Katastrophe? Diego Pooth lässt Ekat blinken: „Liebe dich nicht!“ Diego Pooth und Ekaterina Leonova wurden stark für ihr Rumba -Debakel bei „Let’s Dance“ kritisiert. Sie sind still. Was ist in den „Team Smarties“ los? Köln – Für ihren kataströse rumba, Diego pooth (21) und Ekaterina Leonova ...",en,"The cause of ""Let’s Dance"" disaster? Diego Pooth lets Ekat flashing: ""Don't love yourself!""","29.03.2025 20:38 19:521 The cause of ""Let’s Dance"" disaster? Diego Pooth lets Ekat flashing: ""Don't love yourself!"" Diego Pooth and Ekaterina Leonova were strongly criticized for their Rumba debacle at ""Let’s Dance"". You are still. What's going on in the ""Team Smarties""? Cologne - for their catastrian Rumba, Diego Pooth (21) and Ekaterina Leonova ...",2025-03-30 23:26:07
de,Seit Wochen Demos und Polizeigewalt - Kann ich jetzt noch in die Türkei reisen?,"Urlaub: BILD klärt, was Sie bei Reisen in die Türkei jetzt beachten sollten.",en,Demos and police violence for weeks - can I still travel to Turkey?,Vacation: Image clarifies what you should consider when traveling to Turkey.,2025-03-30 23:25:16
de,"„Bei mir müssen Sie nicht singen, nur zuhören“","Zum Abschluss der Buchmesse in Leipzig trat Angela Merkel im Gewandhaus auf. Die Lesung der Altkanzlerin war auf die Stadt zugeschnitten, in der sie vor 50 Jahren studiert hat. Ein paar politische Spitzen setzte sie aber auch.",en,"""With me you don't have to sing, just listen""","At the end of the book fair in Leipzig, Angela Merkel performed in the Gewandhaus. The reading of the former Chancellor was tailored to the city in which she studied 50 years ago. But she also set a few political leaders.",2025-03-30 23:19:19
de,Strom- und Wasserversorgung unterbrochen: WHO ruft nach Erdbeben in Myanmar höchste Notfall-Stufe aus,Nach dem Beben herrscht in Myanmar ein erhöhtes Risiko für die Ausbreitung von Krankheiten. Die Weltgesundheitsorganisation ruft Notfall-Stufe 3 aus und bittet um Hilfsgelder.,en,Power and water supply interrupted: WHO calls the highest emergency level after earthquakes in Myanmar,"After the quake, there is an increased risk of spreading diseases in Myanmar. The World Health Organization exits emergency level 3 and asks for aid.",2025-03-30 23:17:00
