iso_code,title,description,lang_tranlation,title_translated,description_translated,pubDate
at,Gasaustritt in Lochau: Zwei Häuser evakuiert,In Lochau ist am Freitagvormittag (21. März) aus einem Lkw Gas ausgetreten. Zwei Häuser wurden evakuiert.,en,Gas exit in Lochau: two Hauser evacuated,In Lochau on Friday morning (21st Marz) it escaped from a truck gas. Two houses were evacuated.,2025-03-21 09:39:46
at,Lkw krachte in Supermarkt in Flachau,"In Flachau musste kurzzeitig der Penny-Markt geschlossen werden. Ein Lkw war gegen die Außenmauer geprallt. FLACHAU. Ein Lkw krachte diese Woche gegen die Außenwand des Penny-Supermarktes in Flachau. Die Fassade wurde stark beschädigt. Aus Sicherheitsgründen war der Supermarkt kurzzeitig gesperrt. Am heutigen Freitag, den 21. März, war der Supermarkt allerdings schon wieder für die Kunden geöffnet. Mehr Neuigkeiten aus dem Pongau findest du HIER. Das könnte dich auch interessieren:...",en,Truck crashed into supermarket in Flachau,"The Penny market had to be closed briefly in Flachau. A truck had crashed into the meadow wall. Flachau. A truck crashed against the floodplain wall of the Penny supermarket in Flachau this week. The facade was severely damaged. The supermarket was briefly closed from security. On Friday, March 21, the supermarket was again open for customers. You can find more news from the Pongau here. You could also be interested: ...",2025-03-21 09:39:29
at,US-Model wird zum dritten Mal Mama,Die frohe Botschaft verkündete die 32-Jährige via Instagram.,en,US model will be mom for the third time,The good news tiled the 32-year-old via Instagram.,2025-03-21 09:39:22
at,Hommage an das Wienerlied,"Der Frühling ist gekommen, um hoffentlich zu bleiben! Um den Frühling in Wien drehte sich kürzlich alles mit dem acappella Quartett "" GUSTAV KLINGT"" im Bühnenwirtshaus Mayer. "" Dreimal Mitzi, einmal Strizzi, Zu viert singen wiir acappella. Leiwand und mit viel Wiener Schmäh"". Unter dieser Devise brachten die vier Stimmakrobaten zeitgenössische Wienerlieder mit dem bekannten Schmäh zu Gehör. Dieses Quartett fand vor gut einem Jahr zusammen und feierte schon erfolgreiche Bühenauftritte. Natürlich...",en,Homage to the Wienerlied,"The spring has come to hopefully stay! Around the spring in Vienna, everything turned with the Acappella quartet ""Gustav sounds"" in the Bühnwirtshaus Mayer. ""Three times Mitzi, once strizzi, four of them sing Wiir Acappella. Leisand and with a lot of Viennese Schmah"". Under this motto, the four stimmacrobats brought contemporary Viennese songs with the well -known Schmah. This quartet came together a year ago and celebrated successful boo appearances. Naturally...",2025-03-21 09:38:57
at,Eintauchen in der Welt der PORR,"Workshop an der PTS Am Donnerstag, 13.03.2025, war die Baufirma PORR zu Besuch an der Polytechnischen Schule und führte die Schüler in die Welt der Baubranche ein. Innovatives Arbeiten verbindet! Von der Planung über die Umsetzung bis hin zum Betrieb: Die Firma PORR baut Großprojekte und kleinere Bauvorhaben mit Leidenschaft, Engagement und technischer Exzellenz mit über 150 Jahren Erfahrung. Und davon durften auch die Schüler der PTS profitieren. Der Lehrlingsbeauftragte für ganz Kärnten,...",en,Immerse yourself in the world of Porr,"Workshop at the PTS on Thursday, March 13, 2025, was the construction company Porr visiting the polytechnic school and entering the school in the world of the construction industry. Innovative work connects! From planning to implementation to the company: Porr builds GroProjections and smaller construction projects with passion, commitment and technical excellence with over 150 years of experience. And the PTS students were also able to benefit from this. The apprentice representative for all of Karnten, ...",2025-03-21 09:38:38
at,Trump ordnet Auflösung des Bildungsministeriums an,"US-Präsident Donald Trump hat per Dekret eine Auflösung des Bildungsministeriums angeordnet. Dieses kann eigentlich nur durch den Kongress abgeschafft werden, was die oppositionellen Demokraten im Senat verhindern könnten. Droht eine Konfrontation?",en,Trump orders the Ministry of Education.,"US prasident Donald Trump has ordered a resolution of the Ministry of Education by decree. This can actually only be abolished by the congress, which the opposition Democrats could prevent in the Senate. Is there a threat of confrontation?",2025-03-21 09:37:41
at,Mit nur 16 Jahren: TikTok-Star plötzlich verstorben,Mehr als eine Million Menschen folgen dem TikToker Mommy Joshua auf der Plattform. Nun trauern sie um den Tod des jungen Mannes.,en,At the age of only 16: Tikok star suddenly died,More than a million people follow the Tikoker Mommy Joshua on the platform. Now they mourn the death of the young man.,2025-03-21 09:37:35
at,Vulkanausbruch in Indonesien: Große Aschewolken legen Bali-Flüge lahm,Der Strom in besiedelten Gebieten rund um den Vulkan Lewotobi Laki-Laki ist teilweise ausgefallen. Auch der Flugverkehr nach Bali ist betroffen.,en,Vulcan eruption in Indonesia: Groe ash clouds paralyze Bali-Flue,The electricity in populated areas around the Lewotobi Laki-Laki volcano has partially failed. Air traffic to Bali is also affected.,2025-03-21 09:37:33
at,Krallt sich Hütter noch die Kugel? So läuft Weltcup-Finale zur Primetime,Am Samstag startet in Sun Valley (US-Bundesstaat Idaho) zur besten TV-Sendezeit das Weltcup-Finale. Für Österreich geht's um die Ski-Ehre.,en,Does Hutter still claw the ball? This is how World Cup final runs to prime time,The World Cup final starts in Sun Valley (U.S. state Idaho) at the best TV broadcast. For Austria it's about the skiing honor.,2025-03-21 22:50:00
at,"Neuer Name für Europas Aufrüstungspläne nach Kritik aus Rom, Madrid","""Readiness 2030"" statt ""ReArm Europe"" im Gespräch",en,"New name for Europe's plane after criticism from Rome, Madrid","""Readiness 2030"" instead of ""REARM Europe"" in the conversation",2025-03-21 22:48:46
at,WM-Qualifikation - Österreich-Gruppe: Siege von Zypern und Bosnien,Der erste Tabellenführer in Österreichs Gruppe H der europäischen Fußball-WM-Qualifikation heißt Zypern. Die Zyprioten gewannen am Freitag in Larnaka 2:0 gegen San Marino.,en,World Cup qualification-Osterreich Group: Victories of Cyprus and Bosnia,The first table faster in Osterreich's group H of the European Fubal World Cup qualification is Cyprus. The Cypriots won 2-0 against San Marino in Larnaka on Friday.,2025-03-21 22:48:35
at,Hütter jagt Kristall – gelingt der große Coup?,Österreichs Speed-Spezialistin Cornelia Hütter kämpft beim Weltcupfinale in Sun Valley um die Abfahrtskugel. Die Entscheidung fällt am Samstag.,en,Hutter hunts crystal succeeds in the Groe Coup?,Osterreich's speed specialist Cornelia Hutter fights for the downhill ball at the World Cup final in Sun Valley. The decision is made on Saturday.,2025-03-21 22:48:25
at,Siemens Healthineers erhält krebsmedizinischen Großauftrag aus Kanada,Auftrag über 800 Mio. kanadische Dollar von der Regierung der Provinz Alberta,en,Siemens Healthineers Remarks Cancer Medicine Gro -Performance from Canada,Mission of $ 800 million Canadian dollars from the government of the province of Alberta,2025-03-21 22:38:45
at,Verstappen und Norris kämpfen um den Sieg,"Morgen (4 Uhr, live ServusTV & Sport24-Liveticker) steigt das zweite Rennen der Formel-1-Saison in Shanghai. Nach Norris' Sieg in Melbourne geht das WM-Duell mit Verstappen in die nächste Runde.",en,Verstappen and Norris cattled for victory,"Tomorrow (4 a.m., Live Servustv",2025-03-21 22:38:38
at,Entscheidungsspiel: Österreich will im Play-off-Rückspiel gegen Serbien den Aufstieg in Liga A,"Österreichs Nationalteam steht vor einer Schlüsselpartie in der Nations League. Nach dem 1:1 gegen Serbien braucht es am Sonntag eine Steigerung, um den Aufstieg in Liga A zu schaffen.",en,Decision game: Osterreich wants to promote in league A in the play-off jerk game against Serbia,"Osterreich's national team faces a final game in the Nations League. After the 1-1 win over Serbia, an increase is needed on Sunday to create the ascent to League A.",2025-03-21 22:38:01
at,Gegen Dänin - Grabher scheitert in der zweiten Miami-Runde,"Die Vorarlbergerin Julia Grabher ist in der zweiten Runde des WTA1000-Tennisturniers von Miami an der Dänin Clara Tauson gescheitert. Der 28-Jährigen gelang beim 4:6,5:7 zwar kein Satzgewinn, Grabher verlangte ihrer als Nummer 20 gesetzten Kontrahentin aber alles ab.",en,Against Danin - Grabher fails in the second round of Miami,"The Vorarlberg woman Julia Grabher failed in the second round of Miami's WTA1000 tennis tournament on the Danin Clara Tauson. The 28-year-old did not win a set win at 4: 6.5: 7, but Grabher demanded everything from her as number 20.",2025-03-21 22:33:45
at,Alles oder nichts: Nations-League-Viertelfinale vor der Entscheidung,"Die Nations League geht in die entscheidende Phase: In der Rückrunde des Viertelfinales kämpfen Deutschland, Italien, Spanien, die Niederlande, Portugal, Dänemark, Kroatien und Frankreich um den Einzug ins Final Four. Wer setzt sich durch und sichert sich das Halbfinal-Ticket?",en,Everything or nothing: National League quarter-finals before the decision,"The Nations League goes into the crucial phase: In the round round of the quarter -finals, Germany, Italy, Spain, the Netherlands, Portugal, Danemark, Croatia and France to move into the final Four. Who prevails and secures the semi-final ticket?",2025-03-21 22:30:42
at,Landesjahrtag der Salzburger Heimatvereine,,en,State anniversary of the Salzburg local associations,,2025-03-21 22:30:42
at,Nations League: Deutschland nach Spektakel gegen Italien weiter,"Die Deutschen führten 3:0, am Ende stand es 3:3. Das Hinspiel hatte das DFB-Team mit 2:1 gewonnen.",en,Nations League: Germany after spectacle against Italy,"The Germans drove 3-0, in the end it was 3: 3. The DFB team won the first leg 2-1.",2025-03-23 21:49:51
at,Seeidylle,Frühlingswanderung um den Wallersee,en,Seedyll,Spring hike around Lake Wallersee,2025-03-23 21:44:28
at,"Deutschland vergeigt 3:0 gegen Italien, steht trotzdem im Halbfinale","Deutschland steht nach einem 3:2-Sieg gegen Italien im Halbfinale der Nations League. Die DFB-Elf war schon 3:0 vorne, verlor dann aber den Faden - im Gesamtscore siegten die Deutschen aber mit 5:3.",en,"Germany wins 3-0 against Italy, but is still in the semi -finals","Germany is in the semi-finals of the Nations League after a 3-2 victory against Italy. The DFB -Elf was already 3-0 in front, but then lost the thread - but in the entire score the Germans won 5: 3.",2025-03-23 21:42:55
at,Helena Autischer führt jetzt die Junge Wirtschaft an,"Die Jungunternehmerin Helena Autischer hat den Bezirksvorsitz der Jungen Wirtschaft Murau übernommen und gleichzeitig ein neues Team vorgestellt. MURAU. Bei der Veranstaltung „Future Talks & Neuwahlen“ der Jungen Wirtschaft (JW) Murau wurde ein neues Vorstandsteam präsentiert. Helena Autischer wurde einstimmig zur neuen Bezirksvorsitzenden gewählt und leitet die JW Murau künftig gemeinsam mit einem engagierten Team. Der neue Vorstand Zum neuen Vorstand gehören Kevin Wagner (Stellvertreter),...",en,Helena Autischer now captures the young economy,The young entrepreneur Helena Autischer took over the district chair of the young economy Murau and at the same time introduced a new team. Murau. At the event Future Talks,2025-03-23 21:35:06
at,Innsbruck: Dance Unit Austria mit Telfer Beteiligung,"Der internationale Tanzwettbewerb ""Dance Unit Competition"" gastierte am vergangenen Wochenende das erste Mal in Österreich. Austragungsort war für zwei Tage die Olympiahalle in Innsbruck. IBK/TELFS. Bei diesem internationalen Wettbewerb waren Teilnehmer aus ganz Österreich und den angrenzenden Ländern dabei. Getanzt wurde in den Altersklassen Minis, Kids, Juniors, Seniors und Adults, getrennt wurden die Gruppen in Solo, Pair/Trio/Quartet, Small Group und Group, bestritten wurden die...",en,Innsbruck: Dance Unit Austria with Telfer participation,"The international dance competition ""Dance Unit Competition"" made a guest appearance in Austria for the first time last weekend. The venue was the Olympic Hall in Innsbruck for two days. IBK/Telfs. Participants from all over Austria and the neighboring countries were involved in this international competition. Dancing was danced in the age groups Minis, Kids, Juniors, Seniors and Adults, the groups were separated into Solo, Pair/Trio/Quartet, Small Group and Group, the ...",2025-03-23 21:34:20
at,ein neues Kapitel beginnt mit dem Nachwuchs und den Damen,"Am vergangenen Wochenende fand in Wels der Auftakt der Nachwuchsmeisterschaften des OÖ Gewichtheberverbandes statt. In fünf Runden duellieren sich über die ganze Saison verteilt die Nachwuchshoffnungen in den Schüler und Jugend – Klasse u9, u11, u13 und u15 Ranshofen hatte neben den Geschwistern Elisabeth und Konstantin Ecker erneut einen Neuling am Start. Sebastian Heidecker zeigte sich erstmals auf der Plattform. Der Ranshofner Nachwuchs überzeugte mit einer starken Leistung und einer...",en,A new chapter begins with the offspring and the ladies,"Last weekend, the start of the youth championships of the OO weightlifting association took place in Wels. In five rounds round off the whole season, the young hopes in the school and youth class U9, U11, U13 and U15 Ranshofen were once again at the start in addition to the siblings Elisabeth and Konstantin Ecker. Sebastian Heidecker showed himself on the platform for the first time. The Ranshofner youngsters convinced with a strong performance and a ...",2025-03-23 21:33:19
at,Pkw verunglückt im Öamtc-Fahrtechnikzentrum,"Komplett außer Kontrolle muss ein Fahrzeug im Öamtc-Fahrtechnikzentrum in Marchtrenk geraten sein, denn: Es prallte beim Training gegen die Leitschiene und musste von der Feuerwehr mit dem Kran geborgen werden. MARCHTRENK. Ein Fahrschüler hat am vergangenen Wochenende beim Training im Öamtc-Fahrtechnikzentrum in Marchtrenk wohl Mut mit Leichtsinn verwechselt – oder das Gaspedal mit der Bremse. Er krachte während der Übungsfahrt am Gelände bei einem Manöver mit seinem Pkw gegen die Leitschiene....",en,Cars for the car in the OAMTC driving technology center,"A vehicle must have been in the OAMTC driving technology center in MarchTrenk completely out, because: It crashed into training against the guiding rail and had to be recovered by the fire brigade with the crane. Marchtrenk. Last weekend, a driving school was probably confused courage with the brake during training at the OAMTC driving technology center in Marchtrenk in Marchtrenk or the accelerator pedal. During the ride on the country, he crashed into a manover with his car against the guiding rail ...",2025-03-23 21:25:42
at,Lateinamerikanische Stimmung in Gresten,"Musik aus Süd- und Mittelamerika sorgte in der Grestner Kulturschmiede für Begeisterung. GRESTEN. Die Band ""Fusion Latina"" nahm die Besucherinnen und Besucher, darunter Christa Hofbauer, Gerhard Graschopf und Helga Hofmarcher, mit auf eine musikalische Reise durch Süd- und Mittelamerika. ""Die schwungvolle Musik"" wurde von Sarah Michalko und Bibiana Auer ebenso genossen wie von Gertraud und Günther Ehrgott, Gerlinde Auer, Julia Puchebner und Ingrid Michalko. Ein gelungener Abend war es auch für...",en,Latin American mood in Greste,"Music from Sud- and Central America provided enthusiasm in the Grestner cultural smithy. Greste. The band ""Fusion Latina"" took the visitors, including Christa Hofbauer, Gerhard Graschopf and Helga Hofmarcher, on a musical journey through Sud and Central America. ""The lively music"" was enjoyed by Sarah Michalko and Bibiana Auer as well as from Gertraud and Gunther Ehrgott, Gerlinde Auer, Julia Puchebner and Ingrid Michalko. It was also a successful evening for ...",2025-03-23 21:20:52
at,Dressler/Waller holen vierten Platz in Mexiko,,en,Dressler/Waller get fourth place in Mexico,,2025-03-23 21:20:03
at,Marko ist „besorgt“ - Krisengipfel! Verstappen-Klausel macht Angst,"Bei Red Bull schrillen nach dem GP von China die Alarmglocken! Max Verstappen belegte nur den vierten Platz und hatte keine Chance, im Kampf um den Sieg einzugreifen. Liam Lawson landete gar nur auf dem zwölften Rang. Nun gibt es eine Krisensitzung ...",en,Marko is concerned - crisis summit! Verstappen-Klausel scares,"At Red Bull, the alarm bells shrill after the GP of China! Max Verstappen only took fourth place and had no chance to intervene in the fight for victory. Liam Lawson only landed in the second place. Now there is a crisis meeting ...",2025-03-23 21:13:47
at,Einigung in Riad? - USA und Russland geben „gemeinsame Erklärung“ ab,Die USA und Russland haben sich offenbar auf eine gemeinsame Erklärung zur Ukraine verständigt. Das Papier soll am Dienstag veröffentlicht werden. Das Treffen in der saudischen Hauptstadt Riad hat etwa zwölf Stunden gedauert.,en,Agree in Riad? - USA and Russia release joint explanation,The United States and Russia have apparently understood a common explanation for Ukraine. The paper is to be published on Tuesday. The meeting in the Saudi capital Riad took about two hours.,2025-03-24 22:17:20
at,Heide Zeiringers Sammlung,"Das Hirt-Haus Atelier in Scheifling zeigt die Sammlung Heidi Zeiringer, am 21. 3. 25 wurde es bei der Vernissage zur Schatzgrube ausgewählter Kunstwerke aus 40 Jahren Sammelleidenschaft. Gela Hirt-Thomsen begrüßte zur Sonderausstellung die Unternehmerin und Visionärin und zur Freundin gewordene Heide Zeiringer. Die seit ihrer Pensionierung 2024 akribisch daran arbeitet, sich zu verändern. Bezeichnete sie als großzügig, mitfühlend, mutig und beharrlich, streifte ihren Lebensweg. Heidi Zeiringer...",en,Heide Zeiringer's collection,"The Hirt-Haus Atelier in Scheifling shows the Heidi Zeiringer collection, and on 21.3. 25 it became the treasure pit of selected works of art from 40 years of collective passion. Gela Hirt-Thomsen is buried at the special exhibition, the entrepreneur and visionary and girlfriend became Heide Zeiringer. Which has been working meticulously since retirement in 2024 to argue. She described as a large -scale, shaky, brave and persistent, grazed her way of life. Heidi Zeiringer ...",2025-03-24 22:16:50
at,Wohnungsbrand in Innsbruck fordert ein Todesopfer,Ein Brand in einer Wohnung eines Hochhauses im Innsbrucker Stadtteil Olympisches Dorf hat am späten Montagnachmittag ein Todesopfer gefordert. Ein Polizeisprecher bestätigte der APA am Abend entsprechende Medienberichte. Die Identität des Opfers war vorerst ebenso unklar wie die Brandursache. Die Ermittlungen waren im Gange. Der Brand war kurz vor 16.00 Uhr ausgebrochen. Ein Großaufgebot der Feuerwehr rückte aus und löschte letztlich die Flammen.,en,Fire in Innsbruck demands a fatality,A fire in an apartment of a high -rise in Innsbruck district of Olympic village called for a fatality on Monday afternoon. A police spokesman confirmed the APA corresponding media reports in the evening. The victim's identity was just as unclear as the cause of the fire. The investigation was underway. The fire broke out shortly before 4 p.m. A fire brigade broke out and ultimately started the flames.,2025-03-24 22:16:13
at,Edelsdorf: Jagdstand im Wert von mehreren hundert Euro brannte nieder,Montagfrüh brannte ein mobiler Jagdstand aus bislang unbekannter Ursache nieder. Verletzt wurde niemand.,en,Edelsdorf: Hunting stand worth several hundred euros burned down,Monday fruh burned down a mobile hunting stand for a previously unknown cause. Nobody was injured.,2025-03-24 22:15:59
at,Basketball - Auch starkes erstes Viertel konnte Devils nicht vor Schlappe retten,Die Wiener Neustädter entschieden am Wochenende gegen Mistelbach den ersten Spielabschnitt noch mit 17:14 für sich. Trotzdem verloren sie am Ende mit 44:82. Vor allem im zweiten Viertel waren die Blue Devils chancenlos.,en,Basketball - Even strong first quarter could not save Devils from a mere,"The Wiener Neustadter decided on the weekend against Mistelbach the first section of the game with 17:14. Nevertheless, they lost 44:82 in the end. The Blue Devils had no chance, especially in the second quarter.",2025-03-24 22:15:00
at,Tirol: Wohnungsbrand in Innsbruck forderte ein Todesopfer,Die Identität des Opfers sowie die Brandursache sind vorerst unklar. Die Ermittlungen sind im Gange. Das Feuer brach am Montag gegen 16 Uhr aus.,en,Tyrol: Fire in Innsbruck demanded a fatality,The victim's identity and the cause of the fire are initially unclear. The investigation is underway. The fire broke out on Monday around 4 p.m.,2025-03-24 22:14:58
at,50 Helfer sammeln ca. 300 kg Müll,"Wie bereits im Vorjahr organisierte der Umweltausschuss der Marktgemeinde Hofkirchen am 22. März wieder die Landschaftssäuberungsaktion „Hui statt Pfui“. Die gesamte Gemeindebevölkerung war aufgerufen, sich aktiv an dieser Aktion zur Sauberkeit und Gesundheit unserer Umwelt zu beteiligen. Etwa 50 fleißige Helfer fanden sich um 8.30 Uhr beim Gemeindebauhof ein, um durch ihre persönliche, aktive Mithilfe einen Beitrag zum Umweltschutz zu leisten. Ziel dieser Aktion war es, die Fluss- und...",en,50 helpers collect approx. 300 kg of mull,"As in the previous year, the environmental committee of the market town of Hofkirchen on March 22 again organized the landscape cleaning campaign Hui instead of Pfui. The entire community volation was called to actively participate in this action on the cleanliness and health of our environment. Around 50 versed helpers came to the municipal building yard at 8:30 a.m. to make a contribution to environmental protection through their personal, active help. The aim of this campaign was the river and ...",2025-03-24 22:14:52
at,"Dechantskirchen: FPÖ-Plakate mit Hakenkreuzen besprüht, Polizei bittet um Hinweise",Bislang Unbekannte besprühten mehrere Wahlplakate mit Hakenkreuzen und beschädigten das Fahrzeug eines Parteifunktionärs. Die Polizei sucht nach Hinweisen.,en,"Dechantskirchen: FPO posters with swastikas, the police asks for clues","Previously unknowns, several election posters with swastikas and damaged the vehicle of a party functionary. The police are looking for clues.",2025-03-24 22:13:14
at,Bosnien-Herzegowina noch ohne Punkteverlust,,en,Bosnia-Herzegovina still without loss of points,,2025-03-24 22:12:04
at,Zweiter Sieg für England unter Coach Tuchel,,en,Second victory for England under coach Tuchel,,2025-03-24 22:07:58
at,Magnolienblüte...,..rosa/ pink,en,Magnoliablood ...,..rosa/ pink,2025-03-25 19:35:34
at,Online Casino mit Paysafe 2025: Schnelle & Sichere Zahlungen,"Paysafe ist eine der beliebtesten Zahlungsmethoden in Online Casinos. Mit der Paysafecard oder einem Paysafe-Konto können Spieler schnell und anonym Einzahlungen tätigen – ohne Bankverbindung oder Kreditkarte. In diesem Artikel erfahren Sie, warum ein Paysafe Casino die beste Wahl ist und welche Vorteile es bietet. NINLAY - 250% BIS ZU €2,500 + 250FS🎰CROWNSLOTS - 400% bis zu €4.000 + 250 FS💣NEOSPIN - 100% BIS ZU €6.000 + 100 FS🧨1RED - WILLKOMMENSBONUS 200% bis zu 9.300€ + 100 FREISPIELE💥LOKI -...",en,Online Casino with Paysafe 2025: Fast,"Paysafe is one of the most popular payment methods in online casinos. With the Paysafecard or a Paysafe account, players can quickly and anonymously pay deposits without bank details or credit card. In this article you will learn why a Paysafe Casino is the best choice and what advantages it offers. Ninlay - 250% up to 2,500 250fScrown slots - 400% up to 4,000 250 fsneospine - 100% up to 6,000 100 FS1RED - welcome bonus 200% up to 9,300 100 free play eloci –..........",2025-03-25 19:35:28
at,Schein und Auto futsch - Raser brettert mit 119 km/h durch das Ortsgebiet,"Besonders eilig hatte es wohl ein 37-jähriger Pkw-Fahrer, der mit 119 km/h bei erlaubten 50 km/h durchs Ortsgebiet bretterte. Der Führerschein wurde ihm abgenommen, das Auto beschlagnahmt.",en,Schein and Auto Futsch - Raser brings through the local area at 119 km/h,"A 37-year-old car driver was particularly in a hurry who, at 119 km/h at permitted 50 km/h, broke it through the local area. The driving license was taken away, the car was confiscated.",2025-03-25 19:35:13
at,Politik intern: Wer führt die Geschäfte der Landes-VP?,Ein Wirtschaftsbündler wird ebenso als Nachfolger von Eisel-Eiselsberg gehandelt wie ein weststeirischer Bürgermeister.,en,Politics internally: Who will run the Landes-VP's business?,An economic bundle is acted as a successor to Eisel-Eiselsberg as well as a West Styrian master.,2025-03-25 19:35:06
at,Assistenzeinsatz - Maul- und Klauenseuche: Heer unterstützt Slowakei,Die slowakische Regierung kämpft derzeit gegen einen massiven Ausbruch der Maul- und Klauenseuche. Das österreichische Heer wurde am Dienstag im Rahmen des EU-Katastrophenschutzmechanismus ebenfalls alarmiert.,en,Assistance use - mouth and claw disease: Army supports Slovakia,The Slovak government is currently fighting a massive outbreak of mouth and claw disease. The Esterreiche army was also alerted on Tuesday as part of the EU disaster protection mechanism.,2025-03-25 19:34:47
