iso_code,title,description,lang_tranlation,title_translated,description_translated,pubDate
cy,"ΠΑΕΙ ΚΙ ΑΥΤΟΣ, ΗΤΑΝ ΠΟΛΛΑ ΤΑ ΛΕΦΤΑ...","Θυμάστε που είχε γραφτεί στην Ελλάδα ότι, μεγάλη ομάδα της Κύπρου ήθελε πολύ να κλείσει τον Γκουστάβο Φουρτάδο της Λαμίας από το Χειμώνα για το ερχόμενο Καλοκαίρι, αλλά ο Βραζιλιάνος ταλαντούχος φορ και ο μάνατζέρ του, τής έριξαν... «πόρτα» με την πρόταση ότι ήταν τάχα κλειστός στον Ολυμπιακό Πειραιώς; Αν όχι, διαβάστε εδώ... Εν τέλει, [...]The post ΠΑΕΙ ΚΙ ΑΥΤΟΣ, ΗΤΑΝ ΠΟΛΛΑ ΤΑ ΛΕΦΤΑ... appeared first on Super Sport FM.",en,"He's gone too, there was a lot of money ...","Do you remember that it was written in Greece that a large team of Cyprus wanted to close Gustavos Furtado of Lamia since winter for the coming summer, but the Brazilian talented forward and his manager threw her ... ""door"" with the suggestion that she was closed? If not, read here ... in the end, [...] the post goes too, there was a lot of money ... appeared first on super sport fm.",2025-04-08 18:00:00
cy,ΔΙΑΒΑΣΤΕ/ΠΑΕΙ ΣΤΗΝ ΑΣΙΑ ΓΙΑ ΧΡΗΜΑΤΑ!,"Η Μάντσεστερ Γιουνάιτεντ ανακοίνωσε την πραγματοποίηση περιοδείας στην Ασία αμέσως μετά την ολοκλήρωση της Premier League, με τον διευθύνοντα σύμβουλο του συλλόγου, Ομάρ Μπεράντα, να δηλώνει πως στόχος είναι η «οικονομική ενίσχυση», καθώς οι «κόκκινοι διάβολοι» παλεύουν να εξισορροπήσουν τις μεγάλες οικονομικές ζημίες των τελευταίων ετών. Η περιοδεία θα περιλαμβάνει δύο φιλικά παιχνίδια: το πρώτο [...]",en,READ/TAKE TO ASIA FOR MONEY!,"Manchester United have announced a tour of Asia immediately after the completion of the Premier League, with the club's chief executive, Omar Beranda, to declare that the aim is to ""financial support"", as the ""red devils"" are struggling. The tour will include two friendly games: the first [...]",2025-04-08 17:57:16
cy,Νέο triple-double του Γιάννη και νίκη για Μπακς – Όλα τα αποτελέσματα στο NBA,"Με σερί 23 πόντων και επιμέρους σκορ 40-13 στην 4η περίοδο, οι Μπακς κατάφεραν να επικρατήσουν των Τίμπεργουλβς, με τον Γιάννη Αντετοκούνμπο να σημειώνει νέο σερί triple-double στο NBA Το τρίτο του σερί triple-double σημείωσε τα ξημερώματα ο Γιάννης Αντετοκούνμπο, ο οποίος ηγήθηκε στη νίκη (110-103) των Μπακς κόντρα στους Τίμπεργουλβς. Τα «ελάφια» μπήκαν στο ματς, βρισκόμενοι [...]",en,New Triple-Double of John and Buck Niki-All results in NBA,"With a series of 23 points and a score of 40-13 in the 4th period, the Bucks managed to dominate the Timberwolves, with Yiannis Antetokounbos scoring a new Triple-Double Seri in NBA's third Triple-Double in the early morning by Yiannis Antetokoumos (110-10). Against the Timberwolves. The ""deer"" entered the match, being [...]",2025-04-09 06:15:56
cy,Ομόνοια Αραδίππου: Η λεγόμενη κακή ήττα,"Δεν είναι η πρώτη φορά που η Ομόνοια Αραδίππου έχει χάσει τρία συνεχόμενα παιχνίδια. Για την ακρίβεια συνέβη άλλες δύο φορές και άλλη μια που έχασε τέσσερα σερί ματς. Τότε όμως είχε γίνει με ομάδες που έχουν μεγαλύτερους στόχους. Αντίθετα στα πλέι άουτ ηττήθηκε απέναντι σε ΑΕΛ, Ένωση και Νέα Σαλαμίνα. Κι αν η ήττα [...]The post Ομόνοια Αραδίππου: Η λεγόμενη κακή ήττα appeared first on Super Sport FM.",en,Omonia Aradippou: The so -called bad defeat,"This is not the first time that Omonia Aradippou has lost three consecutive games. In fact, it happened twice and another one that lost four consecutive matches. But then it was done with groups with greater goals. In contrast to the playoffs, he was defeated against AEL, Union and New Salamis. And if the defeat [...] The post Omonia Aradippou: The so -called bad defeat appeared first on super sport fm.",2025-04-09 06:15:48
cy,Ποιο serum είναι κατάλληλο για τις πρώτες ρυτίδες;,LADYTIMES,en,Which serum is suitable for first wrinkles?,Ladytimes,2025-04-09 06:15:11
cy,Taste Atlas: Εκτός λίστας καλύτερων street food γύρος και σουβλάκι - Η «άγνωστη» λιχουδιά στο Νο1,Αυτή είναι η «χρυσή» λίστα του street food.,en,"Taste Atlas: Outside the best street food list and skewer - the ""unknown"" delicacy at No1","This is the ""golden"" list of street food.",2025-04-09 06:14:50
cy,Για αποσταθεροποίηση παγκόσμιου εμπορίου προειδοποιούν κινέζικα επιμελητήρια,Σθεναρή αντίθεσή τους στη μονομερή επιβολή ανταποδοτικών δασμών από τις ΗΠΑ,en,For global trade destabilization warn Chinese Chambers,Their strong opposition to unilateral imposition of US duties,2025-04-09 06:09:35
cy,«Ξεκίνησαν οι ειρωνείες από τους γνωστούς πολέμιους...»,"Με ανάρτησή του, ο πρόεδρος της ΕΝΠ Κώστας Στρατής σχολίασε τις αντιδράσεις στη δήλωση του Πέτρου Σάββα ότι το πρωτάθλημα της α’ κατηγορίας θα πρέπει να διεξάγεται με 17 ομάδες: «Τόλμησε να πει την άποψη του ο φίλος Πέτρος Σάββας του Ολυμπιακού και ξεκίνησαν οι ειρωνείες, από τους γνωστούς πολέμιους. “Να τις κάνετε 30, 40 [...]",en,"""The irony started from the well -known warriors ...""","In a post, NNP President Costas Stratis commented on reactions to Peter Savva's statement that the first division championship should be held with 17 teams: ""Dare to say his opinion, friend Petros Savvas of Olympiakos and Olympiakos began. “Make them 30, 40 [...]",2025-04-09 06:09:23
cy,"Έστειλαν σημαντικά μηνύματα για τον αθλητισμό Παναγιώτης Καττιρτζής και Νεκτάριος Πετεβίνος, στο Δημοτικό Σχολείο Ψιμολόφου","Μια ξεχωριστή εμπειρία είχαν την ευκαιρία να ζήσουν οι μαθητές του Δημοτικού Σχολείου Ψιμολόφου, κατά τη διάρκεια της επίσκεψης του ποδοσφαιριστή του ΑΠΟΕΛ, Παναγιώτη Καττιρτζή, και του εκπροσώπου Τύπου της ομάδας, Νεκτάριου Πετεβίνου. Η παρουσία τους εντάσσεται στο πλαίσιο του προγράμματος επισκέψεων της Εθνικής Σχολής Δεοντολογίας του Αθλητισμού (ΕΣΔΑ), το οποίο στοχεύει στην καλλιέργεια σωστής [...]",en,They sent important messages for sports Panagiotis Katritzis and Nektarios Petevinos at Psimolofou Primary School,"A special experience had the opportunity to live by the students of the Primary School of Psimolofou, during the visit of APOEL footballer Panagiotis Katitzis and the team spokesman Nektarios Petevinou. Their presence is part of the Visits of the National School of Ethics of Sport (ECHR), which aims to cultivate proper [...]",2025-04-09 06:07:44
cy,"Έστειλαν σημαντικά μηνύματα για τον αθλητισμό Παναγιώτης Καττιρτζής και Νεκτάριος Πετεβίνος, στο Δημοτικό Σχολείο Ψιμολόφου (Pics)","Μια ξεχωριστή εμπειρία είχαν την ευκαιρία να ζήσουν οι μαθητές του Δημοτικού Σχολείου Ψιμολόφου, κατά τη διάρκεια της επίσκεψης του ποδοσφαιριστή του ΑΠΟΕΛ, Παναγιώτη Καττιρτζή, και του εκπροσώπου Τύπου της ομάδας, Νεκτάριου Πετεβίνου. Η παρουσία τους εντάσσεται στο πλαίσιο του προγράμματος επισκέψεων της Εθνικής Σχολής Δεοντολογίας του Αθλητισμού (ΕΣΔΑ), το οποίο στοχεύει στην καλλιέργεια σωστής [...]",en,They sent important messages for Sport Panagiotis Katritzis and Nektarios Petevinos at Psimolofou Elementary School (PICS),"A special experience had the opportunity to live by the students of the Primary School of Psimolofou, during the visit of APOEL footballer Panagiotis Katitzis and the team spokesman Nektarios Petevinou. Their presence is part of the Visits of the National School of Ethics of Sport (ECHR), which aims to cultivate proper [...]",2025-04-09 06:07:44
cy,Τα... εκτός έδρας της δίνουν το προβάδισμα-τίτλου!,"Η Πάφος FC βρίσκεται στην πρώτη θέση και παραμένει το μεγάλο φαβορί για τον τίτλο, παρά την τελευταία ήττα που δέχθηκε από το ΑΠΟΕΛ καθώς διατήρησε το +6 από τον δεύτερο Άρη. Ήταν η τρίτη εντός έδρας ήττα για την παφιακή ομάδα, που το αξιοσημείωτο γι’ αυτλην είναι πως έχει πολύ καλύτερη συγκομιδή στα εκτός [...]",en,Her ... away games give her the lead!,"Paphos FC is in the first place and remains the big favorite for the title, despite the last defeat it received from APOEL as it retained 6 of the second Mars. It was the third home defeat for the Pafia team, which is remarkable for it is that it has a much better harvesting outside [...]",2025-04-09 06:05:49
cy,Ξεκίνησε η προπώληση για το «αιώνιο»! – Όλες οι λεπτομέρειες,"Από τις 9:00 το πρωί ξεκίνησε η προπώληση των 800 εισιτηρίων που έχει στην διάθεση της η ομάδα μας για το παιχνίδι της ερχόμενης Κυριακής (13/04) με αντίπαλο τον Αποέλ για την 5η αγωνιστικής της Β’ φάσης του πρωταθλήματος. Με βάση την τροποποίηση που έγινε στην προκήρυξη του πρωταθλήματος από το Διοικητικό Συμβούλιο της ΚΟΠ, [...]",en,"The pre -sale for the ""eternal"" began! - All the details","From 9:00 in the morning, the 800 tickets available to our team for the next Sunday (13/04) game against APEL for its 5th Championship match has begun. Based on the amendment made in the announcement of the championship by the COP Board of Directors, [...]",2025-04-09 06:04:09
cy,Μπαρτσελόνα – Ντόρτμουντ 4-0: Oι“μπλαουγκράνα” συνέτριψαν την Μπορούσια και έκλεισαν θέση στα ημιτελικά του Champions League,"Με τους Γιαμάλ και Ραφίνια να κάνουν πάρτι και τον Λεβαντόφσκι να εκτελεί, η Μπαρτσελόνα ισοπέδωσε με 4-0 την Ντόρτμουντ στο “Μοντζουίκ” και βρίσκεται με το ένα πόδι στα ημιτελικά του Champions League. Μια μαγική Μπαρτσελόνα έκρυψε την μπάλα και έκλεισε θέση στα ημιτελικά του Champions League. Οι Καταλανοί δεν συνάντησαν καμία αντίσταση απέναντι στην [...]",en,"Barcelona-Dortmund 4-0: The ""Blaugrana"" crushed Borussia and closed a position in the Champions League semifinals","With Yamal and Rafinia partying and Levadovsky running, Barcelona leveled Dortmund 4-0 in Modzuk and is one foot in the Champions League semi-finals. A magical Barcelona hid the ball and closed the Champions League semifinals. The Catalans did not meet any resistance to [...]",2025-04-09 21:00:45
cy,Η κυρίαρχη Παρί έκανε την ανατροπή κόντρα στην Άστον Βίλα και πήρε προβάδισμα πρόκρισης!,"Η Άστον Βίλα προηγήθηκε στο «Παρκ ντε Πρενς» με τον Ρότζερς όμως η ανώτερη Παρί έφτασε σε σπουδαία ανατροπή με εκπληκτικά γκολ των Ντουέ, Κβαρατσχέλια και Μέντες, για να επικρατήσει με 3-1 και να αποκτήσει καθαρό προβάδισμα πρόκρισης στους «4» του Champions League. Η φετινή Παρί του Λουίς Ενρίκε είναι μία πολεμική μηχανή που δεν [...]",en,The dominant Paris made the overturn against Aston Villa and took a qualifying lead!,"Aston Villa was led by Park de Prens with Rogers, but senior Paris reached a great overturn with stunning goals from due, Kvaratshelia and Mentes, to prevail 3-1 and get a clear lead in the Champions League. Luis Enrique's Paris is a war machine that is not [...]",2025-04-09 20:59:50
cy,"Γκολάρες, μπαλάρα και έφυγε για ημιτελικό η τρομερή Παρί!","Με γκολ παγκόσμιας κλάσης και τρομερό ποδόσφαιρο, η Παρί «πάτησε» την Άστον Βίλα με 3-1, με το σκορ να την... αδικεί κιόλας, σε ένα ματς που έκανε τα πάντα!",en,"Goals, Balara and the terrible Paris left for the semifinals!","With a world-class goal and awesome football, Paris hit Aston Villa 3-1, with the score ... wrong in a match that did everything!",2025-04-09 20:59:07
cy,"Παρί – Άστον Βίλα 3-1: Έκανε την ανατροπή με Ντουέ, Κβαρατσχέλια και Μέντες και απέκτησε αβαντάζ για τους 4","Η Άστον Βίλα προηγήθηκε στο “Παρκ ντε Πρενς” με τον Ρότζερς όμως η ανώτερη Παρί έφτασε σε σπουδαία ανατροπή με εκπληκτικά γκολ των Ντουέ, Κβαρατσχέλια και Μέντες, για να επικρατήσει με 3-1 και να αποκτήσει καθαρό προβάδισμα πρόκρισης στους 4 του Champions League. Η Παρί μπήκε στο γήπεδο με τον αέρα της πρωταθλήτριας Γαλλίας (σφράγισε [...]",en,"Paris-Aston Villa 3-1: He did the overthrow with duu, kvaratschelia and Mentes and acquired a avant-garde for 4","Aston Villa led in ""Park de Princes"" with Rogers, but senior Paris reached a great overturn with stunning goals from duu, Kvarachchelia and Mentes, to prevail 3-1 and get a clear lead in the Champions League. Paris entered the stadium with the air of France champion (sealed [...]",2025-04-09 20:57:58
cy,Μπαρτσελόνα... über alles,"Οι Καταλανοί παρέδωσαν μαθήματα παραδοσιακών χορών, ζάλισαν την Μπορούσια Ντόρτμουντ και την έστειλαν στο σπίτι της με το βαρύ 4-0. Εκεί έκανε όνομα, εκεί έζησε τα πιο ανέμελα χρόνια, σε αυτή οφείλει το ποδοσφαιρικό του ευ ζην. Και πως της το ξεπληρώνει; Σκοράροντας ακατάπαυστα εναντίον της, όπου κι αν την βρει. Ο Ρόμπερτ Λεβαντόφσκι είναι [...]",en,Barcelona ... über alles,"The Catalans taught traditional dances lessons, stunned Borussia Dortmund and sent her home 4-0. He made a name there, there he lived for the most carefree years, he owes his football. And how does she pay for her? Scoring endlessly against her, wherever she finds her. Robert Levadovsky is [...]",2025-04-09 20:56:49
cy,"Μια Μπαρτσελόνα... όνειρο, συνέτριψε την Ντόρτμουντ και έκλεισε θέση στα ημιτελικά!","Μια μαγική Μπαρτσελόνα έκρυψε την μπάλα και έκλεισε θέση στα ημιτελικά του Champions League. Οι Καταλανοί δεν συνάντησαν καμία αντίσταση απέναντι στην Ντόρτμουντ, την οποία και κατατρόπωσαν με 4-0 στο πρώτο μεταξύ τους παιχνίδι για τα προημιτελικά έχοντας σε εξαιρετική κατάσταση τους Λεβαντόφσκι, Γιαμάλ, Ραφίνια και Φερμίν. Οι “μπλαουγκράνα” άνοιξαν το σκορ στο 25ο λεπτό, όταν ο Φερμίν εκτέλεσε [...]",en,"A Barcelona ... dream, crushed Dortmund and closed the semifinals!","A magical Barcelona hid the ball and closed the Champions League semifinals. The Catalans met no resistance to Dortmund, which they defeated 4-0 in the first game for the quarter-finals with Levadovsky, Yamal, Rafinia and Fermin. The ""Blaugrana"" opened the scoring in the 25th minute when Fermin executed [...]",2025-04-09 20:50:19
cy,17:00 ΑΕΛ – ΚΕΡΑΥΝΟΣ (SF 1) (Z),,en,17:00 AEL - LIGHT (SF 1) (Z),,2025-04-09 20:48:23
cy,17:00 ΑΕΛ – ΚΕΡΑΥΝΟΣ (SF 1) (Z),,en,17:00 AEL - LIGHT (SF 1) (Z),,2025-04-09 20:48:23
cy,19:45 LEGIA WARSZAWA – CHELSEA (Z),,en,19:45 Legia Warszawa - Chelsea (Z),,2025-04-09 20:47:27
cy,19:45 LEGIA WARSZAWA – CHELSEA (Z),,en,19:45 Legia Warszawa - Chelsea (Z),,2025-04-09 20:47:27
