iso_code,title,description,lang_tranlation,title_translated,description_translated,pubDate
at,Aktuell 3.800 Polizeischülerinnen und -schüler in Grundausbildung,Polizeischulen so voll wie nie zuvor – Personalstand seit Ende 2018 um rund 3.100 Polizistinnen und Polizisten gestiegen,en,"Currently 3,800 police students in basic training","Police schools have increased by around 3,100 police officers since the end of 2018",2025-04-26 06:00:17
at,Auf den Wellen des Planksees steigt heuer die Surf-Action,"Durch ganz Österreich geht heuer das Surf Opening 2025 über die Wellen der verschiedenen Seen. Das Opening ist die Eröffnung der diesjährigen Saison im Surfen. Der Saisonauftakt findet heuer mit Events quer durch Österreich statt und auch im Bezirk Leibnitz machen die Boarderinnen und Boarder am 1. Mai Station. ÖSTERREICH/ST. VEIT. Egal ob am See, am Fluss oder mitten in der Stadt – 48 lokale Anbieter sorgen für einzigartige Erlebnisse vor Ort. Und es kommen laufend neue Anbieter hinzu. Am 1....",en,The surfing action is increasing on the waves of the Planksee this year,"All over Austria, the Surf Opening 2025 goes over the waves of the different lakes this year. Opening is the opening of this year's season in surfing. The start of the season takes place across Austria with events this year and the Boarders will also stop in the Leibnitz district on May 1st. Austria/st. Veit. Whether at the lake, on the river or in the middle of the city - 48 local providers provide unique experiences on site. And new providers are always added. On 1 ...",2025-04-26 06:00:08
at,Schnellbahn zwischen Hernals und Heiligenstadt fällt aus,"Zwischen 28. April und 23. Juni müssen Fahrgäste der S-Bahn-Strecke zwischen Hernals und Handelskai mit einigen Änderungen rechnen. In einer ersten Bauphase gibt es gar keine Züge zwischen den Stationen. Ein Schienenverkehr ist jedoch geplant. WIEN. Die S45, auch bekannt als Vorortelinie, ist eine der stärksten befahrenen Bahnstrecken in Wien. Damit Fahrgäste weiterhin pünktlich und sicher von Hernals nach Handelskai gelangen, wird die Strecke jetzt modernisiert und weitestgehend saniert. Am...",en,Quick track between Hernals and the Heiligenstadt is canceled,"Between April 28 and June 23, passengers of the S-Bahn line between Hernals and Handelskai have to expect some changes. In a first construction phase there are no trains between the stations. However, rail traffic is planned. VIENNA. The S45, also known as a suburban line, is one of the strongest busy railway lines in Vienna. So that passengers continue to get to Handelskai on time and safely from Hernals, the route is now modernized and largely renovated. On ...",2025-04-26 06:00:08
at,Auszeichnung für Baukultur im Weinviertel,"Mit einer neuen Plakette rückt das Land Niederösterreich gelungene Sanierungen historischer Presshäuser ins Rampenlicht. Beim Festakt im Meierhof Ulrichskirchen wurden 24 Bauwerke ausgezeichnet – darunter sechs aus dem Bezirk Mistelbach. Ziel ist es, das kulturelle Erbe der Kellergassen zu bewahren und andere zur Nachahmung zu inspirieren. NÖ/BEZIRK MISTELBACH. „Mit dieser Auszeichnung danken wir allen Kellerbesitzerinnen und Kellerbesitzern für ihre herausragenden Leistungen“, betonte...",en,Award for building culture in the Weinviertel,"With a new badge, the state of Lower Austria moves successful renovations of historical press houses into the spotlight. 24 buildings were awarded at the ceremony in the Meierhof Ulrichskirchen - including six from the Mistelbach district. The aim is to preserve the cultural heritage of Kellergassen and inspire others to imitate. Lower Austria/Mistelbach district. ""With this award, we thank all cellar owners for their outstanding achievements,"" emphasized ...",2025-04-26 06:00:08
at,Weinviertelfestival 2026 - Sonderprojekte: Bezirk Hollabrunn glänzt durch Abwesenheit,"Das Viertelfestival bietet alle vier Jahre die Gelegenheit, kulturelle Projekte im jeweiligen Bezirk zu etablieren oder weiterzuentwickeln. Diese Chance kann man nutzen oder - wie im Fall von Hollabrunn - an sich vorübergehen lassen.",en,Weinviertel Festival 2026 - Special projects: District Hollabrunn shines through absence,The quarter festival offers the opportunity every four years to establish or develop cultural projects in the respective district. You can use this opportunity or - as in the case of Hollabrunn - pass by.,2025-04-27 03:45:00
at,Tischtennis - Wiener Neustadt steht im Bundesliga-Halbfinale mit dem Rücken zur Wand,"Meister Wiener Neustadt unterlag im Halbfinal-Hinspiel Stockerau mit 2:4, betrieb nach zwischenzeitlichem 0:3-Rückstand aber noch Schadensbegrenzung.",en,Table tennis - Wiener Neustadt is in the Bundesliga semi -final with his back to the wall,"Master Wiener Neustadt lost to Stockerau in the semi-final first leg, but still limited damage after 0: 3 deficit.",2025-04-27 03:30:00
at,Rechnungsabschluss - Bruck: Wenig Gegenwind der Opposition beim Abschluss des Finanzjahres,"Die Stadt schloss das Jahr 2024 mit einem kräftigen Minus von 1,2 Millionen Euro ab. Auch das Haushaltspotenzial ist zum fünften Mal in Folge negativ. Nur die Grünen enthielten sich der Stimme.",en,Invoice conclusion - Bruck: Little headwind of the opposition at the end of the financial year,The city finished 2024 with a strong minus of 1.2 million euros. The budget potential is also negative for the fifth time in a row. Only the Greens abstained from the voice.,2025-04-27 03:30:00
at,Kehrtwende - Lukić bleibt vorerst Bad-Wirt in Pyhra,"Das Restaurant am See bleibt als Terrazzaria mit verändertem Angebot erhalten. Ob es am zum Badestart pünktlich eröffnet werden kann, bleibt durch Personalmangel jedoch offen.",en,U -turn - Lukić remains in Pyhra for the time being,"The restaurant on the lake is preserved as a terrazzaria with a changed offer. However, a lack of staff remains open whether it can be opened on time at the start of the bath.",2025-04-27 03:30:00
at,"Deutsche-Liga-Ticker - Werder Bremen gegen St. Pauli, LIVE ab 17.30 Uhr",Am 31. Spieltag der deutschen Fußball-Bundesliga kommt es zum Duell zwischen Werder Bremen und dem FC St. Pauli. Wir berichten live – siehe Ticker unten.,en,"Deutsche-Liga-Ticker-Werder Bremen against St. Pauli, live from 5.30 p.m.","On the 31st matchday of the German Bundesliga, there is a duel between Werder Bremen and FC St. Pauli. We report live - see ticker below.",2025-04-27 03:29:12
at,Bundesliga im Ticker - Rapid gegen Blau-Weiß Linz – ab 14.30 Uhr LIVE,"28. Spieltag der österreichischen Bundesliga. Rapid empfängt Blau-Weiß Linz, wir berichten ab 14.30 Uhr live – siehe Ticker unten.",en,Bundesliga in the ticker - rapid against Blau -Weiß Linz - from 2.30 p.m. Live,"28th matchday of the Austrian Bundesliga. Rapid receives blue and white Linz, we report live from 2.30 p.m.-see ticker below.",2025-04-27 03:26:24
at,14 Tote und über 750 Verletzte bei Hafen-Explosion im Iran,Riesige Explosion erschütterte größten Handelshafen des Landes,en,14 deaths and over 750 injured at the port explosion in Iran,Huge explosion shaken the country's largest commercial port,2025-04-27 03:26:20
at,Papst Franziskus in Basilika Santa Maria Maggiore beigesetzt,Sarg mit Papst Franziskus auf dem Weg zum Petersplatz,en,Pope Francis in Basilica Santa Maria Maggiore buried,Coffin with Pope Francis on the way to St. Peter's Square,2025-04-27 03:24:30
at,Riesige Hafen-Explosion im Iran: Ursache steht fest,Bei der gewaltigen Detonation im größten Hafen des Iran sind am Samstag Staatsmedien zufolge nach einer aktuellen Bilanz mittlerweile mindestens 18 Menschen getötet und mehr als 700 verletzt worden.,en,Huge port explosion in Iran: the cause is certain,"According to state media, at least 18 people were now killed and more than 700 injured on Saturday, according to a current balance sheet.",2025-04-27 03:21:23
at,Milliarden-Deal als Türöffner in den Emiraten,Warum Österreich auf die Golf-Region setzt und Abu Dhabi bei Handelsabkommen mit der EU unterstützt. Und was Ex-OMV-Chef Seele dort treibt.,en,Billion-dollar deal as door openers in the emirates,Why Austria relies on the Golf region and supports Abu Dhabi with the EU in trade agreements. And what ex-OMV boss Seele drives there.,2025-04-27 03:20:00
at,St. Pöltens Frauen rücken nächstem Titel näher,,en,St. Pölens women move closer next title,,2025-04-27 20:02:13
at,St. Pölten nach Austria-2:2 in Frauenliga 7 Punkte voran,"Der SKN St. Pölten ist dem 10. Meistertitel in Folge in der Frauen-Fußball-Bundesliga noch näher gekommen. Der Serienchampion feierte am Sonntag in der 3. Runde der Meistergruppe bei der Vienna einen 4:0-Erfolg, gewann damit auch das zehnte Pflichtspiel unter Trainerin Lisa Alzner und vergrößerte den Vorsprung auf die Wiener Austria vor der Rückrunde auf sieben Punkte. Der Verfolger kam bei Sturm Graz nur zu einem 2:2. Neun Zähler sind im Saisonfinish noch zu vergeben.",en,St. Pölten after Austria-2: 2 in Frauenliga 7 points ahead,"The SKN St. Pölten has come even closer to the 10th championship title in a row in the women's football Bundesliga. The serial champion celebrated a 4-0 win on Sunday in the 3rd round of the master group at the Vienna, also won the tenth competitive game under trainer Lisa Alzner and increased the lead to Vienna Austria to seven points before the second half of the season. The pursuer only came to a 2-2 at Sturm Graz. Nine points can still be awarded in the season finish.",2025-04-27 20:01:47
at,"Ludwig verteidigt ersten Platz: ""Stabile Regierung vor dem Sommer""","Der Wiener Bürgermeister Michael Ludwig (SPÖ) hat sich trotz leichter Verluste ""in aller Demut"" sehr zufrieden mit dem Ergebnis der Wiener Gemeinderatswahl am Sonntag gezeigt. Auf eine Fortsetzung der Koalition mit den Neos wollte er sich nicht festlegen und ließ sich alle Optionen offen",en,"Ludwig defended first place: ""Stable government before summer""","Despite the slight loss ""in all humility"", the mayor Michael Ludwig (SPÖ) showed himself very satisfied with the result of the Vienna City Council election on Sunday. He did not want to commit himself to a continuation of the coalition with the Neos and was open to all options",2025-04-27 20:01:15
at,AMINATA & THE ASTRONAUTS,"Wie viele Stammgäste immer wieder bestätigen, kann der HOB i RAUM alles sein. Am Samstag zum Beispiel ein Club in Harlem. Und mit viel Soul und Motown Sound wird dieser Club von Aminata & The Astronauts förmlich überrannt. Vom ersten Song an versucht die Sängerin Aminata Seydi mit ihrer Stimme und ihrer Bühnenpräsenz das Publikum mitzureißen. Wolfgang Schmidt am Keyboard, Thomas Palme Gitarre, Peter Strutzenberger Kontrabass und Thomas Böröcz am Schlagzeug sind die spielfreudige Band. Bei ""I...",en,Aminata,"As many regular guests repeatedly confirm, the raised room can be. On Saturday, for example, a club in Harlem. And with a lot of soul and Motown Sound this club becomes Aminata",2025-04-27 20:01:09
at,Im Rofan - Mit Turnschuhen im Schnee: Wanderer in Bergnot,Auf vielen Tiroler Gipfeln liegt noch Schnee. Dennoch wollte Sonntag ein Urlauberpaar (25 und 28) aus Finnland im Rofangebirge eine fordernde Bergtour unternehmen. Das Duo war dabei jedoch völlig unzureichend ausgerüstet.,en,In the roofan - with sneakers in the snow: hiker in mountainous,"There is still snow on many Tyrolean peaks. Nevertheless, Sunday a couple of vacationers (25 and 28) from Finland wanted to take a demanding mountain tour in the Rofan Mountains. However, the duo was completely insufficiently equipped.",2025-04-27 20:00:49
at,Tanz auf zarten Blühen,Maikäfer,en,Dance on delicate bloom,Cockroach,2025-04-27 20:00:40
at,Göfis stoppt Höhenflug des SV Ludesch,Ludesch Ausgerechnet Nachbar SC Göfis beendet die beeindruckende Erfolgsserie des SV Ludesch im Walgauderby. Vor knapp 500 Zuschauern in Ludesch setzten sich die Gäste in einer emotionalen Partie mit 3:2 knapp durch. Zwei der drei Göfner Treffer waren echte Highlights: Anil Arslan brachte seine Farben kurz nach der Pause mit einem Geniestreich – einem Schuss [...],en,Göfis stops SV Ludesch,"Ludesch, of all people, neighbor SC Göfis ends the impressive series of success of SV Ludesch in the Walgauderby. In front of almost 500 spectators in Ludesch, the guests narrowly won 3-2 in an emotional game. Two of the three Göfner goals were real highlights: Anil Arslan brought his colors shortly after the break with a stroke of genius - a shot [...]",2025-04-27 20:00:26
at,Historischer Treffer von VfB-Tormann Eres,Goalie trifft in Nachspielzeit nach Aufholjagd zum 3:3.,en,Historical hit by VfB goalkeeper Eres,Goalie meets 3: 3 after catching up after catching up.,2025-04-27 20:00:25
at,Röthis und Lauterach mit Niederlagen,"Schwarzach Weniger erfolgreich verlief der Spieltag für die beiden abstiegsbedrohten Vorarlberger Teams in der Regionalliga West: Der Letzte, SC Röthis, musste sich dem FC Pinzgau/Saalfelden mit 1:3 geschlagen geben. Eine bittere Niederlage, die im Kampf um den Klassenerhalt besonders schmerzt. Noch härter erwischte es Lauterach, das beim Tabellenführer und amtierenden Meister Austria Salzburg völlig chancenlos [...]",en,Röthis and Lauterach with defeats,"Schwarzach was less successful in the game day for the two relegation -threatened Vorarlberg teams in the Regionalliga West: The last, SC Röthis, had to surrender to FC Pinzgau/Saalfelden 1: 3. A bitter defeat that particularly hurts in the fight for relegation. Lauterach caught it even harder, which the leaders and reigning master Austria Salzburg completely chance [...]",2025-04-27 20:00:25
at,2. LANDESLIGA NORD - Kein Raum für Fehler im Dreikampf um Meisterschale,"Spannung pur in der 2. Landesliga Nord! Mit Koppl, dem HSV Wals und der SG Gneis/ASK/PSV liefern sich drei Mannschaften ein packendes Rennen um Aufstieg und Meisterschale. Am vergangenen Wochenende gaben alle drei ein klares Statement ab!",en,2. Landesliga Nord - No room for mistakes in the three -way battle for master shell,"Pure excitement in the 2nd Landesliga North! With Koppl, HSV Wals and the SG Gneis/ASK/PSV, three teams have a gripping race for ascent and master bowl. Last weekend all three gave a clear statement!",2025-04-27 20:00:09
at,"Wahlbeteiligung sinkt auf 62,8 Prozent","Weniger Stimmberechtigte als 2020 machten sich am Sonntag zur Wahlurne auf, ein historisches Tief bedeutet das aber nicht. Dafür hätte die Beteiligung unter die 60,81 Prozent sinken müssen.",en,Voting turnout drops to 62.8 percent,"Less voters than in 2020 set out on Sunday, but that does not mean a historical low. To do this, the participation should have dropped below 60.81 percent.",2025-04-28 04:34:45
at,Lehrermangel: Ministerium schreibt 6.100 Stellen aus,Alleine in Wien werden knapp 2.000 Lehrer gesucht.,en,"Lack of teacher: Ministry writes 6,100 jobs","Almost 2,000 teachers are sought in Vienna alone.",2025-04-28 04:34:23
at,Salzburg sucht Trainer - Was der neue Bulls-Coach alles mitbringen sollte,"Nach dem Abgang von Meister-Trainer Oliver David ist Salzburg unter Zugzwang – ein neuer Trainer muss her. Die „Krone“ erstellt ein Profil, was gesucht ist und der „Neue“ alles mitbringen sollte.",en,Salzburg is looking for a trainer - what the new bulls coach should bring with you,"After the departure of master coach Oliver David, Salzburg is under pressure-a new coach is needed. The ""crown"" creates a profile that is sought and the ""new"" should bring everything.",2025-04-28 04:34:16
at,„Krone“- Interview - Walchhofer: „50 Jahre sollten es noch werden“,"Michael Walchhofer wird 50! Die „Krone“ besuchte den Salzburger daheim und sprach mit dem Abfahrtsweltmeister von 2003 über prägende Kindheitserinnerungen, Erfahrungen als Profiskifahrer und Visionen für den Sport.",en,"""Krone"" - Interview - Walchhofer: ""It should still be 50 years""","Michael Walchhofer is 50! The ""Krone"" visited the Salzburg at home and spoke to the downhill world champion of 2003 about formative childhood memories, experiences as a professional driver and visions for sport.",2025-04-28 04:33:41
at,Strahlenspürer-Einsätze: Polizei zieht Bilanz,"Im Jahr 2024 sind die Strahlenspürer der Kärntner Polizei zwölf Mal ausgerückt, um auf radioaktive Gefahrenquellen zu reagieren, meist ausgelöst durch Sondermüll. Dank empfindlicher Messgeräte seien alle Vorfälle ohne Gefahr für die Bevölkerung geklärt worden.",en,Radiation pureer missions: the police take stock,"In 2024, the rays of the Carinthian police have moved out twelve times to react to radioactive sources of danger, mostly triggered by hazardous waste. Thanks to sensitive measuring devices, all incidents have been clarified without danger for the population.",2025-04-28 04:31:39
at,Im Opus-Style - „Klopp“-Chöre: Slot revanchiert sich bei Vorgänger,"Mit „Jürgen Klopp“-Gesängen hat Liverpools Meistertrainer Arne Slot auch seinen Vorgänger gewürdigt. Noch vor einem Jahr war es Klopp, der den Niederländer mit einer adaptierten Version des Opus-Hit „Live is Life“ an der Anfield Road willkommen geheißen hatte.",en,"In the opus style-""Klopp"" choirs: Slot returns to its predecessor","With ""Jürgen Klopp"" chants, Liverpool's master coach Arne Slot also recognized his predecessor. A year ago it was Klopp who welcomed the Dutch with an adapted version of the Opus hit ""Live is Life"" to the Angard Road.",2025-04-28 04:30:02
at,Prozess-Start nach Bombenserie,"Nach mehrfachen Bombenanschlägen im Umfeld der Zeugen Jehovas steht ab Montag ein 56 Jahre alter Steirer vor Gericht. Angeklagt sind terroristische Straftaten. Dem Mann wird vorgeworfen, er habe mehr als 30 Zeugen Jehovas einschließlich seiner Ex-Frau töten wollen.",en,Process start after series of bombing,"After multiple bombings in the vicinity of Jehovah's Witnesses, a 56 -year -old Styrian will be on trial from Monday. Terrorist crimes are accused. The man is accused of killing more than 30 Jehovah's Witnesses, including his ex-wife.",2025-04-28 04:30:00
at,Beim WM-Gold der Oma - Sieben Enkelkinder warten auf die Tätowierung,"Die Masters-Leichtathleten Karmella Michlfeit und Gottfried Gassenbauer leben für ihren Sport. Die 76-Jährige hat Wette mit der Familie laufen, der 66-Jährige einst einen Speer im Hals stecken.",en,With the Grandma World Cup gold - seven grandchildren are waiting for the tattoo,"The Masters light athletes Karmella Michlfeit and Gottfried Gassenbauer live for their sport. The 76-year-old has bet with the family, the 66-year-old once stuck a spear in her throat.",2025-04-28 04:30:00
at,"Bei Hüfte, Knie, Fuß und Sprunggelenk haben die Schwazer Ärzte die Nase vorn",Das Endoprothetik-Zentrum sowie das Zentrum für Fuß- und Sprunggelenkschirurgie des Schwazer Bezirkskrankenhauses sind die einzig zertifizierten in Westösterreich. Der ärtzliche Direktor verrät das Erfolgsrezept.,en,"At the hip, knee, foot and ankle, the Schwaz doctors have their nose ahead",The endoprosthetic center and the center for foot and ankle surgery of the Schwaz district hospital are the only certified in Western Austria. The medical director reveals the recipe for success.,2025-04-28 04:30:00
at,"Trump an Putin: Angriffe stoppen, Friedens-Deal eingehen","Was sich der US-Präsident vom Kremlchef erwartet? „Ich möchte, dass er mit dem Schießen aufhört, sich hinsetzt und einen Deal unterschreibt“, sagt Donald Trump.",en,"Trump to Putin: Stop attacks, go into peace deal","What does the US president expect from the Kremlin chief? ""I want him to stop shooting, sit down and sign a deal,"" says Donald Trump.",2025-04-28 04:28:56
at,Warum der US-Anleihemarkt verrückt spielt [premium],Die Reaktion der Anleihehändler auf Trumps Politik überraschte fast alle Experten. US-Investoren sollten stets ein Auge auf die Renditen von zwei- und zehnjährigen Staatspapieren werfen.,en,Why the US bond market is going crazy [Premium],The reaction of bond dealers to Trump's politics surprised almost all experts. US investors should always keep an eye on the returns of two- and ten-year-old government papers.,2025-04-29 03:49:11
at,"KTM-Mutter Pierer Mobility fuhr im Vorjahr 1,2 Milliarden Verlust ein","Die KTM-Mutter Pierer Mobility kann nur vorläufige Zahlen für 2024 vorlegen. Demnach verlief das Vorjahr tiefrot, bis März 2025 verloren 1850 Beschäftigte ihre Jobs",en,KTM-Mother Pierer Mobility drove 1.2 billion loss in the previous year,"The KTM mother Pierer Mobility can only provide preliminary numbers for 2024. Accordingly, the previous year was deep red, until March 2025 1850 employees lost their jobs",2025-04-29 03:45:15
at,"KTM-Mutter Pierer Mobility fuhr im Vorjahr 1,2 Milliarden Euro Verlust ein","Die KTM-Mutter Pierer Mobility kann nur vorläufige Zahlen für 2024 vorlegen. Demnach verlief das Vorjahr tiefrot, bis März 2025 verloren 1850 Beschäftigte ihre Jobs",en,KTM-Mother Pierer Mobility drove 1.2 billion euros in the previous year,"The KTM mother Pierer Mobility can only provide preliminary numbers for 2024. Accordingly, the previous year was deep red, until March 2025 1850 employees lost their jobs",2025-04-29 03:45:15
at,Die Kunst der Sozialdemokratie,"Sparkurs ja, Verengung nein: Nach dem Urnengang wird auch die Kulturstadt Wien erneut zur Debatte stehen müssen.",en,The art of social democracy,"Austerity yes, narrowing No: After the urn gang, the Kulturstadt Vienna will also have to be discussed again.",2025-04-29 03:45:00
at,Newcomerin Elsa: Die besten Ideen hat sie am Fahrrad [premium],"Elsa Steixner, aus Neubau stammende Popsängerin mit Jazzhintergrund, stellt mit ihrer famosen Band Elsa ihr Album „Jump“ vor. Präsentiert wird es am 6. Mai im Porgy & Bess.",en,Newcomer Elsa: She has the best ideas on the bike [Premium],"Elsa Steixner, a pop singer from a new building with a jazz background, presents her album ""Jump"" with her famous band Elsa. It will be presented on May 6th in Porgy",2025-04-29 03:44:29
at,"Straßenkämpfe, Intrigen und ein österreichischer „Tourist“: Die Geschichte der Papstwahl [premium]","Abgeschottet und unbeeinflusst von der Welt, sollen die Kardinäle im Konklave einen neuen Papst wählen. Der Weg zum heutigen Ritual der Papstwahl war steinig.",en,"Street struggles, intrigue and an Austrian ""tourist"": The history of the Pope election [Premium]","Disappeared and unaffected by the world, the cardinals in the conclave should choose a new pope. The path to today's ritual of the pope election was rocky.",2025-04-29 03:43:52
at,Tödliche Messerattacke: Prozess geht weiter,"Nach mehrmonatiger Unterbrechung wird am Dienstag im Landesgericht Ried der Prozess gegen einen 23-Jährigen, der den Vater mit neun Messerstichen getötet haben soll, fortgesetzt. Im November war vertagt worden, da dem Antrag auf einen Lokalaugenschein stattgegeben wurde.",en,Deadly knife attack: process continues,"After several months of interruption, the trial against a 23-year-old who is said to have killed the father with nine knife stings will continue on Tuesday. It was postponed in November because the application for a local inspection was granted.",2025-04-29 03:43:42
at,Übergangszeit birgt Gefahren für Wanderer,Die Bergrettung Vorarlberg mahnt in der Übergangszeit zwischen Winter und Sommer zur Vorsicht. Jedes Jahr werden schlecht ausgerüstete Wanderer von den winterlichen Verhältnissen in den Bergen überrascht – auch es im Tal schon Frühlingswetter gibt.,en,Transitional time harbors dangers for hikers,"The Vorarlberg mountain rescue warns for caution in the transition period between winter and summer. Every year, poorly equipped hikers are surprised by the winter conditions in the mountains - there are also spring weather in the valley.",2025-04-29 03:42:10
at,Kanada: Regierende Liberale gewannen Parlamentswahl,"Es ist noch unklar, ob Premier Carney eine Mehrheitsregierung bilden kann oder mit einer kleineren Partei zusammenarbeiten muss.",en,Canada: Governing Liberals won parliamentary election,It is still unclear whether Premier Carney can form a majority government or has to work with a smaller party.,2025-04-29 03:40:04
at,Europäische Medien von mehreren Seiten unter Druck [premium],"Unabhängige Berichterstattung in der EU wird durch physische Gewalt, unternehmerische Zwänge und staatliche Interventionen bedroht.",en,European media under pressure from several sides [Premium],"Independent reporting in the EU is threatened by physical violence, entrepreneurial constraints and government interventions.",2025-04-29 03:38:01
at,Kommentar - Das Spiel der Spiele,über den direkten Showdown der Admira in Ried.,en,Comment - The game of the games,About the direct showdown of the Admira in Ried.,2025-04-30 04:15:00
