iso_code,title,description,lang_tranlation,title_translated,description_translated,pubDate
se,Zelenskyj: Ryssarna tiger om USA:s förslag,Ukrainas president Volodymyr Zelenskyj konstaterar att Ryssland fortfarande inte har svarat på USA:s propåer för att nå en vapenvila i Ukraina.,en,Zelenskyj: The Russians Tiger on the US proposal,Ukraine President Volodymyr Zelenskyj notes that Russia has still not responded to the US proposals to reach a ceasefire in Ukraine.,2025-03-29 20:04:00
se,Djurgården valde Södertälje före derbyn mot AIK,Seriesegrarna Djurgården valde att möta serietrean Södertälje istället för seriefemman AIK i semifinalen i det hockeyallsvenska slutspelet. Det blev klart sent på lördagskvällen när Djurgårdens tränare Robert Kimby berättade om klubbens beslut.,en,Djurgården chose Södertälje before the derby against AIK,The series winners Djurgården chose to meet the series Trean Södertälje instead of the series fifeman AIK in the semi -finals in the hockeyall Swedish playoffs. It was clearly late on Saturday night when Djurgården's coach Robert Kimby talked about the club's decision.,2025-03-29 21:14:17
se,Här brinner Putins limousin i Moskva,Värd över tre miljoner svenska kronor,en,Here Putin's limousine in Moscow burns,Worth over SEK 3 million,2025-03-29 21:05:49
se,Succé för Jesper Svensson på PGA-touren,Rookie på PGA-touren.Det stoppar inte Jesper Svensson från att göra jättesuccé.Svensken slåss om titeln i Texas efter en makalös avslutning.,en,Success for Jesper Svensson on the PGA Tour,Rookie on the PGA Tour. It doesn't stop Jesper Svensson from doing huge success.,2025-03-29 21:05:42
se,Protester mot Tesla och Musk,"Hundratals demonstrationer mot biltillverkaren Tesla och dess ägare Elon Musk väntas äga rum under lördagen i USA, Kanada och Europa, skriver amerikanska medier. Sedan Elon Musk började som chef för Donald Trumps effektiviseringsdepartement, vars mål är att banta ner statsapparaten, har tusentals människor tvingas bort från sina jobb. Det, i kombination med kontroversiella uttalanden och en uppmärksammad gest från Musk, har lett till omfattande protester mot honom och hans bolag. – Det är olyckligt att Musk har valt att använda sin makt och sina rikedomar till dåliga saker, säger Austin...",en,Protests against tesla and musk,"Hundreds of demonstrations against car manufacturer Tesla and its owner Elon Musk are expected to take place on Saturday in the United States, Canada and Europe, writes American media. Since Elon Musk began as head of Donald Trump's efficiency ministry, whose goal is to lose the state apparatus, thousands of people have been forced away from their jobs. This, in combination with controversial statements and a notable gesture from Musk, has led to extensive protests against him and his company. - It is unfortunate that Musk has chosen to use his power and its wealth for bad things, says Austin ...",2025-03-29 21:05:10
se,Putins limousin går upp i rök,"En lyxbil som uppges tillhöra Vladimir Putin har eldhärjats utanför ryska underrättelsetjänsten FSB:s huvudkontor i Moskva, skriver The Sun.Man utreder om det rör sig om en riktad attack.Bilen ska ha varit värd 3,6 miljoner kronor.",en,Putin's limousine goes up in smoke,"A luxury car that is said to belong to Vladimir Putin has been fire -raised outside the Russian intelligence service FSB's head office in Moscow, writes The Sun.man is investigating whether it is a targeted attack. The car should have been worth SEK 3.6 million.",2025-03-29 21:03:07
se,30-tals villa såld i Billesholm,,en,30's villa sold in Billesholm,,2025-03-29 21:00:00
se,De tvingas lämna ”Let's dance” i kval 3,"Efter två spännande dueller står det klart vilka som tvingas lämna ”Let's dance”.Och ingen av dem blir juryns wildcard. – Jag är så ledsen, säger Ciara Zelmerlöw som är en av dem som inte får fortsätta.",en,They are forced to leave “let's dance” in qualifying 3,"After two exciting duels, it is clear who is forced to leave ""Let's dance"". And none of them will be the jury's wildcard. - I'm so sad, says Ciara Zelmerlöw, who is one of those who must not continue.",2025-03-29 20:55:38
se,Kenttäs svar efter fansens kritik,"Björklöven åkte ut i kvartsfinal. Sedan riktade fansen kritik mot sportchef Per Kenttä, 44. – Jag är lika förbannad själv, säger han efter uttåget.",en,Kenttäs response after the fans' criticism,"Björklöven went out in the quarterfinals. Then the fans criticized sports manager Per Kenttä, 44. - I am just as damned myself, he says after the exit.",2025-03-29 20:55:34
se,Trumps och Stubbs oväntade möte – har spelat golf,"USA:s president Donald Trump hittade en ny golfpartner för dagen.Han gick en runda med finske statsministern Alexander Stubb.De ska också ha enats om ”stärkt partnerskap”, skriver Trump på Truth Social.",en,Trump's and Stubb's unexpected meeting - has played golf,"US President Donald Trump found a new golf partner for the day. He went on a round with Finnish Prime Minister Alexander Stubb. They should also have agreed on ""strengthened partnership,"" Trump writes on Truth Social.",2025-03-29 20:55:32
se,Tacka Trump för att polletten trillat ned,Det gryende samförståndet mellan presidenterna Trump och Putin har utlöst en stark politisk rekyl i Europa. En ny normalitet håller oväntat på att växa fram. Det märks på flera sätt.,en,Thank Trump for the toddling to be down,The dawned consensus between presidents Trump and Putin has triggered a strong political recoil in Europe. A new normality is unexpectedly growing. It is noticeable in several ways.,2025-03-29 20:55:21
se,Explosion i hyreshus i Trollhättan,,en,Explosion in apartment building in Trollhättan,,2025-03-30 23:51:58
se,Misstänkt explosion i Trollhättan,"En misstänkt explosion inträffade i området Hjortmossen i Trollhättan under söndagskvällen, GP.",en,Suspected explosion in Trollhättan,"A suspected explosion occurred in the Hjortmossen area in Trollhättan during Sunday evening, GP.",2025-03-30 23:51:58
se,Barnen försökte döda sin mamma på grund av wi-fi,"Tre tonåringar försökte hugga ihjäl sin mamma med kniv.Orsaken: Hon hade stängt av deras wi-fi, skriver Fox News.",en,The kids tried to kill their mother because of wi-fi,"Three teenagers tried to chop their mother with a knife. The cause: she had turned off their Wi-Fi, writes Fox News.",2025-03-30 23:47:40
se,Tonåring svårt skadad i krock,,en,Teenager severely injured in crash,,2025-03-30 23:36:40
se,Tonåring svårt skadad i krock,En minderårig tonårspojke skadades allvarligt i en bilolycka på riksväg 95 utanför Arvidsjaur under söndagskvällen.,en,Teenager severely injured in crash,An underage teenage boy was seriously injured in a car accident on national highway 95 outside Arvidsjaur on Sunday evening.,2025-03-30 23:36:39
se,Allvarlig bilolycka – tonårspojke svårt skadad,En minderårig tonårspojke skadades allvarligt i en bilolycka på rikväg 95 utanför Arvidsjaur under söndagskvällen.,en,Serious car accident - teenage boy severely injured,An underage teenage boy was seriously injured in a car accident on Rikväg 95 outside Arvidsjaur on Sunday evening.,2025-03-30 23:36:33
se,Brand i radhus – räddningstjänsten hindrade spridning,En brand startade i en innervägg i ett radhus vid Strövelstorp under natten mot måndag. Räddningstjänsten fick kontroll över branden inom en halvtimme efter larmet.,en,Fire in townhouses - the rescue service hindered spread,A fire started in an interior wall in a townhouse at Strövelstorp during the night towards Monday. The rescue service gained control of the fire within half an hour after the alarm.,2025-03-30 23:12:16
se,Gåta för barn förbryllar – ser du vad svaret är?,"Bildgåtan är avsedd för förskolebarn.Men många vuxna har inte en aning om vad lösningen är tänkt att vara, skriver Daily Mail.Testa dig själv – ser du vad det rätta svaret är?",en,Mystery for children confuses - do you see what the answer is?,"Image mystery is intended for preschool children. But many adults have no idea what the solution is supposed to be, writes Daily Mail. Test yourself - do you see what the right answer is?",2025-03-30 22:54:47
se,Källor: Trump till Saudiarabien – första statsbesöket,"USA:s president Donald Trump planerar att resa till Saudiarabien i mitten av maj, uppger två amerikanska källor för Axios. Om presidenten inte planerar in några andra besök innan dess kommer det att bli hans första utlandsresa sedan hon svors in som president. Även under Trumps första mandatperiod var hans första statsbesök i Saudiarabien.",en,Sources: Trump to Saudi Arabia - first state visit,"US President Donald Trump is planning to travel to Saudi Arabia in mid -May, two US sources say. If the president does not plan any other visits before that, it will be his first trip abroad since she swores in as president. Even during Trump's first term of office, his first state visit to Saudi Arabia was.",2025-03-30 22:32:03
se,Brand i radhus – ännu inte under kontroll,"Det brinner i ett radhus vid Strövelstorp. Räddningstjänsten är på plats för att släcka. – Branden är ännu inte under kontroll, men vi har förhoppningar om att få den under kontroll, säger Jonas Hemert, vakthavande befäl.",en,Fire in townhouses - not yet under control,"It burns in a townhouse at Strövelstorp. The rescue service is in place to extinguish. ""The fire is not yet under control, but we have hopes to get it under control,"" says Jonas Hemert, guard officer.",2025-03-30 22:23:56
se,NBA-svensken nära sitt personbästa i vinsten,Pelle Larsson noterades för 15 poäng när Miami van över...,en,NBA-Swede near his personal best in the winnings,Pelle Larsson was listed for 15 points when Miami used to ...,2025-04-01 04:23:34
se,Lyssna: Fyra bilar brann i Höganäs och Helsingborg i natt,"Lyssna på och läs en sammanfattning av de senaste nyheterna, läget i trafiken och väderprognosen för nordvästra Skåne. Oftast med Peter Ferm och Yvonne Johansson. Nytt avsnitt varje vardag vid halvsjutiden på morgonen.",en,Listen: Four cars burned in Höganäs and Helsingborg last night,"Listen to and read a summary of the latest news, the situation in traffic and the weather forecast for northwestern Skåne. Most often with Peter Ferm and Yvonne Johansson. New section every weekday at half -time in the morning.",2025-04-01 04:22:00
se,Varning för rysk våroffensiv: ”Försöker trycka på”,,en,"Warning for Russian spring offensive: ""Trying to press""",,2025-04-01 04:21:06
se,Astra Zeneca-kandidat sänkte kolestorol i fas 2b-studie,Astra Zenecas kandidat AZD0780 visade statistiskt säkerställd kolesterolreduktion jämfört med placeo i fas 2b-studien Pursuit.,en,Astra Zeneca candidate lowered cholestorol in phase 2b study,Astra Zeneca's candidate AZD0780 showed statistically secured cholesterol reduction compared to Placeo in the Phase 2B study Pursuit.,2025-04-01 04:20:56
se,Stor utmaning när elevantalet sjunker,,en,Great challenge when the number of pupils sinks,,2025-04-01 04:20:00
se,Kinas industri-PMI ökade för sjätte månaden i rad,"Kinas inköpschefsindex för industrin steg till 51,2 i mars jämfört med 50,8 i februari. Det framgår av det inköpschefsindex för industrin som sammanställs av Caixin Insight och S&P Global.",en,China's industrial PMI increased for the sixth month in a row,China's purchasing manager index for the industry rose to 51.2 in March compared to 50.8 in February. This is evident from the purchasing manager index for the industry compiled by Caixin Insight and S,2025-04-01 04:17:26
se,Därför klippte TV4 bort Robban från finalen av Farmen 2025,TV4 valde att klippa bort Robert Nilsson från finalen av Farmen 2025.,en,"Therefore, TV4 cut Robban from the final of Farmen in 2025",TV4 chose to cut Robert Nilsson from the final of Farmen 2025.,2025-04-01 04:16:26
se,Hör hela samtalet med dementa kvinnan,PLUS Här är hela samtalet mellan Postkodlotteriets säljare och en dement äldre dam.,en,Hear the entire conversation with the demented woman,Plus here is the entire conversation between the Postcode Lottery's seller and a demented older lady.,2025-04-01 04:16:22
se,RBA lämnar styrräntan oförändrad,"Australiens centralbank, RBA, lämnade på tisdagen sin styrränta oförändrad på 4,10 procent. Enligt Trading Economics konsensusprognos väntade analytiker att räntan skulle lämnas oförändrad.",en,RBA leaves the policy rate unchanged,"Australia's central bank, RBA, on Tuesday left its policy rate unchanged at 4.10 percent. According to Trading Economics consensus prognosis, analysts expected the interest rate to be left unchanged.",2025-04-01 04:16:02
se,Svag utveckling i basindustrin – åtgärder krävs för att vända trenden,"Svensk ekonomi befinner sig i ett osäkert läge. Konjunkturen är svag samtidigt som basindustrins produktion faller, skriver Kerstin Hallsten...",en,Weak development in the basic industry - Actions are required to reverse the trend,"The Swedish economy is in an uncertain position. The business cycle is weak at the same time as the base industry's production falls, writes Kerstin Hallsten ...",2025-04-01 04:15:00
se,Recyclade romaner – en hållbar teater?,På Stockholms teatrar spelas just nu en mängd pjäser som bygger på skön­litteratur. Vad händer med scenkonsten när den mest ägnar sig åt att återvinna romaner?,en,Recycled novels - a sustainable theater?,"At Stockholm's theaters, a number of pieces are currently being played on fiction. What happens to the performing arts when it is most engaged in recycling novels?",2025-04-01 20:00:00
se,Misstänkt farligt föremål i Malmö,"Ett misstänkt farligt föremål har hittats i ett fordon i Malmö, skriver polisen på sin hemsida.",en,Suspected dangerous item in Malmö,"A suspected dangerous object has been found in a vehicle in Malmö, police write on their website.",2025-04-01 19:56:21
se,Säsongens sjätte ligamål för Elanga,Målskytt i landslagets 5–1-seger mot Nordirland nyligen.Och Anthony Elangas målform håller i sig. I kvällens Premier League-match mot Manchester United prickade han in 1–0-målet.,en,Season's sixth league goals for Elanga,Goal scorer in the national team's 5-1 victory against Northern Ireland recently. And Anthony Elanga's target form persists. In tonight's Premier League match against Manchester United he dotted the 1-0 goal.,2025-04-01 19:55:35
se,Misstänkt farligt föremål i Malmö,Hittades i bil,en,Suspected dangerous item in Malmö,Found by car,2025-04-01 19:54:53
se,Misstänkt farligt föremål i bil i Malmö,"Nationella bombskyddet ska undersöka ett misstänkt föremål som påträffats på Stockholmsvägen i Malmö. Föremålet upptäcktes när en bil stoppades vid en rutinkontroll. – Vi har under kvällen kontrollerat en bil med flera personer. I bilen hittar vi även ett föremål som gör att patrullen väljer att spärra av. Bombskyddet ska komma till platsen, säger Patric Fors, presstalesperson. Fyra personer ska förhöras och brottsrubriceringen är inledningsvis förberedelse till allmänfarlig ödeläggelse enligt polisens notis.",en,Suspected dangerous item in car in Malmö,"The national bomb protection will investigate a suspected object found on Stockholm Road in Malmö. The item was discovered when a car was stopped during a routine check. - We checked a car with several people during the evening. In the car we also find an object that makes the patrol choose to block off. The bomb protection will come to the scene, says Patric Fors, press spokesman. Four people will be interrogated and the crime classification is initially preparation for general destruction according to the police's note.",2025-04-01 19:54:35
se,Misstänkt farligt föremål i Malmö,"Nationella bombskyddet ska undersöka ett misstänkt föremål som påträffats på Stockholmsvägen i Malmö, skriver polisen på sin hemsida. En bit av vägen är avstängd. Föremålet upptäcktes i en bil vid en rutinkontroll.",en,Suspected dangerous item in Malmö,"The national bomb protection will investigate a suspected object found on Stockholm Road in Malmö, the police write on its website. A piece of the road is turned off. The item was discovered in a car at a routine check.",2025-04-01 19:54:35
se,Waltz i nytt blåsväder,"USA:s nationella säkerhetsrådgivare Michael Waltz har använt sitt privata Gmail-konto i regeringsarbetet, avslöjar Washington Post. Flera andra medlemmar i Trumps nationella säkerhetsråd har också kommunicerat internt via tjänsten.Avslöjandet kommer bara en vecka efter omtalade ”Signalgate”.",en,Waltz in new windy weather,"US national security adviser Michael Waltz has used his private Gmail account in government work, the Washington Post reveals. Several other members of Trump's National Security Council have also communicated internally through the service. The disclosure comes just a week after mentioned ""signal gate"".",2025-04-01 19:54:22
se,Simon Strand reagerar på drömmålet – i mexikansk tv,,en,Simon Strand reacts to the dream goal - in Mexican TV,,2025-04-01 19:51:25
se,Karin Eriksson: Handelskriget har blivit Trumps svagaste punkt,WASHINGTON. Donald Trump hävdar att befrielsens dag är kommen. Men många amerikaner fruktar nya bördor för hushållen. Därför har handelskriget blivit den nygamla presidentens svagaste punkt.,en,Karin Eriksson: The trade war has become Trump's weakest point,"Washington. Donald Trump claims that the day of liberation has come. But many Americans fear new burdens for households. Therefore, the trade war has become the new president's weakest point.",2025-04-01 19:51:02
se,Vita huset: Tullar ska träda i kraft omedelbart på onsdagen,Donald Trump väntas offentliggöra nya tullar under en pressträff på onsdagen. Enligt Vita husets talesperson kommer tullarna att träda i kraft omedelbart. Tidigare på dagen utlovade Ursula von der Leyen att EU står redo att svara på det upptrappade handelskriget.,en,White House: Customs shall take effect immediately on Wednesday,"Donald Trump is expected to publish new tariffs during a press conference on Wednesday. According to the White House spokesperson, the customs will come into force immediately. Earlier in the day, Ursula von der Leyen promised that the EU is ready to respond to the escalated trade war.",2025-04-01 19:50:33
se,USA: Biltullar på 25 procent införs imorgon,,en,USA: car tolls of 25 percent are introduced tomorrow,,2025-04-02 18:33:56
se,Parisa Liljestrands ord om Dermot Clemenger: ”Han var ju snabb”,"Expressen fann Dermot Clemenger på ett hotell i London – och insatsen hyllas nu av kulturministern.– Det är väl fint att journalistiken lyckas pinpointa honom och ställa honom mot väggen, säger Parisa Liljestrand (M) i ”Fördomspodden”.",en,"Parisa Liljestrand's words about Dermot Clemenger: ""He was fast""","Expressen found Dermot Clemenger at a hotel in London - and the effort is now praised by the Minister of Culture. “It is nice that journalism manages to Pinpointa him and put him against the wall,” says Parisa Liljestrand (M) in the ""prejudice pod"".",2025-04-02 18:30:45
se,Barn föll från fönster – allvarligt skadat,,en,Children fell from windows - seriously damaged,,2025-04-02 18:24:57
se,Morgan Johanssons känga: ”Kristersson signalerar att han är konflikträdd”,Ännu har inte Ulf Kristersson lyft gripandet av Joakim Medin direkt med Turkiets president Erdogan.,en,"Morgan Johansson's boot: ""Kristersson signals that he is conflicted""",Ulf Kristersson has not yet lifted the arrest of Joakim Medin directly with Turkey's President Erdogan.,2025-04-02 18:24:46
se,Albin Carlson blodig mot Djurgården,Blodiga bilder på Albin Carlson.Södertäljebacken fick lämna isen på grund av en Djurgårdsklubba i ansiktet.,en,Albin Carlson Bloody against Djurgården,Bloody pictures of Albin Carlson.södertäljebacken had to leave the ice because of an animal club on the face.,2025-04-02 18:21:50
se,FN-planets mardröm – landningshjul trasigt,Tvingas till dramatisk nödlandning,en,UN plane nightmare-landing wheels broken,Forced to dramatic emergency landing,2025-04-02 18:21:12
se,Mardrömslandningen – landningshjulen sönder,FN-planets dramatiska nödlandning i Mogadishu,en,Nightmare Landing - the landing wheels broken,UN Planet's dramatic emergency landing in Mogadishu,2025-04-02 18:19:18
se,Så drivs pojkarna till pedofili och knivdåd,"Är 764 en pedofilring, terrorgrupp eller urspårad digital fritidsgård för asociala tonårskillar? SVT:s ”Uppdrag granskning” kartlägger rörelsens fäste i Sverige – men en drivkraft hamnar i skymundan.",en,So the boys are driven to pedophilia and knife deed,"Is 764 a pedophile ring, terrorist group or derailed digital leisure farm for asocial teenage boys? SVT's ""Assignment Review"" maps the movement's attachment in Sweden - but a driving force ends up in the cloud.",2025-04-02 18:17:51
se,Samarbetet kommer framställas som succé,"Elon Musk kan vara på väg bort från Donald Trumps sida, men båda lär vilja framställa samarbetet som en succé. Framöver kan Musk nyttjas – eller åsidosättas – i den mängd som anses gynna Trump mest.",en,The collaboration will be portrayed as a success,"Elon Musk may be on his way away from Donald Trump's side, but both will want to portray the collaboration as a success. In the future, Musk can be used - or overridden - in the amount that is considered to benefit Trump the most.",2025-04-02 18:16:46
se,”Inte uteslutet att vi kommer svartlista”,"Folksam meddelar att man sålt alla sina aktier i elbilsjätten Tesla. Nu överväger ytterligare en pensionsjätte att göra samma sak, andra avvaktar men följer utvecklingen.",en,"""Not excluded that we are coming blacklist""","Folksam announces that all their shares were sold in the electric car giant Tesla. Now another pension giant is considering doing the same thing, others are awaiting but follows the development.",2025-04-02 18:16:36
se,Stjärnan: Jag har haft samma par kalsonger i åtta år,"Manchester Citys målvakt Ederson, 31, anslöt till klubben för åtta år sedan.",en,Star: I have had the same pair of underwear for eight years,"Manchester City goalkeeper Ederson, 31, joined the club eight years ago.",2025-04-02 22:01:32
se,Kaosscener: Mourinho nöp tränarrivalen i näsan,José Mourinho nöp tränarrivalen Okan Buruk i näsan efter det att portugisens Fenerbache förlorat Istanbulderbyt i fotboll hemma mot Galatasaray med 1–2.,en,KAASSCENERS: Mourinho named the coach rival in the nose,José Mourinho snapped the coach rival Okan Buruk in his nose after the Portuguese's Fenerbache lost Istanbulderbyt in football at home against Galatasaray by 1-2.,2025-04-02 22:00:33
se,Kristersson om Trumps tullar: Sverige förberett,"Sverige är väl förberett, säger statsminister Ulf Kristersson (M) sedan USA:s president Donald Trump gett besked om bland annat 20-procentiga tullar på varor från EU.",en,Kristersson about Trump's customs: Sweden prepared,"Sweden is well prepared, says Prime Minister Ulf Kristersson (M) since US President Donald Trump announced, among other things, 20 percent customs duties on goods from the EU.",2025-04-02 21:58:57
se,Dousa rasar mot Trumps tullar,"Sveriges utrikeshandelsminister Benjamin Dousa (M) reagerade starkt på Donald Trumps besked under kvällen. Presidenten inför ”strafftullar” till hela världen, 20 procent till EU. – USA överger nu det handelssystem som de varit med och byggt upp. Som lett till enorma mänskliga framsteg, skriver han till Expressen.",en,Dousa raging against Trump's customs,"Swedish Foreign Trade Minister Benjamin Dousa (M) reacted strongly to Donald Trump's message during the evening. The president introduces ""penalties"" to the whole world, 20 percent to the EU. - The United States is now abandoning the trading system they have been involved in and built up. Which has led to huge human progress, he writes to Expressen.",2025-04-02 21:52:22
se,Expert: Osäkerheten kommer att kvarstå,"President Donald Trumps tullar mot omvärlden blev högre än vad som hade förväntats, säger två experter som TT talat med. – Jag tror det blev lite värre än vad marknaden hade räknat med, säger Mattias Persson, chefsekonom vid Swedbank.",en,Expert: Uncertainty will remain,"President Donald Trump's tariffs against the outside world were higher than expected, says two experts that TT spoke to. - I think it got a little worse than the market had expected, says Mattias Persson, chief economist at Swedbank.",2025-04-02 21:47:34
se,Lista: USA:s nya tullar mot omvärlden,USA inför nya tullar mot omvärlden – däribland 20 procent mot EU och 34 procent mot Kina. Här är en rad av länderna som drabbas.,en,List: US new tariffs against the outside world,The United States introduces new customs against the outside world - including 20 percent against the EU and 34 percent against China. Here are a number of countries that are affected.,2025-04-02 21:44:52
