iso_code,title,description,lang_tranlation,title_translated,description_translated,pubDate
fi,Viekö Trumpin päätös työt suomalaiselta autotehtaalta? Näin kommentoi Uudenkaupungin tehdas,"”Työt Uudenkaupungin tehtaalla jatkuvat tehtyjen suunnitelmien mukaisesti”, Valmet Automotive kertoo. Yhdysvaltain presidentin Donald Trumpin huhtikuuna alkuun väläyttämillä tuontiautojen 25 prosentin tariffikorotuksilla ei ole välitöntä vaikutusta Uudenkaupungin autotehtaan tuotantoon, Valmet Automotive kertoo. – Toistaiseksi työt tehtaalla jatkuvat tehtyjen suunnitelmien mukaisesti. On silti vaikea arvioida minkälaisia vaikutuksia tuontitulleilla on autojen kysyntään, tiedotuspäällikkö Mikael Mäki sanoo.",en,Does Trump's decision work from a Finnish car factory? This is how the New Town factory commented,"“Work at the Uusikaupunki plant will continue according to the plans made,” says Valmet Automotive. US President Donald Trump's April at the beginning, the 25 % tariff increases for imported vehicles have no immediate impact on the production of the Uusikaupunki car factory, says Valmet Automotive. - So far, work at the factory will continue according to the plans made. Still, it is difficult to assess the impact of import duties on the demand for cars, says Mikael Mäki, Information Manager.",2025-03-29 20:18:50
fi,Lakkouhka Kanarialla – Yksi vilkkaimmista lomakausista vaarassa,"Ammattiliitot vaativat 7,75 prosentin palkankorotusta tai kertaluonteista maksua. Kanariansaarten majoitus- ja ravitsemisalan työntekijät saattavat mennä lakkoon pääsiäislomien aikaan, kertoo Canarian Weekly. Lakkouhan syynä on Espanjan kahden suurimman ammattiliiton Comisiones Obrerasin (CCOO) ja Unión General de Trabajadoresin (UGT) ehdotus kertaluonteisesta maksusta tai 7,75 prosentin palkankorotuksesta.",en,Strike threat with Canaria - one of the busiest holiday season in danger,"Trade unions require a salary increase of 7.75 % or a one -off payment. The accommodation and hospitality workers in the Canary Islands may go on strike during Easter holidays, says Canarian Weekly. The cause of the strike is the proposal of a one -time payment or a 7.75 % salary increase by the two largest of Spain's two largest trade unions, CCOMORAS (CCOO) and UNIón General de Trabajadores (UGT).",2025-03-29 20:15:02
fi,"Myanmarin maanjäristyksessä kuolleita yli 1 600, uhrimäärän uskottiin yhä nousevan",Myanmarin perjantaisen maanjäristyksen kuolonuhrien määrä kasvoi lauantaina yli 1 600:aan. Maata hallitseva sotilasjuntta kertoi tilanteesta lauantaina alkuillasta Suomen aikaa.,en,"More than 1,600 those who died in the Myanmar earthquake, the number of victims was still believed to rise","On Saturday, the number of deaths on Friday's earthquake in Myanmar increased to over 1,600. The dominant military junta reported the situation on Saturday evening Finnish time.",2025-03-29 20:14:26
fi,"Windowsista tulee pian tikittävä aikapommi, jos et päivitä","Windows-tekijät haluavat toden teolla saada ihmiset siirtymään uusimpaan versioon. Tilaston perusteella työsarkaa riittää vielä. Uusin Windows-versio on Windows 11. Windows 10, tuo aikoinaan ”viimeiseksi Windowsiksi” kuvailtu käyttöjärjestelmä, on virallisesti tulossa tiensä päähän lokakuussa 2025. Microsoft haluaisi kaikkien siirtyvän uusimpaan Windowsiin, mutta kaikki eivät toivetta noudata. Nyt Forbes mainitsee Microsoftin uusimmista, jokseenkin kylmäävistä varoituksista. Redmondin jättiläinen on nimittäin julkaissut uuden artikkelin, jossa kerrotaan riskeistä, joita tuen ulkopuolelle tipahtavan käyttöjärjestelmän käytöstä seuraa.",en,Windows will soon become a ticking time bomb if you don't update,"Windows factors really want to get people to move to the latest version. Based on the statistics, there is still enough work. The latest version of Windows is Windows 11. Windows 10, once brings the ""last Windows"" operating system, is officially coming to an end in October 2025. Microsoft would like everyone to move to the latest Windows, but not everyone will follow. Now Forbes mentions Microsoft's latest, somewhat cold warnings. Namely, the Redmond giant has published a new article about the risks that follow the use of an operating system that is exhausted.",2025-03-29 20:09:09
fi,"Vuoden sketsihahmo jakoi somessa mielipiteet – "" Miksi en yllättynyt lainkaan""",Putouksen kausi huipentui lauantaina sketsihahmokilpailun finaaliin.,en,"The sketch character of the year shared opinions in Somme - ""Why I wasn't surprised at all""",The Fall season culminated on Saturday in the finals of the sketch character competition.,2025-03-29 20:07:00
fi,Nainen jäi hotellin baarissa miehen alle – Löi kovaäänisesti päänsä,Kolmekymppinen helsinkiläisnainen jäi lattialle tajuttomana makaamaan. Riita kuhmolaisessa kapakassa johti täysin ulkopuolisen naisen saamaan aivovammaan. Tajunsa menettänyt nainen kiidätettiin paikalliseen keskussairaalaan ja sieltä edelleen yliopistolliseen sairaalaan tehohoitoon.,en,The woman stayed under the man in the hotel bar - struck her head loudly,A Helsinki woman in her thirties stayed unconscious on the floor. The dispute in the Kuhmo tavern led to a brain injury to an external woman. The woman who had lost her consciousness was rushed to a local central hospital and from there to university hospital for intensive care.,2025-03-29 20:05:04
fi,Yhdysvallat | Satanistit ja ”katolisen uskon Navy Seal -sotilaat” ottivat yhteen Kansasissa – Neljä pidätettiin,Perjantaina Kansasin kongressitalolla järjestetty seremonia päätyi käsirysyksi satanistien johtajan ja kristillisten vastamielenosoittajien välillä.,en,"United States Satanists and the ""Catholic Faith Navy Seal soldiers"" took together in Kansas -four were arrested","On Friday, the ceremony at the Kansas Congress House ended up as a handheld between Satanist leader and Christian protesters.",2025-03-29 20:03:00
fi,Hamas godkänner förslag om fortsatt vapenvila i Gaza,Israel säger sig ha gett eget motförslag.,en,Hamas Godkäner förslag om fortsatt vapenvila i gaza,Israel Säger sig ha gett eget motförslag.,2025-03-29 20:02:50
fi,Freestyle | Anni Kärävä voitti MM-pronssia,Anni Kärävä saavutti uransa ensimmäisen MM-mitalin.,en,Freestyle Anni Kärävä won the World Cup bronze,Anni Kärävä achieved the first World Championship medal of her career.,2025-03-29 20:02:00
fi,Nato | Ilmavoimat osallistuu Nato-harjoitukseen Hollannissa,Harjoitukseen osallistuu kaikkiaan viisitoista Nato-maata ja yli 90 lentokonetta.,en,NATO | Air Force participates in NATO exercise in the Netherlands,A total of fifteen NATO countries and over 90 aircraft participate in the exercise.,2025-03-30 23:27:00
fi,Ilmavoimat osallistuu Nato-harjoitukseen Hollannissa,Harjoitukseen osallistuu kaikkiaan viisitoista Nato-maata ja yli 90 lentokonetta.,en,Air Force participates in NATO exercise in the Netherlands,A total of fifteen NATO countries and over 90 aircraft participate in the exercise.,2025-03-30 23:24:00
fi,Helheten talar emot tunnelmynning i parken,,en,Helheten Talar Emot Moodynning I PARKEN,,2025-03-30 23:05:00
fi,Vi konkurrerar framför allt med Stockholm,,en,VI Konkurrerar Framför Allt Med Stockholm,,2025-03-30 23:03:00
fi,SFP är den aktiva aktören för svenska ärenden i Vanda,,en,SFP är den Aktiva Aktören För Svenska Ärenden I Vanda,,2025-03-30 23:03:00
fi,Friluftsbad ska användas som vinterbadplatser,,en,Friluftsbad Ska Användas som vinbadplatser,,2025-03-30 23:02:00
fi,Flerkanalfinansieringen hämmar offentliga vården,,en,Flerkanalfinaieringen HAPPENTLIGA vården,,2025-03-30 23:02:00
fi,Vardagstryggheten för seniorer måste stärkas,,en,Vardagstryggheten för seniorer måste staress,,2025-03-30 23:02:00
fi,I kommunalvalet påverkar vi ungas mentala hälsa,,en,I kommunalvals påverkar vi ungas mentala Hälsa,,2025-03-30 23:02:00
fi,"Varför skolstig på engelska, SFP?",,en,"Varför Skolstig på Engelska, SFP?",,2025-03-30 23:01:00
fi,Tekoäly lipsautti lasten­tapahtuman mainokseen sopimatonta sisältöä,Tietyt sanat tuottivat sivustoilla päänvaivaa.,en,Artificial intelligence slipped in inappropriate content for a children's event,Certain words produced headaches on the sites.,2025-04-01 04:25:00
fi,"Stubbs sju timmar med Trump – hur viktigt var mötet, Ville Niinistö?",Sedan sitt möte med Alexander Stubb i lördags verkar Donald Trump sjunga på en ny melodi när det gäller Ryssland och Ukraina. Vad blev egentligen sagt mellan de två männen?,en,"Stubbs sju Timmar med Trump - Hur Viktigt var mett, Ville Niinistö?",Sedan Sitt Med Alexander Stubb i Lördags Verkar Donald Trump Sjuna på en nyodi när det gäller ryssland och Ukraine. Vad Blev Egentligen Sagt Mellan de två Männen?,2025-04-01 04:18:05
fi,Joka neljännellä suomalaisella ei ole lainkaan säästöjä,"Danske Bank suosittelee, että jokaisen olisi hyvä pyrkiä säästämään itselleen vähintään neljän kuukauden menoja vastaava puskuri.Artikkeli Joka neljännellä suomalaisella ei ole lainkaan säästöjä julkaistiin ensimmäisen kerran Verkkouutiset.",en,Every fourth Finn has no savings at all,Danske Bank recommends that everyone should try to save a buffer equivalent to at least four months of expenditure. Every four Finns have no savings for the first time.,2025-04-01 04:16:57
fi,Sensuurin murtajat pitävät internetin avoimena,"Tor-selain ei ole ainoa tapa kiertää sensuuria. Kun hallitukset ympäri maailmaa kiristävät verkkosensuuria, kehittäjät ja aktivistit rakentavat uusia tapoja pitää viestintä vapaana.",en,Censorship fractures keep the Internet open,"The Tor browser is not the only way to circulate censorship. As governments around the world tighten online censorship, developers and activists build new ways to keep communication free.",2025-04-01 04:16:00
fi,Nato-diplomaatti Yhdysvaltojen toimista: ”Vaarallista peliä”,"Diplomaattilähteiden mukaan Natoa haastetaan nyt sekä sisältä, että ulkoa. Yhdysvalloilta halutaan loppuviikon Nato-kokouksessa vastauksia moniin avoimiin kysymyksiin.",en,NATO Diplomat about the US Actions: “Dangerous Game”,"According to diplomatic sources, NATO is now challenged both inside and out. The United States wants answers to many open questions at the NATO meeting for the rest of the week.",2025-04-01 04:15:00
fi,Suora lähetys kello 19: IS:n suuri vaali­tentti sähköistää kisan – kaikki puheen­johtajat lauteilla,Kunta- ja aluevaalien ennakkoäänestys alkaa keskiviikkona.,en,Direct broadcast at 7 pm: IS's large election exam will electrify the race - all chairmen on the rafts,Advance voting for municipal and regional elections will begin on Wednesday.,2025-04-01 04:12:00
fi,Venäläisten lennokkikauhu kasvaa: Ukraina iskee etulinjassa jo 40 kilometrin syvyyteen,Moskovan mediassakin puhutaan Ukrainan lennokkien suorituskyvystä.Artikkeli Venäläisten lennokkikauhu kasvaa: Ukraina iskee etulinjassa jo 40 kilometrin syvyyteen julkaistiin ensimmäisen kerran Verkkouutiset.,en,Russian airplane horror is growing: Ukraine strikes the front line as early as 40 kilometers,"Moscow's media also talks about the performance of Ukrainian airplane. Article Russian airplane horror is growing: Ukraine strikes the front line for the first time, for the first time, online news was released.",2025-04-01 04:10:37
fi,Näin Tommi Niemelä reagoi kysymykseen Pelicansin jättifiaskosta,Ilveksellä on nyt tarjolla neljä ottelupalloa välieriin etenemiseen. Päävalmentaja Tommi Niemelä ei ole täysin tyytyväinen.,en,This is how Tommi Niemelä reacted to the question of the Pelicans giant fiascus,Ilves now offers four match balls to advance to the semi -finals. Head coach Tommi Niemelä is not completely satisfied.,2025-04-01 04:10:00
fi,Tuliterästä Teslasta jäi paha näky vain 300 kilometrin jälkeen,Vähän ajetusta Tesla Model Y:stä jäi lohduton näky.,en,The tesla was left with a bad sight after only 300 kilometers,The little -driven Tesla Model Y was left with a hearty sight.,2025-04-01 04:09:00
fi,Viimeinen kivihiilivoimala Suomessa sammuu tänään,Helen Oy sulkee Salmisaaren kivihiilivoimalaitoksen tänään.Artikkeli Viimeinen kivihiilivoimala Suomessa sammuu tänään julkaistiin ensimmäisen kerran Verkkouutiset.,en,The last coal power plant in Finland will go out today,"Helen Oy closes the Salmisaari coal power plant today. The article last coal power in Finland goes out today Today, online news was released.",2025-04-01 04:08:27
fi,Suomeen jysähti muhkea Eurojackpot-voitto,Suomalaista nettipelaajaa lykästi tiistain arvonnassa.,en,There was a plush Eurojackpot win in Finland,Finnish online player postponed in Tuesday's draw.,2025-04-01 20:06:00
fi,Venäjältä yllätystarjous Elon Muskille,"Vladimir Putinia edustava lähettiläs kehuu Muskia ”suureksi visionääriksi” ja ehdottaa suoraa keskustelua yhteistyöstä. Venäjä on ilmoittanut olevansa kiinnostunut toimittamaan pienen ydinvoimalan Elon Muskin johtamalle Mars-lennolle. Ehdotuksen on tehnyt presidentti Vladimir Putinin kansainvälisestä yhteistyöstä vastaava lähettiläs Kirill Dmitrijev. Asiasta kertoo uutistoimisto Reuters, joka siteeraa Venäjän valtiollista RIA-uutistoimistoa. – Uskomme, että Venäjällä on paljon annettavaa Mars-mission toteuttamiseen, koska meillä on ydinteknologiaa, jota mielestäni voitaisiin soveltaa, Dimitrijev sanoi.",en,Russia's surprise offer to Elon Musk,"The ambassador representing Vladimir Putin praises Musk as a ""great visionary"" and proposes a direct debate on cooperation. Russia has announced that it is interested in supplying a small nuclear power plant to Elon Musk-led Mars flight. The proposal was made by Kirill Dmitrijev, the ambassador for President Vladimir Putin's international cooperation. Reuters, a news agency, tells about the Russian state RIA news agency. ""We believe that Russia has a lot to give to the implementation of the Mars mission because we have a nuclear technology that I think could be applied,"" Dimitrijev said.",2025-04-01 20:05:10
fi,HS: Talousvaikuttaja Tom von Weymarn on kuollut,,en,HS: Financial influencer Tom von Weymarn is dead,,2025-04-01 20:01:51
fi,Suomalaismies katosi Utahissa – ei ole nähty kahteen viikkoon,Poliisi pyytää apua miehen löytämiseksi.,en,Finnish man disappeared in Utah - not seen for two weeks,Police are asking for help to find a man.,2025-04-01 20:00:00
fi,Finnairin kone teki yllättävän käännöksen,Matkustajille etsittiin uudet reititykset.,en,Finnair's machine made a surprising turn,New routes were sought for passengers.,2025-04-01 19:59:00
fi,"Paige, 32, sai niskaansa rajuja seksisyytöksiä – ”Elämäni karmein hetki”",Paige Spiranac golfasi Dubaissa ensimmäistä kertaa ammattilaisena.,en,"Paige, 32, got his neck with the violent sexiness - ""The harshest moment of my life""",Paige Spiranac golfing in Dubai for the first time as a professional.,2025-04-01 19:58:00
fi,Suosittu turistikylpylä evakuoitiin Islannissa,"”Varoitus: Purkaus on alkanut”, tiedotti Islannin meteorologinen virasto tiistaina.",en,A popular tourist spa was evacuated in Iceland,"""Warning: The eruption has begun,"" the Icelandic meteorological agency announced on Tuesday.",2025-04-01 19:54:00
fi,Suomalaismies katosi Utahissa,"Suomalaismiestä ei ole nähty kahteen viikkoon sen jälkeen, kun hän saapui Salt Lake Cityn kansainväliselle lentoasemalle 5. maaliskuuta. Suomalaismies on kadonnut Utahissa, tiedottaa Duchesnen piirikunnan seriffin toimisto. Asiasta uutisoi Foxin paikalliskanava.",en,Finnish man disappeared in Utah,"The Finnish man has not been seen for two weeks since he arrived at Salt Lake City International Airport on March 5. A Finnish man has disappeared in Utah, says the office of the Duchehesne County Sheriff. Fox's local channel reported.",2025-04-01 19:48:03
fi,Tässä on venäläinen eläke – ”En edes halua yrittää elää sillä”,"Eläke ei houkuttele Irina Rodninaa. Taitoluistelulegenda Irina Rodnina, 75, kertoo Sport24-sivuston haastattelussa, ettei voisi kuvitellakaan nojaavansa Venäjällä pelkkään eläkkeeseen. Kolminkertaiselta olympiavoittajalta kysyttiin, mitä mieltä hän on 20 000 ruplan eläkkeestä. Summa vastaa 218 euroa.",en,"Here is a Russian pension - ""I don't even want to try to live with it""","The pension does not attract Irina Rodna. Figure skating legend Irina Rodnina, 75, says in an interview with Sport24 that you could not imagine leaning on a pension in Russia alone. A triple Olympic winner was asked what he thinks about 20,000 rubles. The amount corresponds to € 218.",2025-04-01 19:41:15
fi,X-Factor-tähti on edelleen kateissa,"X Factor -tähti ja rugbypelaaja Levi Davis katosi vuoden 2022 lokakuussa. Julkkis-X Factoriin vuonna 2019 osallistunutta Levi Davisia ei ole vieläkään löydetty. Rugbyn pelaaja Davis katosi 29. lokakuuta 2022 Barcelonassa. Davisin uskotaan lähteneen Barcelonan keskustassa sijaitsevasta pubista mukanaan ainoastaan pieni musta reppu. Davisin läheinen ystävä kertoi tuolloin tämän sanoneen, että menee tapaamaan ystäviään.",en,X-Factor star is still missing,"X Factor star and rugby player Levi Davis disappeared in October 2022. Levi Davisis, who participated in the 2019 celebrity-X Factor, has still not been found. Rugby player Davis disappeared on October 29, 2022 in Barcelona. Davis is believed to have left the pub in the center of Barcelona with only a small black backpack. A close friend of Davis said at the time he said he would go to meet his friends.",2025-04-01 19:39:21
fi,Alue- ja kuntavaalien ennakkoäänestys alkoi maltillisesti,"Kuntavaaleissa valitaan valtuutetut kuntien valtuustoihin, jotka päättävät kunnan toiminnasta ja taloudesta. Aluevaaleissa valitaan valtuutetut aluevaltuustoihin, jotka vastaavat hyvinvointialueiden sosiaali- ja terveyspalveluiden sekä pelastustoimen järjestämisestä. https://vaalit.fi/alue-ja-kuntavaalit",en,Advance voting for regional and municipal elections began moderately,"In the municipal elections, delegates are selected for municipal councils that decide on the activities and finances of the municipality. In the regional elections, delegates are selected for regional councils, which are responsible for the organization of social and health services in the welfare areas and the rescue service. https://vaalit.fi/thela-ja-",2025-04-02 18:34:04
fi,Olli Rehniltä vankka näkemys Trumpin tulleihin Politicossa: Euroopan pitäisi vastata samalla mitalla,Suomen Pankin pääjohtajan mielestä ilmassa on nyt inflaatiota kiihdyttäviä sekä hillitseviä riskejä.,en,Olli Rehn has a solid view of Trump's duties in Politico: Europe should respond with the same measure,"According to the CEO of the Bank of Finland, there are now inflation risks in the air.",2025-04-02 18:34:00
fi,Tylerin kolmen vuoden työ teki hänestä yllättäen miljonäärin: ”Rehellisesti sanottuna...”,Yllättävä pikkupeli teki omistajastaan rikkaan viikossa.,en,"Tyler's three -year work suddenly made him a millionaire: ""Honest ...""",A surprising little game made its owner rich in a week.,2025-04-02 18:33:00
fi,Jokereilta viiltävä kuitti HIFK:lle,"Jokerit julkaisi lyhyen päivityksen HIFK:n kauden päättymisen jälkeen. Jokerit otti ilon irti, kun paikallisvastus HIFK:n kausi päättyi keskiviikkona. Helsingin IFK hävisi SaiPalle neljännessä puolivälierässä maalein 2–6, mikä tarkoitti, että Raimo Helmisen suojatit etenivät SM-liigan välieriin tylysti voitoin 4–0.",en,A receipt of a Joker for HIFK,"The Jokers released a brief update after the end of the HIFK season. The Jokers took off the joy when the local HIFK season ended on Wednesday. IFK in Helsinki lost to SaiPa in the fourth quarter-finals with a score of 2-6, which meant that Raimo Helminen's protectors advanced to the semi-finals of the SM league with a 4-0 win.",2025-04-02 18:32:35
fi,Koripallo | Lauri Markkasen kausi päättyi tylysti,Lauri Markkasen kausi on ollut hankala.,en,Basketball | Lauri Markkanen's season ended with a bluntly,Lauri Markkanen's season has been difficult.,2025-04-02 18:30:00
fi,"Kiitos ja hyvästi, HIFK 2024–2025: Ville Peltosen jatkon kohdalla organisaatio joutuu tekemään arvovalintoja",Ennakkoon viime kautta heikommalla kokoonpanolla tähän kauteen lähtenyt HIFK ehti syksyllä nostaa odotuksia. Mutta lopulta vain pettääkseen ne kevään pudotuspeleissä – jälleen kerran.,en,"Thank you and goodbye, HIFK 2024-2025: For Ville Peltonen's follow -up, the organization will have to make value choices","In the fall, HIFK, who had left this season in the fall, raised expectations in the fall. But in the end, just to betray them in the spring playoffs - once again.",2025-04-02 18:29:42
fi,"Helena Koivu julkaisi kuvan sairaalasta – kertoo nyt, mitä tilanteessa poliisien kanssa tapahtui",Koivun mukaan hänet vietiin pois paikalta ilman selityksiä.,en,Helena Koivu published a picture of the hospital - now tells what happened with the police,"According to birch, he was taken out of the place without explanation.",2025-04-02 18:27:00
fi,Ilves ei malttanut pysyä pikkuveljenä − sen faneilla ja Tapparalla tekee tiukkaa tottua tilanteeseen,Ilves nöyryytti Tapparan kesälomalle yllättävän selkeästi. Tapparalla ja Ilveksen faneilla riittää totuttelemista uuteen tilanteeseen.,en,"The lynx could not stay as a little brother - with its fans and Tappara, it is tight to get used to the situation",Ilves humiliated Tappara's summer vacation surprisingly clearly. Tappara and Ilves fans are enough to get used to the new situation.,2025-04-02 18:26:24
fi,"Kaupunkisuunnittelu | Stoa laajenee ja Puhos muuttuu: ”Vaikea uskoa, että ollaan tässä pisteessä”",Jo kertaalleen purettavaksi suunniteltu Puhos nousee kunniapaikalle uudessa kaavamuutoksessa.,en,"Urban planning Stoa is expanding and Puhos changes: ""Hard to believe we're at this point""","Puhos, already planned for demolition, will rise to the place of honor in a new change of plan.",2025-04-02 18:23:00
fi,Lauri Markkasesta ikäviä uutisia,Lauri Markkasen kausi päättyi samoissa tunnelmissa kuin oli kulkenutkin.,en,Lauri Markkanen from nasty news,Lauri Markkanen's season ended in the same mood as he had passed.,2025-04-02 18:23:00
fi,Wall Streetin futuurit laskuun Trumpin tulli-ilmoituksen jälkeen − Nasdaq jyrkässä laskussa,Euroopan unionille asetettiin 20 prosentin tullit. Euro vahvistuu dollariin nähden.,en,Wall Street futures decline after Trump's customs declaration-Nasdaq in steep fall,20 % duties were placed on the European Union. The euro is strengthened by the dollar.,2025-04-02 21:35:00
fi,Trump: 20 prosentin tulli EU:lle,Yhdysvallat aikoo asettaa suuria tulleja tärkeimmille kauppakumppaneilleen. Presidentti Donald Trumpin mukaan tuontitullit tulevat vaurastuttamaan yhdysvaltalaisia.,en,Trump: 20 % Customs to the EU,"The United States intends to set large duties on its main trading partners. According to President Donald Trump, import duties will be prosperous in the United States.",2025-04-02 21:26:00
fi,Testaa tietosi torstain Urheiluvisassa!,Torstain visassa mm. formuloita ja hiihtoa!,en,Test your information on Thursday's sports quiz!,Thursday in Visa Formulas and skiing!,2025-04-02 21:21:00
fi,Trumps besked om tullar: 20 procent på varor från EU,USA inför 20-procentiga tullar varor från EU uppger president Donald Trump på en pressträff på onsdag kväll finsk tid.,en,Trumps Besked Om Tullar: 20 Procent på Varor Från EU,USA Inför 20-ProCentiga Tullar Varor Från Eu Uppger President Donald Trump på en pressräff på onsdag kväll finsk tid.,2025-04-02 21:16:30
fi,Hallituksen sosiaali­turvaleikkuri iski rajusti – tuloissa jopa neljänneksen pudotus,THL:n mukaan perusturvan riittävyys on heikentynyt etenkin työttömillä lapsiperheillä.,en,The government's social security cutter struck a dramatically,"According to THL, the adequacy of basic security has declined, especially in unemployed families with children.",2025-04-02 21:07:00
fi,Kommentti: Mestaruuden arvoinen maali – Valioliigan kohtalo sinetöitiin derbyssä,"Everton ei pystynyt pysäyttämään naapurinsa mestaruusjunaa, kirjoittaa Janne Palomäki. Avausjakso Anfieldillä näytti vähintään mielenkiintoiselta. Everton ei ollut tullut naapuriin pelkästään pysäköidäkseen bussin oman maalin eteen.",en,Comment: Championship goal - The Fate of the Premier League was sealed in Derby,"Everton couldn't stop his neighbor's championship train, writes Janne Palomäki. The opening period at Anfield seemed at least interesting. Everton had not just come to the neighbor just to park the bus's own goal.",2025-04-02 20:59:40
fi,Näin erikoisia kulkupelejä Venäjän joukot käyttävät – kuvat leviävät,"Pinkki moottoripyörä, turkoosi hyökkäysajoneuvo, 1950-luvun maasturi... sotarintamalta on bongattu taas uusia venäläisviritelmiä.",en,This is how special Russian troops use - the pictures are spreading,"Pink motorcycle, turquoise attack vehicle, 1950s SUV ... New Russian tunes have been spotted on the war front.",2025-04-02 20:55:00
fi,Trump: 20 prosentin tuontitulli EU:lle,,en,Trump: 20 percent import duty for the EU,,2025-04-02 20:48:58
