iso_code,title,description,lang_tranlation,title_translated,description_translated,pubDate
at,Wohntraum statt Fabrik,"Dort, wo heute eine Wohnanlage steht, stand früher die Farbfabrik Leithner. OBERNBERG. ""Die Humbel Invest GmbH ist stets aktiv auf der Suche nach attraktiven Investitionsmöglichkeiten, die nachhaltige und wirtschaftlich sinnvolle Perspektiven bieten"", erklärt Christian Humbel. In der Gemeinde Obernberg am Inn ergab sich dabei vor einiger Zeit eine vielversprechende Gelegenheit: Ein Baugrundstück stand zum Verkauf – und das ohne Bauzwang. Allerdings war mit dem Erwerb eine besondere Bedingung...",en,Living dream instead of factory,"Where a residential complex is today, the Leithner color factory used to be. Obernberg. ""Humbel Invest GmbH is always active in search of attractive investment opportunities that offer sustainable and economically sensible perspectives,"" explains Christian Humbel. Some time ago, there was a promising opportunity in the municipality of Obernberg am Inn: a building plot was for sale - and without compulsory construction. However, the acquisition was a special condition ...",2025-04-10 09:25:16
at,Düstere Aussichten - Brunold warnt: „Wird noch ein extrem harter Kampf“,"Beim UEFA Nations League-Spiel der ÖFB-Damen im Schnabelholz gegen die Niederlande, durfte Carina Brunold endlich wieder ein bisschen Heimatluft schnuppern. Am Rande des Spiels sprach die 22-Jährige auch über die Admiral Bundesliga und die Situation der beiden Vorarlberger Vereine.",en,"Dark prospects - Brunold warns: ""Will still be an extremely hard fight""","At the UEFA Nations League game of the ÖFB women in the Schnabelholz against the Netherlands, Carina Brunold was finally allowed to sniff a little home air again. On the edge of the game, the 22-year-old also spoke about the Admiral Bundesliga and the situation of the two Vorarlberg clubs.",2025-04-10 09:25:00
at,Bewohner von Sydney in Alarmbereitschaft wegen Riesenschlange,"Nun sind Bewohner eines küstennahen Vororts von Sydney aufgefordert worden, sich vor einer ausgebüxten exotischen Schlange in Acht zu nehmen.",en,Residents of Sydney on alarm for giant snake,"Now the residents of a Sydney, close to the coast have been asked to take care of an exotic snake in front of an exploited.",2025-04-10 09:24:20
at,Mit Mut und Herz durch Regen und Nebel,"Lukas und Helmut Schindelegger beweisen bei der verregneten Rebenland Rallye: Je schlimmer die Bedingungen, desdo besser für das eingespielte Team. STEIERMARK/BEZIRK GMÜND. Die Rebenland Rallye 2025 wird wohl als die nasseste Ausgabe in die Geschichte eingehen. Dauerregen empfing die Teilnehmer in der südlichen Steiermark und sorgte mit dem konstanten Regenfall und dem Schlamm, der aus den Cuts auf die Straße befördert wurde, für extreme Fahrbahnverhältnisse. Doch wirklich prägen sollte die...",en,With courage and heart through rain and fog,"Lukas and Helmut Schindelegger prove rally in the rainy vine country: the worse the conditions, desdo better for the well -rehearsed team. Styria/Gmünd district. The Rebenland Rallye 2025 will probably go into history as the wetest edition. Permanent rain received the participants in southern Styria and provided extreme road conditions with the constant rain and the mud that was transported from the cuts to the street. But the ...",2025-04-10 09:24:18
at,"Was an den Börsen Angst machte? Lehman, Covid - und Trump",Börsen messen Angst: Kein US-Präsident sorgte für derartigen Schrecken.,en,"What scared the stock exchanges? Lehman, Covid - and Trump",Excesses measure fear: no US president caused such horrors.,2025-04-10 17:11:59
at,"Engagement, Herz und Haltung","Für seinen Einsatz ist Claudius Kuvi, Trainer und Nachwuchsleiter der UVB Oberbank Vöcklamarkt, als ""Supercoach"" nominiert. VÖCKLAMARKT. Bei der UVB Oberbank Vöcklamarkt betreuen engagierte Trainer elf Nachwuchsmannschaften. Claudius Kuvi spielt eine zentrale Rolle. Seit 2011 steht der Nachwuchsleiter und Trainer fast täglich auf dem Platz. Was ihn antreibt? „Als Trainer ist man die verlängerte Hand vom Elternhaus. Man sollte den Kindern gute Werte vermitteln, sie nicht nur spielerisch...",en,"Commitment, heart and attitude","Claudius Kuvi, coach and young manager of UVB Oberbank Vöcklamarkt, is nominated as a ""super coach"" for his commitment. Vöcklamarkt. At the UVB Oberbank Vöcklamarkt, committed trainers look after eleven young teams. Claudius Kuvi plays a central role. Since 2011, the young manager and trainer has been on the pitch almost every day. What drives him? “As a trainer, you are the extended hand from the parents' house. You should convey good values ​​to the children, not only in a playful way ...",2025-04-10 17:11:34
at,US-Anleihen geraten am Donnerstag unter Druck,Die jüngste Zollwende von US-Präsident Trump hat keine nachhaltige Trendwende bei den US-Anleihen herbeigeführt.,en,US bonds come under pressure on Thursday,US President Trump's latest customs reverie has not brought about a sustainable trend reversal in the US bonds.,2025-04-10 17:10:58
at,235.000 Jungbäume für zukunftsfitten Wald,"Die Österreichischen Bundesforste (ÖBf) mit Sitz in Purkersdorf (Bezirk St. Pölten) wollen in der neuen Aufforstsaison rund 1,3 Millionen Jungbäume pflanzen. Der Großteil davon sollen Lärchen sein. In Niederösterreich kommen 235.000 neue Bäume hinzu.",en,"235,000 young trees for future fit forest","The Austrian Federal Forest (ÖBF), based in Purkersdorf (St. Pölten district), want to plant around 1.3 million young trees in the new research season. Most of them should be larch. 235,000 new trees are added in Lower Austria.",2025-04-10 17:10:12
at,"Verstappen über RB21-Handling: ""Da hast du ja deine Antwort!""",Max Verstappen spricht über das Handling seines RB21-Boliden und rechnet in Bahrain mit einem schwierigen Rennen: Bedingungen kommen nicht entgegen,en,"Verappen via RB21 handling: ""You have your answer!""",Max Verstappen talks about the handling of his RB21 car and expects a difficult race in Bahrain: conditions do not meet,2025-04-10 17:10:02
at,Beste Online Casino (2025),"Der deutsche Online-Glücksspielmarkt bietet eine beeindruckende Vielfalt – doch wie finden Sie das **beste Online Casino Deutschland**, das legal und vertrauenswürdig ist? In diesem Artikel erfahren Sie, worauf Sie bei einem **Casino Online Deutschland** achten sollten. Wir zeigen Ihnen, welche Anbieter als **seriöses Online Casino Deutschland** gelten und worauf es bei sicheren Zahlungsmethoden, attraktiven Bonusangeboten und einer umfangreichen Spielauswahl ankommt.Beste Online Casinos...",en,Best online casino (2025),"The German online gambling market offers an impressive variety-but how do you find the ** Best Online Casino Germany ** that is legal and trustworthy? In this article you will find out what to look for at a ** Casino online Germany **. We show you which providers are considered ** serious online casino germany ** and what is important for safe payment methods, attractive bonus offers and an extensive selection of games. Best online casinos ...",2025-04-10 17:09:41
at,EU spricht mit Vereinigten Arabischen Emiraten über Freihandelsabkommen,"Von Edith Hancock DOW JONES--Die Präsidentin der Europäischen Kommission, Ursula von der Leyen, hat Gespräche mit den Vereinigten Arabischen Emiraten über ein Freihandelsabkommen angekündigt, wenige Stunden, nachdem die EU ihre geplanten Gegenzölle auf US-Waren für 90 Tage ausgesetzt hat. Von der Leyen habe am Donnerstag mit...",en,EU talks to United Arab Emirates about free trade agreements,"By Edith Hancock Dow Jones-the President of the European Commission, Ursula von der Leyen, announced talks with the United Arab Emirates about a free trade agreement, a few hours after the EU has exposed its planned counter-duties on US goods for 90 days. From the Leyen on Thursday with ...",2025-04-10 17:09:41
at,Beste Online Casino Deutschland [2025],"In Deutschland boomt der Markt für Online Casinos, doch nur Anbieter, die ein sicheres, legales und seriöses Spielerlebnis bieten, überzeugen langfristig. Deshalb sollten Sie sich für ein **beste Online Casino Deutschland** entscheiden, das über eine gültige Lizenz und strenge Sicherheitsvorkehrungen verfügt. In diesem Artikel erfahren Sie, worauf es ankommt und welche Vorteile ein **Casino Online Deutschland** bietet – ob Sie per **Online Casino Deutschland PayPal** oder per **Online Casino...",en,Best online casino Germany [2025],"In Germany, the market for online casinos is booming, but only providers who offer a safe, legal and serious gaming experience convince in the long term. Therefore, you should choose a ** Best Online Casino Germany ** that has a valid license and strict security precautions. In this article you will find out what is important and what advantages a ** Casino online germany ** offers - whether you via ** online casino germany PayPal ** or via ** online casino ...",2025-04-10 17:07:52
at,Eierproduktion läuft - 900 Hühner für den Mitterbacher Regiohof,"Weiße und braune Hühner, außerdem Grünleger: Am Regiohof wird wieder fleißig gegockert und gelegt.",en,Egg production runs - 900 chickens for the Mitterbacher RegioHof,"White and brown chickens, as well as green layers: at the regiohof it is diligently tasted and placed again.",2025-04-10 17:07:00
at,Osterdeko wie aus dem Bilderbuch,Die Schüler*innen der BAfEP Oberwart haben im Rahmen des Werkunterrichts alte Bilderbücher in kreative Osterdeko verwandelt und damit den Eingangsbereich des Schulgebäudes gestaltet. Das Ergebnis kann sich sehen lassen und verleiht der Dornburggasse einen originellen österlichen Anstrich.,en,Easter decoration like from the picture book,The students of the Bafep Oberwart converted old picture books into creative Easter decorations as part of the work lesson and thus designed the entrance area of ​​the school building. The result is impressive and gives the Dornburggasse an original Easter coat of paint.,2025-04-10 17:06:45
at,Musikalischer Neustart für Sängerin Marie Fischer,"Nach Jahren der Musikleidenschaft und ersten Erfahrungen in der Branche wagt Marie Fischer jetzt den Schritt in eine neue Richtung. FELDKIRCHEN. ""Ich wollte genau die Musik machen, die mich bewegt und die mir Spaß macht"", sagt sie über ihren Neustart. Mit ""Ich glaub ich bin verliebt"" verbindet die Feldkirchnerin klassische Schlagergefühle mit einem frischen, modernen Sound, der auf jeder Tanzfläche funktioniert. Moderner SoundHinter der Produktion steckt kein Geringerer als der österreichische...",en,Musical restart for singer Marie Fischer,"After years of passion for music and initial experience in the industry, Marie Fischer is now taking the step in a new direction. Feldkirchen. ""I wanted to make exactly the music that moves me and that I enjoy,"" she says of her restart. With ""I think I'm in love"", the Feldkirchner connects classic hit feelings with a fresh, modern sound that works on every dance floor. Modern sound in production is none other than the Austrian ...",2025-04-11 08:55:54
at,„Dancing Stars“ intim - Danilo Campisis süße Liebesbotschaft an Corinna,"So viel Gefühl ist selbst für „Dancing Stars“ selten! Profi-Tänzer Danilo Campisi hat seiner Verlobten, Rennfahrerin Corinna Kamper, auf Instagram eine unfassbar romantische Liebeserklärung gemacht.",en,"""Dancing Stars"" Intim - Danilo Campisi's sweet love message to Corinna","So much feeling is rare even for ""dancing stars""! Professional dancer Danilo Campisi made his fiancee, racing driver Corinna Kamper, an incredibly romantic declaration of love on Instagram.",2025-04-11 08:55:48
at,SPORT/'Bild': BVB denkt über Rückkehr von Hummels nach,"DORTMUND (dpa-AFX) - Borussia Dortmund (BVB (Borussia Dortmund)) denkt einem Bericht der ""Bild"" zufolge über die Rückkehr von Fußballstar Mats Hummels nach. Der Weltmeister von 2014 könnte als Standby-Profi für die Club-WM im Juni und Juli verpflichtet werden, berichtet die Zeitung. Der 36 Jahre alte Hummels hatte...",en,Sport/'Image': BVB thinks about the return of Hummels,"Dortmund (dpa -Afx) - Borussia Dortmund (BVB (Borussia Dortmund))), according to a report by the ""picture"", is thinking about the return of football star Mats Hummels. The 2014 world champion could be signed as a standby professional for the Club World Cup in June and July, the newspaper reports. The 36 -year -old Hummels had ...",2025-04-11 08:55:38
at,Sperre reduziert: Dragovic im Wiener Derby spielberechtigt,Austrias Abwehrchef hatte im Cup-Semifinale gegen Hartberg nach dem Schlusspfiff Schiedsrichter Gishamer beleidigt,en,Reduced lock: Dragovic in the Vienna Derby eligible to play,Austrian defense chief had insulted referee Gishamer in the Cup Semifinal against Hartberg after the final whistle,2025-04-11 08:55:30
at,Naturvielfalt fördern durch ungemähte Flächen,"Gartenbesitzer und Gemeinden sind eingeladen, ihre Rasenflächen ungemäht zu lassen.",en,Promote nature diversity through unemployed areas,Garden owners and municipalities are invited to leave their lawns unused.,2025-04-11 08:55:21
at,"Ehrlich, ich war’s! Ganz allein!",Sprechblase Nr. 587. Warum wir über „Certified Human“ nachdenken.,en,"Honestly, I was! All alone!","Speech bubble No. 587. Why we think about ""Certified Human"".",2025-04-11 08:54:49
at,ROUNDUP: US-Sondergesandter Witkoff ist in Russland,"MOSKAU/WASHINGTON (dpa-AFX) - Der US-Sondergesandte Steve Witkoff ist nach Russland gereist und soll voraussichtlich den russischen Präsidenten Wladimir Putin treffen. Witkoff sei gelandet, bestätigte Kremlsprecher Dmitri Peskow einen Bericht der US-Nachrichtenseite ""Axios"". Zu einem von ""Axios"" ebenfalls...",en,Roundup: U.Sal-Sonderstander Witkoff is in Russia,"Moscow/Washington (dpa-AfX)-The US specialist Steve Witkoff has traveled to Russia and is expected to meet Russian President Vladimir Putin. Witkoff had landed, Kremlin spokesman Dmitri Peskow confirmed a report on the US news page ""Axios"". To one of ""Axios"" too ...",2025-04-11 08:54:38
at,Dragovic darf doch im Wiener Derby ran,Die Sperre von Austrias Aleksandar Dragovic ist laut der Fußball-Bundesliga verringert worden.,en,Dragovic is allowed in the Vienna Derby,The lock of Austria Aleksandar Dragovic has been reduced according to the Bundesliga.,2025-04-11 08:54:32
at,ROUNDUP/Aktien Frankfurt Eröffnung: Dax im Minus mit US-chinesischem Zollstreit,"FRANKFURT (dpa-AFX) - Der DAX hat am Freitag seine anfänglichen Gewinne abgegeben und deutlich ins Minus gedreht. Gut anderthalb Stunden nach Handelsbeginn notierte der deutsche Leitindex 1,26 Prozent tiefer bei 20.303,45 Punkten. Damit zeichnet sich für die zu Ende gehende, turbulente Börsenwoche ein Minus von 1,6...",en,Roundup/shares Frankfurt Opening: Dax in the minus with US Chinese customs dispute,"Frankfurt (dpa -AfX) - The DAX made its initial profits on Friday and made it significantly into the minus. A good hour and a half after the start of the trade, the German leading index was 1.26 percent lower at 20,303.45 points. This shows a minus of 1.6 ...",2025-04-11 08:53:38
at,Ölpreise legen trotz Eskalation im Zollkonflikt etwas zu,"NEW YORK/LONDON (dpa-AFX) - Die Ölpreise sind am Freitag leicht gestiegen. Eine erneute Anhebung der Zölle von China auf Waren aus den USA konnte die Notierungen am Ölmarkt vorerst nicht weiter belasten. Der Preis für ein Barrel (159 Liter) der Nordseesorte Brent zur Lieferung im Juni kostete 63,46 Dollar und damit 13 Cent mehr als am Vortag.",en,"Despite escalation in the customs conflict, oil prices add something","New York/London (dpa -AfX) - the oil prices rose slightly on Friday. A renewed raising of the tariffs of China to goods from the United States could not continue to burden the lists on the oil market for the time being. The price for a barrel (159 liters) of the North Sea variety Brent for delivery in June cost $ 63.46, more than the previous day.",2025-04-11 08:53:38
at,Osterkonzert im Rathausfestsaal Wolfsberg,"Schülerinnen und Schüler aus der Instrumentalklasse von Christian Theuermann gastierten mit den Instrumenten Akkordeon, Steirische Harmonika und Keyboard im Rathausfestsaal Wolfsberg und sorgten im Rahmen der Osterverkaufsausstellung für die musikalische Untermalung.",en,Easter concert in the Rathausfestsaal Wolfsberg,"Pupils from the instrumental class of Christian Theuermann guest accordion, Styrian harmonica and keyboard at the Rathausfestsaal Wolfsberg and ensured the musical background as part of the Easter sales exhibition.",2025-04-11 18:21:36
at,"""Konflikte schüren"": Erdoğan schießt gegen Israel","Der türkische Präsident Recep Tayyip Erdoğan hat Israel eine gezielte Spaltung Syriens vorgeworfen, um die ""Revolution"", die zum Sturz des Machthabers Bashar al-Assad geführt hat, zunichte zu machen.",en,"""Schüren"": Erdoğan shoots against Israel","Turkish President Recep Tayyip Erdoğan has accused Israel of a targeted division of Syria to nail the ""revolution"", which led to the fall of the ruler Bashar al-Assad.",2025-04-11 18:17:43
at,"Red Bull: Suzuka-Wiederholung laut Christian Horner ""unmöglich""",Red Bull wähnt sich in Bahrain ein großes Stück hinter McLaren und hat keine Hoffnung auf eine Wiederholung von Suzuka - Max Verstappen fehlt der Grip,en,"Red Bull: According to Christian Horner, Suzuka Reduction ""impossible""",Red Bull believes in Bahrain a big piece behind McLaren and has no hope of repeating Suzuka - Max Verstappen is missing the grip,2025-04-11 18:17:42
at,"""Dancing Stars"": Knoll und Weichselbraun singen - Balazs gibt einen Punkt",Die beiden Moderatoren bewiesen zum Start der fünften Show Gesangstalent.,en,"""Dancing Stars"": Knoll and Vistula Brown Singing - Balazs gives a point",The two moderators demonstrated singing talent at the start of the fifth show.,2025-04-11 18:17:18
at,"MotoGP Katar Training 2025: Morbidelli vorn, keine Aprilia in den Top 10!","Alle sechs Ducatis, zwei KTMs, eine Honda und eine Yamaha in den Top 10: Franco Morbidelli stürmt im Zeittraining der MotoGP in Lusail zur Tages-Bestzeit",en,"MotoGP Qatar Training 2025: Morbidelli in front, no Aprilia in the top 10!","All six Ducatis, two KTMS, a Honda and a Yamaha in the top 10: Franco Morbidelli storms in the time training of the MotoGP in Lusail for the day of the day",2025-04-11 18:16:11
at,Landesgalerie NÖ widmet sich Christa Hauer,Die Landesgalerie Niederösterreich in Krems widmet sich in der Schau „Christa Hauer. Künstlerin.Galeristin.Aktivistin“ dem großen kultur- und gesellschaftspolitischen Engagement der 2013 verstorbenen Künstlerin. Sie hätte heuer ihren 100. Geburtstag gefeiert.,en,Landesgalerie NÖ is dedicated to Christa Hauer,"The Lower Austria State Gallery in Krems is devoted to the great cultural and sociopolitical engagement of the artist who died in 2013 in the show ""Christa Hauer. Artist. She would have celebrated her 100th birthday this year.",2025-04-11 18:15:21
at,Ganz in Weiß,Krokusse am Seewaldsee,en,Completely in white,Crocuses at the Seewaldsee,2025-04-11 18:15:14
at,Frauen-BL-Meistergruppe - St. Pöltnerinnen greifen wieder nach den Sternen,Von der Pole Position aus starten die SKN-Kickerinnen am Sonntag in die Meistergruppe. Ein Sieg beim Tabellenzweiten Austria Wien wäre schon die halbe Miete am Weg zur Titelverteidigung.,en,Women's BL master group-St. Pöltner women again reach for the stars,"From the pole position, the SKN kickers start the master group on Sunday. A win at the second place in the table Austria would be half the battle on the way to defending the title.",2025-04-11 18:15:00
at,"MotoGP-Liveticker Katar: Bagnaia knapp vor Marquez, Martin auf Platz 20",Die MotoGP in Katar im Liveticker: Morbidelli am Freitag vor Bagnaia und Marquez +++ Jorge Martin mit Rückstand auf Platz 20 +++ Alle Infos von der Strecke,en,"MotoGP live ticker Qatar: Bagnaia just ahead of Marquez, Martin in 20th place","The MotoGP in Qatar in LiveTicker: Morbidelli on Friday ahead of Bagnaia and Marquez Jorge Martin, behind 20th place, all information from the route",2025-04-11 18:14:02
at,Adabei Primetime - Andrea Berg im Talk ++ Flirt-Alarm in Hollywood,"Andrea Berg wurde im Netz beschimpft! Was die Schlager-Queen zu dazu sagt, hat sie im Interview verraten. Im Marchfelderhof ging’s unterdessen bei den Promis um heiße Themen: Steigert Spargel wirklich die Manneskraft? Auch in Hollywood brodelt die Gerüchteküche: Wer turtelt gerade mit wem – und wer soll gar wieder solo sein?",en,Adabei Primetime - Andrea Berg in the Talk Flirt -Alarm in Hollywood,"Andrea Berg was insulted on the net! In an interview, she revealed what the Schlager Queen says about it. In the Meanwhile, the celebrities went for hot topics in the Marchfelderhof: asparagus really increases the manpower? The rumor mill is also bubbling in Hollywood: who is currently doing with whom - and who should be solo again?",2025-04-11 18:13:28
at,"Ist das der Tiefpunkt, Lewis Hamilton? ""Definitiv kein schönes Gefühl!""",Lewis Hamilton erlebt im Qualifying zum Großen Preis von Bahrain am Samstag eine Enttäuschung - die Schuld dafür sucht der Brite aber einzig und allein bei sich selbst,en,"Is that the low point, Lewis Hamilton? ""Definitely not a nice feeling!""",Lewis Hamilton experiences a disappointment in qualifying at the Grand Prix of Bahrain on Saturday - but the Briton is only looking for the fault for itself,2025-04-12 23:22:06
at,"Gold, Öl & Co. in KW 15: Die Tops und Flops unter den Rohstoffen",So bewegten sich die einzelnen Commodities in der Kalenderwoche 15:,en,"Gold, oil",So the individual commodities moved in calendar week 15:,2025-04-12 23:19:00
at,Salzburger Liga - Befreiungsschläge und falsche Ausschlüsse,Der abschließende Samstag in der 20. Runde der Salzburg Liga brachte für Klubs an der Spitze und am Ende der Tabelle Befreiungsschläge. Und zudem die ein oder andere kuriose Szene.,en,Salzburg League - liberation strokes and false exclusions,The final Saturday in the 20th round of the Salzburg League brought liberation strokes for clubs and at the end of the table. And also one or the other curious scene.,2025-04-12 23:18:58
at,"""Anradeln"" lockte wieder zahlreiche Gäste an","BAD RADKERSBURG. Mehr als 1.500 Teilnehmer eröffneten in der südlichsten Kurstadt der Steiermark die Frühjahrs-Radsaison. Das traditionelle ""Anradeln"" lockte wieder Hobbyradler aus Nah und Fern in die Region. An drei Tagen konnten sie die bestens vorbereiteten Radwege in der herrliche Landschaft genießen. Schon beim ""Einradeln"" am ersten Tag erkundeten rund 250 sportliche Akteure auf der zwanzig Kilometer langen Tour die Region. Natürlich kamen anschließend die kulinarischen Genüsse nicht zu...",en,"""Annels"" attracted numerous guests again","Bad Radkersburg. More than 1,500 participants opened the spring cycling season in the southernmost spa town of Styria. The traditional ""rescue"" attracted hobby cyclists from near and far to the region. On three days they were able to enjoy the well -prepared bike paths in the wonderful landscape. As early as ""united"" on the first day, around 250 sporting players explored the region on the twenty -kilometer -long tour. Of course, the culinary delights did not meet afterwards ...",2025-04-12 23:16:07
at,Klimaschule mit Tiroler Klimaschutzpreis ausgezeichnet,"De vor 15 Jahren ins Leben gerufene Nationalpark Hohe Tauern Klimaschule wurde im April 2025 mit dem Tiroler Klimaschutzpreis in der Kategorie „Bildungsarbeit“ ausgezeichnet. Das bestätigt die Qualität und Beständigkeit der Bildungsarbeit des Nationalparks Hohe Tauern. MATREI. Seit ihrer Gründung im Jahr 2010 hat die Klimaschule des Nationalparks Hohe Tauern über 35.000 Schülerinnen und Schüler erreicht – sei es vor Ort in den Schulklassen, die NationalparkrangerInnen besuchen oder direkt im...",en,Climate school with Tyrolean climate protection price excellent,"DE National Park Hohe Tauern Climate School launched 15 years ago was awarded the Tyrolean Climate Protection Award in the ""Education Work"" category in April 2025. This confirms the quality and resistance of the educational work of the Hohe Tauern National Park. Matrei. Since its foundation in 2010, the climate school of the Hohe Tauern National Park has reached over 35,000 pupils - be it on site in the school classes that visit the national park rangers or directly in ...",2025-04-12 23:00:07
at,"13. April 1870: Das ""Metropolitan Museum of Art"" wird in New York gegründet","Unter Sonntag, 13. April, ist im Buch der Geschichte unter anderem verzeichnet:",en,"April 13, 1870: The ""Metropolitan Museum of Art"" is founded in New York","On Sunday, April 13th, the history of history is recorded, among other things:",2025-04-12 22:37:04
at,Mehr als 100 Tote bei Angriffen im Sudan befürchtet,"Im Sudan sind bei Angriffen der RSF-Miliz auf die Stadt Al-Fashir (El-Fasher) und zwei nahe gelegene Flüchtlingslager nach Schätzungen der UNO mehr als 100 Menschen ums Leben gekommen, darunter auch 20 Kinder. Das UNO-Büro für humanitäre Angelegenheiten (OCHA) warf der Miliz am Samstag ""koordinierte Boden- und Luftangriffe"" auf die belagerte Stadt Al-Fashir und die Flüchtlingslager Samsam und Abu Shuk vor.",en,More than 100 deaths in attacks in Sudan feared,"According to estimates by the UN, more than 100 people, including 20 children, died in Sudan when the RSF militia attacks the city of Al-Fashir (El-Fasher) and two nearby refugee camps. The Miliz accused the UN Office for Humanitarian Affairs (OCHA) on Saturday ""Coordinated Floor and Air strikes"" on the besieged city of Al-Fashir and the refugee camp Samsam and Abu Shuk.",2025-04-12 22:36:18
