iso_code,title,description,lang_tranlation,title_translated,description_translated,pubDate
gb,Declan Rice makes Martin Odegaard feelings clear as he shares what Arsenal captain is 'really' like behind the scenes ahead of PSG clash - TBR Football,Declan Rice makes Martin Odegaard feelings clear as he shares what Arsenal captain is 'really' like behind the scenes ahead of PSG clash TBR Football“He’s our leader” – Rice backs Odegaard amid criticism Arseblog NewsOdegaard must do more for Arsenal and has biggest stage yet to step up London Evening StandardWhat's wrong with Martin Odegaard? Why Arsenal captain has suffered his alarming dip Metro.co.ukDeclan Rice responds after calls for Martin Odegaard to lose Arsenal captaincy The Mirror,en,Declan Rice makes Martin Odegaard feelings clear as he shares what Arsenal captain is 'really' like behind the scenes ahead of PSG clash - TBR Football,Declan Rice makes Martin Odegaard feelings clear as he shares what Arsenal captain is 'really' like behind the scenes ahead of PSG clash TBR Football“He’s our leader” – Rice backs Odegaard amid criticism Arseblog NewsOdegaard must do more for Arsenal and has biggest stage yet to step up London Evening StandardWhat's wrong with Martin Odegaard? Why Arsenal captain has suffered his alarming dip Metro.co.ukDeclan Rice responds after calls for Martin Odegaard to lose Arsenal captaincy The Mirror,2025-05-07 05:15:00
gb,South London primary school with 132 empty places set to close as it faces £215k debt,The Wandsworth school has seen pupil numbers fall dramatically over the past five years,en,South London primary school with 132 empty places set to close as it faces £215k debt,The Wandsworth school has seen pupil numbers fall dramatically over the past five years,2025-05-07 05:15:00
gb,Flora Day 'more important than Christmas' for town,"Helston's Flora Day welcomes 20 to 25,000 people in a celebration that is deeply important for those involved.",en,Flora Day 'more important than Christmas' for town,"Helston's Flora Day welcomes 20 to 25,000 people in a celebration that is deeply important for those involved.",2025-05-07 05:14:58
gb,Arkema: First-Quarter 2025 Results,,en,Arkema: First-Quarter 2025 Results,,2025-05-07 05:14:09
gb,Councillors use their community funds to keep Eye 'lollipop lady' until end of school year,Lisa Bryan was made redundant after 26 years as Eye Primary School's ‘lollipop lady’,en,Councillors use their community funds to keep Eye 'lollipop lady' until end of school year,Lisa Bryan was made redundant after 26 years as Eye Primary School's ‘lollipop lady’,2025-05-08 04:03:00
gb,The 60th Academy of Country Music Awards are here; newcomer Ella Langley leads the nominations,"The 2025 Academy of Country Music Awards will take place Thursday at the Ford Center at The Star in Frisco, Texas, just north of Dallas",en,The 60th Academy of Country Music Awards are here; newcomer Ella Langley leads the nominations,"The 2025 Academy of Country Music Awards will take place Thursday at the Ford Center at The Star in Frisco, Texas, just north of Dallas",2025-05-08 04:02:32
gb,Inside Kim Kardashian's kinky flesh-flashing outfit for the Met Gala afterparties,"During the evening's festivities, Kim was seen hobnobbing with two of her glamorous gal pals - Ciara, 39, and La La Anthony, 45.",en,Inside Kim Kardashian's kinky flesh-flashing outfit for the Met Gala afterparties,"During the evening's festivities, Kim was seen hobnobbing with two of her glamorous gal pals - Ciara, 39, and La La Anthony, 45.",2025-05-08 04:02:27
gb,Woodside Energy Group Ltd Annual General Meeting Address by Chair Richard Goyder and CEO Meg O'Neill,,en,Woodside Energy Group Ltd Annual General Meeting Address by Chair Richard Goyder and CEO Meg O'Neill,,2025-05-08 04:02:05
gb,How the Warrington Guardian reported on VE Day 80 years ago,"AFTER almost six years of war, May 8, 1945, was a real reason to celebrate.",en,How the Warrington Guardian reported on VE Day 80 years ago,"AFTER almost six years of war, May 8, 1945, was a real reason to celebrate.",2025-05-08 04:02:00
gb,Plans approved for new cafe at old brewery building,"Plans have been approved by Brighton and Hove City Council to open a café at the Phoenix Community Centre in Brighton, near The Level.",en,Plans approved for new cafe at old brewery building,"Plans have been approved by Brighton and Hove City Council to open a café at the Phoenix Community Centre in Brighton, near The Level.",2025-05-08 04:02:00
gb,Campaign to honour brave pilots and navigators in WW2,Among those who served in the Photographic Reconnaissance Unit was Wilfred Bruce Tilley.,en,Campaign to honour brave pilots and navigators in WW2,Among those who served in the Photographic Reconnaissance Unit was Wilfred Bruce Tilley.,2025-05-08 04:02:00
gb,"Why are altcoins like IOTA, EOS, Quant, and Bitcoin Cash rising?","The crypto market continued doing well on Thursday, with Bitcoin surging to the crucial resistance point at $99,000. This surge has pushed the market cap of all coins to over $3.07 trillion. Some of the top-performing cryptocurrencies were EOS, IOTA, Quant (QNT), and Bitcoin Cash (BCH). EOS price rises as DEX volume rise ahead of [...]",en,"Why are altcoins like IOTA, EOS, Quant, and Bitcoin Cash rising?","The crypto market continued doing well on Thursday, with Bitcoin surging to the crucial resistance point at $99,000. This surge has pushed the market cap of all coins to over $3.07 trillion. Some of the top-performing cryptocurrencies were EOS, IOTA, Quant (QNT), and Bitcoin Cash (BCH). EOS price rises as DEX volume rise ahead of [...]",2025-05-08 04:02:00
gb,"BITS & BYTES: Berkshire Pulse at The Foundry; Sabina Sciubba at Race Brook Lodge; ‘Recycled Runway’ at American Mural Project; ‘Sewn, Thrown, & Blown’ at Childs+Clark Gallery; ‘Opposites Attract’ at Lauren Clark Fine Art; Barbara McClintock at The Carle; North Berkshire Contra Dance; Berkshire Waldorf School kindergarten open house","The Berkshire Pulse Young Choreographers Workshop and Initiative were established as a platform for students works that give voice to the issues affecting their generation and address important topics such as anxiety, body image, isolation, and joy.",en,BITS,"The Berkshire Pulse Young Choreographers Workshop and Initiative were established as a platform for students works that give voice to the issues affecting their generation and address important topics such as anxiety, body image, isolation, and joy.",2025-05-08 04:01:31
gb,From apathy to celebration – how four people lived VE Day in 1945 - The Guardian,From apathy to celebration – how four people lived VE Day in 1945 The GuardianView Full coverage on Google News,en,From apathy to celebration – how four people lived VE Day in 1945 - The Guardian,From apathy to celebration – how four people lived VE Day in 1945 The GuardianView Full coverage on Google News,2025-05-08 04:01:00
gb,Bihar couple names newborn daughter ‘Sinduri’ after Operation Sindoor,"A Bihar couple named their newborn daughter ‘Sinduri’ to commemorate Operation Sindoor, a military response to the Pahalgam terrorist attack on April 22, which claimed the lives of 26 civilians.",en,Bihar couple names newborn daughter ‘Sinduri’ after Operation Sindoor,"A Bihar couple named their newborn daughter ‘Sinduri’ to commemorate Operation Sindoor, a military response to the Pahalgam terrorist attack on April 22, which claimed the lives of 26 civilians.",2025-05-09 05:34:00
gb,Give it a rest on lecturing people on what they should or shouldn’t do on Sundays,"Martyrs Memorial Free Presbyterian Church on the Ravenhill Road, Belfast, is just around the corner from where I live — so, naturally, I take a passing interest in what’s going on there. We’re practically neighbours, after all.",en,Give it a rest on lecturing people on what they should or shouldn’t do on Sundays,"Martyrs Memorial Free Presbyterian Church on the Ravenhill Road, Belfast, is just around the corner from where I live — so, naturally, I take a passing interest in what’s going on there. We’re practically neighbours, after all.",2025-05-09 05:33:39
gb,Transforming Healthcare through Social Data: A New Era of Integrated Innovation,"Roja Rani Perumandla introduces a visionary model to embed social determinants into everyday clinical care In today’s digital transformation era, healthcare is evolving to prioritize Social Determinants of Health (SDOH) as central elements in care delivery. Roja Rani Perumandla, an expert in healthcare systems, presents a groundbreaking framework that transforms social risk data into structured, [...]The post Transforming Healthcare through Social Data: A New Era of Integrated Innovation appeared first on TechBullion.",en,Transforming Healthcare through Social Data: A New Era of Integrated Innovation,"Roja Rani Perumandla introduces a visionary model to embed social determinants into everyday clinical care In today’s digital transformation era, healthcare is evolving to prioritize Social Determinants of Health (SDOH) as central elements in care delivery. Roja Rani Perumandla, an expert in healthcare systems, presents a groundbreaking framework that transforms social risk data into structured, [...]The post Transforming Healthcare through Social Data: A New Era of Integrated Innovation appeared first on TechBullion.",2025-05-09 05:33:38
gb,Pakistan denies Indian accusations of attacks on military bases,"Pakistan has denied Indian accusations it has attacked military bases amid the growing conflict between the two neighbours. India’s Headquarters of the Integrated Defence Staff, a central coordinating arm for all Indian armed forces, said military stations in Jammu, Udhampur and Pathankot were targeted by Pakistan using missiles and drones. It said the attacks were [...]The post Pakistan denies Indian accusations of attacks on military bases appeared first on Jersey Evening Post.",en,Pakistan denies Indian accusations of attacks on military bases,"Pakistan has denied Indian accusations it has attacked military bases amid the growing conflict between the two neighbours. India’s Headquarters of the Integrated Defence Staff, a central coordinating arm for all Indian armed forces, said military stations in Jammu, Udhampur and Pathankot were targeted by Pakistan using missiles and drones. It said the attacks were [...]The post Pakistan denies Indian accusations of attacks on military bases appeared first on Jersey Evening Post.",2025-05-09 05:33:21
gb,Pakistan denies Indian accusations of attacks on military bases,Both sides have traded heavy fire across their frontier in disputed Kashmir.,en,Pakistan denies Indian accusations of attacks on military bases,Both sides have traded heavy fire across their frontier in disputed Kashmir.,2025-05-09 05:33:21
gb,Harvey Weinstein's alleged rape victim reveals his bombshell claim about Gwyneth Paltrow and Penelope Cruz,"Kaja Sokola, a former model who has accused Harvey Weinstein of rape, revealed in court on Thursday what he said about actresses Gwyneth Paltrow and Penelope Cruz.",en,Harvey Weinstein's alleged rape victim reveals his bombshell claim about Gwyneth Paltrow and Penelope Cruz,"Kaja Sokola, a former model who has accused Harvey Weinstein of rape, revealed in court on Thursday what he said about actresses Gwyneth Paltrow and Penelope Cruz.",2025-05-09 05:33:05
gb,Daughter of 'mushroom poisoner' reveals what mum told her before fatal lunch that killed three,"Erin Patterson has denied deliberately poisoning a beef wellington in an attempt to kill four members of Simon Patterson’s family in Victoria, Australia",en,Daughter of 'mushroom poisoner' reveals what mum told her before fatal lunch that killed three,"Erin Patterson has denied deliberately poisoning a beef wellington in an attempt to kill four members of Simon Patterson’s family in Victoria, Australia",2025-05-09 05:32:46
gb,Plymouth World War Two hero who is 'last one left' unveils memorial to the fallen,'There were seven of us in the Lancaster and they’re all gone. I was the baby of the group',en,Plymouth World War Two hero who is 'last one left' unveils memorial to the fallen,'There were seven of us in the Lancaster and they’re all gone. I was the baby of the group',2025-05-09 05:32:35
gb,Biker's family sue over death on 'degraded' road,"Robert Newcombe, from Ilkeston, Derbyshire, died on the A43 in Northamptonshire.",en,Biker's family sue over death on 'degraded' road,"Robert Newcombe, from Ilkeston, Derbyshire, died on the A43 in Northamptonshire.",2025-05-09 05:32:22
gb,‘Beach of Dreams’ will arrive in Abergele this weekend – what to expect,A national celebration of coastlines event is coming to Conwy county this weekend.,en,‘Beach of Dreams’ will arrive in Abergele this weekend – what to expect,A national celebration of coastlines event is coming to Conwy county this weekend.,2025-05-09 05:32:00
gb,Arsenal ‘process over’ at ‘fourth tier’ club as Man Utd need ‘cold-blooded’ sale of ‘vanishing’ star,"The fallout from Arsenal's Champions League exit continues as Man Utd are told they cannot 'bankroll a maybe', while Ange Postecoglou could be a genius...",en,Arsenal ‘process over’ at ‘fourth tier’ club as Man Utd need ‘cold-blooded’ sale of ‘vanishing’ star,"The fallout from Arsenal's Champions League exit continues as Man Utd are told they cannot 'bankroll a maybe', while Ange Postecoglou could be a genius...",2025-05-10 07:23:44
gb,Scottish Greens call for end to monarchy ahead of major pro-Republic rally,The Scottish Greens have called for the monarchy to be abolished ahead of a pro-Republican event in Edinburgh on Saturday,en,Scottish Greens call for end to monarchy ahead of major pro-Republic rally,The Scottish Greens have called for the monarchy to be abolished ahead of a pro-Republican event in Edinburgh on Saturday,2025-05-10 07:23:30
gb,Heartbroken locals set to unite and sup their last pint at The Hare & Hounds pub in Accrington this weekend,It’s the end of a 200-year-old era for a much community pub this weekend as it will close its doors for good.,en,Heartbroken locals set to unite and sup their last pint at The Hare,It’s the end of a 200-year-old era for a much community pub this weekend as it will close its doors for good.,2025-05-10 07:23:05
gb,Malayali students in JK allege government apathy as many looks to return amidst growing tension in the region,"On Thursday night, the students sent an email to the Kerala Chief Minister and Chief Secretary, however there was no reply for the next two days. However, later they received a call from the state government authorities.",en,Malayali students in JK allege government apathy as many looks to return amidst growing tension in the region,"On Thursday night, the students sent an email to the Kerala Chief Minister and Chief Secretary, however there was no reply for the next two days. However, later they received a call from the state government authorities.",2025-05-10 07:23:00
gb,FIFA Women’s World Cup to expand to 48 teams from 2031 edition,"FIFA expands Women’s World Cup to 48 teams from 2031, with a new 12-group format, UK’s 2035 bid, and historic inclusion of Afghan refugee team.",en,FIFA Women’s World Cup to expand to 48 teams from 2031 edition,"FIFA expands Women’s World Cup to 48 teams from 2031, with a new 12-group format, UK’s 2035 bid, and historic inclusion of Afghan refugee team.",2025-05-10 07:23:00
gb,Dog owners in England urged to remove three items from kitchen this weekend,"As much as we know we shouldn’t, it’s easy to fall for the puppy dog eyes, dropping a treat or two for your furry friend.",en,Dog owners in England urged to remove three items from kitchen this weekend,"As much as we know we shouldn’t, it’s easy to fall for the puppy dog eyes, dropping a treat or two for your furry friend.",2025-05-10 07:23:00
gb,Contaminated cheese is urgently recalled in all Tesco stores over bacteria that causes meningitis & pregnancy loss,,en,Contaminated cheese is urgently recalled in all Tesco stores over bacteria that causes meningitis,,2025-05-10 07:22:49
gb,Contaminated cheese is urgently recalled in all Tesco stores over bacteria that causes meningitis & pregnancy loss,,en,Contaminated cheese is urgently recalled in all Tesco stores over bacteria that causes meningitis,,2025-05-10 07:22:49
gb,Contaminated cheese urgently recalled in all Tesco stores over meningitis fears - The Sun,Contaminated cheese urgently recalled in all Tesco stores over meningitis fears The SunUrgent Tesco product recall for cheese over contamination fears as shoppers are told 'do not eat it' GB NewsTesco issues urgent 'do not eat' cheese warning over 'potentially deadly' listeria contamination lbc.co.ukTesco shoppers told 'do not eat' product due to serious contamination alert Devon LiveUrgent cheese recall issued with ‘do not eat’ warning Daily Express,en,Contaminated cheese urgently recalled in all Tesco stores over meningitis fears - The Sun,Contaminated cheese urgently recalled in all Tesco stores over meningitis fears The SunUrgent Tesco product recall for cheese over contamination fears as shoppers are told 'do not eat it' GB NewsTesco issues urgent 'do not eat' cheese warning over 'potentially deadly' listeria contamination lbc.co.ukTesco shoppers told 'do not eat' product due to serious contamination alert Devon LiveUrgent cheese recall issued with ‘do not eat’ warning Daily Express,2025-05-10 07:22:49
gb,“Here we go” – Fabrizio Romano confirms Arsenal have sealed big money signing,"After losing out on the Premier League title and the Champions League this season, Arsenal have made a big statement. The Gunners have lost out on the league title for the last three season and their efforts to win the Champions League this season were thwarted by Paris Saint-Germain at the semifinal stage. With manager [...]The post “Here we go” – Fabrizio Romano confirms Arsenal have sealed big money signing appeared first on CaughtOffside.",en,“Here we go” – Fabrizio Romano confirms Arsenal have sealed big money signing,"After losing out on the Premier League title and the Champions League this season, Arsenal have made a big statement. The Gunners have lost out on the league title for the last three season and their efforts to win the Champions League this season were thwarted by Paris Saint-Germain at the semifinal stage. With manager [...]The post “Here we go” – Fabrizio Romano confirms Arsenal have sealed big money signing appeared first on CaughtOffside.",2025-05-10 07:22:21
gb,Woeful Colorado Rockies branded 'worst team in history' after giving up TWENTY-ONE runs in loss to Padres,"Spare a thought for fans of the Colorado Rockies, after their team gave up a barely-believable 21 runs to the San Diego Padres in an embarrassing Saturday night at Coors Field.",en,Woeful Colorado Rockies branded 'worst team in history' after giving up TWENTY-ONE runs in loss to Padres,"Spare a thought for fans of the Colorado Rockies, after their team gave up a barely-believable 21 runs to the San Diego Padres in an embarrassing Saturday night at Coors Field.",2025-05-11 03:34:42
gb,Maternal testosterone levels shape boys' activity and girls' strength by age 7,"Boys born to mothers with PCOS or high third-trimester testosterone levels are less physically active at age 7, particularly on weekends. Girls exposed to high prenatal testosterone show reduced muscle strength but not lower activity levels.",en,Maternal testosterone levels shape boys' activity and girls' strength by age 7,"Boys born to mothers with PCOS or high third-trimester testosterone levels are less physically active at age 7, particularly on weekends. Girls exposed to high prenatal testosterone show reduced muscle strength but not lower activity levels.",2025-05-11 03:34:00
gb,Sunday’s briefing: Southampton avoid unwanted record and Chelsea’s Invincibles,"Champions Chelsea completed an unbeaten season in the Women’s Super League, while the Saints passed Derby’s record low tally of 11 points.",en,Sunday’s briefing: Southampton avoid unwanted record and Chelsea’s Invincibles,"Champions Chelsea completed an unbeaten season in the Women’s Super League, while the Saints passed Derby’s record low tally of 11 points.",2025-05-11 03:33:39
gb,Sunday’s briefing: Southampton avoid unwanted record and Chelsea’s Invincibles,"Champions Chelsea completed an unbeaten season in the Women’s Super League, while the Saints passed Derby’s record low tally of 11 points.",en,Sunday’s briefing: Southampton avoid unwanted record and Chelsea’s Invincibles,"Champions Chelsea completed an unbeaten season in the Women’s Super League, while the Saints passed Derby’s record low tally of 11 points.",2025-05-11 03:33:39
gb,Sunday’s briefing: Southampton avoid unwanted record and Chelsea’s Invincibles,"Champions Chelsea completed an unbeaten season in the Women’s Super League, while the Saints passed Derby’s record low tally of 11 points.",en,Sunday’s briefing: Southampton avoid unwanted record and Chelsea’s Invincibles,"Champions Chelsea completed an unbeaten season in the Women’s Super League, while the Saints passed Derby’s record low tally of 11 points.",2025-05-11 03:33:39
gb,Sunday’s briefing: Southampton avoid unwanted record and Chelsea’s Invincibles,"Champions Chelsea completed an unbeaten season in the Women’s Super League, while the Saints passed Derby’s record low tally of 11 points.",en,Sunday’s briefing: Southampton avoid unwanted record and Chelsea’s Invincibles,"Champions Chelsea completed an unbeaten season in the Women’s Super League, while the Saints passed Derby’s record low tally of 11 points.",2025-05-11 03:33:39
gb,Sunday’s briefing: Southampton avoid unwanted record and Chelsea’s Invincibles,"Champions Chelsea completed an unbeaten season in the Women’s Super League, while the Saints passed Derby’s record low tally of 11 points.",en,Sunday’s briefing: Southampton avoid unwanted record and Chelsea’s Invincibles,"Champions Chelsea completed an unbeaten season in the Women’s Super League, while the Saints passed Derby’s record low tally of 11 points.",2025-05-11 03:33:39
gb,Sunday’s briefing: Southampton avoid unwanted record and Chelsea’s Invincibles,"Champions Chelsea completed an unbeaten season in the Women’s Super League, while the Saints passed Derby’s record low tally of 11 points.",en,Sunday’s briefing: Southampton avoid unwanted record and Chelsea’s Invincibles,"Champions Chelsea completed an unbeaten season in the Women’s Super League, while the Saints passed Derby’s record low tally of 11 points.",2025-05-11 03:33:39
gb,Sunday’s briefing: Southampton avoid unwanted record and Chelsea’s Invincibles,"Champions Chelsea completed an unbeaten season in the Women’s Super League, while the Saints passed Derby’s record low tally of 11 points.",en,Sunday’s briefing: Southampton avoid unwanted record and Chelsea’s Invincibles,"Champions Chelsea completed an unbeaten season in the Women’s Super League, while the Saints passed Derby’s record low tally of 11 points.",2025-05-11 03:33:39
gb,Sunday’s briefing: Southampton avoid unwanted record and Chelsea’s Invincibles,"Champions Chelsea completed an unbeaten season in the Women’s Super League, while the Saints passed Derby’s record low tally of 11 points.",en,Sunday’s briefing: Southampton avoid unwanted record and Chelsea’s Invincibles,"Champions Chelsea completed an unbeaten season in the Women’s Super League, while the Saints passed Derby’s record low tally of 11 points.",2025-05-11 03:33:39
gb,India’s strikes forced Pakistan for peace plea: Sources,"Government sources confirmed that the Directors General of Military Operations (DGMOs) of both nations reached an agreement without third-party intervention. Following India’s precise strikes on eight Pakistani air bases, Pakistan initiated peace talks, seeking a cessation of hostilities.",en,India’s strikes forced Pakistan for peace plea: Sources,"Government sources confirmed that the Directors General of Military Operations (DGMOs) of both nations reached an agreement without third-party intervention. Following India’s precise strikes on eight Pakistani air bases, Pakistan initiated peace talks, seeking a cessation of hostilities.",2025-05-12 05:21:00
gb,"BJP workers booked for vandalizing Karachi Bakery in Shamshabad, Hyderabad",RGIA town police said that there were no injuries after workers tried to break Karachi Bakery board with a stick.,en,"BJP workers booked for vandalizing Karachi Bakery in Shamshabad, Hyderabad",RGIA town police said that there were no injuries after workers tried to break Karachi Bakery board with a stick.,2025-05-12 05:21:00
gb,Zelenskyy rejects Putin’s proposal: ‘No peace talks without ceasefire’,Ukrainian President Volodymyr Zelenskyy responded cautiously to Russian President Vladimir Putin’s proposal for direct peace talks.,en,Zelenskyy rejects Putin’s proposal: ‘No peace talks without ceasefire’,Ukrainian President Volodymyr Zelenskyy responded cautiously to Russian President Vladimir Putin’s proposal for direct peace talks.,2025-05-12 05:21:00
