iso_code,title,description,lang_tranlation,title_translated,description_translated,pubDate
cz,V Hondurasu se zřítilo letadlo: Mezi mrtvými je známý hudebník,Nejméně sedm lidí zemřelo v pondělí večer při pádu malého letadla do moře u pobřeží Hondurasu. Deset zraněných převezli policisté a záchranáři do blízké nemocnice. Informují o tom honduraská média. Příčina nehody se vyšetřuje.,en,In Honduras the plane was born: among the dead is the musician known,The least seven people died on Monday in the evening at the small plane's pad to the sea at the time of Honduras. The ten injured police and the rescuers to the closer hospital. I inform Hondurask Media. Pricina's accident is toned.,2025-03-18 05:05:00
cz,Boj o nejmocnější funkci ve sportu vrcholí. Favorit je pro návrat Ruska na OH,Mezinárodní olympijský výbor volí nového prezidenta. Po dvanáctiletém období Němce Thomase Bacha se hlásí o nejmocnější post ve světovém sportu sedm uchazečů. Hraje se o hodně. Třeba o návrat Ruska na olympiádu.,en,Fight for the most powerful function in sport Vrcholi. Favorite is for Returning Russia at Olympics,"Olympic Olympic Visor of the New President. After a two -year period of German Thomas Bach, seven candidates are voting on the Svetov Sport. It is played a lot. It is necessary to return Russia to the Olympiad.",2025-03-18 06:20:00
cz,Pavel hostí bezpečnostní konferenci: Dorazí i poradce Zelenského,"Na konferenci věnované bezpečnosti dnes na Pražském hradě vystoupí prezident Petr Pavel, premiér Petr Fiala (ODS) a poradce ukrajinského prezidenta Oleksandr Kamyšin. Promluví i ministryně obrany Jana Černochová (ODS), ministr zahraničí Jan Lipavský (nestr.) a ministr vnitra Vít Rakušan (STAN). Konferenci Naše bezpečnost není samozřejmost pořádá spolek Jagello 2000, letos se v panelech zaměří na témata navyšování obranných výdajů či významu obranného průmyslu pro ekonomiku.",en,Pavel Hosts Smoic Conference: Considers of Zelenka,"President Petr Pavel, Premier Petr Fiala (ODS) and advisor to the Ukrainian President Oleksandr Kamysin at the conference of Menovan. The Minister of Defense Jan Cernochov (ODS), Foreign Minister Jan Lipavsky (nesstr.) And the Minister of the Interior Vit Austria (STAN). The conference of us is not a matter of course the meeting of the Jagello 2000 Association, this year in the panels will be focused on the topics of bringing the defensive people or the importance of the defense of the economy.",2025-03-18 06:45:00
cz,Ukrajina testuje balonové mateřské lodě pro vypouštění dronů zabijáků,"Technologie balonů pro vojenské účely slaví v poslední době pozoruhodnou renesanci. Sociálními sítěmi nedávno prolétly snímky s ukrajinskými plavidly, ze kterých piloti vypouštějí sebevražedné drony–interceptory. Mají za úkol vyhledávat a ničit ruskou konkurenci, která šíří zkázu na tamním ...",en,Ukraine tests the balloon maternity boat to drain the drone of the kilib,"Balloon technology for military relevant reasons recently a remarkable renaissance. Social sites have not flew with Snimky with Ukrainian vessels, from which pilots eject the suicide of dronyinterceptors. They were to search for and do not go to Russian competition, which siri spoil the tamnim ...",2025-03-18 06:45:00
cz,Jak mluvit o sexu se svým partnerem,"Rozhovory o sexu, potřebách i preferencích jsou pro vztah důležité. I proto, že právě takové debaty vedou ke zdravému sexuálnímu životu. Porovnání tužeb, očekávání i vlivu výchovy na to, co si přejete, může předcházet vztahovým potížím.",en,How to talk about sex with your partner,"Interviews about sex, Potrebach and preferences are important for the relationship. Also because just such a debate leads to healthy sexual life. Comparison of tuze, expectations and influence of upbringing on what you want, it can predeterize the relationship.",2025-03-18 06:45:00
cz,"Konečné domů. Astronauti, kteří uvízli na ISS, vyrazili zpátky k Zemi",Dvojice astronautů by se po devíti měsících nouzového pobytu na Mezinárodní vesmírné stanici měla v nejbližších hodinách vrátit zpět na Zemi.,en,Finally the house. Astronauts who have been on the ISS set back to the ground,"A pair of astronaut, after a short month of emergency stay on the international universe, had to return back to the ground at the closest station.",2025-03-18 06:40:58
cz,Obnovení geopolitického napěti = kapitál prchá do bezpečnějších aktiv - Ranní shrnutí (18.03.2025),"Obnovení geopolitického napětí mezi Izraelem a Hamásem a USA a Íránem přimělo kapitál k úniku do bezpečnějších aktiv. V první části dne jsme zaznamenali zisky zlata, ropy a amerického dolaru. Kontrakty CFD na americké indexy, stejně jako kontrakty na i...",en,Renewing geopolitical voltage = capital fold into safety assets - morning summarizing (18.03.2025),"The renewal of the geopolitical voltage between Israel and Hamas and the US and the Iran primarily primarily the capital to join the safety assets. In the first part of the day we noticed profits of gold, oil and the US dollar. CFD contracts for American indices, as well as contracts for i ...",2025-03-18 06:40:45
cz,Ranní shrnutí (18.03.2025),"Obnovení geopolitického napětí mezi Izraelem a Hamásem a USA a Íránem přimělo kapitál k úniku do bezpečnějších aktiv. V první části dne jsme zaznamenali zisky zlata, ropy a amerického dolaru. Kontrakty CFD na americké indexy, stejně jako kontrakty na i...",en,Morning summarized (18.03.2025),"The renewal of the geopolitical voltage between Israel and Hamas and the US and the Iran primarily primarily the capital to join the safety assets. In the first part of the day we noticed profits of gold, oil and the US dollar. CFD contracts for American indices, as well as contracts for i ...",2025-03-18 06:40:45
cz,"Častější nemoci, horší průběh. Imunita Čechů je zřejmě porušená, říká lékařka","Častější, závažnější i opakované nákazy u svých pacientů zaznamenávají někteří praktičtí lékaři. Odborníci vysvětlují, co za tím může stát i jak se onemocněním bránit.",en,"Castejsi diseases, worse prubeh. The immunity of the guild is apparently a chunky, a ricker of a doctor",Somewhat practical doctors record in their patients. I am explaining what to do and how to defend the disease.,2025-03-18 06:40:00
cz,Bývalý obránce NHL Klouček se zabil po nárazu do rozvodového sloupku. Bylo mu 45 let,Při nedělním lyžování ve Špindlerově Mlýně tragicky zemřel bývalý hokejista Tomáš Klouček.,en,Bye of the NHL defense Kloucek killed himself after the divorce column. He was 45 years old,"During the Sunday skiing in the Spindler Mlyne, the hockey player Tomas Kloucek died.",2025-03-18 06:37:03
cz,Izrael obnovil útoky v Gaze: Noční nálety zabily nejméně 200 lidí,"Noční údery v Pásmu Gazy, jimiž Izrael ukončil klid zbraní trvající od ledna, zabily nejméně 200 lidí, mezi nimi řadu dětí.The post Izrael obnovil útoky v Gaze: Noční nálety zabily nejméně 200 lidí appeared first on Epoch Times ČR.",en,Israel renewed the assaults in Gaza: Night on the Night killed at least 200 people,"Night in the Gaza Passport, Jiiz Israel ended the calm weapon since January, killed at least 200 people, among them the advice. The post of Israel restored the assaults in Gaza: Night.",2025-03-18 06:34:21
cz,"Pastrňák přihrál Zachovi na gól, Vladař naskočil do souboje s Torontem","V pěti pondělních zápasech hokejové NHL Češi bodovali jen v souboji Bostonu s Buffalem. Přihrávka Davida Pastrňáka a zakončení Pavla Zachy pomohlo Bruins k zisku bodu po výsledku 2:3 po prodloužení. Gólman Dan Vladař na startu třetí třetiny nahradil odvolaného parťáka Dustina Wolfa, jenž nezastavil kanonádu Toronta. Maple Leafs potěšili své fanoušky triumfem 6:2.",en,"Pastrnak pricked to the Gol, Vladar suckled into a duel with Toronto","In the ponds of the hockey NHL, the Czechs scored only in the Boston battle with Buffalo. David Pastrnak and Paul's ending, Bruins helped Bruins to gain a point after the result 2: 3 after the extension. Golman Dan Vladar at the start of Treta Tretina replaced the revocated participation of Dustin Wolf, Jenz did not stop Canonad Toronto. Maple Leafs used their fans triumph 6: 2.",2025-03-18 06:32:55
cz,Kalkulačka: Rodičovský příspěvek 2025. Výpočet a kdy chodí na účet,,en,Calculation: Rodicovsky Pispevek 2025.,,2025-03-18 09:25:00
cz,Americký index SP 500 se propadl o více jak 10 %,Americký index SP 500 se po páteční silné zelené seanci pohybuje výše a obchoduje se kolem úrovně 5 619 bodů. Trhy se mezitím připravují na středeční zasedání Fedu a případná oznámení týkající se ukrajinsko-ruského příměří.,en,The American Index SP 500 has failed more than 10 %,"The American Index SP 500 is moving at a thickness of a strong green session and trades around 5,619 points. Meanwhile, the markets are prepared at the middle of the fed and the announcement of the Ukrainian-Ruske Primeri.",2025-03-18 09:23:32
cz,Alphabet: Obnovený dialog ohledně akvizice Wizu,"Alphabet dle neověřených zpráv obnovil rozhovory ohledně akvizice startupu Wiz Inc. , který se zabývá kybernetickou bezpečností. Oproti původní nabídce okolo 23 mld. USD nyní Alphabet nabízí dle neověřených zpráv kolem 30 mld. USD.",en,Alphabet: Renewed dialogue regarding the acquisition of Wizu,"Alphabet, according to non -neoveered reports, renewed interviews regarding the acquisition of Wiz Inc. startup. that is embedded with cyber security. Compared to the original offer of around 23 billion, USD now offers around $ 30 billion according to non -even reports.",2025-03-18 09:23:14
cz,"Ústavní soud zrušil rozsudek nad Vrabelem, zdůraznil svobodu projevu","Brno - Ústavní soud (ÚS) zrušil rozsudek nad Ladislavem Vrabelem, jenž dostal peněžitý trest za tvrzení o plánovaném českém jaderném útoku na Rusko. V nálezu zdůraznil ""kardinální význam svobody...",en,"The Constant Court ruined the verdict over the sparrow, imposed freedom of speech","Brno - The constant court (US) ruined the judgment over Ladislav Vrabel, Jenz was punished for the claim for the planned Czech nuclear of the Utok on Russia. In the found he was ""Cardinal's meaning of freedom ...",2025-03-18 09:23:00
cz,Austrálie chce od Číny vysvětlení dopisů žádajících informace o disidentech,"Austrálie žádá Čínu o vysvětlení původu anonymních dopisů, které některým lidem v Austrálii nabízely odměnu za informace o místě pobytu dvou hongkongských disidentů. S odvoláním na australské ministerstvo zahraničí to napsala agentura Reuters.The post Austrálie chce od Číny vysvětlení dopisů žádajících informace o disidentech appeared first on Epoch Times ČR.",en,Australia wants to explain from the cines a letter to the information about the dissevents,"Australia Zada ​​Cina on explaining the origin of anonymous letter that some people in Australia offered to delete for information about the place of stay of two Hong Kong dissident. With appeal to the Australian Foreign Ministry, it was written by Reuters.The Post Australia wants to explain from the Czech Republic to the letter of information about the Appeared First On the Times Cr.",2025-03-18 09:22:45
cz,Němečtí poslanci debatují o finančním balíku na obranu a investice,"Berlín - V Německu dnes začala mimořádná schůze Spolkového sněmu, na které by poslanci měli schválit obsáhlý finanční balík, a zajistit tak stovky miliard eur na obranu a investice do infrastruktury....",en,German MEPs I debate on financial Balica for defense and investment,"Berlin - In Germany today, a meeting of a federal dream, on which MEPs should approve of the financial package, provide hundreds of billions of euros to defense and investment in infrastructure ....",2025-03-18 09:22:00
cz,Němečtí poslanci schválili obsáhlý finanční balík s penězi na obranu a investice,"Berlín - Poslanci německého Spolkového sněmu dnes na mimořádné schůzi schválili obsáhlý finanční balík, který má zajistit stovky miliard eur na obranu a investice do infrastruktury. Podpořily ho strany...",en,German MEPs applied to the financial package with money for defense and investment,"Berlin - The Members of the German Federal Dream today have an extraordinary meeting applied to the financial packaging, which should provide hundreds of billions of euros to defense and investment in infrastructure. He was supported by the parties ...",2025-03-18 09:22:00
cz,"Trump zvažuje uznání ruské anexe Krymu, Kyjev kreslí nové červené linie","Americká administrativa zvažuje, že uzná ruskou anexi Krymu. S odkazem na své zdroje to uvedl zpravodajský portál Semafor. Kyjev zase před úterním telefonátem mezi Trumpem a Putinem vysílá signály, co by pro něj v rámci mírové dohody bylo už nepřijatelné.",en,"Trump consider recognition of Russian annexation of Crimea, Kyiv has drawn new red line","The US administration considers that the recognition of Russian annexation of Crimea. With reference to his resources, Portal Semafor said it. Kiev, in turn, before the tongue phone between Trump and Putin, dragged the signals of what would be uncomfortable for it in the Mirova Agreement.",2025-03-18 09:22:00
cz,"Lidé se mohou v sobotu seznámit s prací meteorologů, tématem jsou extrémy počasí",Praha - Lidé mohou v sobotu 22. března navštívit některá pracoviště Českého hydrometeorologického ústavu (ČHMÚ) během každoročního Dnu otevřených dveří. Letošním tématem jsou extrémy počasí. Pobočky...,en,"People can get acquainted on Saturday with the work of a meteorologist, the theme is the extremes of Pocasi","Prague - People can visit some of the Czech Hydrometeorological Settings on Saturday, June 22, during the every day of the open door. This year I Themes are Extremes Pocasi. Backy ...",2025-03-18 09:22:00
cz,Němečtí poslanci debatují o obsáhlém balíku s penězi na obranu a investice,"Berlín - V Německu dnes začala mimořádná schůze Spolkového sněmu, na které by poslanci měli schválit obsáhlý finanční balík, a zajistit tak stovky miliard eur na obranu a investice do infrastruktury....",en,German MEPs I debate with the service of Balica with money for defense and investment,"Berlin - In Germany today, a meeting of a federal dream, on which MEPs should approve of the financial package, provide hundreds of billions of euros to defense and investment in infrastructure ....",2025-03-18 09:22:00
cz,Poslední v Evropě. Kojenecké ústavy se po letech přešlapování zavřely,Je to však jen jeden z kroků na cestě ke zlepšení péče o ohrožené děti,en,Last in Europe. Infant constituents have closed after years,It is just one of the step on the ceste to improve the furnace of the endeavors of children,2025-03-18 12:30:00
cz,V Liberci dojde k úplné uzavírce tunelu 18. 3. 2025 v 20:00 hod z důvodu havárie inženýrských sítí,Dnes 18. 3. 2025 v 20:00 hod. dojde cca na 20 minut k úplné uzavírce silnice I/35 v Libereckém tunelu z důvodu havárie inženýrských sítí. “V průběhu bouracích prací v tunelu jsme shledali havarijní stav napájecích kabelů světelné signalizace nad,en,In Liberec there will be a completely closure of tunnel 18. 3. 2025 at 20:00 pm,"Today 18. 3. 2025 at 20:00. The road I/35 in the Liberec tunnel for about 20 minutes will be completely closed. In the tunnel, we found the emergency state of the cable of the light signaling above the tunnel",2025-03-18 12:30:00
cz,"Za úpadek českých cukrovarů nemůže jen Ukrajina, ale i země, kde se nevyrábí","Minulý týden skončil jeden z cukrovarů v Česku a stále častěji se objevují hlasy, že důvodem jsou rostoucí dovozy levného cukru z Ukrajiny. Tak jednoduché to ale není.",en,"For the fall of the Czech sugar refinery, not only Ukraine, but also the earth, where they do not get burned","Last week, one of the sugar refinery in the Czech Republic ended, and there are still voices that the reason is to grow cheap sugar from Ukraine. But it's not that simple.",2025-03-18 12:30:00
cz,"Podle úřadu můžou za loňské drahé máslo „výrobní náklady“, trh fungoval","Zdražování másla ve druhé polovině loňského roku bylo způsobené objektivními příčinami, především značným růstem nákladů na jeho výrobu. V tiskové zprávě to dnes uvedl Úřad pro ochranu hospodářské soutěže.",en,"According to the urada, they can make the Lonské expensive production, the market worked","The showcase in the other half of the Lon year was caused by the objective prague, before the branded rustle laid on its production. In the press report, this was stated today by Urad for the Protection of Economic Society.",2025-03-18 12:29:53
cz,"ANTOŠOVA BŘITVA: Motákovy emoce mě neuvěřitelně bavily, byl skvělej! Stejně jako celá série","Praha zažila hokejový svátek. Přes 34 tisíc diváků v O2 areně na dvě čtvrtfinálová utkání Sparty s Třincem, monstrózní předzápasový program a hokej jako řemen, který musel bavit úplně každého. Je to fakt neuvěřitelná série.",en,"Antos's Britva: Motak's emotions enjoyed me incredibly, he was great! Just like a whole series","Prague experienced Hockey's Hockey. Over 34 thousand views in the two -folds of the Sparta, the TRINCE, a monstrous progress program and hockey as a remedy that had to entertain everywhere. It's a really incredible series.",2025-03-18 12:29:33
cz,Jana Nagyová zřejmě přijde o imunitu v kauze Čapí hnízdo,"Členové Výboru pro právní záležitosti (JURI) doporučili europoslancům, aby zbavili imunity Janu Nagyovou (ANO) z frakce Patrioti pro Evropu. Je jednou z obžalovaných v kauze Čapí hnízdo.",en,Jana Nagyova apparently about the immunity in the Capi Hnízdo case,The Clenic Center for the Polnice (Yuri) recommended MEPs to relieve Jan Nagy's immunity (YES) from the patriots for Europe. He is one of the habituals in the CAPI Hnízdo case.,2025-03-18 12:27:48
cz,Řidič nabral na přechodu v Bruntále dvě děti. Od nehody s nadávkami ujel,"Po neznámém řidiči, který se v Dukelské ulici v centru Bruntálu střetl se dvěma dětmi, pátrá policie. Nehoda se stala v pondělí před budovou Wellness centra. Školáci sice neutrpěli žádná viditelná zranění, řidič však v rozporu se zákonem i slušnými mravy z místa nehody ujel, aniž by se zajímal o jejich další osud.",en,Ridic gained two children on the prechod in Bruntale. Since the accident with the caddles has been offending,"After a non -driver, which in Dukelske Street in the center of Bruntal stretched with two children, the floors of the police. The accident happened on Monday in front of the Wellness Center building. Although the scrolling does not spend any visible injured, the driver, contrary to the end and the decent morals of the accident, missed the accident, without interest in their other fate.",2025-03-18 12:26:54
cz,Nagyová může přijít o imunitu. Klíčový výbor europarlamentu podpořil její další stíhání,"Europoslanci z výboru pro právní záležitosti (JURI) doporučili zbavit imunity Janu Nagyovou (ANO) z frakce Patrioti pro Evropu, která je v Česku stále obžalovaná v kauze Čapí hnízdo. Informoval o tom na sociální síti X europoslanec Tomáš Zdechovský.",en,Nagy's can receive immunity. Klicovy Vanger of the European Parliament supported her other manner,"The MEPs from the Choir for the Foreign Association (Juri) recommended to rid the immunity of Jan Nagyová (YES) from the faction of the patriots for Europe, which is still horrified in the CAPI Hnízdo case. MEP Tomas Zdechovsky informed about it on the social siti x.",2025-03-18 12:26:00
cz,"Roky trýznila partnerova syna, dostala podmínku: Zvrat v případu! Soud jej musí projednat znovu","Případem ženy z Plzeňska, která tři roky trýznila partnerova syna, se musí znovu zabývat Vrchní soud v Praze. Původně jí uložil jen podmínku. Nejvyšší soud (NS) ale vyhověl dovolání nejvyššího státního zástupce Igora Stříže, který s tím nesouhlasil. ČTK to bez dalších podrobností řekla mluvčí Nejvyššího soudu Gabriela Tomíčková. Plné odůvodnění zatím není dostupné.",en,"For years she trained her partner's son, got the condition: reversal in case! The court must discuss it again","The female of Pilsen, who has trapped his partner's son for three years, must be re -established by the High Court in Prague. It was only suppressed by the condition. But the highest judgment (NS) complied with the appeal of the highest statutory representative Igor Strize, who disagreed with this. CTK it without other details of the complaint of the testimony of Gabriel Tomickova's highest court. Fully rejection is not available.",2025-03-18 12:26:00
cz,Sedlák se ve čtvrtfinále těší na Zohornu: S takovými hráči je vždycky velká zábava,"Kapitán hokejového Dynama Lukáš Sedlák patří k nejkomplexnějším hráčům pardubické sestavy. Střílí góly, vytváří pozice pro spoluhráče, ale zároveň se nebojí chodit do prostorů, kde to bolí. A nemá problém vyvolávat konflikty se soupeři. Těch pravděpodobně přibude během čtvrtfinálové série s Českými Budějovicemi, která začíná už v úterý v 17 hodin v enteria areně — a to zejména v brankovištích.",en,The saddle is in the thicarfinale tesi on the zohorn: with such playing is always a big entertainment,"Captain of the hockey dynamo Lukas Sedlak belongs to the most comprehensive game Pardubice set. They stared goals, create positions for co -horses, but also I don't be afraid to go to the space where they were. And there is no problem to induce conflicts with a folder. These are likely to prib you during the quarterfinal series with the Czechs Budejovice, which starts at 5 pm in the Enteria Arena, especially in the goalies.",2025-03-18 12:26:00
cz,Radioporadna: Odvahu do života doporučuje finanční poradce Radim Frolík: Peníze je dobré investovat a dál (audio),"Finanční radioporadna. Peníze vládnou světu, jak je namnožit, jak si je uchovat na horší časy, jak mít z čeho žít v důchodu? Pro koho má smysl spoření a pro koho ne? A proč po mnoha letech stále není v širším povědomí znám rozdíl mezi různými druhy a",en,Radioporadna: The courage in life is recommended by the financial advisor Radim Frolik: The money is good to invest and gave (audio),"Financial radioporadna. Make -up the rulers of the world, how to make it, how to keep them on worse time, how to live in spirit in spirit? For whom does it make sense of deposit and for whom not? And why after many years is still not in the sires of the difference between different types and",2025-03-18 13:03:00
cz,Fiala s Babišem přešli na nový způsob vzájemné komunikace,"Lžete a manipulujete. Zhruba v tomto duchu by se dal shrnout další ze série epistolární komunikace mezi předsedou hnutí ANO Andrejem Babišem a premiérem Petrem Fialou (ODS). Tentokrát odpověděl Babiš na pondělní premiérův dopis a zjevně očekává, že korespondence plná vzájemného obviňování z neschopnosti bude pokračovat.",en,Fiala with Babis Presli on a new way,"Lzete and manipulate. Roughly in this spirit, one could summarize another of the series Epistolar Communication between the forecast of YES movements Andrej Babis and Premier Petr Fiala (ODS). This time, Babis answered a letter to Monday premieruv and obviously comply with the correspondence of the full accusation of inability to continue.",2025-03-18 13:02:41
cz,Kvitovou čeká třetí zápas po mateřské pauze,Petru Kvitovou po téměř dvoutýdenní pauze čeká další duel. V Miami nastoupí česká tenistka proti Sofii Keninové z USA. Zápas začíná v 19:00 a Sport.cz nabídne podrobnou online reportáž.,en,Kvita Ceka Treti Zapas after Matuske pause,"Petra Kvitova after almost a two -day break waiting for another duel. In Miami, a Czech tennis player against Sofia Keninove from the USA. Zacina starts at 19:00 and Sport.cz will offer a detailed online report.",2025-03-18 13:02:31
