iso_code,title,description,lang_tranlation,title_translated,description_translated,pubDate
pt,PTP pede melhorias no transporte de mercadorias para a Madeira,"A presidente do Partido Trabalhista Português (PTP), Raquel Coelho, defende melhorias nas ligações marítimas de transporte de mercadorias para a Madeira, sustentando que hoje é mais caro ser madeirense do que lisboeta.",en,PTP calls for improvements in the transport of goods to wood,"The president of the Portuguese Labor Party (PTP), Raquel Coelho, advocates improvements in the maritime transportation connections to Madeira, maintaining that today it is more expensive to be Madeiran than Lisbon.",2025-05-09 05:18:19
pt,Líder norte-coreano supervisiona exercício de contra-ataque nuclear,"O líder da Coreia do Norte, Kim Jong-un, supervisionou diretamente um exercício de contra-ataque nuclear, que incluiu um teste de míssil tático e artilharia de longo alcance, informou hoje a agência estatal KCNA.",en,North Korean leader supervises nuclear counterattack exercise,"North Korean leader Kim Jong-un directly supervised a nuclear counterattack exercise, which included a long-range tactical and artillery test, state agency KCNA said today.",2025-05-09 05:18:19
pt,Lula da Silva vai à China em busca de investimentos no meio da guerra comercial de Trump,"O Presidente brasileiro visita Pequim segunda e terça-feira para atrair investimentos, no meio da guerra comercial iniciada com as tarifas impostas pelo Presidente dos Estados Unidos, Donald Trump, cujo principal alvo é a China.",en,Lula da Silva goes to China in search of investments in the middle of Trump's trade war,"The Brazilian president visits Beijing Monday and Tuesday to attract investments, in the middle of the trade war started with the tariffs imposed by the president of the United States, Donald Trump, whose main target is China.",2025-05-10 07:24:26
pt,"Cavaliers, com Mitchell em destaque, respondem aos Pacers e regressam à série","Os Cleveland Cavaliers venceram os Indiana Pacers por 126-104, reduzindo a desvantagem na série da semifinal da Conferência Este para 1-2",en,"Cavaliers, with Mitchell prominently, respond to Pacers and return to the series","The Cleveland Cavaliers beat the Indiana Pacers by 126-104, reducing the disadvantage in the semifinal series of the conference to 1-2",2025-05-10 07:23:53
pt,Kiara Fernandes joga pela seleção nacional sub/17,A jogadora do Anadia Squash Clube integra a equipa lusa que está a disputar o Campeonato da Europa por Países de Equipas Mistas em Bordéus,en,Kiara Fernandes plays for the national team under/17,Anadia Squash Club player is part of the Lusa team that is playing the European championship for mixed teams in Bordeaux teams,2025-05-10 07:22:25
pt,Presidenta do México anuncia processo contra Google; entenda,,en,Mexico President announces a lawsuit against Google; understand,,2025-05-10 07:20:01
pt,Lucros a descer: será 2025 um ano mais difícil para a banca nacional?,"O Santander, o BPI, o Novo Banco e o Montepio já apresentaram os seus resultados relativos ao primeiro trimestre de 2025. O que nos contam os números? A análise deste tema foi feita pela jornalista da secção de Economia do Expresso Isabel Vicente. Ouça o novo episódio do Economia dia a dia, podcast diário do Expresso, conduzido por Juliana Simões",en,Profits to go down: Is it 2025 a harder year for the national bank?,"Santander, BPI, Novo Banco and Montepio have already presented their results related to the first quarter of 2025. What do the numbers tell us? The analysis of this theme was made by the journalist of the Economics Section of Expresso Isabel Vicente. Listen to the new episode of Economics Day by Day, Daily Expresso Podcast, led by Juliana Simões",2025-05-10 07:20:00
pt,Abatem árvore centenária e filmam crime. Podem apanhar dez anos de prisão,"A dupla cometeu o crime em 2023, no Reino Unido. Dois anos depois foram considerados culpados e, em breve, conhecerão a sentença.",en,Slack centenary tree and filming a crime. Can catch ten years in prison,The duo committed the crime in 2023 in the UK. Two years later they were considered guilty and will soon know the sentence.,2025-05-10 07:19:56
pt,Embaixador português na Roménia pede mais ligações aéreas diretas ao país,"O embaixador português em Bucareste defendeu, em entrevista à Lusa, a necessidade de mais ligações aéreas diretas entre Portugal e a Roménia, para fomentar o turismo e o aprofundamento de relações entre os dois países dos extremos da Europa.",en,Portuguese ambassador in Romania asks for more direct air connections to the country,"The Portuguese ambassador in Bucarest defended, in an interview with Lusa, the need for more direct air connections between Portugal and Romania, to foster tourism and the deepening of relations between the two countries of the extremes of Europe.",2025-05-10 07:19:56
pt,Arquivo preserva protestos pró-democracia em Hong Kong à espera de justiça,"Um novo arquivo quer preservar a memória dos protestos pró-democracia de 2019 em Hong Kong, na esperança de que no futuro os responsáveis por violações dos direitos humanos sejam responsabilizados, disse à Lusa um porta-voz.",en,File preserves pro-democracy protests in Hong Kong waiting for justice,"A new archive wants to preserve the memory of the 2019 pro-democracy protests in Hong Kong, hoping that in the future those responsible for human rights violations will be held responsible, a spokesman told Lusa.",2025-05-10 07:19:56
pt,"EUA ""mais atentos"" aos problemas do mundo com Leão XIV, diz jesuíta","O jesuíta português Ricardo da Silva, vigário numa igreja de Nova Iorque, acredita que Leão XIV poderá ajudar os norte-americanos a ""prestarem mais atenção"" e a ficarem mais ""sensibilizados"" face aos problemas e necessidades do mundo.",en,"USA ""most attentive"" to the world's problems with Lion XIV, says Jesuit","Portuguese Jesuit Ricardo da Silva, a vicar in a New York church, believes that Leo XIV could help Americans ""pay more attention"" and get more ""sensitized"" in the face of the problems and needs of the world.",2025-05-10 07:19:56
pt,Acordo selado. Arsenal garante primeiro (e milionário) reforço de 2025/26,Zubimendi está de 'malas aviadas' para deixar a Real Sociedad rumo a Londres.,en,Sealed agreement. Arsenal guarantees first (and millionaire) reinforcement of 2025/26,Zubimendi is in 'aviated bags' to leave Real Sociedad towards London.,2025-05-10 07:19:55
pt,Papa Leão XIV emite primeira mensagem especificamente destinada ao Brasil,"Vídeo foi divulgado no perfil oficial do Padre Marcelo Rossi, que recebeu o vídeo de um amigoOriginalmente publicado em Papa Leão XIV emite primeira mensagem especificamente destinada ao Brasil, Conteúdo original de Jornal Midiamax | Notícias de Campo Grande e Mato Grosso do Sul.",en,Papa Leão XIV emits first message specifically intended for Brazil,"Video was released in the official profile of Father Marcelo Rossi, who received the video of a friendly published in Papa Leão XIV emits first message specifically intended for Brazil, original content of newspaper Midiamax | News from Campo Grande and Mato Grosso do Sul.",2025-05-11 03:21:51
pt,4h. Rui Borges pede foco para vencer campeonato,"O técnico leonino está satisfeito com o desempenho dos leões frente ao Benfica, mas pede especial foco na última jornada. Ainda, Vladimir Putin propõe novas negociações de paz.",en,4h. Rui Borges asks focus to win championship,"The Leonino coach is pleased with the performance of the lions against Benfica, but asks for a special focus on the last day. Also, Vladimir Putin proposes new peace negotiations.",2025-05-11 03:17:26
pt,Operário supera Creespom-DF e avança para a segunda fase do Brasileiro Feminino A3,"Com um gol salvador de Aíssa nos acréscimos da primeira etapa, o Galo fez história e avançou para a segunda fase pela primeira vem sua históriaOriginalmente publicado em Operário supera Creespom-DF e avança para a segunda fase do Brasileiro Feminino A3, Conteúdo original de Jornal Midiamax | Notícias de Campo Grande e Mato Grosso do Sul.",en,Worker surpasses Creespom-DF and advances to the second phase of the Brazilian female A3,"With a savior goal of AiSassa in the additions of the first stage, the Rooster made history and advanced to the second phase for the first comes its history and published in Operário surpasses Creespom-DF and advances to the second phase of Brazilian female A3, original content of Midiamax newspaper | News from Campo Grande and Mato Grosso do Sul.",2025-05-11 02:55:36
pt,Confronto em Itaporã termina em morte após denúncia de violência doméstica,"Na residência foram apreendidas três armas de fogo que seriam de posse do homem que acabou mortoOriginalmente publicado em Confronto em Itaporã termina em morte após denúncia de violência doméstica, Conteúdo original de Jornal Midiamax | Notícias de Campo Grande e Mato Grosso do Sul.",en,Confrontation in Itaporã ends in death after complaint of domestic violence,"At the residence three firearms were seized that would be in possession of the man who was eventually deadly published in a clash in Itaporã ends in Death after denunciation of domestic violence, original content of newspaper Midiamax | News from Campo Grande and Mato Grosso do Sul.",2025-05-11 02:45:58
pt,Totoloto. Saiba qual é a chave vencedora deste sábado,,en,Totoloto. Find out what is the winning key this Saturday,,2025-05-11 02:43:34
pt,Flamengo mantém tabu e derruba Bahia no Maracanã com gol solitário de Arrascaeta,"Flamengo reassumiu de forma provisória a liderança do Campeonato Brasileiro, mas pode ser ultrapassado pelo Palmeiras no domingoOriginalmente publicado em Flamengo mantém tabu e derruba Bahia no Maracanã com gol solitário de Arrascaeta, Conteúdo original de Jornal Midiamax | Notícias de Campo Grande e Mato Grosso do Sul.",en,Flamengo keeps taboo and knocks Bahia in Maracanã with solitary goal of Arrascaeta,"Flamengo reassured the leadership of the Brazilian Championship provisionally, but can be overtaken by Palmeiras on Sunday Originally published in Flamengo maintains taboo and knocks down Bahia in Maracanã with solitary goal of Arrascaeta, original content of newspaper Midiamax | News from Campo Grande and Mato Grosso do Sul.",2025-05-11 02:19:27
pt,3h. Montenegro acusa PS de espalhar medo,"Luís Montenegro considera-se o ""farol"" da política portuguesa. Ainda, Mariana Mortágua apela ao voto dos “invisíveis”.",en,3h. Montenegro accuses PS of spreading fear,"Luís Montenegro is considered the ""lighthouse"" of Portuguese politics. Still, Mariana Mortágua appeals to the vote of the ""invisible"".",2025-05-11 02:14:16
pt,Corpo de arquiteto desaparecido após show da Lady Gaga é encontrado,"Arquiteto Igor Sousa havia desaparecido na Praia de Copacabana, no Rio de Janeiro, foi encontrado próximo às Ilhas Cagarras na manhã deste sábado (10)Originalmente publicado em Corpo de arquiteto desaparecido após show da Lady Gaga é encontrado, Conteúdo original de Jornal Midiamax | Notícias de Campo Grande e Mato Grosso do Sul.",en,Missing architect body after Lady Gaga show is found,"Architect Igor Sousa had disappeared on Copacabana beach in Rio de Janeiro, was found near the Cagarras islands on Saturday morning (10) originally published in a missing architect body after Lady Gaga concert is found, original content from Midiamax newspaper | News from Campo Grande and Mato Grosso do Sul.",2025-05-11 02:01:00
pt,"Trump anuncia ""grandes progressos"" nas negociações entre China e EUA","O Presidente dos Estados Unidos, Donald Trump, congratulou-se no sábado com os ""grandes progressos"" das negociações com a China, em Genebra, sobre as tarifas.",en,"Trump announces ""great progress"" in negotiations between China and USA","United States President Donald Trump welcomed on Saturday with the ""great progress"" of negotiations with China in Geneva on tariffs.",2025-05-11 02:00:34
pt,Bahrein vence Leão de Ouro da Bienal de Arquitetura de Veneza,"A sustentabilidade e a luta contra o calor extremo, propostas do reino do Bahrein para a Bienal de Arquitetura de Veneza deste ano, venceram neste sábado o Leão de Ouro do Melhor Pavilhão, anunciou o júri.O pavilhão, justificou, oferece uma proposta viável para as condições de calor extremo. ""A arquitetura deve enfrentar os desafios duplos da resistência ambiental e da sustentabilidade"", diz o júri citando os criadores.0. Imagem inserida a 28/04/2025 17:26O Leão de Ouro do melhor pavilhão, na",en,Bahrain beats the Golden Leão at the Venice Architecture Biennial,"Sustainability and the fight against extreme heat, proposals from the Bahrain Kingdom to the Venice Architecture Biennial of this year, won the Golden Lion of the best pavilion on Saturday, the jury announced. The pavilion, justified, offers a viable proposal for extreme heat conditions. ""Architecture must face the double challenges of environmental resistance and sustainability,"" says the jury by citing the creators. Image inserted on 28/04/2025 17: 26th Golden Lion of the best pavilion, in",2025-05-11 02:00:00
pt,No dia em que já não restarem enfermeiros,"É essencial garantir que os profissionais de enfermagem estejam protegidos, valorizados e capacitados para exercerem o seu papel com mestria. Opinião de Lúcia Leite",en,The day there are no longer nurses,"It is essential to ensure that nursing professionals are protected, valued and trained to play their role with mastery. Lúcia Leite's opinion",2025-05-12 05:19:00
pt,Pequim recebe Lula e outros líderes para reforçar laços contra Trump,"Pequim recebe hoje vários líderes latino-americanos, a começar pelo Presidente do Brasil, na véspera de um fórum diplomático que visa reforçar as relações com a região, face às tensões comerciais com Washington.",en,Beijing receives Lula and other leaders to reinforce ties against Trump,"Beijing today receives several Latin American leaders, starting with the President of Brazil, on the eve of a diplomatic forum aimed at reinforcing relations with the region, in the face of commercial tensions with Washington.",2025-05-12 05:18:52
pt,Campanha entra hoje na última semana com AD e PS a cruzarem-se em Espinho,"A campanha eleitoral entra hoje na última semana com os partidos a terem ações de norte a sul do país e as comitivas da AD e PS a cruzarem-se na feira de Espinho, terra de Luís Montenegro.",en,Campaign enters today in the last week with AD and PS to cross in Espinho,"The election campaign enters the last week today with the parties to have actions from north to south of the country and AD and PS entourages to cross at the Fair of Espinho, Land of Luís Montenegro.",2025-05-12 05:18:52
pt,Sofre com rinite alérgica? Esta infusão pode aliviar os sintomas,Já ouviu falar em tanchagem?,en,Do you suffer from allergic rhinitis? This infusion can relieve symptoms,Have you heard of a tancha?,2025-05-12 05:18:50
pt,6h. Greve da CP continua até quarta-feira,"A Comboios de Portugal prevê assegurar aproximadamente 50% dos serviços habituais. É o sexto dia consecutivo de paralisação e foi prolongada até quarta-feira, 14 de maio.",en,6h. CP strike continues until Wednesday,"Comboios de Portugal provides to ensure approximately 50% of the usual services. It is the sixth consecutive day of stoppage and was extended until Wednesday, May 14.",2025-05-12 05:15:24
pt,Taça é festa: os dias do futebol feminino,"Futebol#NãoPára é o espaço de opinião quinzenal de Vasco Pinho, diretor da Federação Portuguesa de Futebol",en,Cup is party: The days of women's football,Soccer,2025-05-12 05:10:00
pt,Bónus vitalício no Montepio já chega a 65 gestores e custa 30 milhões,"O grupo Montepio paga uma pensão vitalícia a actuais e ex-gestores que não resulta de qualquer contribuição. Na lista estão Tomás Correia, Carlos Tavares e Vítor Melícias. Factura já pesa nas contas.",en,Bonus Vitalitius in Montepio already reaches 65 managers and costs 30 million,"The Montepio Group pays a lifetime pension to current and former managers who do not result from any contribution. On the list are Tomás Correia, Carlos Tavares and Vítor Melícia. Invoice already weighs in the accounts.",2025-05-12 05:08:00
pt,"Trump anuncia medida para baixar preços dos medicamentos nos EUA entre 30% e 80%, sem explicar como","O Presidente norte-americano, Donald Trump, anunciou este domingo que vai assinar hoje uma ordem executiva que, segundo ele, vai reduzir o preço dos medicamentos sujeitos a receita médica nos Estados Unidos entre 30% e 80%",en,"Trump announces measure to lower US drug prices between 30% and 80%, without explaining how","US President Donald Trump announced this Sunday that he will sign an executive order today that, according to him, will reduce the price of medicines subject to revenue in the United States between 30% and 80%",2025-05-12 05:05:58
pt,Sobre crimes na nossa rua,"Crime na nossa rua! Bem-vindos ao primeiro episódio de CSI de Casal. Esta semana falamos de como se partilha gossip de um prédio, do nosso ódio a um caixa do Continente e de engatar na Ovibeja.",en,About crimes on our street,"Crime on our street! Welcome to the first episode of Caso de Casal. This week we talk about how to share gossip from a building, our hatred to a continent's cashier and to engage at Ovibeja.",2025-05-12 05:05:36
pt,"O ""perdão"" deve ser instrumento de liderança?",Em que situações ou perante que erros devem os líderes perdoar? E há um perdão sincero e um perdão instrumental? Hoje falamos sobre a necessidade de perdoar.,en,"Should ""forgive"" be a leadership instrument?",In what situations or in the face of mistakes should leaders forgive? And is there a sincere forgiveness and an instrumental forgiveness? Today we talk about the need to forgive.,2025-05-12 05:05:12
pt,Os políticos ao chegarem às feiras ficam como os feirantes ou já chegam lá assim? Quem ganhou num terreno onde Portas era imbatível?,A feira de Espinho recebeu na mesma manhã a visita de sete caravanas partidárias. Os políticos disputaram com os feirantes a atenção dos clientes e alguns vendedores não gostaram de ter tanto tempo perdido,en,Do politicians when they get to the fairs look like the marketers or get there? Who won on a terrain where doors were unbeatable?,The thorn fair received the visit of seven party caravans. Politicians disputed with the marketers the attention of customers and some salespeople did not like to have lost so much time,2025-05-13 06:30:00
pt,"Saiu a lotaria à feira de Espinho, na mesma manhã recebeu sete partidos. Montenegro jogava em casa, correu-lhe bem?",A feira de Espinho recebeu na mesma manhã a visita de sete caravanas partidárias. Os políticos disputaram com os feirantes a atenção dos clientes e alguns vendedores não gostaram de ter tanto tempo perdido,en,"The lottery came out at the Fair of Espinho, the same morning received seven parties. Montenegro played at home, did you go well?",The thorn fair received the visit of seven party caravans. Politicians disputed with the marketers the attention of customers and some salespeople did not like to have lost so much time,2025-05-13 06:30:00
pt,Brasil e Portugal buscam se conectar com o que há de mais moderno no tráfego aéreo,"Começa em Lisboa, nesta terça-feira, o AirSpace World 2025, que reúne, no Parque das Nações, as maiores empresas e instituições internacionais de controle do tráfego aéreo no mundo.",en,Brazil and Portugal seek to connect with the latest in air traffic,"It starts in Lisbon on Tuesday, the Airspace World 2025, which brings together, in Parque das Nações, the largest companies and international air traffic control institutions in the world.",2025-05-13 06:30:00
pt,"Aumenta o número de pessoas em situação de sem-abrigo nas urgências hospitalares que procuram teto, comida e higiene",Muitos acabam por abandonar o espaço antes de serem chamados para a consulta.,en,"Increases the number of people in a homeless situation at hospital emergency rooms looking for ceiling, food and hygiene",Many end up abandoning the space before they are called for the consultation.,2025-05-13 06:29:55
pt,Defesa ou desenvolvimento?,"Os 2% do PIB em Defesa correspondem a mais de um quarto da totalidade das verbas do PRR. O PRR, sim, é um instrumento de desenvolvimento.",en,Defense or development?,"The 2% of GDP in defense correspond to more than a quarter of all the funds of PRR. PRR, yes, is an instrument of development.",2025-05-13 06:29:00
pt,Actuação dos NAPA na primeira semifinal da Eurovisão entre as notícias que marcam esta terça-feira,"Portugal compete hoje por um lugar na final do 69.o Festival Eurovisão da Canção, a decorrer em Basileia, na Suíça, com a canção ""Deslocado"", interpretada pelos Napa.A passagem à etapa decisiva, no entanto, será difícil, segundo as casas de apostas. Na segunda-feira à tarde, Portugal surgia em 15.o lugar, nas apostas relativas à primeira semifinal.A realização de duas semifinais, para apurar os países em competição na final, aconteceu pela primeira vez em 2008 e, desde então, Portugal falhou c",en,Napa performance in the first semifinal of Eurovision among the news that marks this Tuesday,"Portugal is currently competing for a place in the 69th final. The Eurovision Song Festival, taking place in Basel, Switzerland, with the song ""Displaced"", played by Napa. The decisive stage passage, however, will be difficult, according to betting houses. On Monday afternoon, Portugal appeared in 15th place, in the bets related to the first semifinal. The realization of two semifinals, to investigate the countries in competition in the final, happened for the first time in 2008 and since then Portugal failed C",2025-05-13 06:27:57
pt,Acerto de Contas nos rendimentos: Os portugueses pagam demasiados impostos?,"Seis conversas de 15 minutos entre a diretora editorial do SAPO, Joana Petiz, e o economista e presidente do ISEG João Duque sobre seis temas que marcam a campanha às Legislativas 2025. Hoje fala-se de caminhos para a progressão dos salários e rendimentos.",en,Setting accounts on income: Do Portuguese pay too much taxes?,Six 15-minute conversations between SAPO editorial director Joana Petiz and Economist and President of ISEG João Duque about six themes that mark the campaign to legislatures 2025. Today we talk about ways for the progression of salaries and income.,2025-05-13 06:26:00
pt,"Trump diz que seria ""estúpido"" recusar avião presidencial oferecido pelo Qatar","Família real dos Emirados está a preparar a oferta aos Estados Unidos de um Boeing 747-8, avaliado em 360 milhões de euros.",en,"Trump says it would be ""stupid"" to refuse presidential plane offered by Qatar","Royal family of the Emirates is preparing the offer to the United States of a Boeing 747-8, valued at 360 million euros.",2025-05-13 06:25:51
pt,Telemóvel em alta voz nos transportes dá multa até 250 euros,"A lei tem quase 20 anos, mas são poucas as coimas aplicadas na última década. A Autoridade da Mobilidade e dos Transportes (AMT) quer mais fiscalização e enviou ao governo uma proposta que lhe dá mais poderes para atuar.",en,High voice mobile phone in transport gives fine up to 250 euros,"The law is almost 20 years old, but there are few fines applied in the last decade. The Mobility and Transport Authority (AMT) wants more supervision and sent the government a proposal that gives it more powers to act.",2025-05-13 06:25:08
pt,Pequim levanta proibição às companhias aéreas chinesas de receberem aviões da Boeing,"Ainda assim, o restabelecimento das entregas de aviões poderá ser de curta duração, caso a guerra tarifária não venha a ser resolvida durante os três meses de suspensão.",en,Beijing raises a ban on Chinese airlines to receive Boeing aircraft,"Still, the restoration of aircraft deliveries may be short -term if the tariff war is not resolved during the three months of suspension.",2025-05-13 06:24:56
pt,Revisão contratual para Geny Catamo,Moçambicano vai ter condições revistas durante o verão e avança aquisição da percentagem do passe ao Amora,en,Contractual review for Geny Catamo,Mozambican will have conditions during summer and advances the acquisition of the percentage of the pass to Amora,2025-05-14 08:39:00
