iso_code,title,description,lang_tranlation,title_translated,description_translated,pubDate
cz,"Generace se střídají, on zůstává: audiokniha Dům pod náměstím zdarma",Román Markéty Hejkalové se zaměřil na příběh starého domu a jeho stále se měnících obyvatel. Jaké stopy na osudech zdejších lidí zanechala divoká historie dvacátého století? Uživatelé iDNES Premium získají audioknihu Dům pod náměstím zdarma.,en,"Generations alternate, he remains: Audiobook House under Square FREE",Markéta Hejkalová's novel focused on the story of the Old House and its still changing inhabitants. What traces of the fate of the people have left the wild history of the twentieth century? Idnes Premium users will receive an audiobook house under the square for free.,2025-04-15 22:41:00
cz,Nové číslo časopisu TÝDEN: Co přináší vydání 8/2025?,,en,New issue of the magazine Week: What brings edition 8/2025?,,2025-04-15 22:30:00
cz,Autor Egypťana Sinuheta pátrá po utrpení Ježíše. Audiokniha se 40% slevou,V románu Jeho království: Jedenáct listů Marca Manilia Mezentiana z jara roku 30 po Kristu se Mika Waltari podíval na ukřižování Ježíše Krista jinou perspektivou. Spisovatel proslulý nadčasovým dílem Egypťan Sinuhet přiblížil téma mladším generacím. Uživatelé iDNES Premium získají audioknihu se slevou 40 %.,en,The author of Egypt Sinhet searches for the suffering of Jesus. Audiobook with 40% discount,"In the novel by his kingdom: Eleven leaves of Marc Manilia Mence of the spring of the year 30 After Christ, Mike Waltari looked at the crucifixion of Jesus Christ by another perspective. The writer famous for the timeless work of Egyptian Sinuhet explained the theme to the younger generations. Idnes Premium users will receive an audiobook with a 40 %discount.",2025-04-15 22:29:00
cz,Režisér filmu Sám doma 2 by rád vystřihnul scénu s Trumpem,"Režisér slavného filmu Sám doma 2 s Macaulay Culkinem v hlavní roli Chris Columbus prohlásil, že kvůli studu by si přál, aby byla vystřižena scéna, v níž se na pár vteřin objeví americký prezident Donald Trump. S nadsázkou dodal, že to neudělá, protože by ho Trumpova administrativa mohla deportovat do Itálie, v níž má kořeny. Columbus to řekl v rozhovoru pro server San Francisco Chronicle.",en,Director of the film Alone at home 2 would like to cut out a scene with Trump,"The director of the famous film Alone 2 with Macaulay Culkin in the lead role of Chris Columbus said that for a shame he would like a scene to be cut out in which US President Donald Trump would appear for a few seconds. He added with exaggeration that he would not do it, because Trump's administration could deport him to Italy in which he has roots. Columbus said this in an interview with San Francisco Chronicle.",2025-04-15 22:20:50
cz,Na rozloučení s Aloisem Švehlíkem promluví Pavla Beretová a zazpívá Igor Orozovič,"Rodina, kolegové i veřejnost se ve středu dopoledne rozloučí s Aloisem Švehlíkem. Smuteční obřad hostí historická budova Národního divadla od 11:00. Přímý přenos můžete na iDNES.cz sledovat od 10:30. Legendární herec a dabér zemřel 2. dubna ve věku 85 let.",en,Pavla Beretová speaks to the farewell to Alois Švehlík and sings Igor Orozovich,"Family, colleagues and the public will say goodbye to Alois Švehlík on Wednesday morning. The funeral ceremony hosts the historical building of the National Theater from 11:00. You can watch live broadcast at iDNES.cz from 10:30. The legendary actor and duber died on April 2 at the age of 85.",2025-04-15 22:20:05
cz,Psychiatr zkoumá Lidské vědomí a tajemství smrti. Audiokniha se 40% slevou,Tématy spojenými s umíráním se ve svém díle zabývá renomovaný psychiatr Stanislav Grof. Jak odchod z tohoto světa vnímaly staré civilizace a co o procesu skonu říkají současné výzkumy? Uživatelé iDNES Premium získají audioknihu Lidské vědomí a tajemství smrti se 40% slevou.,en,The psychiatrist examines human consciousness and the mystery of death. Audiobook with 40% discount,The themes associated with dying are dealt with in his work by renowned psychiatrist Stanislav Grof. How did the leaving this world perceived old civilizations and what do current research say about the process? Idnes Premium users will gain an audiobook of human consciousness and the secret of death with a 40% discount.,2025-04-15 22:10:00
cz,V Národním divadle se dnes lidé rozloučí s hercem Aloisem Švehlíkem,"Praha - V Národním divadle (ND) se dnes herečtí kolegové i veřejnost rozloučí s Aloisem Švehlíkem. Pro veřejnost bude historická budova otevřená od 10:30, aby mohli lidé položit květiny na jeviště...",en,At the National Theater today people say goodbye to actor Alois Švehlík,"Prague - At the National Theater (ND), actors today and the public say goodbye to Alois Švehlík. The historic building will be open to the public from 10:30 so that people can lay flowers on the stage ...",2025-04-15 22:10:00
cz,"Ne každý starosta je osvícený. Jeho prioritou nemusí být platit nepedagogy, kritizuje novelu Pištora","Ve středu mají poslanci schvalovat novelu školského zákona, která mimo jiné přesouvá odpovědnost za financování nepedagogických pracovníků na zřizovatele škol, tedy obce. „De facto nám to nebylo předkládáno, abychom o tom diskutovali, ale bylo nám to předloženo jako hotová věc,“ kritizuje v pořadu Dvacet minut Radiožurnálu Zdeněk Pištora, místopředseda Svazu měst a obcí, starosta města Postoloprty na Lounsku.",en,"Not every mayor is enlightened. His priority may not be to pay non -teaching, criticizing the amendment to Pištora","On Wednesday, deputies are to approve the amendment to the Education Act, which, inter alia, shifts responsibility for the financing of non -teaching workers to the founder of schools, ie municipalities. ""We were not de facto presented to discuss it, but we were presented as a finished thing,"" says Zdeněk Pištora, Vice -Chairman of the Union of Towns and Municipalities, Mayor of Postoloprty in the Louny region.",2025-04-15 22:10:00
cz,Soud bude jednat o dohodách o vině a trestu v kauze Dozimetr,"Praha - Obvodní soud pro Prahu 9 dnes bude rozhodovat o tom, zda schválí dohody o vině a trestu sjednané mezi státním zástupcem a podnikateli Pavlem Dovhomiljou a Zakaríou Nemrahem viněnými v kauze...",en,The court will discuss the guilt and punishment agreements in the dosimeter case,Prague - The District Court for Prague 9 today will decide whether to approve agreements on guilt and punishment agreed between the prosecutor and entrepreneur Pavel Dovhomilja and Zakaría Nemrah guilty in the case ...,2025-04-15 22:07:00
cz,Vláda posoudí vstup do řízení ÚS o důchodové reformě či změnu v plánu obnovy,"Praha - Návrh vstoupit jako vedlejší účastník do řízení, ve kterém na návrh hnutí ANO rozhoduje Ústavní soud (ÚS) o zrušení důchodové reformy, dnes posoudí vláda. Na programu má také novelu zákona...",en,The Government assesses the entry into the Pension Reform or the change in the renewal plan,Prague - The proposal to enter as a secondary party to the proceedings in which the Constitutional Court (ÚS) decides on the annulment of pension reform on the proposal of the ANO movement. The program also has an amendment to the law ...,2025-04-15 22:04:00
cz,Slovenskou národní filmovou cenu za nejlepší snímek loňska dostalo drama Vlny,,en,The Slovak National Film Prize for the best film last year received a drama wave,,2025-04-16 21:44:00
cz,"Eurostat: Inflace v EU se v březnu snížila na 2,5 procenta, klesla i v Česku",,en,"Eurostat: Inflation in the EU decreased to 2.5 percent in March, and decreased in the Czech Republic",,2025-04-16 21:34:00
cz,Obyvatelé Libavé už přes půl roku nemohou pít vodu z kohoutku. Obsahuje nadlimitní množství uranu,Víc než půl roku nemůžou obyvatelé Města Libavá na Olomoucku pít vodu z vodovodní sítě. Obsahuje nadlimitní množství uranu. Dodávky pitné vody má na starosti armáda. Termín pro výměnu vadných vodovodních filtrů několikrát odložila. Nyní by se lidé měli dočkat nápravy.,en,Libava residents have not been able to drink water from the tap for over six months. Contains above -the -limit amount of uranium,"For more than half a year, the inhabitants of Libavá in the Olomouc region cannot drink water from the water supply network. It contains above -the -limit amounts of uranium. Drinking water supplies are in charge of the army. The deadline for replacing defective water filters has postponed several times. Now people should wait.",2025-04-16 21:33:00
cz,"Požár a ztroskotání lodi v Kongu si vyžádal 50 mrtvých, stovky se pohřešují",,en,"The fire and shipwreck of the ship in Congo claimed 50 dead, hundreds are missing",,2025-04-16 21:27:00
cz,Izrael si z 30 procent území Pásma Gazy vytvořil nárazníkovou zónu,,en,Israel has created a bumper zone from 30 percent of the Gaza zone,,2025-04-16 21:18:00
cz,Skupina J. A. R. ruší koncerty. Dan Bárta utrpěl poškození sluchu,"Skupina J. A. R. měla naplánované do pražského Lucerna Music Baru tři koncerty. V úterý vystoupila, a bylo vyprodáno. Středeční a čtvrteční sety ale musela přeložit. Její zpěvák Dan Bárta utrpěl traumatické poškození sluchu a nemohl zpívat.",en,Group J. A. R. cancels concerts. Dan Barta suffered hearing damage,The J. A. R. Group had three concerts scheduled for Lucerna Music Bar in Prague. She got out on Tuesday and was sold out. Wednesday and Thursday sets had to translate. Her singer Dan Bárta suffered traumatic hearing damage and could not sing.,2025-04-16 21:15:16
cz,Fotbalisté Arsenalu vyřadili obhájce titulu Real Madrid a po 16 letech postoupili do semifinále Ligy mistrů,Semifinále Ligy mistrů už zná své účastníky. Arsenal porazil na Santiago Bernabéu obhájce titulu Real Madrid a po 16 letech se tak pokusí dostat do finále Ligy mistrů.,en,Arsenal footballers eliminated the defenders of the title Real Madrid and after 16 years advanced to the Champions League semifinals,He already knows his participants. Arsenal defeated Santiago Bernabéu defending champion Real Madrid and after 16 years he will try to get to the final of the Champions League.,2025-04-16 21:04:00
cz,"Fotbalisté Arsenalu vyřadili v LM obhájce trofeje Real, Inter přešel přes Bayern",Madrid/Milán - Fotbalisté Arsenalu vyřadili obhájce trofeje Real Madrid a poprvé od roku 2009 postoupili do semifinále Ligy mistrů. Po úvodní domácí výhře 3:0 dnes zvítězili ve španělské metropoli...,en,"Arsenal footballers eliminated the LM lawyer Real, Inter passed through Bayern",Madrid/Milan - Arsenal footballers have eliminated Real Madrid trophies and for the first time since 2009 they advanced to the Champions League semifinals. After the opening home win 3: 0 today won the Spanish capital ...,2025-04-16 21:04:00
cz,"Byli jsme podělaní, snad to z nás přes noc spadne, pravil spasitel Hanáků Orsava","Olomouc se v prvním duelu baráže o extraligu s Jihlavou protrápila k výhře 2:1 po samostatných nájezdech. Prvoligová Jihlava obrovskou bojovností a úpornou defenzívou dlouho brnkala favoritovi na nervy. Hanáky spasil útočník Jakub Orsava, který nejprve devět sekund před koncem první třetiny vyrovnal na 1:1 a poté utkání rozhodl, když jako jediný ze všech aktérů proměnil samostatný nájezd.",en,"We were fucking, hopefully it will fall overnight, said the Savior of Hanák Orsava","Olomouc in the first duel of the relegation of the extraleague with Jihlava ruptured to win 2: 1 after separate raids. The first league Jihlava has long been nervous about the Favorit of Favorit. Hanaky was saved by attacker Jakub Orsava, who first equalized nine seconds before the end of the first period 1: 1 and then decided the match when he was the only one of all actors to change a separate raid.",2025-04-16 21:01:28
cz,"Saka zazdil penaltu, Arsenal přesto vyřadil Real. Liga mistrů skončila i Bayernu",Pro obhájce triumfu cesta v Lize mistrů skončila. Finále na domácím stadionu si nezahraje ani Bayern Mnichov.,en,"The jacket bricked a penalty, yet Arsenal knocked Real. The Champions League also ended Bayern",The triumph advocate has ended the journey in the Champions League. Bayern Munich will not play the finals at the home stadium.,2025-04-16 21:01:03
cz,Bartoš: Limitovat pomoc lidem ohroženým ztrátou bydlení je špatně. Schválený zákon pomůže jen hrstce,"Poslanecká sněmovna schválila zákon o podpoře bydlení. Proč s výsledkem nejsou spokojeni Piráti, kteří zákon připravovali? „Naším odchodem z vlády do něj začala výrazně zasahovat koalice Spolu, a to zejména do množství lidí, kterým zákon může pomoci,“ říká v pořadu Dvacet minut Radiožurnálu poslanec České pirátské strany, její bývalý předseda a někdejší vicepremiér Ivan Bartoš.",en,Bartoš: Limit help people with a vulnerable loss of housing is wrong. The law approved will help only a handful,"The Chamber of Deputies passed the Housing Support Act. Why aren't the Pirates satisfied with the result? ""Our departure from the government began to significantly interfere with the coalition together, especially in the number of people to whom the law can help,"" says the program of the Czech Pirate Party, its former chairman and former Deputy Prime Minister Ivan Bartoš.",2025-04-16 22:20:00
cz,Ruský útok na Dnipro podle ukrajinských úřadů zabil dvě ženy a zranil 16 lidí,"Kyjev - Rozsáhlý ruský dronový útok na ukrajinské město Dnipro ve středu večer zabil dvě ženy a dalších 16 lidí, včetně několika dětí, zranil. S odvoláním na šéfa správy Dněpropetrovské oblasti Serhije...",en,"According to the Ukrainian authorities, the Russian attack on Dnipro killed two women and injured 16 people","Kiev - The large Russian drone attack on the Ukrainian city Dnipro killed two women and another 16 people, including several children, injured. Referring to the head of the Dnipropetrov region, Serhije ...",2025-04-16 22:16:00
cz,Rakušan bude dnes jednat s odboráři o plánovaném zvyšování platů,"Praha - Ministr vnitra Vít Rakušan (STAN) se dnes setká s odbory bezpečnostních sborů, aby s nimi projednal plánované zvyšování odměn. Rakušan minulý týden navrhl vládě, aby od 1. července zvýšila...",en,Austrian will discuss with trade unionists today about planned salary increase,"Prague - Minister of Interior Vít Austria (STAN) will now meet the departments of security forces to discuss with them the planned increase in rewards. Last week, the Austrian proposed to the government to increase from 1 July ...",2025-04-16 22:08:00
cz,Kulhánek dnes představí výsledky právního auditu digitalizace stavebního řízení,Praha - Ministr pro místní rozvoj Petr Kulhánek (za STAN) dnes představí výsledky auditu právní části digitalizace stavebního řízení. Účelem auditu je komplexní přezkum přípravy digitalizace stavebního...,en,Kulhánek today will present the results of the legal audit of the digitization of the building proceedings,Prague - Minister for Regional Development Petr Kulhánek (for STAN) will present the results of the legal part of the digitization of the building proceedings today. The purpose of the audit is a comprehensive review of the preparation of the digitization of the construction ...,2025-04-16 22:06:00
cz,Kdy začíná platit smlouva a jak se počítají lhůty a čas při plnění povinností?,Kdy přesně vzniká nebo zaniká určité právo nebo povinnost? A co když je povinnost jednoho vzájemně podmíněná s právem druhého a naopak? Když má být něco vykonáno v určitý den – do kolika hodin?,en,When does the contract start to apply and how are the deadlines and time to fulfill their obligations?,When exactly does a particular right or obligation arise or disappear? And what if the duty of one is subject to the right of another and vice versa? When something is to be done on a certain day - how many hours?,2025-04-16 22:00:10
cz,"Nepodceňujte oční kontakt, je to zázrak. Pomůže s pamětí, v lásce i mateřství","Oční kontakt je poměrně intimní věc a ne každý ho chce opětovat. Tento druh neverbální komunikace okamžitě vyvolává emoce. Můžete zažít pocit souznění, porozumění, ale také hněv, vztek, nepřátelství nebo ignoraci. Ať tak či onak, pohledem do očí můžete mít hned jasno, co k vám ten druhý cítí.",en,"Do not underestimate eye contact, it is a miracle. Will help with memory, love and motherhood","Eye contact is a relatively intimate thing and not everyone wants to return it. This kind of non -verbal communication immediately evokes emotions. You can experience a sense of harmony, understanding, but also anger, anger, hostility or ignorance. Either way, looking into the eyes you may be clear about what the other one feels.",2025-04-16 22:00:00
cz,Jak dlouho si postojíte ve frontě? Redakce otestovala pobočky pošt,"Čím dál víc seniorů si už penzi nenechává posílat na poštu, ale využívají bankovních služeb a nechávají si ji zasílat na účet. Potvrdil to test MF DNES, který ve všech krajích v Česku mapoval situaci na největších pobočkách pošty během výplatního dne důchodů. Tam, kde se před lety běžně tvořily dlouhé fronty, panoval nyní klid. Závěry testu odpovídají trendu, který zaznamenala i Česká správa sociálního zabezpečení, která má výplatu důchodů na starosti.",en,How long do you stand in the queue? The editors tested the post offices,"More and more seniors are no longer sent to the post office, but use banking services and have it sent to their account. This was confirmed by the MF DNES test, which in all regions in the Czech Republic mapped the situation at the largest branches of the post office during the pension day. Where long queues were common years ago, there was now peace. The conclusions of the test correspond to the trend, which was also recorded by the Czech Social Security Administration, which is in charge of the payment of pensions.",2025-04-16 22:00:00
cz,"Apple připravuje systém, který má změnit to, jak využíváte jeho iPady","Za necelé dva měsíce by měla společnost Apple představit novou generaci operačního systému pro své tablety. A mohla by to být změna, která konečně přinese větší využití potenciálu, který toto zařízení má.",en,Apple is preparing a system to change how you use its iPads,"In less than two months, Apple should present a new generation of the operating system for its tablets. And it could be a change that will finally bring the greater use of the potential that this device has.",2025-04-16 22:00:00
cz,Chiloé je Irskem Jižní Ameriky a domovem vzácného darwinova psa,Nenápadně se přikrást zezadu a zabít kladivem. tak dříve vypadala vědecká práce. Vítejte ve světě jedné velmi zvláštní psovité šelmy.,en,Chilée is Ireland of South America and the home of a rare Darwin's dog,"Essee inconspicuously from behind and kill a hammer. So earlier, scientific work looked like. Welcome to the world of one very special canine beast.",2025-04-16 22:00:00
cz,RECENZE: O lásce k fotbalu bez fotbalu. Vyšehrad Dvje potká Babovřesky,"Kina budou zase plná, o to se fanoušci série postarají, ač Vyšehrad Dvje pokračuje v polepšování svého hrdiny, což může skalní ctitele otrávit a nové těžko zláká. Navíc sleduje příliš dějových linek a nejzábavnější vtipy ukrývá mimo ně, v podtitulcích televizních zpráv jako „další turista napadl medvěda“.",en,Review: About football love without football. Vyšehrad two meets Babovřesky,"The cinemas will be full, the fans of the series will take care of, although Vyšehrad two continues to improve their hero, which can poison the rock worshipers and hardly attract the new. In addition, he follows too many story lines and hides the most fun jokes outside them, in the subtitles of television news as ""another tourist attacked a bear"".",2025-04-16 22:00:00
cz,"Nemocnice jako hotel. O jednolůžkové pokoje mají lidé zájem, nejsou ale nárokové","Nemocnice jako hotel? Když má člověk kousek štěstí, tak to není žádný problém. Může si totiž zažádat o různě vybavený jednolůžkový pokoj, který si zaplatí, přičemž ceny se pohybují ve stokorunách či jednotkách tisíc. Záleží ale na tom, zda je pokoj v momentě, kdy do nemocnice nastoupí, volný.",en,Hospital as a hotel. People are interested in single rooms but are not entitled,"Hospital as a hotel? When a person is lucky, it is no problem. It can apply for differently equipped single room, which will pay, while prices are in hundreds of crowns or units of thousands. But it depends on whether the room is free when the hospital enters the hospital.",2025-04-18 02:00:00
cz,"Je Velký pátek, den ticha, půstu a vzpomínek na ukřižování Krista","Dnes je Velký pátek, kdy si křesťané připomínají ukřižování Ježíše Krista. Na památku jeho utrpení na křížové cestě se v kostelech konají obřady. The post Je Velký pátek, den ticha, půstu a vzpomínek na ukřižování Krista appeared first on Epoch Times ČR.",en,"Is Good Friday, Day of Silence, Fasting and Memories of the Crucifixion of Christ","Today it is Good Friday, when Christians commemorate the crucifixion of Jesus Christ. In memory of his suffering on the Stations of the Cross, ceremonies are held in churches. The Post is Good Friday, the Day of Silence, Fasting and Memories of the Crucifixion of Christ Appeared First On Epoch Times ČR.",2025-04-18 01:34:18
cz,"Je Velký pátek, den, kdy ukřižovali Krista. Měl by platit půst, ticho a rozjímání",,en,"It is Good Friday, the day when they crucified Christ. Should pay fasting, silence and meditation",,2025-04-18 01:25:00
cz,"Den v obrazech: Ceny zlata, Jarní sněhová nadílka v Evropě a Velikonoční trh ve Vídni","Světové události dne 17. dubna zaznamenané objektivem fotoaparátu.The post Den v obrazech: Ceny zlata, Jarní sněhová nadílka v Evropě a Velikonoční trh ve Vídni appeared first on Epoch Times ČR.",en,"Day in Paintings: Gold Prices, Spring Snow Downbell in Europe and Easter Market in Vienna","World events on April 17, recorded by the camera lens.The Post day in the paintings: gold prices, spring snow gifts in Europe and Easter market in Vienna Appeared First On Epoch Times ČR.",2025-04-18 01:22:00
cz,"Africká venkovská strava je stejně zdravá jako středomořská, uvádí studie","Dáresalám (Tanzanie) - Zelené banány, maniok nebo kvašené banánové nápoje prospívají lidskému tělu stejně jako některé položky středomořské diety jako jsou olivový olej, rajčata nebo červené víno....",en,"African rural diet is as healthy as Mediterranean, the study says","Daresal (Tanzania) - Green Bananas, Maniok or fermented banana drinks benefit the human body as well as some Mediterranean diet items such as olive oil, tomatoes or red wine ....",2025-04-18 01:10:00
cz,Český kajakář zemřel na Korsice při sjezdu rozvodněné řeky,Ajaccio (Korsika) - Dvaašedesátiletý český kajakář přišel o život ve čtvrtek odpoledne při sjíždění řeky Tavignano na Korsice. Přes rychlý zásah záchranářů se muže nepodařilo oživit. Uvedl to zpravodajský...,en,Czech kayaker died in Corsica during the congress of the flooded river,"Ajaccio (Corsica) - The 62 -year -old Czech kayaker lost his life on Thursday afternoon while down the Tavignano River in Korsice. Despite the rapid intervention of the rescuers, the man could not revive. He said the news ...",2025-04-18 00:40:00
cz,"Český kajakář zemřel na Korsice při sjíždění řeky, selhalo mu srdce",Ajaccio (Korsika) - Dvaašedesátiletý český kajakář přišel o život ve čtvrtek odpoledne při sjíždění řeky Tavignano na Korsice. Přes rychlý zásah záchranářů se muže nepodařilo oživit. Uvedl to zpravodajský...,en,"Czech kayaker died in Corsica while descending the river, his heart failed","Ajaccio (Corsica) - The 62 -year -old Czech kayaker lost his life on Thursday afternoon while down the Tavignano River in Korsice. Despite the rapid intervention of the rescuers, the man could not revive. He said the news ...",2025-04-18 00:40:00
