iso_code,title,description,lang_tranlation,title_translated,description_translated,pubDate
cz,Jaké investice do dopravy plánují politické strany? Podívejte se na úvodní část šesté debaty Česko 2025,Dálniční síť v Česku loni narostla o rekordních 111 kilometrů asi 1500. Přesto Česko stále ve srovnání hustoty dálnic vychází v Evropské unii jako průměrné. Lépe je na tom s hustotou celé silniční sítě. Kvalitou silnice ale patří podle Indexu prosperity mezi nejhoršími. Do jakých dopravních projektů politické strany plánují investovat? A jak rychle se má na českých silnicích jezdit? Podívejte se na úvodní část šesté debaty Česko 2025.,en,What investments in transport do political parties plan? Check out the introductory part of the sixth debate Czech 2025,"The highway network in the Czech Republic increased by a record 111 kilometers last year. Nevertheless, the Czech Republic is still average in the European Union compared to the highway density. It is better off with the density of the entire road network. According to prosperity, the quality of the road is one of the worst. In what traffic projects do the political parties plan to invest? And how fast is the Czech roads to ride? Check out the opening part of the sixth debate Czech Republic 2025.",2025-05-09 05:30:00
cz,Na Jablonecku a v okolí řádí falešní policisté,"Policisté z Jablonecka varují před podvodníky, kteří se vydávají za falešné kriminalisty. Snaží se z lidí vylákat peníze a posílají falešná předvolání, služební průkazy a zneužívají policejní databázi osob v pátrání. Jednu ze svých obětí tento týden připravili o tři miliony korun.",en,In the Jablonec region and around the fake police officers raging,"Police officers from the Jablonec region warn against fraudsters who follow false criminalists. They try to lure money from people and send false summons, service cards and abuse the police database of people in the search. One of their victims deprived three million crowns this week.",2025-05-09 05:30:00
cz,"V Čeladné se zřítil strop hotelu, tři lidé zraněni, nikdo nezůstal pod sutinami",,en,"In Čeladná crashed the ceiling of the hotel, three people injured, no one stayed under the rubble",,2025-05-09 05:26:00
cz,V hotelu v Čeladné se propadl strop: Při neštěstí byly uvnitř desítky lidí,"V noci na pátek se v Hotelu Zámeček v Čeladné zřítil strop a část vnitřních konstrukcí. V době neštěstí bylo uvnitř asi 20 lidí, tři z nich utrpěli středně těžká zranění. Záchranáři potvrdili, že pod sutinami nezůstali žádní uvěznění. Příčina zřícení je stále předmětem vyšetřování.",en,A ceiling fell in a hotel in Čeladná: there were dozens of people inside the disaster,"On Friday night, the ceiling and part of the internal structures collapsed at the Hotel Hotel in Čeladná. At the time of the disaster there were about 20 people inside, three of them suffered moderate injuries. Rescuers confirmed that there were no imprisonment under the rubble. The cause of collapse is still subject to investigation.",2025-05-09 05:26:00
cz,"Okupace? Osvobodili jsme se sami? Vyskočil, Schneider a další skoncovali s nesmysly","„Nesmí se zapomínat na oběti, které nám umožnily se vůbec narodit. Nesmí se zapomínat na ta strašná čísla na dětských ručičkách v Osvětimi!“ I to zaznělo v souvislosti s výročím 8. května 1945. Pěkně „po ostravsky“ pak padla například slova o „Blbuších“. Došlo i na oslavy ukončení druhé světové války v Moskvě. „JE SUIS FICO,“ nechybělo. Promluvili herec Ivan Vyskočil, několikanásobný bloger roku Ladislav Větvička, autor literatury faktu Bruno Solařík a publicista a bezpečnostní analytik Jan Schneider, jenž mj. spolupracoval s legendární kapelou.",en,"Occupation? Did we free ourselves? Jumped up, Schneider and others ended up with nonsense","""It must not be forgotten the victims that allowed us to be born at all. It must not be forgotten about the terrible figures on the children's hands in Auschwitz!"" This was also said in connection with the anniversary of May 8, 1945. Pretty ""after Ostrava"" then fell, for example, words about ""foolish"". There was also a celebration of the end of World War II in Moscow. ""He's Suis Fico,"" she didn't miss. The actor Ivan Vyskočil, the multiple blogger of the year Ladislav Větvička, the author of the Literature of the Union of Bruno Solařík and the publicist and the security analyst Jan Schneider, who worked with the legendary band.",2025-05-09 05:25:00
cz,Rusko řeší zničený pomník Rudoarmějců v Teplicích. Zahájilo trestní stíhání,"Šéf ruského vyšetřovacího výboru Alexandr Bastrykin nařídil zahájení trestního řízení v souvislosti s nedávným zničením sochy rudoarmějce v Teplicích. Pomník sovětského vojáka, který stál v teplických Havlíčkových sadech od roku 1955 coby součást pietního místa, byl v noci na středu stržen z podstavce a zcela zničen neznámými pachateli. Vedení severočeského města tento čin odsoudilo.",en,Russia solves a destroyed monument to the Red Army in Teplice. Has initiated criminal prosecution,"The head of the Russian Investigation Committee Alexandr Bastrykin ordered the initiation of criminal proceedings in connection with the recent destruction of the Red Army statue in Teplice. The memorial of the Soviet soldier, who stood in Teplice Havlíčkovy sady since 1955 as part of the memorial place, was pulled from the pedestal on Wednesday night and completely destroyed by unknown perpetrators. The leadership of the North Bohemian city condemned this act.",2025-05-09 05:24:00
cz,"Washington srovnal sérii s Carolinou, Edmonton slaví už šestou výhru v řadě","Hokejisté Washingtonu ve druhém kole play off NHL zvítězili nad Carolinou 3:1 a srovnali tak stav série na 1:1 na zápasy. O srovnání usilovali rovněž hráči Vegas, kteří ve druhé partii za stavu 4:4 hráli s Edmontonem prodloužení. V 76. minutě ale z přečíslení 2 na 1 rozhodla o šesté výhře Oilers v letošních vyřazovacích bojích za sebou produktivní dvojice Connor McDavid - Leon Draisaitl.",en,"Washington leveled the series with Carolina, Edmonton celebrates the sixth win in a row","Washington hockey players in the second round of the NHL play off over Carolina 3: 1 and compared the status of the series to 1: 1 for matches. Vegas players also sought to compare, playing with Edmonton's extension in the second game. In the 76th minute, however, from renumbering 2 to 1 decided on the sixth win of Oilers in this year's knockout fighting, the productive pair Connor McDavid - Leon Draisaitl.",2025-05-09 05:23:10
cz,"Malířské válečky datuji podle postelových scén z filmů, říká sběratel","Co mají společného postelové scény ze starých českých filmů a malířské válečky? A proč lidé považují kostrbaté vzory na válečcích, které vznikaly v družstvu invalidů Slezanka, za secesní výtvory? Na to vše umí odpovědět Ondřej Matula, který už několik let malířské válečky sbírá a také mapuje jejich historii.",en,"I date painting rollers by bed scenes from movies, says collector","What do the bed scenes from old Czech films and paint rollers have in common? And why do people consider rough patterns on rollers that were created in the Slezanka Invalid team as Art Nouveau creations? Ondřej Matula can answer all of this, who has been collecting paintings for several years and also maps their history.",2025-05-10 07:23:00
cz,"Nový klub, ve smlouvě klauzule o NHL. Kubalík si zahraje s Kovářem a Voženílkem","Dominik Kubalík bude od příští sezony nastupovat za švýcarský Zug. S vedením klubu, jehož kapitánem je Jan Kovář a za tým hraje i další český hokejista Daniel Voženílek, se dohodl na dvouleté smlouvě. Její součástí je výstupní klauzule pro případný návrat devětadvacetiletého kanonýra do NHL. Klub o tom informoval na webu.",en,"New club, in the contract clause on the NHL. Kubalík will play with a blacksmith and Voženílek","Dominik Kubalík will start for the Swiss Zug from next season. With the management of the club, whose captain is Jan Kovář and other Czech hockey player Daniel Voženílek plays for the team, he agreed on a two -year contract. It includes an exit clause for a possible return of a 19 -year -old cannon to the NHL. The club informed about it on the web.",2025-05-10 07:22:00
cz,Pákistán po útocích shromažďuje vojáky u hranic s Indií. Rubio volá po deeskalaci,"Indie tvrdí, že odpověděla na sobotní pákistánské útoky svými údery na základny v sousední zemi. Podle agentury Reuters uvedli zástupci indické armády, že Pákistán navyšuje počty svých vojáků u hranic. O odvetných úderech v sobotu ovšem mluvil také Pákistán. Obě země si rovněž poprvé telefonovaly, uvedl indický zpravodajský web CNN News.",en,Pakistan gather soldiers at the borders with India. Rubio is calling for deks,"India claims that she replied to Saturday's Pakistani attacks with her strokes on the bases in the neighboring country. According to Reuters, representatives of the Indian army said that Pakistan increases the number of its soldiers at the border. However, Pakistan also spoke about retaliation on Saturday. Both countries also phoned for the first time, said the Indian news website CNN News.",2025-05-10 07:19:00
cz,Praze 4 se nelíbí pracovní názvy stanic metra D. Radnici vadí třeba pojmenování Olbrachtova,"Radnice Prahy 4 požaduje, aby hlavní město zvolilo definitivní názvy stanic budoucí linky metra D, přičemž se jí nelíbí část dosud pracovně používaných a navrhuje jiné. Řekl to mluvčí městské části Aleš Berný. Obecně podle něj vedení radnice preferuje místopisné názvy, a to nejlépe jednoslovná pojmenování jako Ryšánka, Lhotka či Nusle. Mluvčí organizátora pražské dopravy Ropid Filip Drápal řekl, že návrhy posoudí magistrátní místopisná komise.",en,Prague 4 does not like the working names of metro stations. The town hall bothers the name of Olbrachtov,"Prague 4 City Hall requires the capital to choose the definitive names of the Future Metro D Line, and it does not like part of the employment and suggests others. Aleš Berný, a spokesman for the city district, said it. Generally, according to him, the town hall management prefers topographical names, preferably one -word name as Ryšánka, Lhotka or Nusle. Filip Drápal, a spokesman for the Prague Transport Organizer, said the Municipal Topography Commission assesses the proposals.",2025-05-10 07:17:00
cz,V Kyjevě začalo jednání koalice ochotných,"Kyjev - V Kyjevě začalo jednání vrcholných představitelů zemí, které tvoří takzvanou koalici ochotných. Uvedla to francouzská média, která jsou na místě společně s francouzským prezidentem Emmanuelem Macronem....",en,In Kiev began the meeting of the coalition willing,"Kiev - In Kiev, the actions of the top representatives of the countries began to form a so -called coalition willing. This was stated by the French media, which are on the spot together with French President Emmanuel Macron ....",2025-05-10 07:17:00
cz,"Macron: Pokud bude Rusko odmítat příměří, Evropa a USA na něj zvýší tlak","Kyjev - Pokud bude Rusko i nadále blokovat příměří, zvýší na něj Evropa ve spolupráci se Spojenými státy tlak. Dnes to na síti X uvedl francouzský prezident Emmanuel Macron, který přicestoval do Kyjeva,...",en,"Macron: If Russia rejects the ceasefire, Europe and the US will increase the pressure on it","Kiev - If Russia continues to block a ceasefire, Europe will increase pressure in cooperation with the United States. Today, the French President Emmanuel Macron, who arrived at Kiev, ...",2025-05-10 07:17:00
cz,Olympijský vítěz Čopra měl být tváří oštěpařského turnaje. Ten se ale kvůli konfliktu neuskuteční,"Kvůli konfliktu mezi Indií a Pákistánem se neuskuteční na 24. května připravovaný hvězdně obsazený oštěpařský mítink v Bengalúru, jehož tváří a spolupořadatelem je olympijský vítěz a mistr světa Níradž Čopra.",en,The Olympic winner of ČPRA was supposed to be the face of a javelin tournament. But this will not take place due to the conflict,"Due to the conflict between India and Pakistan, the upcoming star -occupied javelin meeting in Bengalur, whose face and co -organizer is the Olympic champion and world champion, will not take place on May 24, is the Olympic champion and world champion.",2025-05-10 07:17:00
cz,"Zelenskyj se dohodl s evropskými lídry na příměří, Putinovi pohrozili sankcemi","Kyjev - Ukrajinský prezident Volodymyr Zelenskyj a vrcholní představitelé Británie, Francie, Německa a Polska se dnes v Kyjevě shodli na nabídce třicetidenního příměří v bojích na Ukrajině, které má bez...",en,"Zeletsky agreed with European leaders on a ceasefire, Putin threatened with sanctions","Kiev - Ukrainian President Volodymyr Zelenkyj and top representatives of Britain, France, Germany and Poland today agreed in Kiev on the offer of a 30 -day truce in the fighting in Ukraine, which he has without ...",2025-05-10 07:17:00
cz,Zelenskyj a evropští lídři jednali po telefonu s Trumpem,"Kyjev - Ukrajinský prezident Volodymyr Zelenskyj a vrcholní představitelé klíčových evropských zemí, kteří jsou na návštěvě Kyjeva, dnes po telefonu mluvili s americkým prezidentem Donaldem Trumpem. Jednání...",en,Zeletsky and European leaders acted over the phone with Trump,Kiev - Ukrainian President Volodymyr Zelenky and top leaders of key European countries who are visiting Kiev today spoke with US President Donald Trump on the phone. Negotiations ...,2025-05-10 07:17:00
cz,Druhá světová válka otevřela cestu k ženské emancipaci,Co přimělo příslušnice „slabšího“ pohlaví přijmout během války práci v průmyslu nebo se rovnou zapojit do boje? Vedle potřeby pomoci a pocitu vlastenectví to byla touha stát se konečně rovnoprávnými.,en,World War II opened the way to female emancipation,"What made the ""weaker"" sexes to accept industry work during the war or engage in fighting? In addition to the need to help and the feeling of patriotism, it was the desire to become finally equal.",2025-05-10 07:15:00
cz,"Oči mu lezly z důlků, popsal agent. Před 65 lety dostali Izraelci Eichmanna","Byla středa 11. května 1960, blížila se půl osmá večer. V argentinské metropoli Buenos Aires zastavil v Garibaldiho ulici asi deset metrů od křižovatky vůz. Z jeho posádky vystoupil jeden muž, zvedl kapotu a začal se zabývat motorem. Třicet metrů od něj, mezi mostem a rohem Garibaldiho ulice, stálo druhé auto. Také jeho řidič vypadal, že řeší poruchu. Ale o nic takového nešlo. Chystal se únos Adolfa Eichmanna.",en,"His eyes climbed out of the sockets, the agent described. Israelis of Eichmann received 65 years ago","It was Wednesday 11th May 1960, approaching half past eight in the evening. In the Argentine capital Buenos Aires, he stopped the car in Garibaldi Street about ten meters from the intersection. One man stepped out of his crew, lifted the hood and began to deal with the engine. Thirty meters from him, between the bridge and the corner of Garibaldi Street, there was a second car. His driver also seemed to solve a failure. But it wasn't like that. The kidnapping of Adolf Eichmann was about to kidnap.",2025-05-11 03:30:00
cz,Město na hranici dvou světů. Nejslabší místo v obraně NATO láká Putina,"Na estonském hraničním městě může ruský diktátor ideálně otestovat, zda Severoatlantická aliance ještě funguje a jestli je Západ ochotný jít do otevřeného střetu. Tzv. „scénář Narva“ hrozí podle expertů už v příštích pár letech.",en,A city on the border of two worlds. The weakest place in NATO's defense attracts Putin,"In the Estonian border town, the Russian dictator can ideally test whether the North Atlantic Alliance still works and whether the West is willing to go into an open clash. So -called. According to experts, the ""Narva scenario"" threatens in the next few years.",2025-05-11 03:30:00
cz,Miliardová ztráta ČD Cargo je zrcadlem průmyslu a ekonomiky. Firma musí projít redukční dietou,"Český průmysl se v posledních letech trápí a není tomu jinak ani v případě železniční nákladní dopravy. Důvody jsou přitom notoricky známé a jsou vlastně platné pro celý průmysl napříč Evropskou unií – skokový nárůst cen elektrické energie a následná vysoká inflace, závazek Evropské unie k uhlíkové neutralitě znamenající ústup od uhlí či rostoucí regulatorní požadavky nejen v oblasti Green Dealu. To vše se podepsalo na útlumu průmyslové, stavební výroby a na celkové hospodářské stagnaci evropské ekonomiky v posledních letech.",en,The billion loss of ČD Cargo is a mirror of industry and economy. The company must go through a reduction diet,"The Czech industry has been worried in recent years and it is not otherwise in the case of railway freight transport. The reasons are notorious and are actually valid for the whole industry across the European Union - a jump increase in electricity prices and subsequent high inflation, the European Union commitment to carbon neutrality means retreating from coal or growing regulatory requirements not only in the Green Deal. All this has been influenced by the attenuation of industrial, construction production and the overall economic stagnation of the European economy in recent years.",2025-05-11 03:30:00
cz,Před Rudolfinem otevřou scénu ke zhlédnutí úvodního koncertu Pražského jara,,en,"In front of Rudolfin, he will open the scene to see the opening concert of the Prague Spring",,2025-05-11 03:28:00
cz,Test Fordu Ranger MS-RT: Pick-up s krizí identity,"Pick-upy jsou z povahy především pracovní stroje, které však v některých verzích slibují i zábavu mimo silnice. Nový Ford Ranger MS-RT se vydal proti proudu a slibuje zábavu na silnici. Je to ale vůbec možné, když chce zůstat pracantem?",en,Test Ford Ranger MS-UT: Pick-up with Identity Crisis,"Pick-ups are primarily working machines, but in some versions they also promise entertainment off the roads. The new Ford Ranger MS-RT has set out upstream and promises fun on the road. But is it even possible to stay a worker?",2025-05-11 03:20:00
cz,"Putin navrhl přímá jednání s Ukrajinou. ""Bez jakýchkoliv předběžných podmínek,"" dodal","Hlava ruského státu tak učinila poté, co Moskvu k bezpodmínečnému příměří vyzval ukrajinský prezident Volodymyr Zelenskyj a lídři evropských zemí.",en,"Putin proposed direct negotiations with Ukraine. ""Without any preliminary conditions,"" he added",The head of the Russian state did so after Moscow to the unconditional ceasefire called for Ukrainian President Volodymyr Zelenky and leaders of European countries.,2025-05-11 03:15:00
cz,Trump zvažuje zvýšení daní pro nejbohatší Američany,"Americký prezident Donald Trump chystá podle zahraničních médií nečekaný krok. Listy The Financial Times a The Wall Street Journal se shodují, že šéf Bílého domu chce zvýšit daně pro nejbohatší Američany. Ještě před pár dny přitom vyšší zdanění movitých odmítal.",en,Trump is considering raising taxes for the richest Americans,"According to foreign media, US President Donald Trump is preparing an unexpected step. The Financial Times and The Wall Street Journal agree that the White House boss wants to raise taxes for the richest Americans. A few days ago, he refused higher taxation of movable movable.",2025-05-11 03:11:00
cz,"Německo je kaput. Musíte staré firmy nechat zemřít, říká komentátor Wolfgang Münchau","Málokdo si dovolil v Německu tak otevřenou kritiku německého ekonomického modelu jako Wolfgang Münchau, bývalý šéf deníku Financial Times Deutschland a zakladatel portálu Eurointelligence, ve své široce citované knize Kaput.",en,"Germany is Kaput. You have to let old companies die, says commentator Wolfgang Münchau","Few have allowed such an open criticism of the German economic model as Wolfgang Münchau, former head of the Financial Times Deutschland and founder of the Euroinlligence portal, in his widely quoted Kaput book.",2025-05-11 03:00:00
cz,"Kočičí leukémie neznamená smrt. Drahoslav hledá domov, musí být ale jedináčkem","Drahoslav (asi 7) je nalezenec, který se do péče spolku Anidef dostal ve zbědovaném stavu. Vyléčili ho, ukázalo se ale, že má tzv. kočičí leukémii. Nijak ho v životě neomezuje, je ale přenosná na jiné kočky. Musí být proto kočičím jedináčkem.",en,"Cat leukemia does not mean death. Drahoslav looking for a home, but must be the only child","Drahoslav (about 7) is a founder who got into the care of Anidef in a folded state. They cured him, but it turned out that he had a so -called cat leukemia. It does not limit it in life, but it is portable to other cats. It must therefore be a cat.",2025-05-11 03:00:00
cz,"OVĚŘOVNA: Norský plyn zdemoluje vaši domácnost, tvrdí dezinformační e-mail. ‚Blbost,‘ reaguje odborník","Dezinformace šířená několik měsíců v řetězovém e-mailu tvrdí, že kvůli rozdílu v kvalitě mezi dříve odebíraným ruským plynem a současným norským plynem může zhasnout plamen u hořáků domácích spotřebičů. To podle textu může následně „zdemolovat celý dům“. Jenže takové případy nezaznamenal ani Český plynárenský svaz, hasiči ani výrobci sporáků či plynových kamen, zjistil iROZHLAS.cz v projektu OVĚŘOVNA!",en,"Verification: Norwegian gas demolishes your household, says misinformation e-mail. 'Stupid,' Reacts an expert","Dezinformace šířená několik měsíců v řetězovém e-mailu tvrdí, že kvůli rozdílu v kvalitě mezi dříve odebíraným ruským plynem a současným norským plynem může zhasnout plamen u hořáků domácích spotřebičů. According to the text, this can then ""demolish the whole house"". Jenže takové případy nezaznamenal ani Český plynárenský svaz, hasiči ani výrobci sporáků či plynových kamen, zjistil iROZHLAS.cz v projektu OVĚŘOVNA!",2025-05-11 03:00:00
cz,Do středy čekejme převážně slunečno s postupně teplejšími dny,"Do středy čekejme převážně slunečno s postupně teplejšími dny, pak nác čeká mírné ochlazení a proměnlivější ráz počasí, hlavně na východě s přeháňkami. Počasí u nás bude nejprve pod vlivem tlakové výše nad severozápadní Evropou. Ve čtvrtek přejde...",en,Let's wait mostly sunny with the gradually warmer days,"We will wait mostly sunny with gradually warmer days, then the Nazi awaits a slight cooling and more variable weather, especially in the east with showers. The weather in our country will first under the influence of the pressure level above the northwest Europe. He will pass on Thursday ...",2025-05-12 05:15:00
cz,Legenda Skype končí. Jaké další kdysi populární služby odnesl čas?,"Skype začal v roce 2003 v Estonsku jako revoluční způsob, jak se spojit s kýmkoliv kdekoliv. V roce 2011 ho koupil Microsoft, který ho teď vypnul.",en,Legend Skype ends. What other once popular services took time?,"Skype began in 2003 in Estonia as a revolutionary way to connect with anyone anywhere. In 2011 it was bought by Microsoft, who now turned it off.",2025-05-12 05:15:00
cz,Trump přijme od Kataru luxusní Boeing 747-8. Má sloužit jako nový Air Force One,"Administrativa amerického prezidenta Donalda Trumpa se chystá přijmout od katarské královské rodiny jako dar luxusní letoun Boeing 747-8, který by měl být upraven tak, aby mohl sloužit jako prezidentský speciál Air Force One. Píší o tom tiskové agentury a americká média s odvoláním na své zdroje, jako první o věci informovala v neděli večer stanice ABC News.",en,Trump will receive luxury Boeing 747-8 from Qatar. Is to serve as a new Air Force One,"US President Donald Trump administration is about to accept from the Qatar royal family as a gift of the luxury Boeing 747-8 aircraft, which should be modified to serve as the presidential special Air Force One. Press agencies and the American media write about it, referring to its resources, first reported on Sunday evening ABC News.",2025-05-12 05:13:00
