iso_code,title,description,lang_tranlation,title_translated,description_translated,pubDate
at,Toller Imago Dei-Auftakt - Kremser Festival startete mit musikalischem Friedensappell,Albert Hosp feierte beim Auftakt des Festivals „Imago Dei“ seinen Einstand als Intendant. Philosoph Konrad Paul Liessmann plädierte für die Einhaltung des Völkerrechts.,en,Great Imago Dei start - Kremser Festival started with musical peace appell,"Albert Hosp celebrated his debut as an director at the ""Imago Dei"" festival. Philosopher Konrad Paul Liessmann advocated compliance with international law.",2025-03-30 22:30:00
at,"""Ganz klar mein Fehler"": Marc Marquez verschenkt Austin-Sieg und WM-Führung",In der neunten Runde stürzt Marc Marquez in Führung liegend auf einem feuchten Randstein - Der WM-Dreikampf ist damit wieder völlig offen,en,"""Clearly my mistake"": Marc Marquez is giving away Austin victory and World Cup lead","In the ninth round, Marc Marquez plunges in the lead on a damp curb - the World Cup rifleman is completely open again",2025-03-30 22:23:15
at,Zeitreise um 80 Jahre in die Vergangenheit,"Im Purgstaller Kutscherhof präsentiert Franz Wiesenhofer derzeit seine Ausstellung zu den Gedenkjahren 1945/55. PURGSTALL. ""Wir erinnern uns heuer an 2 Anlässe: Das Jahr des Kriegsendes und der Befreiung vom Nationalsozialismus, 1945, und an das Jahr des Staatsvertrags, 1955"", begrüßte Franz Wiesenhofer mit seiner Frau Hildegard die Gäste bei der Eröffnung seiner Ausstellung zu den beiden Gedenkjahren. Zahlreiche EhrengästeNeben 3 Bezirkshauptleuten, Bezirkshauptmann Johann Seper, seinem...",en,Time travel by 80 years into the past,"Franz Wiesenhofer is currently presenting his exhibition on the Memorial Years of 1945/55 in the Purgstaller Kutscherhof. Purgstall. ""We remember 2 occasions this year: the year of the end of the war and the liberation from National Socialism, in 1945, and the year of the State Treaty, in 1955"", Franz Wiesenhofer and his wife Hildegard welcomed the guests to the two years of commemoration at the opening of his exhibition. Numerous guests of honor 3 district chiefs, district captain Johann Seper, his ...",2025-03-30 22:11:23
at,Die Liebe siegt immer - Liebstattsonntag am Rathausplatz und Esplanade Gmunden,"Die Liebe siegt immer - Liebstattsonntag am Rathausplatz und Esplanade Gmunden Liebe siegt über alles, so auch das Wetter betreffend. Während am Sonntag 30.3.2025 das Wetter am Vormittag alles andere als feundlich war, konnten die vielen Besucher zu Mittag und Nachmittag die Sonnenstrahlen genießen und ihren Lieben ""die Liebe abstatten"" und so fanden tausende gekaufte Herzen ihren richtigen Platz bei Mann und Frau. Strahlende Gesichter, Herzen groß oder klein zierten die Gäste am...",en,Love always wins - Liebstatt Sunday on Rathausplatz and Esplanade Gmunden,"Love always wins - Liebstatt Sunday on Rathausplatz and Esplanade Gmunden Lieb wins over everything, including the weather. While on Sunday March 30, 2025 the weather was anything but Feundlich in the morning, the many visitors were able to enjoy the sun's rays for lunch and afternoon and ""pay love"" their loved ones and so thousands of bought hearts found their right place in men and women. Bright faces, hearts tall or small the guests adorned ...",2025-03-30 22:08:58
at,Gebühren und Steuern steigen – Hunderte Häftlinge in Haiti ausgebrochen – Griechische Inseln stehen unter Wasser,Wir starten mit Ihnen in den Nachrichtentag und geben Ihnen einen schnellen Überblick über die wichtigsten Themen des Morgens.,en,Fees and taxes rise - hundreds of prisoners broke out in Haiti - Greek islands are under water,We start the news day with you and give you a quick overview of the most important topics of the morning.,2025-04-01 04:22:46
at,Einfaches Rezept - Spargel-Stangen im Blätterteig mit Bärlauchbutter,"Als Vorspeise, Beilage oder leckerer Snack zwischendurch: So einfach lässt sich mit Spargel, Bärlauch und wenigen Zutaten in unter 30 Minuten dieses leckere Gericht zaubern. - Mehr dazu im Video.",en,Simple recipe - asparagus rods in the puff pastry with wild garlic butter,"As a starter, side dish or delicious snack in between: this delicious dish can be conjured up with asparagus, wild garlic and a few ingredients in less than 30 minutes. - More on this in the video.",2025-04-01 04:22:00
at,Erste Schätzungen: CSX mit Zahlen zum abgelaufenen Quartal,"CSX wird voraussichtlich am 16.04.2025 die Geschäftsergebnisse zum jüngsten Jahresviertel vorstellen.Der Gewinn je Aktie dürfte sich laut 25 Analysten für das vergangene Quartal auf durchschnittlich 0,386 USD je Aktie belaufen. Im Vorjahresviertel hatte CSX 0,460 USD je Aktie erwirtschaftet.Auf der Umsatzseite...",en,First estimates: CSX with numbers for the past quarter,"CSX is expected to present the business results for the latest annual quarter on April 16, 2025. According to 25 analysts per share, the profit per share should amount to an average of $ 0.386 per share. In the previous year's quarter, CSX had generated USD 0.460 per share. On the sales page ...",2025-04-01 04:21:33
at,Erste Schätzungen: First Horizon National zieht Bilanz zum abgelaufenen Quartal,"First Horizon National öffnet voraussichtlich am 16.04.2025 die Bücher zum am 31.03.2025 abgelaufenen Quartal.13 Analysten prognostizieren im Schnitt einen Gewinn je Aktie von 0,395 USD gegenüber 0,330 USD im Vorjahresquartal.Den Umsatz betreffend erwarten 10 Analysten eine Verringerung von...",en,First estimates: First Horizon National takes stock of the past quarter,"First Horizon National is expected to open the books on the quarter on April 16, 2025.13 Analysts forecast a profit of a profit of $ 0.395 compared to $ 0.395 in the previous year.",2025-04-01 04:21:33
at,Erste Schätzungen: Autoliv legt Zahlen zum jüngsten Quartal vor,"Autoliv gibt voraussichtlich am 16.04.2025 die Zahlen für das am 31.03.2025 abgelaufene Quartal bekannt.14 Analysten prognostizieren im Schnitt einen Gewinn je Aktie von 1,67 USD gegenüber 1,53 USD im Vorjahresquartal.15 Analysten erwarten im Schnitt einen Umsatz von 2,50 Milliarden USD – das wäre ein Abschlag...",en,First estimates: Autolively presented numbers for the latest quarter,"Autolively, the numbers for the quarter expired on March 31,2025 are expected to be known on April 16, 2025. On average, analysts forecast a profit per share of USD 1.53 $ 1.53 in the previous year.",2025-04-01 04:21:33
at,Erste Schätzungen: US Bancorp stellt das Zahlenwerk zum vergangenen Quartal vor,"US Bancorp äußert sich voraussichtlich am 16.04.2025 zu den Geschäftsergebnissen des am 31.03.2025 abgelaufenen Quartals.Die Schätzungen von 19 Analysten belaufen sich im Durchschnitt auf 0,981 USD je Aktie. Im Vorjahresquartal hatte US Bancorp ein EPS von 0,780 USD je Aktie vermeldet.US Bancorp soll das...",en,First estimates: US Bancorp presents the figures for the past quarter,"Us Bancorp is expected to comment on the business results of the quarter on March 16, 2025. In the previous year's quartal, US Bancorp reported an EPS of USD 0.780 per share.",2025-04-01 04:21:33
at,Erste Schätzungen: Sartorius vz präsentiert Bilanzzahlen zum jüngsten Jahresviertel,"Sartorius vz wird voraussichtlich am 16.04.2025 das Zahlenwerk zum am 31.03.2025 abgelaufenen Jahresviertel vorstellen.8 Analysten schätzen im Schnitt, dass im abgelaufenen Quartal ein Ergebnis von 1,20 EUR je Aktie eingefahren wurde. Das wäre ein Plus von 122,22 Prozent im Verhältnis zum EPS des...",en,First estimates: Sartorius VZ presents balance sheet figures for the latest annual quarter,"Sartorius VZ is expected to present the figures to the annual quarter on April 16, 2025.8 Analysts estimate on average that a result of EUR 1.20 per share was brought in in the past quarter. That would be an increase of 122.22 percent in relation to the EPS of ...",2025-04-01 04:21:33
at,Erste Schätzungen: Abbott Laboratories gibt Ergebnis zum abgelaufenen Quartal bekannt,Abbott Laboratories lässt sich voraussichtlich am 16.04.2025 in die Bücher schauen: Auf der vierteljährlichen Finanzkonferenz wird Abbott Laboratories die Bilanz zum am 31.03.2025 beendeten Jahresviertel offenlegen.Die Prognosen von 21 Analysten für...,en,First estimates: Abbott Laboratories announces the result for the past quarter,"Abbott Laboratories is expected to look into the books on April 16, 2025: At the quarterly financial conference, Abbott Laboratories will disclose the balance sheet to the annual quarter ended on March 31,2025.The forecasts of 21 analysts for ...",2025-04-01 04:21:33
at,Erste Schätzungen: Sartorius öffnet die Bücher zum abgelaufenen Quartal,"Sartorius veröffentlicht voraussichtlich am 16.04.2025 auf der all-dreimonatlichen Finanzkonferenz die Zahlen zum am 31.03.2025 abgelaufenen Jahresviertel.8 Analysten gehen im Schnitt von einem Gewinn je Aktie von 1,20 EUR aus. Im Vorjahresquartal war ein Gewinn je Aktie von 0,540 EUR erwirtschaftet worden.",en,First estimates: Sartorius opens the books for the past quarter,"Sartorius is expected to publish the figures for the annual quarter of the year on April 16, 2025 at the all-three-month financial conference. In the previous year, a profit of EUR 0.540 was generated.",2025-04-01 04:21:33
at,Erste Schätzungen: ICICI Prudential Life Insurance Company gewährt Anlegern Blick in die Bücher,"ICICI Prudential Life Insurance Company öffnet voraussichtlich am 15.04.2025 die Bücher zum am 31.03.2025 abgelaufenen Quartal.In Sachen EPS geht 1 Analyst von einem Gewinn von 2,90 INR je Aktie aus. Im vergangenen Jahr hatte ICICI Prudential Life Insurance Company noch 1,21 INR...",en,First estimates: Icici Prudential Life Insurance Company grants investors in the books,"Icici Prudential Life Insurance Company is expected to open the books on the quarter on March 15, 2025 to the quarter on March 31, 2025. In things, EPS is based on a win of 2.90 INR per share. Last year Icici Prudential Life Insurance Company still had 1.21 INR ...",2025-04-01 04:21:33
at,Beste Online Casino – TOP Online Casinos für deutsche Spieler im April,"Deutsche Spieler, die um echtes Geld spielen, suchen nach einem bestes Online Casino echtgeld, das nicht nur eine riesige Auswahl an Spielen, sondern auch höchste Sicherheitsstandards bietet. In unserem Bericht 2025 stellen wir die führenden Plattformen vor, die als best Online Casino Deutschland und beste Online Casino echtgeld gelten. Zu den Favoriten zählen Spinrollz, Gomblingo, Bet&Play, LuckyCircus, Cazimbo, RollingSlots, RTbet, MalinaCasino und DazardBet. ﻿Beste Online Casinos in...",en,Best online casino - top online casinos for German players in April,"German players who play for real money are looking for a best online casino real money that not only offers a huge selection of games, but also highest safety standards. In our 2025 report, we present the leading platforms that are the best online casino Germany and the best online casino real money. The favorites include Spinrollz, Gomblingo, Bet",2025-04-01 20:04:28
at,Beste Online Casino 2025: TOP 14 Casinos – Spieltipps für den April,"Deutsche Spieler verlangen von einem best Online Casino höchste Qualität, Sicherheit und Innovation. In unserem Vergleich 2025 präsentieren wir Ihnen die Top-Anbieter, die als best Online Casino Deutschland gelten. Unsere Favoriten – Spinrollz, Gomblingo, Bet&Play, LuckyCircus, Cazimbo, RollingSlots, RTbet, MalinaCasino und DazardBet – überzeugen mit einem umfassenden Angebot und modernster Technologie. Beste Online Casino Liste Spinrollz - Gesamt-Testsieger🥇NEU 2025! Gomblingo - Testsieger...",en,Best online casino 2025: Top 14 casinos - play tips for April,"German players demand the highest quality, security and innovation from a best online casino. In our comparison in 2025 we present you the top providers who are considered the best online casino Germany. Our favorites - spin roll, Gomblingo, Bet",2025-04-01 20:01:14
at,Trump will Rüstungsexporte erleichtern,US-Präsident Donald Trump will nach Angaben aus Regierungs- und Industriekreisen Rüstungsexporte erleichtern.,en,Trump wants to make arms exports easier,"According to government and industrial circles, US President Donald Trump wants to facilitate arms exports.",2025-04-01 20:00:23
at,Ergebnis - Göllersdorf - Niederleis 1:0 (0:0),In Kürze findest du hier den vollständigen Bericht zum Spiel.,en,Result - Göllersdorf - Niederleis 1: 0 (0: 0),You will find the full report on the game soon.,2025-04-01 20:00:00
at,Hausbrunn - Kronberg - Ein 0:0 als Befreiungsschlag für Kronberg,Nach zwei 0:4-Pleiten zum Rückrundenstart schrieb Kronberg endlich an - und war in Hausbrunn die gefährlichere Mannschaft.,en,Hausbrunn - Kronberg - a 0-0 as a liberation for Kronberg,"After two 0: 4 bankruptcy at the start of the second half of the season, Kronberg finally wrote down - and was the more dangerous team in Hausbrunn.",2025-04-01 20:00:00
at,Ergebnis - Traismauer - Fels 0:0 (0:0),Hier findest du alle Daten und Fakten zum Spiel.,en,Result - Traismauer - Fels 0: 0 (0: 0),Here you will find all the data and facts about the game.,2025-04-01 20:00:00
at,Bestes Online Casino [2025] ✴️ Die besten 15 Online Casinos hier finden,"Deutsche Spieler verlangen ein Casino, das alle wesentlichen Aspekte erfüllt – Sicherheit, Spielvielfalt und schnelle Zahlungsabwicklung. In unserem aktuellen Testbericht 2025 präsentieren wir die Top-Anbieter, die als best Online Casino Deutschland und bestes Online Casino echtgeld gelten. Zu den führenden Plattformen zählen Spinrollz, Gomblingo, Bet&Play, LuckyCircus, Cazimbo, RollingSlots, RTbet, MalinaCasino und DazardBet. Diese Casinos bieten ein umfassendes Gesamtpaket, das alle...",en,Best online casino [2025] ✴️ The best 15 online casinos can be found here,"German players require a casino that meets all essential aspects - security, variety of games and fast payment processing. In our current test report 2025 we present the top providers who are real money as Best Online Casino Germany and Best Online Casino. The leading platforms include spin roller, Gomblingo, Bet",2025-04-01 19:59:13
at,KAC folgt Salzburg mit 2:0 gegen Linz ins ICE-Finale,"Das Finale der ICE Hockey League heißt wie im Vorjahr Red Bull Salzburg gegen KAC. Der Rekordmeister aus Klagenfurt setzte sich am Dienstag im entscheidenden siebenten Spiel der Halbfinal-Serie gegen die Black Wings Linz zu Hause mit 2:0 (0:0,1:0,1:0) durch. Die Tore erzielten Raphael Herburger (38.) und Nick Petersen (53.). Die Finalserie, die ebenfalls über maximal sieben Spiele geht, beginnt am Freitag in Klagenfurt.",en,KAC follows Salzburg 2-0 against Linz in the ICE final,"As in the previous year, the final of the ICE Hockey League is Red Bull Salzburg against KAC. The record champions from Klagenfurt prevailed on Tuesday in the decisive seventh game of the semi-final series against the Black Wings Linz at home with 2: 0 (0: 0.1: 0.1: 0). The goals scored Raphael Herburger (38th) and Nick Petersen (53.). The final series, which also runs over a maximum of seven games, begins on Friday in Klagenfurt.",2025-04-01 19:59:05
at,Einsatz wegen steckengebliebenen Sattelschleppers,In St. Michael im Lungau hat die Feuerwehr Montagabend einen Sattelzug aus einer misslichen Lage befreien müssen: Das Schwerfahrzeug war von einer schmalen Nebenstraße abgekommen und in der Erde steckengeblieben.,en,Use due to the stuck saddle tractor,"In St. Michael in Lungau, the fire brigade had to free a tractor -trailer from an unsuccessful situation on Monday evening: the heavy vehicle had strayed from a narrow side street and got stuck in the ground.",2025-04-01 19:57:10
at,Online Casino ohne OASIS – TOP 15 Casinos für den April 2025,"Der April steht vor der Tür – deshalb haben wir für Sie eine Liste der besten Casinos ohne OASIS zusammengestellt, die Ihnen im kommenden Monat ein ungestörtes Spielerlebnis bieten!In der heutigen Welt des Online-Glücksspiels ist es entscheidend, ein Online Casino ohne OASIS zu wählen, das Ihnen freien Zugang zu allen Spielen ermöglicht – ohne lästige Einschränkungen. Viele Anbieter kämpfen noch mit der Online Casino trotz OASIS sperre, aber die innovativsten Casinos haben Wege gefunden, diese...",en,Online Casino without Oasis - Top 15 Casinos for April 2025,"April is just around the corner-that's why we have put together a list of the best casinos without an Oasis that will offer you an undisturbed gaming experience in the coming month! In today's world of online gambling, it is crucial to choose an online casino without an oasis that gives you free access to all games-without annoying restrictions. Many providers are still fighting with the online casino despite the Oasis lock, but the most innovative casinos have found paths, these ...",2025-04-01 19:55:57
at,"Siemens kauft Softwareanbieter Dotmatics für 5,1 Mrd Dollar","DOW JONES--Siemens erwirbt für 5,1 Milliarden US-Dollar das US-Unternehmen Dotmatics, einen führenden Anbieter von Forschungs- und Entwicklungssoftware für die Life-Sciences-Branche. Der Technologiekonzern erhöht so den adressierbaren Gesamtmarkt für Industriesoftware um 11 Milliarden Dollar, wie er in München mitteilte. Verkäufer ist Insight...",en,Siemens buys software providers Dotmatics for $ 5.1 billion,"For $ 5.1 billion, Dow Jones-Siemens acquires the US company Dotmatics, a leading provider of research and development software for the Life Sciences industry. The technology group thus increases the addressable overall market for industrial software by $ 11 billion, as he announced in Munich. Seller is insight ...",2025-04-02 18:40:39
at,Le Pen und die Rechten blasen zum Generalangriff auf den Rechtsstaat,Das Urteil gegen die Ex-Chefin des RN ist juristisch gut begründet. Sie versucht sich als politisches Opfer zu stilisieren und so den Missbrauch von EU-Geld zu kaschieren,en,Le Pen and the right bubbles to the general attack on the rule of law,The judgment against the ex-boss of the RN is legally well-founded. She tries to stylize herself as a political victim and thus hide the abuse of EU money,2025-04-02 18:39:00
at,Roche-Aktie: Innovation in der Krebsdiagnostik durch Next Generation Sequencing,"""Ich denke, dass dies ein Bereich ist, in dem wir ein signifikantes Wachstum und eine hohe Akzeptanz sehen (...) sequenzierungsbasierte Diagnostik, um die Onkologie besser zu charakterisieren und das Ansprechen auf die Behandlung zu überwachen"", sagte Matt Sause, CEO von Roche Diagnostics, in einem Interview. Next Generation...",en,Roche share: Innovation in cancer diagnostics by Next Generation Sequencing,"""I think this is an area in which we see significant growth and a high level of acceptance (...) sequencing -based diagnostics to better characterize oncology and to monitor the response to treatment,"" said Matt Sause, CEO of Roche Diagnostics, in an interview. Next generation ...",2025-04-02 18:38:00
at,Sexueller Missbrauch: Zehn Jahre Haft für Vorarlberger Ex-Polizisten,"Der pensionierte Polizist soll sich an seinen beiden Enkelinnen vergangen haben. Zudem wurde er verurteilt, weil er Bildmaterial von Missbrauchsdarstellungen von Minderjährigen besaß",en,Sexual abuse: ten years in prison for ex-police officers,The retired policeman is said to have passed his two grandchildren. He was also convicted because he had images of misuse of minors,2025-04-02 18:36:14
at,"ProSiebenSat.1-Aktionäre erhalten 5,74 Euro in bar und Aktien",Preis unter gegenwärtigem Börsenkurs,en,ProSiebenSat.1 shareholders receive 5.74 euros in cash and stocks,Price under current stock market course,2025-04-02 18:36:09
at,Erster Platz für das abz Lambach,Bundessieg beim Nachhaltigkeitsaward abz Lambach holten sich den ersten Platz beim bundesweiten Nachhaltigkeitsaward! Unter mehr als 40 eingereichten Projekten konnte sich die Klasse 3a der FR Hauswirtschaft mit ihrem kreativen und nachhaltigen Beitrag „Vom Bücherwurm zum Bücherturm“ & „Swap a book and cook“ durchsetzen und sicherte sich so den Bundessieg. Die feierliche Preisverleihung fand am Fr. 21. März 2025 in der Agrarpädagogischen Hochschule in Wien statt. Das Projekt setzt ein starkes...,en,First place for the Abz Lambach,"Federal victory at the sustainability award ABF Lambach took first place in the nationwide sustainability award! Class 3a of FR Hauswirtschaft was able to go under more than 40 projects submitted with its creative and sustainable contribution ""From bookworm to the book tower""",2025-04-02 18:35:13
at,Wieviel Windkraft braucht das Mühlviertel?,Eine Diskussion über Windkraftanlagen im Mühlviertel hat am Mittwochabend Befürworter und Gegner in den Landgasthof Pammer in Leopoldschlag (Bezirk Freistadt) gebracht. In der ORF-Oberösterreich-Sendereihe „Ein Wort am Ort“ haben beide Seiten ihre Argumente mit Leidenschaft vertreten.,en,How much wind power does the Mühlviertel need?,"A discussion about wind turbines in the Mühlviertel brought supporters and opponents to the Pammer Landgasthof in Leopoldschlag (Freistadt district) on Wednesday evening. In the ORF-Oberösterreich series “One Word on Place”, both sides have represented their arguments with passion.",2025-04-02 18:33:02
at,Farbenspiel,,en,Play of colors,,2025-04-02 18:32:18
at,Amazon-Aktie gewinnt: Amazon möchte scheinbar Tiktok kaufen,"Der weltgrößte Online-Händler habe das Angebot in einem Brief an Vizepräsident J.D. Vance und Handelsminister Howard Lutnick unterbreitet, schrieb die ""New York Times"" unter Berufung auf informierte Personen. Verschiedene an den Verhandlungen beteiligte Akteure nähmen die Amazon-Offerte jedoch nicht ernst, hieß...",en,Amazon share wins: Amazon apparently wants to buy Tiktok,"The world's largest online retailer has the offer in a letter to Vice President J.D. Vance and Minister of Commerce Woward Lutnick submitted, the ""New York Times"" wrote, citing informed people. However, various actors involved in the negotiations do not take the Amazon offer seriously, said ...",2025-04-02 18:31:39
at,Angst in der Apotheke - „Kann Frauen keinen sicheren Arbeitsplatz bieten“,"Die jüngste Einbruchsserie in Wiener Apotheken sorgt für Angst unter Mitarbeitern. Eine betroffene Geschäftsleiterin schildert der „Krone“ die Probleme mit Nachtschichten, die hohen Ausgaben für die Sicherheit und fehlende Unterstützung seitens der Kammer.",en,"Fear in the pharmacy - ""Can't offer women a safe job""","The latest series of burglaries in Vienna's pharmacies ensures fear among employees. An affected managing director describes the ""Krone"" the problems with night shifts, the high expenses for security and lack of support from the chamber.",2025-04-02 18:30:10
at,Mourinho griff Galatasaray-Trainer nach Cup-Aus ins Gesicht,Sein Klub Fenerbahce Istanbul verlor gegen den Rivalen 1:2.,en,Mourinho grabbed Galatasaray coach in the face after cup-off,His club Fenerbahce Istanbul lost 1: 2 against the rival.,2025-04-02 22:08:49
at,Ein Winterabenteuer in Kiruna,"Leistung gehört belohnt: Für das großartige Engagement und die herausragenden Leistungen im vergangenen Jahr wurde das Autohaus Seidnitzer mit einer ganz besonderen Reise ausgezeichnet – einer exklusiven Einladung von Volvo nach Kiruna im hohen Norden Schwedens. Eintauchen in ein skandinavisches Wintermärchen Angelika Seidnitzer und Nina Friesenbichler machten sich Ende März auf den Weg nach Lappland – in eine verschneite Welt voller Ruhe, Weite und ganz besonderer Eindrücke. Die Reise führte...",en,A winter adventure in Kiruna,"Performance is rewarded: For the great commitment and outstanding achievements in the past year, the Seidnitzer dealership was awarded a very special trip - an exclusive invitation from Volvo to Kiruna in the far north of Sweden. Diving into a Scandinavian winter fairy tale Angelika Seidnitzer and Nina Friesenbichler made their way to Lapland at the end of March - in a snowy world full of calm, wide and very special impressions. The trip led ...",2025-04-02 22:06:54
at,"3. April 2010: Der neue Tablet-Computer ""iPad"" der Firma Apple wird in den Vereinigten Staaten eingeführt. Am 23. Juli startet der Verkauf in Österreich","Unter Donnerstag, 3. April, ist im Buch der Geschichte unter anderem verzeichnet:",en,"April 3, 2010: The new ""iPad"" tablet computer from Apple will be introduced in the United States. The sale in Austria starts on July 23rd","On Thursday, April 3, the history of history is recorded:",2025-04-02 22:01:47
at,Milan und Inter trennen sich im Cup-Halbfinale 1:1,"Arnautovic sah das Remis von der Bank aus, das Rückspiel findet am 23. April statt",en,Milan and Inter separate 1: 1 in the Cup semi-final,"Arnautovic looked the draw from the bank, the second leg will take place on April 23rd",2025-04-02 22:01:37
at,"Oster-Gewinnspiel 2025 - 3.April: Bargeld, Tablets, Krone Digital & mehr!","Endlich geht‘s los, zum Start vom großen „Krone“-Ostergewinnspiels legen wir gleich richtig los! Wir verlosen neben Bargeld auch 12x Samsung Galaxy Tab inkl. „Krone“ Digital-Jahresabo. Außerdem gibt es noch 6x einen Reisekoffer inkl. Rätselkrone-Jahresabo & 6x € 100 zu gewinnen. HIER mitmachen und gewinnen!",en,"Easter competition 2025 - April 3rd: cash, tablets, crown digital","Finally it starts, at the start of the big ""crown"" Easter competition we really get started! In addition to cash, we are also giving away 12x Samsung Galaxy Tab including ""Krone"" digital annual subscription. There is also 6 times a travel suitcase including puzzle crown annual subscription",2025-04-02 22:01:17
