iso_code,title,description,lang_tranlation,title_translated,description_translated,pubDate
es,Una respuesta a una demanda histórica: La ambulancias ya pueden atravesar esta céntrica calle de Lastres.,"Las ambulancias ya pueden atravesar el casco antiguo de Lastres sin riesgo a quedarse atrapadas en sus estrechas calles. El de ayer gue un día importante para los vecinos de esta villa marinera, que vieron como el Ayuntamiento de Colunga daba respuesta, por fin, a una demanda histórica con una obra que ha permitido ensanchar la Calle Real facilitando así el tránsito de vehículos y el servicio de urgencias.",en,An answer to a historical demand: the ambulances can already cross this central street of Lastres.,"Ambulances can already cross the old town helmet without risk to get trapped in their narrow streets. Yesterday, an important day for the residents of this marine village, who saw how the City Council of Colunga finally responded to a historical demand with a work that has allowed the real street to be widen, thus facilitating the transit of vehicles and the emergency department.",2025-03-18 18:11:32
es,Un jurado popular declara culpable de asesinato al único mayor de edad implicado en el crimen de Mohamed Alí en Ceuta,La acusación popular pide una indemnización de 120.000 euros para los familiares de la víctima.,en,A popular jury declares guilty of murder at the unique of legal age involved in the crime of Mohamed Ali in Ceuta,"The popular accusation asks for compensation of 120,000 euros for the relatives of the victim.",2025-03-18 18:11:28
es,Juan José Ballesta rompe su silencio tras ser exculpado de agresión sexual: 'Me han crucificado',El Juzgado de Instrucción número 4 de Parla ha decretado la conclusión del procedimiento al no haber pruebas incriminatorias,en,Juan Jose Ballesta breaks his silence after being exculpable of sexual assault: 'They have crucified me',The Court of Instruction number 4 of Parla has decreed the conclusion of the procedure since there are no incriminating evidence,2025-03-18 18:11:28
es,INTERNACIONAL | Ciudad de México prohíbe las corridas de toros con violencia contra los animales,INTERNACIONAL: Ciudad de México prohíbe las corridas de toros con violencia contra los animales,en,International | City of Mexico prohibits bullfights with violence against animals,International: City of Mexico prohibits bulls with violence against animals,2025-03-18 18:11:25
es,El Hogar del Jubilado Udaberri suma 184 socios nuevos este último año,,en,The Udaberri Retired Household 184 New Partners this last year,,2025-03-18 19:16:59
es,El bebé dorado de Elon Musk está en apuros y no solo es por su polémico saludo...,"Elon Musk, el hombre más rico del mundo está siendo un partícipe activo en la presidencia actual de Donald Trump, tanto como donante principal de la campaña republicana como por llegar a ser la cabeza del Departamento de Eficiencia Gubernamental (Department of Government Efficiency o DOGE por sus siglas en inglés).",en,Elon Musk's golden baby is in trouble and it's not only because of his polemic greeting ...,"Elon Musk, the richest man in the world is being an active participation in the current presidency of Donald Trump, both as the main donor of the Republican bell and for becoming the head of the Government Efficiency Department (Department of Government Efficient or Doge for its acronym in English).",2025-03-18 19:16:56
es,El Senado aprueba la propuesta del PP para reformar la Ley del Suelo e iniciar su tramitación,"El Senado ha aprobado este martes la proposición de ley para reformar la Ley del Suelo del Partido Popular (PP), por lo que la norma será [...]",en,The Senate approves the proposal of the PP to reform the Land Law and initiate its processing,"The Senate approved on Tuesday the proposition of law to reform the Popular Party Law (PP) law, so the norm will be [...]",2025-03-18 19:16:51
es,"La Laguna Sound Festival da un giro al pop con Nil Moliner, Miss Caffeina y Pignoise","San Javier acogerá, los días 11 y 12 de julio, la segunda edición de La Laguna Sound Festival. El nuevo cartel se presentó esta mañana en la Sala de Catas de Estrella de Levante, en Murcia, y con ello se evidenció un notable cambio de registro: si la del año pasado fue una apuesta por la electrónica con Les Castizos como principal reclamo, este verano la organización lo ha apostado todo al pop y al indie.",en,"The Laguna Sound Festival takes a turn to pop with Nil Moliner, Miss Caffeina and Pignoise","San Javier Cora, July 11 and 12, the second edition of the Laguna Sound Festival. The new poster presented this morning in the Lift Star tastings, in Murcia, and with that a remarkable change of registration was evidenced: if the last year was a commitment to electronics with them Castizos as the main claim, this summer the organization has bet everything on pop and indie.",2025-03-18 19:16:39
es,El TSJC inadmite los recursos de la Generalidad contra la aplicación del 25% de español en una docena de escuelas,El gobierno de ERC se escudaba en la normativa autonómica aprobada a posteriori contra los porcentajes en la enseñanza de idiomas.,en,The TSJC inadmits the resources of the generality against the application of 25% Spanish in a dozen schools,The ERC government was shielded in the autonomic regulations approved by posteriori against the percentages in the language teaching.,2025-03-18 19:16:38
es,"Monólogo de las ocho: ""La presión sólo para Zelenski, con Rusia el duro negociador se vuelve suave y mullido""",Rafa Latorre reflexiona en su monólogo sobre la conversación telefónica entre Trump y Putin.,en,"Monologo of the eight: ""The pressure only for Zelenski, with Russia the hard negotiator becomes soft and fluffy""",Rafa Latorre reflects on his monologue about telephone conversation between Trump and Putin.,2025-03-18 19:16:19
es,"Netanyahu, tras retomar los ataques contra Gaza: “Esto es solo el comienzo”","En las últimas horas han muerto más de 400 personas en la Franja, según las autoridades sanitarias locales",en,"Netanyahu, after retaking the attacks against Gaza: this is just the beginning","In the last hours more than 400 people have died in the strip, according to local health authorities",2025-03-18 19:16:19
es,Tres abejas-ninot viajarán solidariamente de Valencia a la Alcarria,"En estos días en los que el foco está puesto en las Fallas de Valencia 2025, tres pueblos de la Alcarria se han unido para ayudar a los talleres falleros que quedaron afectados por la DANA que azotó muy especialmente a la Comunidad Valenciana el pasado 29 de octubre. Lo han hecho a través de una iniciativa titulada '3 abejas-ninot viajan a la Alcarria', nacida del ingenio de las Burbutrizes, el grupo de antiguas alumnas del colegio Adoratrices de Guadalajara que, como si de un enjambre de estos productivos insectos se tratara, dan rienda suelta a su febril creatividad para poner en marcha diferentes causas benéficas y poner en valor, al mismo tiempo, la riqueza patrimonial de la provincia, especialmente de la comarca alcarreña. ""Surgió, a raíz de ver en televisión y en redes, un taller fallero, concretamente de Paiporta, totalmente inundado, y a su artesana, pues, prácticamente llorando"", ha recordado la burbutriz y diseñadora publicitaria Laura Domínguez, explicando que, con el objetivo de ayudar a Valencia ""de forma directa"", propusieron este proyecto a los alcaldes de las tres localidades implicadas, cuyos ayuntamientos ""van a costear su abeja-ninot para ayudar así a personas que tiene que remontar después de haber visto su negocio destrozado"". La iniciativa solidaria '3 abejas-ninot viajan a la Alcarria' fue presentada este pasado fin de semana en el marco de la 44 Feria Apícola Internacional de Pastrana, cuyo primer edil, Carlos Largo, ha adelantado en COPE Guadalajara que, mientras que ""los ninots de Budia y Peñalver serán expuestos en sus museos"", el de Pastrana ""irá a la Feria y cuando tengamos este Centro de Interpretación de la Miel, en el Museo, también irá aquí"". Cada una de las figuras, que se están elaborando en Paiporta, en el taller de Miriam García, una de las más relevantes artistas en el escalafón de fallas infantiles, que quedó prácticamente destrozado por el paso de la borrasca, lucirán un detalle como seña de identidad del municipio respectivo al que representan.""Cuando nos dijeron que iban a hacer el ninot, desde el Ayuntamiento indicamos que, por favor, para distinguir a cada uno, tuviera cada uno una característica propia"", ha apuntado Largo, desvelando que, en el caso de la Villa Ducal, se ha elegido ""el parche de la princesa Éboli, algo que rápidamente nos identifica"".La presentación oficial de las 3 abejas-ninots se realizará el próximo 20 de mayo, como acto central de la celebración del 'Día Mundial de las Abejas 2025'.",en,Three bees-ninot will travel jointly to La Alcarria,"In these days in which the focus is on the Fallas of Valencia 2025, three villages of the Alcarria have joined to help the Falleros workshops that were affected by the Dana that hit the Valencian Community very especially on October 29. They have done it through an initiative entitled '3 bees-ninot travel to the Alcarria', born from the ingenuity of the Burbutrizes, the group of former students of the School Adoratrices de Guadalajara who, as if a swarm of these productive insects were treated, give free rein to their febrile creativity to implement different causes benefits and put in value, at the same time Patrimonial wealth of the province, especially from the Alcarrena region. ""He ran, to see on television and in networks, a fallero workshop, specifically to Paiporta, totally flooded, and to his artisan, then, practically crying,"" recalled the bubutric and advertising disenator Laura Dominguez, explaining that, with the aim of helping Valencia ""directly"", they proposed this project to the mayors of the three localities involved, whose municipalities are going to Your bee-ninot to help people who have to go back after having seen your shattered business. "" The solidarity initiative '3 bees-ninot travel to the Alcarria' was presented this last weekend in the frame From honey, in the museum, it will also go here. "" Each of the figures, which are being prepared in Paiporta, in the workshop of Miriam Garcia, one of the most relevant artists in the ladder of children Each one had its own characteristic, ""he said long, revealing that, in the case of the Ducal Village,"" the Patch of Princess Eboli has been chosen, something that quickly identifies us "". The official presentation of the 3 bees-ninots will be held next May 20, as a central act of the celebration of the 'World Bees Day 2025'.",2025-03-18 19:16:14
es,"Ferran Torres: ""Cuando ves a un amigo al lado, te dan ganas de hacer cosas grandes""","Fue uno de los grandes protagonistas de la remontada del Barça en el Metropolitano. Ferran Torres, 25 años, atendió a Mundo Deportivo desde la Ciudad del Fútbol de la RFEF. Como segundo capitán de la selección española, el de Foios vivirá un partido especial en Valencia, pero entre los muchos temas de los que habló también destacó la importancia del último resultado del Barça contra el Atlético de Madrid (2-4). Habla del factor diferencial de jugar en un grupo de amigos.",en,"Ferran Torres: ""When you see a friend next door, you want to do big things""","He was one of the main protagonists of the drawing of the boat in the Metropolitan. Ferran Torres, 25 years, attended to Mundo Deportivo from the RFEF Soccer City. As the second captain of the Spanish selection, Foios lived a special match in Valencia, but among the many issues that I speak, I also highlight the importance of the last result of the boat against the Athletic of Madrid (2-4). Talk about the differential factor of playing in a group of friends.",2025-03-18 19:16:14
es,"Las llamadas que realizó la mujer de Gene Hackman el día después de su muerte: ""Ella llamó y describió algo de congestión""","Se pensaba que la mujer, de 65 años, había muerto el 11 de febrero debido a una rara enfermedad rara llamada hantavirus.",en,The calls made,"It was thought that the woman, 65 years old, had died on February 11 due to a rare rare disease called Hantavirus.",2025-03-18 19:16:09
es,Tamara Alegre será la telonera de El Arrebato en Plasencia,"En la presentación del festival Esencial de Plasencia, que tendrá lugar el 5 de julio en la plaza de toros y contará con El Arrebato como cabeza de cartel, los promotores apuntaron que habría un artista invitado, preferentemente de la región.",en,Tamara Alegre will be the telonera of El Arrebato in Plasencia,"In the presentation of the Essential Festival of Plasencia, which will take place on July 5 in the bullring and had the outburst as the head of the poster, the promoters pointed out that there would be an invited artist, preferably of the region.",2025-03-18 19:46:58
es,"El arroyo de Guadalbarcar se llevó la esperanza de hallar viva a María: ""La encontramos entre la maleza""",Las intensas lluvias se cobran una primera vida en Constantina y aún se busca a su marido después de que el coche de ambos fuera arrastrado en un vadoSevilla cierra las compuertas de la Vega de Triana,en,The Guadalbarcar Arroy,Heavy rains charge a first life in Constantine and is still looking for her husband after both the car of both was dragged into a VomeSevilla closes the gates of the Vega de Triana,2025-03-18 19:46:40
es,El Real Madrid golpea dos veces bajo la lluvia,El equipo de Alberto Toril ganó a Arsenal en dos contras finalizadas por Linda Caicedo y Athenea del Castillo,en,Real Madrid hits twice in the rain,Alberto Toril's team won Arsenal in two cons finished by Linda Caicedo and Athenea del Castillo,2025-03-18 19:46:36
es,Rebaja de la tasa de alcohol al volante: el Congreso da el primer paso con la abstención del PP y el 'no' de Vox,"El Pleno del Congreso ha dado este martes el primer paso para bajar la tasa máxima de alcohol en la conducción de los actuales 0,5 gramos por litro de sangre a 0,2, y prohibir la difusión de la ubicación de controles policiales en redes sociales. Con el único voto en contra de Vox y la abstención del PP, el Congreso ha tomado en consideración una proposición del ley del PSOE que modifica el texto refundido de la Ley sobre Tráfico, Circulación de Vehículos a Motor y Seguridad Vial. Según los socialistas, estas propuestas ""no tienen un enfoque represivo, sino que persiguen, como es propio de cualquier sociedad moderna y democrática, que sus ciudadanos puedan ejercer con seguridad su derecho a la libre circulación sin ver comprometidas su vida y su integridad física, todos ellos derechos fundamentales reconocidos"" por la Constitución. En el texto, se añade el párrafo z4) al artículo 76, que considera infracciones graves conducir con tasas de alcohol superiores a 0,1 miligramos por litro de aire espirado o 0,2 gramos por litro en sangre, hasta 0,25 miligramos por litro de aire espirado o 0,5 gramos por litro en sangre. Las infracciones cuando la tasa de alcohol exceda la permitida serán sancionadas con multa de 1.000 euros. En España, según un informe del Instituto Nacional de Toxicología y Ciencias Forenses, el 33% de los conductores fallecidos en accidentes de tráfico presentaban resultados positivos de alcohol en sangre y también el 29% de los peatones fallecidos. Según otro informe de la Fiscalía General del Estado, en el año 2023 se registraron 50.071 condenas penales por conducir con altas tasas de alcohol. Por otra parte, en las pruebas de alcoholemia realizadas a conductores implicados en siniestros de tráfico en el primer semestre del 2024, el 5,61% dieron resultados positivos. ""Las investigaciones disponibles demuestran que el consumo de alcohol, aun en cantidades relativamente pequeñas, aumenta la probabilidad de que se produzca un accidente y también empeora la gravedad del accidente. Los conductores con una tasa entre 0,05 y 0,25 miligramos por litro de aire espirado (0,1 y 0,5 gramos por litro en sangre) tienen hasta tres veces mayor riesgo de accidente mortal, cuando se les compara con conductores sobrios"", señala el PSOE, que recuerda que las actuales tasas datan de hace 25 años. Marlaska lo avanzó en septiembre En septiembre de 2024, el ministro del Interior, Fernando Grande-Marlaska, anunciaba su intención de promover esta reforma legal al entender que la ""sociedad española está madura"" para aceptar este cambio y en atención a la solicitud de las asociaciones afectadas por la ""violencia vial"". ""En más de la mitad de los siniestros aparece el alcohol o drogas como determinante"", dijo en un desayuno informativo en Madrid. De hecho, tras el anuncio de Grande-Marlaska, victimas, automovilistas y expertos aplaudieron que el ministro del Interior apostara por iniciar los trámites parlamentarios para bajar la tasa de alcohol en sangre a 0,2 gramos por litro de alcohol en sangre, frente al 0,5 actual. Desde Automovilistas Europeos Asociados...",en,Drive of the alcohol rate at the wheel: Congress takes the first step with the abstention of the PP and the 'no' of Vox,"The Plenary of the Congress has given this Tuesday the first step to lower the maximum rate of alcohol in the conduction of the current 0.5 grams per liter of blood to 0.2, and prohibit the diffusion of the location of police controls on social networks. With the only vote against Vox and the abstention of the PP, the Congress has taken into consideration a proposition of the PSOE law that modifies the consolidated text of the law on traffic, circulation of motor vehicles and road safety. According to the socialists, these proposals ""do not have a repressive approach, but they pursue, as is typical of any modern and democratic society, that their citizens can safely exercise their right to free circulation without seeing their life and physical integrity compromised, all of them fundamental rights recognized"" by the constitution. In the text, paragraph Z4) at article 76, which considers serious infractions to drive with alcohol rates greater than 0.1 milligrams per liter of exhaled air or 0.2 grams per liter in blood, up to 0.25 milligrams per liter of exhaled air or 0.5 grams per liter in blood. The infractions when the alcohol rate exceeds the allowed will be sanctioned with a fine of 1,000 euros. In Spain, according to a report from the National Institute of Toxicology and Forensic Sciences, 33% of drivers who died in traffic accidents had positive blood alcohol results and also 29% of deceased pedestrians. According to another report by the State Attorney General, in 2023, 50,071 criminal convictions were registered with high alcohol rates. On the other hand, in breathalyzer tests performed on drivers involved in traffic accidents in the first semester of 2024, 5.61% gave positive results. ""The available investigations show that alcohol consumption, even in relatively small quantities, increases the probability that an accident occurs and also worsens the seriousness of the accident. Drivers with a rate between 0.05 and 0.25 milligrams per liter of exhaled air (0.1 and 0.5 grams per liter in blood) have up to three times greater risk of fatal accident, when compared to them, The PSOE, who remembers that the current fees date from 25 years ago. Marlaska advanced it in September in September 2024, Interior Minister Fernando Grande-Marlaska announced his intention to promote this legal reform in understanding that ""Spanish society is mature"" to accept this change and in attention to the request of the associations affected by ""road violence"". ""In more than half of the accidents alcohol or drugs appear as a determinant,"" he said at an informative breakfast in Madrid. In fact, after the announcement of Grande-Marlaska, victims, motorists and experts applauded that the Minister of the Interior bet on starting parliamentary procedures to lower the blood alcohol rate to 0.2 grams per liter of blood alcohol, compared to the current 0.5. From associated European motorists ...",2025-03-18 19:46:27
