iso_code,title,description,lang_tranlation,title_translated,description_translated,pubDate
pt,Trump diz estar expectante para falar com Putin sobre cessar-fogo,"O Presidente dos Estados Unidos Donald Trump disse que está expectante pelo telefonema com o homólogo russo Vladimir Putin, que decorrerá hoje, frisando que ainda há ""muito a fazer"" para um acordo de cessar-fogo na Ucrânia.""Muitos elementos de um Acordo Final foram acordados, mas ainda há muito a fazer. Milhares de jovens soldados e outros estão a ser mortos. Todas as semanas há 2.500 mortes de soldados, de ambos os lados, e isto deve acabar JÁ. Estou expectante pelo telefonema com o Presidente",en,Trump says he is expectant to talk to Putin about ceasefire,"United States President Donald Trump said this expectant by calling with Russian homologous Vladimir Putin, who had taken place today, stressing that there is still ""much to do"" for a ceasefire agreement in Ukrainia. On both sides, and this should end.",2025-03-18 05:00:00
pt,Ataques israelitas regressam e matam pelo menos 205 na Faixa de Gaza,"Pelo menos 205 pessoas morreram esta terça-feira devido a ataques do exército israelita contra a Faixa de Gaza, disseram fontes do Governo do enclave, citados por meios de comunicação da Palestina.",en,Israelite attacks return and kill at least 205 in the Gaza Strip,"At least 205 people died this Tuesday due to Israeli army attacks against the Gaza Strip, sources of the Enclave government said by Palestine's means of communication.",2025-03-18 06:17:54
pt,"Manifesto dos 50 reuniu-se com Amadeu Guerra, elogiou o PGR e pediu-lhe ""prioridades"" para melhorar Justiça","Representantes do Manifesto dos 50 falam de “uma reunião muito produtiva”, que tratou dos temas “mais sensíveis”. A Amadeu Guerra sublinharam a “importância de serem estabelecidas prioridades e medidos os resultados”",en,"Manifesto of the 50 gathered with Amadeu Guerra, praised the PGR and asked him ""priorities"" to improve justice","Representatives of the 50 manifesto speak of a very productive meeting, which dealt with the most sensitive topics. Amadeu Guerra underlined the importance of being established priorities and the results measured",2025-03-18 06:45:11
pt,O cerco a Ana Paula,"Ana Paula perdeu a casa porque a renda ficou incomportável, perdeu a barraca porque a Câmara de Loures a demoliu e pode perder os filhos porque sem casa nem barraca não tem onde viver com eles. Está cercada. O parto do quarto filho, que está marcado para hoje, será um dos poucos dias felizes. Porque, ao contrário do que fizemos com a habitação, não confiámos a nossa saúde exclusivamente ao mercado",en,The siege of Ana Paula,"Ana Paula lost the house because the lace was unimportable, lost the tent because Loures Camara Demolved her and can lose her children because without a tent or tent has nowhere to live with them. This is surrounded. The delivery of the fourth child, which is marked for today, will be one of the few days happy. Because, contrary to what we did with the housing, we do not trust our health exclusively to the market",2025-03-18 06:45:00
pt,Sporting: perceba o trabalho que Gyokeres fará durante a pausa,Aproveitará para se restabelecer completamente e ficar 'no ponto' para a fase final da época,en,Sporting: Realize the work that Gyokeres will do during the break,He had taken the opportunity to restore completely and be 'at the point' for the final phase of the time,2025-03-18 06:45:00
pt,Benfica 'saca do cheque' para garantir El Ouahdi de uma vez por todas,Encarnados estarão dispostos a chegar aos dez milhões de euros pelo lateral marroquino.,en,Benfica 'Check Bags' to ensure El Ouahdi once and for all,Incarnate will be willing to reach the ten million euros from the Moroccan back.,2025-03-18 06:44:51
pt,EUA dizem que deportados para El Salvador são do gangue Tren de Aragua,"A porta-voz da Casa Branca, Karoline Leavitt, reafirmou esta terça-feira que o governo dos EUA não tem dúvidas de que os migrantes venezuelanos enviados e presos em El Salvador são membros do Tren de Aragua.",en,USA say that deported to El Salvador are from the gang Tren de Aragua,White House spokesman Karoline Leavitt reaffirmed this Tuesday that the US government has no doubt that Venezuelan migrants sent and arrested in El Salvador are members of the Aragua Tren.,2025-03-18 06:44:01
pt,Há uma alternativa à NATO?,"O que Nuno Melo disse ao Público sobre a compra de aviões militares americanos é o que os líderes europeus estão a dizer baixinho: hoje é a Ucrânia, amanhã podemos ser nós. Não se pode deixar de desconfiar de Putin, e não se pode confiar nestes americanos. Mas interessa acabar com a NATO?",en,Is there an alternative to NATO?,"What Nuno Melo told the public about the purchase of US military aviations and what European leaders are saying softly: today and Ukrainia, tomorrow we can be us. One cannot fail to be suspicious of Putin, and one cannot trust these Americans. But do you matter to end the NATO?",2025-03-18 06:42:56
pt,ONG moçambicana denuncia assassínio de mais um apoiante de Mondlane,"A plataforma eleitoral moçambicana Decide denunciou esta terça-feira que mais um apoiante do ex-candidato presidencial Venâncio Mondlane foi ""sequestrado e assassinado"", elevando para 15 o total de vítimas desde dezembro.",en,Mocambican NGO denounces murder of another Mondlane supporter,"The Mocambican electoral platform decides to report this Tuesday that another supporter of former presidential candidate Venancio Mondlane was ""kidnapped and murdered"", raising to 15 the total victims since December.",2025-03-18 06:41:14
pt,Toneladas de petróleo derramadas após ato suspeito de sabotagem na Noruega,"O operador da rede elétrica nacional, Statnett, calculou que cerca de 60.000 toneladas de petróleo foram derramadas num posto de transformação de eletricidade desativado.",en,Tons of pitroleum spilled after suspected sabotage act in Norway,"National Electric Network operator, Statnett, estimated that about 60,000 tons of oil was spilled at a disabled electricity transformation station.",2025-03-18 06:39:46
pt,Advogados começam hoje a escolher o próximo bastonário,"Os advogados começam esta terça-feira a escolher o seu bastonário para o próximo triénio, com a escolha a recair entre dar a continuidade à atual bastonária ou entre os seus três opositores, estreantes na corrida ao cargo.",en,Lawyers begin today to choose the next Bastonario,"Lawyers start this Tuesday to choose their business for the next triennium, with the choice to fall between continuing the current Bastonaria or between their three opponents, rookies in the race.",2025-03-18 06:39:36
pt,Democracia não é só urnas: o perigoso precedente de Montenegro,"A história da democracia não se faz apenas com aquilo que os líderes de hoje fazem. Faz-se, acima de tudo, com aquilo que os líderes de amanhã aprendem que podem fazer. Se Montenegro ganha e diz que as eleições o absolvem de qualquer dúvida, estará inocentemente a ensinar uma lição que um dia poderá ser usada contra a própria democracia",en,Democracy is not only ballot box: the dangerous precedent of Montenegro,"The history of democracy is not just what today's leaders do. It is done above all with what the tomorrow leaders learn they can do. If Montenegro wins and says that the elections acquit him of any doubt, he will be innocently teaching a lesson that can one day be used against his own democracy",2025-03-18 06:38:48
pt,Nove distritos do continente sob aviso laranja na quinta-feira devido ao vento,"Viseu, Castelo Branco, Porto, Guarda, Vila Real, Viana do Castelo, Aveiro, Coimbra e Braga vão estar sob aviso laranja entre as 00h e as 6h de quinta-feira devido aos ventos fortes.",en,Nine districts of the continent under orange warning on Thursday due to the wind,"Viseu, Castelo Branco, Porto, Guarda, Vila Real, Viana do Castelo, Aveiro, Coimbra and Braga will be under orange warning between 00h and 6am on Thursday due to the strong winds.",2025-03-18 09:22:21
pt,"ONU considera ataque a Gaza ""inaceitável"" e apela ao cessar-fogo","O coordenador humanitário da Agência das Nações Unidas de Assistência aos Refugiados Palestinianos (UNRWA), Muhannad Hadi, classificou o ataque israelita à Faixa de Gaza na madrugada desta terça-feira como inaceitável, apelando à restauração imediata do cessar-fogo.",en,"UN considers attack on ""unacceptable"" Gaza and appeals to the ceasefire","The Humanitarian Coordinator of the United Nation Agency for Palestinian Refugees (Unrwa), Muhannad Hadi, classified the Israelite attack the Gaza Strip at dawn on this Tuesday as unacceptable, appealing the immediate restoration of the ceasefire.",2025-03-18 09:21:52
pt,'Macaco' chega a tribunal para julgamento da 'Operação Pretoriano',"Vítor Manuel Aleixo e outros cinco arguidos vão ser ouvidos, esta terça-feira, no Tribunal de São João Novo, no Porto.",en,'Monkey' arrives in court for trial of 'black Operation',"Vitor Manuel Aleixo and five other defendants will be heard, this Tuesday, in the Court of Sao Joao Novo, in Porto.",2025-03-18 09:20:38
pt,No supermercado do futuro não há códigos de barras e as balanças conhecem a fruta,"Para comprar fruta e legumes, é preciso decorar um número para colocar na balança. Isso vai deixar de ser necessário. Nas balanças inteligentes, basta pôr a fruta. Isto é possível com muitas câmaras e Inteligência Artificial, como se pode ver na reportagem da RTL num supermercado em Düsseldorf, na Alemanha.",en,In the supermarket of the future there are no bar codes and the balance sheets know the fruit,"To buy fruit and vegetables, and I need to decorate a number to put in the balance. This will cease to be necessary. In intelligent rocks, just for the fruit. This is possible with many cameras and artificial intelligence, as can be seen in the RTL report in a supermarket in Dusseldorf, Germany.",2025-03-18 09:20:26
pt,Sete folgas em 74 dias: o calendário infernal do Real Madrid em 2025,Nove jogos com menos de 72 horas de descanso e uns potenciais 72 encontros na época preocupam um plantel já afetado por lesões,en,Seven clearances in 74 days: Real Madrid infernal calendar in 2025,Nine games with less than 72 hours of rest and some potential 72 encounters at the time worry a squad already affected by injuries,2025-03-18 09:20:00
pt,Dona da Iberia pretende comprar TAP para criar duplo hub no Sul da Europa,"Para o International Airlines Group (IAG), a compra da TAP pode permitir a criação de um duplo hub no Sul da Europa (Madrid-Lisboa) para concorrer com as grandes transportadoras do Norte.",en,Owner of Iberia intends to buy TAP to create double hub in southern Europe,"For the International Airlines Group (IAG), the purchase of TAP can allow the creation of a double hub in southern Europe (Madrid-Lisboa) to compete with large northern carriers.",2025-03-18 09:19:46
pt,"PlayStation fundou um novo estúdio liderado por Jason Blundell, ex-diretor de Call of Duty Zombies","Um novo projeto.Jason Blundell é o diretor do novo estúdio Dark Outlaw Games, que está sob a alçada da PlayStation.",en,"PlayStation founded a new studio led by Jason Blundell, former director of Call of Duty Zombies","A new project. Jason Blundell and the director of the new studio Dark Outlaw Games, who is under the Playstation's reach.",2025-03-18 09:19:33
pt,Foto de família em Azeméis revela populações novas de rododendro raro,"Uma fotografia de família tirada por acaso numa zona ribeirinha de Oliveira de Azeméis revelou existirem nesse concelho populações antes desconhecidas de um rododendro raro em todo o mundo, informaram esta terça-feira os especialistas envolvidos na descoberta.",en,Family photo in Azemeis reveals new populations of rododendro rare,"A photograph of family taken by chance in a riverside area of ​​Oliveira de Azemeis revealed that there are previously unknown populations of a rare Rododendro around the world, experts involved in the discovery said.",2025-03-18 09:18:18
pt,Transportes: Greve dá direito a devolução do dinheiro do passe?,Conheça as regras.,en,Transport: Strike of the right to return the money from the pass?,I know the rules.,2025-03-18 09:18:00
pt,"Guterres ""chocado"" com ataques e fim do cessar-fogo na Faixa de Gaza","António Guterres pediu ""veementemente"" que se respeite o cessar-fogo.",en,"Guterres ""shocked"" with attacks and end of ceasefire in the Gaza Strip","Antonio Guterres ""vehemently"" asked for the ceasefire to respect.",2025-03-18 09:17:53
pt,Este destino tem a melhor relação qualidade/preço do mundo e fica no sul do país,Conheça a zona de Portugal que tem a melhor relação qualidade/preço do mundo e onde uma refeição com três pratos para duas pessoas custa 50€,en,This destination has the best quality/price relationship in the world and is in the south of the country,Meet the Portugal area that has the best quality/price relationship in the world and where a meal with three dishes for two people costs 50,2025-03-18 12:30:00
pt,IL suspende preparação de autárquicas. Mariana Leitão concorre a deputada,"O líder da IL admitiu hoje que a líder parlamentar e candidata presidencial, Mariana Leitão, poderá vir a integrar as listas de candidatos a deputados e anunciou que o partido irá suspender a preparação das autárquicas até às eleições legislativas.",en,IL suspends preparation of autarchics. Mariana Leitao competes for Deputy,"The IL leader admitted today that the parliamentary leader and presidential candidate, Mariana Leitao, could join the lists of candidates for deputies and announced that the party will suspend the preparation of the autarchics until the legislative elections.",2025-03-18 12:29:30
pt,12 mortos em queda de avião nas Honduras,"Avião de pequeno porte caiu no mar, segundos depois de levantar voo",en,12 Dead in Honduras Avian Fall,"Small plane fell into the sea, seconds after raising flight",2025-03-18 12:29:15
pt,"Albuquerque diz que só ""grande votação"" no PSD traz estabilidade à Região","O cabeça de lista do PSD às eleições de domingo na Madeira, Miguel Albuquerque, afirmou hoje que a sua campanha consiste em ""dizer a verdade às pessoas"" e realçou que só uma ""grande votação"" no partido trará estabilidade à região.""O que é fundamental, neste momento, é fazermos tudo o que é possível para termos uma boa votação no PSD, porque só com uma grande votação no PSD é que vamos ter um governo estável na Madeira. Não tenho nenhuma dúvida sobre isso"", declarou.O candidato, também líder re",en,"Albuquerque says that only ""big vote"" in the PSD brings stability the region","PSD's list head The Sunday elections in Madeira, Miguel Albuquerque, said today that his campaign consists of ""telling the truth to people"" and realized that only a ""great vote"" in the party will bring stability to the region. doubts about it, ""he said.",2025-03-18 12:28:16
pt,Como será a próxima geração de designers? Fomos descobrir,O Lifestyle ao Minuto falou com alguns dos designers recém-formados Istituto Europeo di Design que apresentaram a sua primeira coleção na mais recente edição da ModaLisboa.,en,How will the next generation of designers be? We went to find out,Lifestyle to the minute spoke to some of the designers received European Istituto Di Design who presented their first collection in the latest edition of Modalisboa.,2025-03-18 12:27:49
pt,Banda Semisonic contesta uso da sua música pela Casa Branca nas redes sociais,"A Casa Branca adicionou o sucesso ""Closing Time"" a um ""post"" de um homem algemado enquanto é revistado num aeroporto, utilizando a legenda ""não precisas de ir para casa, mas não podes ficar aqui"".",en,Semisonic band disputes use of their music by the White House on social networks,"The White House added the success ""Closing Time"" to a ""post"" of a handcuffed man while and searched at an airport, using the caption ""You don't need to go home, but you can't stay here"".",2025-03-18 12:27:33
pt,"Galp sofre novo corte de preço-alvo, desta vez pela JB Capital Markets","A casa de investimento espanhola está menos otimista quanto ao desempenho da Galp, mas continua a recomendar a compra dos títulos da petrolífera.",en,"Galp suffers new target price cut, this time by JB Capital Markets","The Spanish investment house is less optimistic about Galp's performance, but continues to recommend buying Petrolifera titles.",2025-03-18 12:27:29
pt,BYD revoluciona mercado de carros elétricos com recarregamento em 5 min e supera Musk,,en,Byd revolutionizes electric cars market with recharging at 5 min and surpasses musk,,2025-03-18 12:27:01
pt,Médio Oriente: Hamas diz que está a trabalhar com mediadores para conter ataques israelitas,"O Hamas ""aceitou o acordo de cessar-fogo e implementou-o integralmente, mas a ocupação israelita renegou os seus compromissos (...) ao retomar [esta noite] a agressão e a guerra"", disse o responsável à agência France-Presse, sublinhando que o movimento, até agora, não respondeu aos ataques.",en,MEDIATE ORIENTE: Hamas says he is working with mediators to contain Israelite attacks,"Hamas ""accepted the ceasefire agreement and implemented it in full, but the Israelite occupation reneged its commitments (...) by resuming [tonight] the aggressive and war,"" said the responsible agency France-Press, stressing that the movement, so far, has not responded to the attacks.",2025-03-18 12:26:54
pt,Envolvido em acidente de barco com morte volta para cargo na Casa Civil,"Nivaldo volta a ocupar cargo de assessor especial após ficar 9 meses afastadoOriginalmente publicado em Envolvido em acidente de barco com morte volta para cargo na Casa Civil, Conteúdo original de Jornal Midiamax | Notícias de Campo Grande e Mato Grosso do Sul.",en,Involved in a boat accident with death returns to office at the Civil House,"Nivaldo returns to occupy the position of special advisor after 9 months remotely published in involved in a boat accident with death goes to office in the Civil House, original content of newspaper Midiamax | News from Campo Grande and Mato Grosso do Sul.",2025-03-18 12:26:53
pt,"Messi desfalca seleção argentina: «É uma pena perder estes dois jogos, mas...»",Atleta vai falhar os compromissos internacionais por conta de uma lesão no adutor,en,"Messi misses Argentina: And a pity losing these two games, but ...",Athlete will fail international commitments because of a harm in the adductor,2025-03-18 13:02:00
pt,Barcelona: lesão termina época para Marc Casadó,Médio espanhol ficará de fora dos relvados durante aproximadamente dois meses,en,Barcelona: injury ends time for marc married,Spanish medium had been outside the pitch for about two months,2025-03-18 13:01:39
pt,Happy Gilmore 2 recebe novo trailer,Tacada de génio.Adam Sandler regressa a Happy Gilmore e traz consigo uma série de caras conhecidas.,en,Happy Gilmore 2 receives new trailer,Genio's shot.adam Sandler returns to Happy Gilmore and brings a series of known guys.,2025-03-18 13:01:37
pt,Bolsa de Lisboa segue no verde a par da Europa,"As maiores subidas vão para a Mota Engil cresce 3,85% para os 3,39 euros, seguido pelo Banco Comercial Português (BCP) que valoriza 2,85% para os 0,57 euros, e a Galp Energia sobe 1,62% para os 15,40 euros.",en,Lisbon bag follows in green alongside Europe,"The largest climbs go to the ENGIL Mota grows 3.85% to 3.39 euros, followed by the Portuguese Commercial Bank (BCP) which values ​​2.85% for 0.57 euros, and Galp Energia rises 1.62% to 15.40 euros.",2025-03-18 13:01:18
pt,"PR critica quem tenta sabotar fórmula de «dois povos, dois Estados»","O Presidente da República lamentou hoje o agravamento da situação no Médio Oriente, com bombardeamos israelitas a Gaza, comentando que ""há quem, dos vários lados, não queira a fórmula"" de «dois povos, dois Estados» e faça tudo para a impossibilitar.",en,"Prizes who tries to sabotage formula of two peoples, two states","The President of the Republic today lamented the aggravation of the situation in the Middle East, with Israelites bombarded the Gaza, commenting that ""there are those who, on the various sides, do not want the formula"" of two peoples, two states and do everything to make it impossible.",2025-03-18 13:01:17
pt,Carro consumido por incêndio na A5 na saída para Queluz,Bombeiros Sapadores foram acionados para o local e as autoridades estão a investigar as causas do incêndio. Não há feridos a registar.,en,Car consumed by fire in A5 at the output to Queluz,Sapadors firefighters were called to the scene and the authorities are investigating the causes of the fire. There are no injuries to register.,2025-03-18 13:01:11
pt,Tribunal de Angra condena homem por abuso sexual de crianças a 20 anos de prisão,Arguido terá ainda de pagar indemnizações no valor de 35 mil euros.,en,Angra Court condemns man for sexual abuse of children to 20 years of prison,Defendant also will have to pay compensation in the amount of 35 thousand euros.,2025-03-18 13:01:05
pt,Chuva intensa abre comportas nas barragens do Algarve,"A Barragem de Odeleite, em Castro Marim, no Algarve, foi alvo de um descarregamento temporário da albufeira para descarregar em segurança os caudais excedentários esta manhã, algo que não acontecia desde 2018, partilhou o porta-voz da Águas do Algarve.",en,Intense rain opens floodgates in the Algarve dams,"The Odeleite Dam in Castro Marim, in the Algarve, was the target of a temporary unloading of the Albufeira to discharge the exceeding flows this morning, something that has not happened since 2018, shared the Aguas do Algarve spokesman.",2025-03-18 13:01:00
pt,Investimento de 60 milhões no aeroporto de Beja,"A Mesa vai investir 60 milhões de euros num novo hangar no aeroporto de Beja para triplicar a sua capacidade de manutenção. A companha, parte do grupo português Hi Fly, atua na área de engenharia e manutenção de aeronaves e vai construir o seu segundo hangar neste aeroporto. “Estamos muito satisfeitos por dar este passo, [...]",en,60 million investment at Beja Airport,"The table will invest 60 million euros in a new hangar at Beja airport to triple its maintenance capacity. Company, part of the Portuguese group Hi Fly, operates in the aircraft engineering and maintenance area and will build its second hangar at this airport. We are very pleased to take this step, [...]",2025-03-18 13:00:52
pt,Guelra invade-nos com um mar de sabores,"Este artigo integra a 13.a edição do ECO magazine. Pode comprar AQUI. Bem no coração de Belém, o Guelra original (aberto em setembro de 2023) transformou-se recentemente em dois restaurantes distintos: o Guelra Ocean to Table, no piso térreo, com uma convidativa esplanada, que serve almoços de comida de conforto em que a estrela é [...]",en,Guelra invades us with a sea of ​​flavors,"This article is part of the 13th edition of Eco Magazine. You can buy here. Right in the heart of Belem, the original guel (opened in September 2023) has recently become two distinct restaurants: the Ocean to Table Guelra on the ground floor, with an inviting esplanade, which serves comfortable foods where the star and [...]",2025-03-18 13:00:40
pt,Google paga 32 mil milhões de dólares para comprar a empresa de cibersegurança Wiz,Esta é a maior aquisição já feita pela tecnológica e irá melhorar a sua oferta de segurança na cloud num mundo de ameaças de inteligência artificial em avanço. O Wiz passará a fazer parte do negócio de cloud do Google.,en,"Google pays 32,000 million dollars to buy the Cyberrseguranca Wiz company",This is the highest acquisition made by Technologica and will improve its cloud security offer in a world of artificial intelligence in advance. Wiz had become part of Google's cloud business.,2025-03-18 13:35:36
pt,Novocaine. O último micro-herói,Um thriler doloroso com as desventuras de um pequeno herói incapaz de sentir dor.,en,Novocaine. The last microheri,A painful Thriler with the misadventures of a small hero unable to feel pain.,2025-03-18 13:35:14
pt,Falhanço na Taça leva Premier League a suspender 'revolução',"Incidente no jogo da quinta eliminatória da Taça de Inglaterra, entre o Bournemouth e o Wolves, levou a Premier League a adiar a introdução do fora de jogo semiautomatizado",en,Failure in the taca leads Premier League to suspend 'revolution',"Incident in the game of the fifth eliminatoria of the England TACA, between Bournemouth and Wolves, led the Premier League to postpone the introduction of the semiautomatized out of play",2025-03-18 13:34:19
pt,Adesão à greve dos trabalhadores da Carris nos 22%,"A adesão à greve desta terça-feira dos trabalhadores da Carris registou, ao longo da manhã, uma adesão de 22%, o que implicou a supressão de aproximadamente 40% do serviço de transporte público de passageiros, segundo a empresa.",en,Adhesion the strike of carris workers in the 22%,"Advisor to the strike of this Terk of Carris workers recorded, throughout the morning, a 22% advisory, which implied the suppression of approximately 40% of the public passenger transport service, according to the company.",2025-03-18 13:33:50
