iso_code,title,description,lang_tranlation,title_translated,description_translated,pubDate
cz,Královéhradecký kraj ruší zakázku na rekonstrukci objektu dětského domova v Sedloňově,"Rada Královéhradeckého kraje rozhodla o zrušení aktuálně probíhající veřejné zakázky na rekonstrukci budovy Dětského domova a školní jídelny Sedloňov. Důvodem je překročení zákonného limitu pro možné vícepráce, které vznikly vlivem havarijního stavu části objektu. Kraj budovu rekonstruuje od března 2024.",en,Kralove Hradec Region Ruthenia for the reconstruction of the building of the Deta Home in Sedlonova,"The Council of the Kralove Hradecke Region decided to resolve the actively exerts on the reconstruction of the building of the Deta Home and Skolni Sedlonov. The reason is the precision of the ending limit for possible vice -drags, which arose due to the emergency state of the part of the building. The region reconstructs the building from Březnune 2024.",2025-03-21 09:34:00
cz,Prorektor Univerzity Karlovy končí. V dopise kritizuje rektorku Králíčkovou,"V den jednání Akademického senátu Karlovy univerzity odchází další z nejbližších spolupracovníků rektorky Mileny Králíčkové. Děje se tak po sérii kritiky spojené s milionovými odměnami pro vedení této vysoké školy. Prorektor pro vnější vztahy Martin Vlach v rezignačním dopise, jehož kopii iDnes.cz získal, popsal důvody své rezignace.",en,Vice -Rector of Charles University. In the letter she criticizes Rector Kralick,"On the day of the Academic sentence of Charles University, he was leaving for more of the closest collaborators of the Rector Milena Kralickov. Thus, after a series of criticism, it is associated with the million -dollar deletions to lead this high school. Vice -Rector for the more relations Martin Vlach in a resignation letter, needed a copy of iDNES.cz, described the reasons of his resignation.",2025-03-21 09:33:00
cz,Nová pravidla bezpečnosti silničního provozu v Itálii. Od začátku roku 2025 platí v Itálii řada zpřísňujících úprav pravidel silničního provozu.,"Změny se týkají obzvláště: řízení za současného používání mobilního telefonu či jiného elektronického zařízení, řízení pod vlivem alkoholu/drog, zvyšují se pokuty za překročení rychlosti a přísně se trestá opuštění zvířat na silnici",en,"Nova rules of road safety in Italy. Since the beginning of 2025, it has been valid in Italy to regulate the rules of road traffic.","Changes are particularly: Renowing for the current use of a mobile phone or other electronic equipment, the right under the influence of alcohol/drugs, I am invention of fines for precocation of speed and the punishment of abandonment on the road",2025-03-21 22:34:28
cz,Satoranský pomohl Barceloně v Evropské lize oplatit porážku Žalgirisu,"Šesti body a šesti doskoky přispěl Tomáš Satoranský k vítězství basketbalistů Barcelony v Evropské lize nad Žalgirisem Kaunas 82:70. Katalánský tým si třetí výhrou v řadě pojistil postavení v první šestici, která postoupí přímo do čtvrtfinále play off.",en,Satoransky helped Barcelone in the European League to return the slagiris defeat,Set points and sires Doskoka Prispel Tomas Satoransky to the Barcelona basketball player in the European League over Zalgiris Kaunas 82:70. Catalic Tym Throws in Rada he secured the first set to advance to the quarterfinal play off.,2025-03-21 22:31:11
cz,"Dva slepené góly Kovařčíka nestačily. Trochu jsme ten zápas ukradli, připustil Gross","Drama jako od Hitchcocka nabídl čtvrtý díl čtvrtfinálové série hokejové extraligy mezi Třincem a Spartou. Soupeři se střídali ve vedení, skvělou třetí dvacetiminutovku, ve které padly dva góly na každé straně, zakončil hostující Michal Řepík vyrovnávací trefou na 3:3 pouhých 27 sekund před třetí sirénou. Rozhodnout tak musel až extra čas. V něm fauloval Cienciala a v přesilovce hostům vystřelil mečbol obránce Kemiläinen. Sparta vede 3:1 na zápasy a týmy se přesouvají zpátky do Prahy.",en,"Two glued goals did not. We have stolen that a little bit, gross added","The drama like Hitchcock has offered the fourth dil a fourth -final series of hockey extraleague between Trinec and Sparta. The coordinates were in line, a great third minute, in which two goals on each side fell, ending the guest Michal's repik with a 3: 3 only 27 seconds before the third siren. So he had to make an extra time. He fouled Ciencial and in Presilovka Hostum pushed Mecbol Defense Kemilainen. Sparta leads 3: 1 to the evaporation and the Tymy is taught back to Prague.",2025-03-21 22:26:35
cz,Anglie při Tuchelově debutu na úvod kvalifikace MS porazila Albánii,Praha - Fotbalisté Anglie zahájili kvalifikaci mistrovství světa 2026 vítězně. Při debutu německého trenéra Thomase Tuchela porazili Albánii 2:0. Autor úvodní branky Myles Lewis-Skelly se stal ve věku...,en,England at Tuchel's debut at UVOD Qualification of the World Championship defeated Albania,Prague - England football player started qualifying for the world championship 2026 Vitezne. During the debut of German Trener Thomas Tuchel defeated Albania 2: 0. The author of the goal of Myles Lewis-Sklly has become at the age of ...,2025-03-21 22:22:00
cz,Demolice bývalého obchodního domu Prior v Brně je po dvou měsících téměř u konce (video),"Demolice bývalého obchodního domu Prior v Brně je po dvou měsících téměř u konce. ??? Na místě brutalistní budovy a okolních pozemcích vznikne promenáda obklopená kancelářemi, obchody i nájemními byty. Stavba za sedm miliard korun má být hotová v...",en,The demolition of the former commercial house Prior in Brno is after two months almost at the end (video),"The demolition of the former Brno department store in Brno is over after two months. ??? On a place of brutalist buildings and surrounding land, promenada is surrounded by office, shops and fine flats. Building for seven billion crowns has a apartment in ...",2025-03-21 22:20:01
cz,Fotbalisté Anglie při Tuchelově debutu na úvod kvalifikace MS porazili Albánii,"Fotbalisté Anglie zahájili kvalifikaci mistrovství světa 2026 vítězně. Při debutu německého trenéra Thomase Tuchela porazili Albánii 2:0. Autor úvodní branky Myles Lewis-Skelly se stal ve věku 18 let a 176 dní nejmladším reprezentantem Anglie, který skóroval v prvním utkání za národní tým.",en,England's football player at Tuchel's debut at UVOD Qualification of the World Championship defeated Albania,"England footballer started qualifying for the world championship 2026 Wish. During the debut of German Trener Thomas Tuchel defeated Albania 2: 0. The author of the introduction of Myles Lewis-Sklly became 18 years old and 176 days of the youngest representative of England, who scored in the first time of the national.",2025-03-21 22:18:57
cz,"Dopad mrazů na tažné ptáky. Mrazivé noci stále pokračují. To je počasí, které hůře zvládají ptáci. (video)","Dopad mrazů na tažné ptáky. ?? Mrazivé noci stále pokračují. To je počasí, které hůře zvládají ptáci. Hlavně ti, kteří se vrátili do Česka ze svých zimovišť. Při těchto podmínkách totiž spotřebovávají mnohem více energie, a slabší jedinci mohou...",en,The impact of frost on tazne birds. I am still continuing the nights of the night. This is the weather that can handle the birds. (video),"The impact of frost on tazne birds. ?? I am still continuing the nights of the night. This is the weather that can handle the birds. Especially those who returned to the Czech Republic of their winter. At these conditions, they consume more energy, and weak individuals can ...",2025-03-21 22:18:55
cz,"Medvěd na Slovensku vážně zranil muže, záchranáři zasahovali vrtulníkem","Bratislava - Medvěd dnes napadl na Slovensku dva muže, jednoho z nich vážně zranil. Starší z dvojice byl podle záchranné služby transportován vrtulníkem do nemocnice, informoval server Aktuality.sk....",en,Medved in Slovakia seriously injured the muse,"Bratislava - Medvede attacked two museums in Slovakia today, one of them seriously injured. The older of the couple was, according to the rescue service, transported by a helicopter to the hospital, reported the server Aktuality.sk ....",2025-03-21 22:16:00
cz,Tuchelův vítězný debut. Anglie na úvod kvalifikace MS porazila Albánii,"Fotbalisté Anglie zahájili kvalifikaci mistrovství světa 2026 vítězně. Při debutu německého trenéra Thomase Tuchela porazili Albánii 2:0. Autor úvodní branky Myles Lewis-Skelly se stal ve věku 18 let a 176 dní nejmladším reprezentantem Anglie, který skóroval v prvním utkání za národní tým.",en,Tucheluv Vitezny debut. England at UVOD qualification of the World Championship defeated Albania,"England footballer started qualifying for the world championship 2026 Wish. During the debut of German Trener Thomas Tuchel defeated Albania 2: 0. The author of the introduction of Myles Lewis-Sklly became 18 years old and 176 days of the youngest representative of England, who scored in the first time of the national.",2025-03-21 22:14:00
cz,Razie na Barrandovském mostě. Policisté prověřovali řidičáky a trestní rejstříky,"Bezmála šedesát policistů spustilo v pátek večer na Barrandovském mostě v Praze rozsáhlou akci, při které namátkově kontrolovali řidiče, zda mají platná řidičská oprávnění či nejsou v policejních databázích evidovaní jako hledaní zločinci. Na místě se pohybovali také celníci. Provoz byl v obou směrech výrazně zpomalen na třicet kilometrů za hodinu.",en,Razie on Barrandovskem Most. Police officers were driven by drivers and criminal rejuvenation,"Nejmil sedesat the police officer launched on the foot of the Barrandovskem Most in Prague, a range of action, which was controlled by the registers, whether they were valid Ridics, or are not registered in police databases as a search for criminals. The customs were moving in the place. The operation was slowly slowed down to the thirty kilometers per hour in both directions.",2025-03-21 22:14:00
cz,Policie pátrá po dvacetiletém autistovi. Špatně se orientuje a nemluví,"Policie pátrá po dvacetiletém Pavlu Mlynářovi, který v neděli večer odešel z Domova pro osoby se zdravotním postižením ve Slaném. Muž je autista, nekomunikuje a má omezenou orientaci v prostoru a čase. Policie o tom informovala na síti X.",en,Police of the floor after twenty years of autistic. Badly orientation and not talk,"Police of the floor after twenty years Pavel Mlynar, who on Sunday in the evening lifted from home for people with medical post -Slan. The man is autistic, does not communicate and has limited orientation in space and case. The police reported on SITI X.",2025-03-23 21:46:00
cz,Fotbalové přestupy ONLINE: Skončí Brännström v Boleslavi? Klub se ho zbavit nechce,"Fotbalové přestupy, podpisy i změny na trenérských postech. Zkrátka vše, co o světovém i českém fotbale na přestupovém poli potřebujete vědět, sledujeme ONLINE na iSport.cz.",en,Football Prestups Online: End Brannstrom in Boleslav? The club does not want to get rid of it,"Football prestars, signatures and changes in trener's posts. The abbreviation everything, what about Svetov and Czech football in the prestruce field need to know, watch online at iSport.cz.",2025-03-23 21:40:00
cz,"Zlín v problémech. Máme víc sil, říká střelec outsidera. Pardavý: Ať si hráči uvědomí, že...","Že je severní vítr krutý, poznávají hokejisté zlínských Beranů. V Litoměřicích schytali v semifinále play off Maxa ligy pětigólový příděl a místy to s nimi při direktu 1:5 nevypadalo dobře, v sérii ztrácí 1:2 na zápasy. „Prohráli jsme naší neefektivitou,“ procedil trenér favorita Ján Pardavý po výplachu. „Měli jen štěstí, všechny zápasy byly zatím vyrovnané,“ kontroval obránce Zdeněk Čáp. Zápas okořenila i bitka loňských spoluhráčů, Australana Costy s Vítkem Bendou.",en,"Zlin in problems. We have more power, saying outsider. Pardavavy: Let the players realize that ...","That is the northern showcase of the Kruty, know the hockeyiste of the zlinsky ram. In the Litomeric, they caught the Petigol Pridel league in the semifinale play off, and it did not look good with them at a directive of 1: 5, in the series losing 1: 2 on the record. We lost our ineffectiveness, the Jan Pardava Favorita Trener proceeded. They only had luck, all the records were still balanced, the defense of Zdenek Cap countered. The battle of the Lonsky team, Australian Costa with Vitek Benda, also spilled.",2025-03-23 21:30:00
cz,"Modré z nebe i z ateliéru! Bez forem by nebylo modrotisku, shodují se formíři otec a syn Bartošovi","Textilní tiskařská technika modrotisk, je už několik let na seznamu nehmotného kulturního dědictví UNESCO. Modrotisk je především o řemesle, bez kterého by se tahle úžasná technika neobešla. Ve staré dílně modrotisku ve Dvoře Králové nad Labem otec a syn Bartošovi opravují i tvoří nové tiskařské formy.",en,"Modre from heaven and from Atelier! Without forms would not be a blueprint, I agree with the molding father and son Bartos","Textile printing technique blueprint, has been on the list of intangible cultural dedicities for several years. The blueprint is a remesla, without which this no -core technique would not. In the old dilly blueprint in the court of Kralove nad Labem father and son of Bartos I also repair the new print forms.",2025-03-23 21:30:00
cz,"Zlín má problém. Máme víc sil, říká střelec outsidera. Pardavý: Ať si hráči uvědomí, že...","Že je severní vítr krutý, poznávají hokejisté zlínských Beranů. V Litoměřicích schytali v semifinále play off Maxa ligy pětigólový příděl a místy to s nimi při direktu 1:5 nevypadalo dobře, v sérii ztrácí 1:2 na zápasy. „Prohráli jsme naší neefektivitou,“ procedil trenér favorita Ján Pardavý po výplachu. „Měli jen štěstí, všechny zápasy byly zatím vyrovnané,“ kontroval obránce Zdeněk Čáp. Zápas okořenila i bitka loňských spoluhráčů, Australana Costy s Vítkem Bendou.",en,"Zlin has a problem. We have more power, saying outsider. Pardavavy: Let the players realize that ...","That is the northern showcase of the Kruty, know the hockeyiste of the zlinsky ram. In the Litomeric, they caught the Petigol Pridel league in the semifinale play off, and it did not look good with them at a directive of 1: 5, in the series losing 1: 2 on the record. We lost our ineffectiveness, the Jan Pardava Favorita Trener proceeded. They only had luck, all the records were still balanced, the defense of Zdenek Cap countered. The battle of the Lonsky team, Australian Costa with Vitek Benda, also spilled.",2025-03-23 21:30:00
cz,Basketbalistky obou brněnských týmů dělí jedna výhra od semifinále,"Basketbalistky Žabin i KP Tany Brno dělí jedna výhra od postupu do ligového semifinále. Úřadující vicemistryně Žabiny zvítězily na hřišti Brandýsa nad Labem jednoznačně 93:57. Druhou čtvrtfinálovou výhru si připsal také tým z Králova Pole, který zdolal Hradec Králové na jeho hřišti 76:64. Obě série mohou skončit ve středu.",en,Basketball players of both Brno Tym Deli one of the semifinale,"Basketball players Zabin and KP TANY Brno Deli one won from the progress to the league semifinale. Urduji vicemistryne Zabiny called on the Hristi Brandys nad Labem unambiguous 93:57. The second fourthfinal wound was also pripsed by the Tym of Kralov, which was conquered by Hradec Kralove on his grave 76:64. Both series can end up in the middle.",2025-03-23 21:29:15
cz,"Obce Banín, Rudná a Svojanov na Svitavsku zasáhly záplavy z dešťové přeháňky","„Čistíme kanálové vpusti, ucpané mostky a odklízíme nánosy bahna,“ uvedla mluvčí hasičů.",en,"The villages of Banin, Rudna and Svojanov in the Svitavy region have been flooded from the destroyer","We can clean the channel, clog the bridges and remove the mud, the spokesmen of the fire brigade.",2025-03-23 21:25:58
cz,ONLINE: Francie - Chorvatsko 2:0. Poražený z dvojutkání doplní českou skupinu,"Dnes se rozhodne o tom, kdo doplní v kvalifikaci o mistrovství světa 2026 českou skupinu, ve které jsou kromě Česka ještě Černá Hora, Faerské ostrovy a Gibraltar. Posledním pátým bude poražený z dvojutkání čtvrtfinále Ligy národů mezi Chorvatskem a Francií. První duel ovládli Chorvaté doma 2:0. Jak dopadne odveta a na koho narazí Češi? Zápas začal ve 20:45. ONLINE přenos sledujte na iSportu.",en,Online: France - Croatia 2: 0. Defeated from two -grades add a Czech group,"Today it will decide to add in the qualifying for the World Championship 2026 a Czech group, which includes the Czech Hora, Faerske Islands and Gibraltar. The last poet will be defeated from the double -leafing of the fourth league of the Něod between Croatia and France. The first duel of the Croatian at home 2: 0. How will the retaliation turn out and who will come across? Zapas started at 20:45. Watch online Prenos on iSport.",2025-03-23 21:20:00
cz,"Pozrite si najvýznamnejšie filmové trailery za posledný týždeň: Happy Gilmore 2, Materialists a ďalšie","Návrat do sveta Johna Wicka, ďalší film Paula Thomasa Andersona, Happy Freakin' Gilmore 2 a ďalšie.Určite si nenechajte ujsť najnovšie filmové trailery, ktoré za posledný týždeň rozvírili filmovú scénu!",en,"Give you a najvyjsi film trailers for the last rods: Happy Gilmore 2, Materialists and Dalsie","Return to John Wick, the other film Paul Thomas Anderson, Happy Freakin 'Gilmore 2 and Dalsie.urcite do not have the Najnovsie film trailers who have been outlined for the last time.",2025-03-23 21:17:03
cz,Fiala (SPD): Potravinové řetězce mají v ČR dvakrát větší marže než v Německu,Komentář na svém veřejném facebookovém profilu k maržím potravinovým řetězcům.,en,Fiala (SPD): Food chain is in the CR twice a larger marze than in Germany,Commentary on his public Facebook profile for Marzim Food Retezcum.,2025-03-23 21:14:00
cz,"Zelení: Obchod s chudobou v budově, která patří městu","Komentář na veřejném facebookovém profilu strany k podnikání firmy TVM Net v budově v pražských Modřanech, kterou má pronajatou od města za velmi výhodných podmínek",en,Greens: a poverty store in a building that belongs to a town,"Commentary on the public Facebook profile of the party to business TVM NET in the building in Prazsky blue, which it has rented from the city under very evaluated conditions",2025-03-24 22:08:00
cz,Američtí představitelé plánovali útok v Jemenu po chatu. Omylem do něj přizvali i novináře,"Americkou politikou v pondělí otřásl bezpečnostní skandál. Vyšlo najevo, že si lidé z nejvyšších pater administrativy amerického prezidenta Donalda Trumpa psali o plánovaném americkém úderu na Húsíe na chatu přes aplikaci Signal. Do skupiny byl navíc přizván i šéfredaktor magazínu The Atlantic Jeffrey Goldberg. Demokraté volají po nezávislém vyšetřování, Bílý dům uvedl, že má ve svůj bezpečnostní tým nadále neutuchající důvěru.",en,The Americans were planning a spring in Yemen after the cottage. Mistaker by mistake by mistake,"The US policy on Monday was slated by a safe scandal. It came to light that people from the top floors of the US President Donald Trump wrote about Planovan by American Uder on Husie at Cottage Signal. In addition, the SEFREDACE Magazine The Atlantic Jeffrey Goldberg was also a prizvan. Democrates call the sowing after the non -slip, the whites said that he had in his safelessly still not rushing Duver.",2025-03-24 22:06:14
cz,Hotel místo symbolu bombardování. Projekt Trumpova zetě vyhnal Srby do ulic,"Tisíce lidí, většinou studentů, demonstrovaly v srbském hlavním městě Bělehradě proti developerskému projektu zetě amerického prezidenta Jareda Kushnera. Ten chce postavit luxusní komplex na místě budovy generálního štábu zničené při bombardování NATO v roce 1999.",en,Hotel Misto Symbol bombing. Trump's Zeta project drove Serbs to the streets,"Thousands of people, mostly a student, demonstrated in Serbia the main city of Belehrade against the development of the Zete President Jared Kushhner. He wants to build a luxury complex on the site of the General Stab building destroyed at NATO bombing in 1999.",2025-03-24 22:01:15
cz,Nechutný Ševcův úlet. Po zápase vulgárně urážel sudí a přál smrt jejich rodinám,Mladoboleslavský sportovní manažer Martin Ševc po pátém utkání čtvrtfinále play off hokejové extraligy vulgárně napadl rozhodčí a prakticky jistě jej čeká disciplinární trest. Hlavní rozhodčí Daniel Pražák a Lukáš Květoň vše uvedli do zápisu.,en,Disgusting sevcuv flew. After the game Vulgarne insulted the Sudi and washed their family's death,Mladá Boleslav's sports manager Martin Sevc after the heel fiddled the plays off the hockey extraleague vulgarne attacked the arbitrators and virtually surely it is expected to be disciplinary punishment. The main arbitrators Daniel Prazak and the Lukas flowed into the write.,2025-03-24 21:53:00
cz,"Velká úleva, zasloužený postup, radoval se Forman. Kacetl: Nechci se vymlouvat, ale...","Král je mrtev! Po pěti získaných titulech a sedmnácti vyhraných sériích končí třinecká dynastie. V nejsledovanějším čtvrtfinále letošních vyřazovacích bojů extraligy Oceláře vyřadila Sparta, v pátém zápase uspěla 3:2 a vyhrocenou sérii zapečetila poměrem 4:1 na zápasy. Spolu s Pardubicemi jsou teď Pražané nejen účastníky semifinále, ale také největšími favority na celkový triumf. „Je to velká úleva. Byli jsme připravení, zasloužený postup,“ řekl domácí Miroslav Forman.",en,"Great relief, delayed procedure, Forman rejoiced. Kacetl: I don't want to make excuses, but ...","The king is dead! After Peti profitable titles and the seventhly, the end of the end of Trinec Dynasty. In the most follow -up quarterfinals this year, Sparta set off the Extraliga Extraliga fighting, and the set succeeded 3: 2 in the heel, and the escalated series gave a 4: 1 ratio to Zapas. Together with Pardubice, the nowadays are not only the semifinale ubastnice, but also the biggest favorites for the overall triumph. It's a big relief. We were prepared, the procedure was delayed, Miroslav Forman said.",2025-03-24 21:50:00
cz,"Anglie i podruhé pod Tuchelem vyhrála. Za Finy se trefil Kairinen, na tři body to ale nestačilo",Sparťanský záložník Kaan Kairinen vstřelil premiérový gól za finskou fotbalovou reprezentaci. Seveřané ale ve druhém utkání kvalifikace o mistrovství světa 2026 neudrželi dvoubrankové vedení a v Litvě jen remizovali 2:2. Nenavázali tak na páteční výhru 1:0 na Maltě. Anglie vyhrála doma i podruhé. Po úvodním vítězství nad Albánií 2:0 dnes ve Wembley zdolala Lotyšsko 3:0.,en,"For the second time, England won under Tuchel. Kairinen hit the Finnish, but it wasn't the three points.","Spartansky founder Kaan Kairinen pushed the Premier Gol for the Finnish football team. But Severane, in the second time of qualification for the World Championship 2026, did not freeze the two -goal lead and in Litve only tied 2: 2. They did not tie up to the pattern 1: 0 per malte. England won at home and for the second time. After the introduction of the Vitezy over Albania 2: 0 today in Wembley overcame Lotysko 3: 0.",2025-03-24 21:50:00
