iso_code,title,description,lang_tranlation,title_translated,description_translated,pubDate
se,Rörd Hedvig Lindahl tackades av – hyllade publiken: ”Inget hat 'whatsoever'”.,"Med ett VM-silver, två OS-silver och två VM-brons är hon en av svensk fotbolls största genom tiderna. Hedvig Lindahl har inte spelat i landslaget sedan 2022, men på fredagskvällen tackades målvakten av på Strawberry arena till stora hyllningar. – Jag visste att jag skulle gråta lite, säger en tagen 41-åring.",en,"Belled Hedvig Lindahl was thanked - praised the audience: ""No hat 'whatsoever'"".","With a World Cup silver, two Olympic silver and two World Cup bronze, she is one of Swedish football's greatest of all time. Hedvig Lindahl has not played in the national team since 2022, but on Friday night the goalkeeper was thanked at Strawberry Arena for big tributes. -I knew I would cry a little, says a 41-year-old.",2025-04-04 18:21:39
se,Jagar rånare med helikopter,Två män har rånat och slagit en man i Saltsjöbaden utanför Stockholm. Nu jagas rånarna med polishelikopter.,en,Chasing robbers by helicopter,Two men have robbed and beat a man in Saltsjöbaden outside Stockholm. Now the robbers are being chased by police helicopter.,2025-04-04 18:18:13
se,"Nära skrällpoäng i första bortamatchen: ""Små, små saker""","Gefle spelade förra säsongen i superettan. En tuff uppgift för Team TG, som trots det var nära att plocka poäng i säsongens första bortamatch i ettan norra. Men ett sent ledningsmål släckte den drömmen.",en,"Near scrap points in the first away game: ""Small, small things""","Gefle played last season in the Superettan. A tough task for Team TG, who was nevertheless close to picking points in the season's first away game in one north. But a late management goal extinguished that dream.",2025-04-05 18:41:33
se,Svenskt fiasko – utslaget i VM-kvartsfinal,"Curling-VM i Moose Jaw slutade i ett fiasko för Sveriges lag Niklas Edin. De regerande mästarna i OS och VM förlorade kvartsfinalen mot Skottland med 7–8. Skottland får nu möta värdnationen Kanada i semifinal. Bruce Mouat, Skottlands skipper, såg till att semifinalplatsen säkrades med matchens sista sten. – Vi fick ett brejk i slutet av femte omgången. Det var där matchen vände. Vi såg framåt hela tiden och behöll vårt lugn, säger han i SVT:s sändning. I den andra semifinalen möts Kina och Schweiz.",en,Swedish failure-the rash in the World Cup quarterfinals,"The Curling World Cup in Moose Jaw ended in a failure for Sweden's team Niklas Edin. The reigning champions in the Olympics and the World Cup lost the quarterfinals against Scotland by 7–8. Scotland is now allowed to meet the host nation Canada in the semi -finals. Bruce Mouat, Scotland Skipper, made sure that the semi -final place was secured with the last stone of the match. - We got a break at the end of the fifth round. That's where the match turned. We looked forward all the time and kept our calm, he says in SVT's broadcast. In the second semi -final, China and Switzerland meet.",2025-04-05 18:33:25
se,Inhopparens formbesked i konkurrensen: ”Välkommet för mig”,Edi Sylisufaj gav svar på tal efter att ha fått inleda på...,en,"The hopper form message in the competition: ""Welcome to me""",Edi Sylisufaj gave answers to speech after starting on ...,2025-04-05 18:31:20
se,Epatraktor körde av vägen,Under lördagskvällen inträffade en singelolycka på väg 110 i höjd med Billeberga.,en,Epatractor drove off the road,"During Saturday night, a single accident occurred on Route 110 at the height of Billeberga.",2025-04-05 18:31:05
se,Siffrorna bakom ”experimentet” Markus Karlsson,"Först skolades Markus Karlsson om från ytterback till innermittfältare.Nu vill 21-åringen ta nästa kliv – genom att ta efter en grönvit supporterfavorit.– Jag vill vara lite mer som Hammar, säger han.",en,"The figures behind the ""Experiment"" Markus Karlsson","First, Markus Karlsson was reversed from outside back to inner center field. Now the 21-year-old wants to take the next step-by taking a green-white supporter favorite.-I want to be a bit more like Hammar, he says.",2025-04-05 18:30:14
se,Global uppvärmning – en folkhälsovinst?,Med ett varmare klimat dör fler på jorden till följd av hetta. Men hittills har den globala uppvärmningen fört med sig en större minskning av köldrelaterad dödlighet än ökning av värmerelaterad dödlighet.,en,Global warming - a public health benefit?,"With a warmer climate, more people die on earth as a result of heat. But so far, global warming has brought a greater reduction in cold -related mortality than increasing heat -related mortality.",2025-04-05 18:30:00
se,Matchens bröts – efter kvittering,"Hemmapubliken rasade mot utvisningen som ledde till Karlskogas kvittering och fick matchen stoppad av inkastade föremål.På det sågar AIK:s Alfred Barklund domarnas bedömning innan matchen gick till förlängning.– Solklart fel domslut av domaren, de förvaltar det bra och har 3–3, säger han i TV4.",en,The match was broken - after receipt,"The home crowd raged against the expulsion that led to Karlskoga's receipt and got the match stopped by thrown objects. At that, AIK's Alfred Barklund saw the judges' assessment before the match went to extension. - Sun clear the wrong judgment by the judge, they manage it well and have 3-3, he says in TV4.",2025-04-05 18:28:28
se,KFUM Karlskr åker ur serien,,en,KFUM Karlskr is leaving the series,,2025-04-05 18:28:04
se,KFUM Karlskr åker ur efter tung förlust,,en,KFUM Karlskr is out after heavy loss,,2025-04-05 18:28:00
se,Britterna tror på USA-avtal – lockar med sänkt skatt för techjättar,Storbritannien kom lindrigare undan än EU när Trump chockade omvärlden med sina handelstullar. Nu hoppas premiärminister Keir Starmer kunna slippa undan helt – i gengäld mot sänkta skatter för amerikanska techjättar.,en,The British believe in US agreements-attracts with lowered tax for tech giants,Britain got away more than the EU when Trump shocked the outside world with his trade duties. Now Prime Minister Keir Starmer hopes to be able to escape completely - in return against lower taxes for American tech giants.,2025-04-05 18:26:51
se,Tomt på kaffehyllorna inför chockhöjning,Prischock på kaffe väntar. Nu bunkrar svenskarna det svarta guldet. – Jag tänkte köpa på extrapris innan priset...,en,Blank on the coffee shelves for shock rise,Price shock on coffee is waiting. Now the Swedes bunker the black gold. - I was going to buy extra price before the price ...,2025-04-06 19:03:57
se,"SVT, det är dags att lägga ”Mästarnas mästare” på is","Så här får det inte fortsätta. Nu är det dags att ta ett beslut om ”Mästarnas mästare”, SVT.",en,"SVT, it's time to put the ""champions champion"" on ice","This is not how it must continue. Now is the time to make a decision on the ""champions champion"", SVT.",2025-04-06 19:02:00
se,”Robinson” bakom kulisserna – Anders Lundins bilder,"”Robinson” är inne på sin 27:e säsong.Nu berättar Anders Lundin om livet bakom kulisserna – som tittarna inte får se.– Jag tycker det är toppen, ingen kommer därifrån, säger programledaren.",en,"""Robinson"" behind the scenes - Anders Lundin's pictures","""Robinson"" is in his 27th season. Now Anders Lundin talks about the life behind the scenes - which the viewers must not see. - I think it is the top, no one comes from there, says the program manager.",2025-04-06 19:01:00
se,Här flyger Sofie i skidliften: ”Fick lindrig hjärnskakning”,Det var i Trysil i Norge som Sofie var å åkte skidor när hon plötsligt fastnade i knappliften och flög.,en,"Here Sofie flies in the ski lift: ""Got a mild concussion""",It was in Trysil in Norway that Sofie was skiing when she suddenly got stuck in the button lift and flew.,2025-04-06 19:00:43
se,Bilar desinficeras vid gränsen för att stoppa smittan,Österrike har stängt ett 20-tal gränsövergångar till Ungern och Slovakien för att hindra att utbrotten av mul- och klövsjuka i länderna sprids. Vid passagerna som fortfarande är öppna desinficeras fordon.,en,Cars are disinfected at the limit to stop the infection,Austria has closed about 20 border crossings to Hungary and Slovakia to prevent the outbreak of mule and clover disease in the countries. At the passages still open disinfected vehicles.,2025-04-06 19:00:27
se,Dick avslöjar: Jag spelar på sprutor,"Dick Axelsson kämpar mot smärtan. Nu avslöjar veteranen att han spelar på sprutor.– Gud straffar en för alla synder, säger Dif-stjärnan.",en,Dick reveals: I play on syringes,"Dick Axelsson is fighting the pain. Now the veteran reveals that he is playing on syringes.-God punishes one for all sins, says the DIF star.",2025-04-06 19:00:16
se,Slog sig blodig efter lång pubrunda – satte sig i bilen och körde iväg,"Omtöcknad efter en vurpa, och full efter en pubrunda, satte sig Karlstadsbon i sin bil och körde de fem milen till Filipstad. Nu väntar fängelse för mannen.",en,Hit himself bloody after long pub round - got in the car and drove away,"Demolished after a rush, and full after a pub round, Karlstadsbon sat in his car and drove the five miles to Filipstad. Now the prison is waiting for the man.",2025-04-06 19:00:00
se,Sexleksakerna örebroare köper mest,”Örebroare köper lite av varje – de är äventyrslystna”,en,Sex toys Örebroare buy the most,"""Örebroare buys a little of each - they are adventurous""",2025-04-06 18:58:34
se,Kina bävar – nu väntar svart måndag,Kinas investerare håller andan. På måndag öppnar landets börser igen efter tullutspelen från först USA:s Donald Trump och sedan svaret från Kina. Ett rejält kursras ligger i fatet.,en,China beans - now the black Monday is waiting,"China's investors hold their breath. On Monday, the country's stock exchanges will open again after the customs play from the first US Donald Trump and then the response from China. A huge course race is in the barrel.",2025-04-06 18:57:15
se,Dick Axelsson spelar semifinalen på sprutor,SÖDERTÄLJE. Dick Axelssons ena finger är ur led. Djurgårdens forwardsstjärna spelar på sprutor.,en,Dick Axelsson plays the semi -finals on syringes,Södertälje. Dick Axelsson's one finger is out of joint. Djurgården's forward star plays on syringes.,2025-04-06 18:56:09
se,OV:s hemliga rutin: ”Ibland får man höra rätt sjuka grejer”,Inför semifinalrysaren avslöjar tränaren avväpnande snacket...,en,"OV's secret routine: ""Sometimes you hear the right sick stuff""","Before the semi -finals, the coach reveals disarming the talk ...",2025-04-07 04:11:00
se,Pippi Långstrump fyller jämnt – firas med ny radioteater,I år fyller två institutioner för barnkulturen jämnt. Pippi Långstrump blir 80 år och Barnradion blir 100. Det firas med ny radioteater av Astrid Lindgrens klassiker från 1945.,en,Pippi Longstocking fills evenly - celebrated with new radio theater,"This year, two institutions for children's culture fill evenly. Pippi Longstocking will be 80 years and children's radio will be 100. It is celebrated with new radio theater by Astrid Lindgren's classic from 1945.",2025-04-07 04:09:00
se,Trump om börskaoset: Ibland krävs medicin,USA:s president Donald Trump liknar de handelstullar han infört mot stora delar av världens länder med ”medicin” – och säger att förra veckans kraftiga börsfall visar att den fungerat. Han bekräftar också att Kina backat kring Tiktok-försäljningen på grund av tullarna.,en,Trump about stock marketcase: Sometimes medicine is required,"US President Donald Trump is similar to the commercial duties he introduced against large parts of the world's countries with ""medicine"" - saying that last week's heavy stock market falls show that it worked. He also confirms that China backed around the Tiktok sales because of customs.",2025-04-07 04:08:35
se,JUST NU: Börser fortsätter rasa – EU har krismöte,”Följdeffekt av Trumps tullannonsering” ✓ Kollaps,en,Right now: Stock Exchange continues to rage - the EU has a crisis meeting,"""The consequence of Trump's customs advertising"" ✓ Collapse",2025-04-07 04:07:53
se,Trump svingar mot Musk: ”Vill aldrig ...”,En spricka har uppstått mellan Musk och Trump kring tullarna mot Europa. Först öppnade Elon Musk för tullfritt ...,en,"Trump swings against Musk: ""Never want to ...""","A crack has arisen between Musk and Trump around customs against Europe. First, Elon Musk opened for duty -free ...",2025-04-07 04:07:11
se,Växelfel orsakar störningar i pendeltågstrafiken,"Pendeltågen har drabbats av stora förseningar på grund av ett växelfel mellan Årstaberg och Stockholms södra. Felet beräknas vara avhjälpt först på tisdag morgon, skriver P4 Stockholm. Vissa tåg på linje 43. mellan Bålsta och Nynäshamn, stannar inte vid Stockholm Odenplan, Stockholm City, Stockholms södra eller Årstaberg. Även sträckorna Södertälje-Uppsala och Märsta-Södertälje är drabbade. Flera avgångar har ställts in och det förekommer felaktiga utrop på stationerna, enligt SL.",en,Gear error causes disruptions in commuter train traffic,"The commuter trains have been hit by major delays due to a gear error between Årstaberg and Stockholm's south. The error is expected to be rectified only on Tuesday morning, writes P4 Stockholm. Some trains on line 43. Between Bålsta and Nynäshamn, does not stop at Stockholm Odenplan, Stockholm City, Stockholm Södra or Årstaberg. The Södertälje-Uppsala stretches and Märsta-Södertälje are also affected. Several departures have been canceled and there are incorrect exclamations at the stations, according to SL.",2025-04-07 04:04:07
se,Stora störningar i pendeltågstrafiken,"Pendeltågen har drabbats av stora förseningar på grund av ett växelfel mellan Årstaberg och Stockholms södra. Felet beräknas vara avhjälpt först på tisdag morgon, skriver P4 Stockholm. Vissa tåg på linje 43 mellan Bålsta och Nynäshamn, stannar inte vid Stockholm Odenplan, Stockholm City, Stockholms södra eller Årstaberg. Även sträckorna Södertälje-Uppsala och Märsta-Södertälje är drabbade. Flera avgångar har ställts in och det förekommer felaktiga utrop på stationerna, enligt SL.",en,Large disturbances in commuter train traffic,"The commuter trains have been hit by major delays due to a gear error between Årstaberg and Stockholm's south. The error is expected to be rectified only on Tuesday morning, writes P4 Stockholm. Some trains on line 43 between Bålsta and Nynäshamn, do not stop at Stockholm Odenplan, Stockholm City, Stockholm Södra or Årstaberg. The Södertälje-Uppsala stretches and Märsta-Södertälje are also affected. Several departures have been canceled and there are incorrect exclamations at the stations, according to SL.",2025-04-07 04:04:07
se,Ingen vill plocka självlysande hjortron,,en,No one wants to pick luminous cloudberries,,2025-04-07 04:03:00
se,DEBATT: Antidemokrater ska inte få våra pengar,"Att fortsätta finansiera organisationer som aktivt motarbetar våra grundläggande värderingar är inte bara naivt – det är ett svek mot den sekulära demokratin, skriver Sameh Egyptson.",en,Debate: Anti -Democrats should not receive our money,"Continuing financing organizations that actively counteract our basic values ​​is not only naive - it is a betrayal of secular democracy, writes Sameh Egyptson.",2025-04-07 04:00:00
se,Vad innebär det här?,Testa om du har koll på sportens alla färger.,en,What does this mean?,Test if you are in control of all the colors of the sport.,2025-04-07 04:00:00
se,Japans premiärminister: Redo förhandla om tullar,Japans premiärminister Shigeru Ishiba meddelade att han kommer att resa till USA så snart som möjligt för att presentera ett omfattande avtal om tullar för president Donald Trump.,en,Japan's Prime Minister: Ready Negotiate Customs,Japan's Prime Minister Shigeru Ishiba announced that he will be traveling to the United States as soon as possible to present a comprehensive tariff agreement to President Donald Trump.,2025-04-07 04:36:23
se,Lyssna: Eldningsförbud i Helsingborg och Landskrona,"Lyssna på och läs en sammanfattning av de senaste nyheterna, läget i trafiken och väderprognosen för nordvästra Skåne. Oftast med Peter Ferm och Yvonne Johansson. Nytt avsnitt varje vardag vid halvsjutiden på morgonen.",en,Listen: Fire ban in Helsingborg and Landskrona,"Listen to and read a summary of the latest news, the situation in traffic and the weather forecast for northwestern Skåne. Most often with Peter Ferm and Yvonne Johansson. New section every weekday at half -time in the morning.",2025-04-07 04:35:17
se,"Elin, 40, och Mario, 32, kan inte få barn: ”Vi får bli de som pratar om det”","För drygt ett år sedan insåg Elin Hörberg och Mario Ochoa att de aldrig kommer att bli föräldrar. Då lade de fem år av ovisshet, undersökningar, operationer och IVF-behandlingar bakom sig. Nu vill de ge andra det som de själva har saknat – ett sammanhang för alla som inte har barn.",en,"Elin, 40, and Mario, 32, can't have children: ""We get to be the ones talking about it""","Just over a year ago, Elin Hörberg and Mario Ochoa realized that they will never be parents. Then they put five years of uncertainty, investigations, operations and IVF treatments behind them. Now they want to give others what they themselves have missed - a context for anyone who does not have children.",2025-04-07 04:32:58
se,Australiska sällsynta jordartsaktier stiger efter Kinas exportkontroller,,en,Australian rare earth shares rise after China's export checks,,2025-04-07 04:32:58
se,Tankbilen skenar – då fattar 27 bilar eld,Eldinfernot på motorvägen • Kampen mot klockan,en,The tanker is shining - then 27 cars catch fire,Fire inferno on the highway • The fight against the clock,2025-04-07 04:31:13
se,Influencer gripen – tog sig i land på förbjudna ön,,en,Influencer Gripen - landed on the banned island,,2025-04-07 04:30:00
se,Idylliska Bullerbyn kan få 48 hektar logistikcenter som granne: ”Tror inte det är sant”,"Stensta by anlades på 1920-talet, som bostäder för de anställda på Mariebergs mentalsjukhus. I dag är det en Bullerby-idyll – med ett stort orosmoln ...",en,"Idyllic noise village can get 48 hectares logistics centers as a neighbor: ""Don't think it's true""","Stensta village was built in the 1920s, as housing for the employees at Marieberg's mental hospital. Today it is a Bullerby idyll-with a great cloud of concern ...",2025-04-07 04:30:00
se,Debatt: Norrbotniabanan — möjlighet och hot,"Mer generellt måste större städer bli regionens primära fokus, då skapas även underlag för infrastruktur, universitet och universitetssjukhus, skriver Lars Westin.",en,Debate: Norrbotniabanan - Opportunity and Hot,"More generally, larger cities must become the region's primary focus, as a basis for infrastructure, university and university hospitals is also created, writes Lars Westin.",2025-04-07 04:30:00
se,Vår konsumtion måste minska – för klimatet,Forskarlarm: Det är dags att sätta gränser,en,Our consumption must decrease - for the climate,Research Alarms: It's time to set boundaries,2025-04-07 04:30:00
se,Livet efter ”Robinson”: Helt isolerad i bunker – i ett år,"Robinsonprofilen Adnan Mzori hamnade i ett våldsamt bråk i Kumlabunkern.Sedan dess har nästan ett år gått – och han hålls fortfarande isolerad.”Jag kan tyvärr inte ge dig några svar”, skriver Mzori inifrån bunkern.",en,"Life after ""Robinson"": Completely isolated in Bunker - for a year","Robinson profile Adnan Mzori ended up in a violent quarrel in the Kumlabunkern. Since then, almost a year has passed - and he is still kept isolated. ""Unfortunately, I cannot give you any answers,"" Mzori writes from within the bunker.",2025-04-07 04:30:00
se,Förslaget: Hon blir ny toppchef i kommunen,Karlskrona kommun ska anställa en ny kommunikationschef.,en,The proposal: She becomes new top manager in the municipality,Karlskrona Municipality will hire a new communications manager.,2025-04-07 18:30:47
se,Blackrocks vd: USA troligen i recession just nu,"De amerikanska tullarna är mer inflationsdrivande än vad marknaden förväntar sig enligt Larry Fink, världens största fondförvaltares vd.",en,Blackrock's CEO: USA probably in recession right now,"The US customs are more inflationary than the market expects, according to Larry Fink, the world's largest fund manager's CEO.",2025-04-07 18:30:36
se,Sex av tio nya bilar laddbara i Umeå,I Umeå noterades ett nytt rekord under första kvartalet 2025: Aldrig tidigare har laddbara bilar utgjort en så stor del av alla nyregistrerade bilar.,en,Six out of ten new cars rechargeable in Umeå,"In Umeå, a new record was noted during the first quarter of 2025: Never before has rechargeable cars been such a large part of all newly registered cars.",2025-04-07 18:30:00
se,Trumps politik stoppar Karolinskas forskning,"Trumpadministrationens vetenskaps­resistens chockar forskarvärlden. Men den påverkar inte bara förhållandena i USA – redan har två forskningsprojekt vid Karolinska institutet påverkats, vara av det ena tvingats lägga ner.",en,Trump's policy stops Karolinska's research,"Trump administration's science resistance shocks the research world. But it does not only affect conditions in the United States - already two research projects at the Karolinska Institute have been affected, to be one forced to close down.",2025-04-07 18:30:00
se,Jorge Bolaño kollapsade på en fest och dog,"Den colombianska VM-spelaren Jorge Bolaño kollapsade på en fest.Han kördes akut till sjukhus, men hans liv gick inte att rädda. ”Jorge var en vän och en oförglömlig lagkamrat”, skriver Bolaños tidigare lagkamrat Gianluigi Buffon på Instagram.",en,Jorge Bolaño collapsed at a party and died,"The Colombian World Cup player Jorge Bolaño collapsed at a party. He was rushed urgently to hospital, but his life could not be saved. ""Jorge was a friend and an unforgettable teammate,"" writes Bolaño's former teammate Gianluigi Buffon on Instagram.",2025-04-07 18:29:22
se,Avbokar nya Fröken Snusk – vill ha gamla,Turerna kring den nya sångerskan bakom Fröken Snusk fortsätter. Nu meddelar en festival i Småland att man avbokar Fröken Snusk från en tilltänkt konsert i sommar.,en,Cancel new Miss Snusk - want old,The tours around the new singer behind Miss Snusk continue. Now a festival in Småland announces that they cancel Miss Snusk from an intended concert this summer.,2025-04-07 18:26:11
se,Stopp på 172 efter singelolycka,"En singelolycka orsakar problem i trafiken på 172 vid Hukenmotet i båda riktningarna, enligt Trafikverket. Räddningstjänst är på plats.",en,Stop on 172 after single accident,"A single accident causes problems in traffic at 172 at Hukenmotet in both directions, according to the Swedish Transport Administration. Rescue services are in place.",2025-04-07 18:25:49
se,Nyförvärvet som har försvunnit: ”Osynlig”,"Två matcher, fem mål, sex poäng.Så... allt frid och fröjd?Knappast. AIK:s prestationer är långt från toppklass – och det är de lyckligtvis medvetet om. Med hjälp av unik data från Playmaker AI synar Expressen nu AIK:s två allsvenska matcher i sömmarna. ✓ Taktiska draget avslöjat: ”Det blir tydligt”.✓ Nyförvärvet som försvunnit: ”Osynlig”✓ Siffrorna som visar John Guidettis inflytande✓ Så mycket överpresterar AIK offensivt",en,"The new acquisition that has disappeared: ""Invisible""","Two matches, five goals, six points.So ... all peace and delight? Hardly. AIK's achievements are far from top class - and fortunately they are conscious of it. With the help of unique data from Playmaker AI, Expressen now calls AIK's two all -Swedish matches in the seams. ✓ The tactical feature revealed: ""It will be clear"". Thus, the new acquisition that has disappeared: ""Invisible"" ✓ The figures showing John Guidetti's influence showers so much over -performing AIK offensive",2025-04-07 18:25:48
se,Största fallgroparna för renoveringssugna – här ska du se upp,Från den 12 maj går det att blåsa på med bostadsrenoveringar när staten står för halva arbetskostnaden. Så undviker du fallgroparna med den nya skatterabatten.,en,Biggest pitfalls for renovation sucks - here you should watch out,"From May 12, it is possible to blow on with housing renovations when the state accounts for half the labor cost. How to avoid the pitfalls with the new tax debate.",2025-04-07 18:23:09
