iso_code,title,description,lang_tranlation,title_translated,description_translated,pubDate
fi,HS: Kasmir kärsii ikävästä vaivasta – uran jatko vaakalaudalla,Muusikko Kasmir kertoo Helsingin Sanomille pohtivansa musiikkiuransa jatkoa. Taustalla vaikuttaa ikävä vaiva.,en,HS: Kasmir is eliminating Ikava's ailment with a continuation of a career at stake,Musician Kasmir tells Helsingin Sanomat that he is considering continuing his music career. The background is influenced by Ikava ailment.,2025-03-25 19:23:00
fi,J. D. Vance matkustaa Grönlantiin,"Vance sanoi eilen Fox Newsin haastattelussa, että Yhdysvaltain presidentti Donald Trump ottaisi saaren haltuunsa tarvittaessa.",en,J. D. Vance to travel to Greenland,Vance said yesterday in an interview with Fox News that US President Donald Trump would take over the island when needed.,2025-03-25 19:57:00
fi,Jääkiekko | SM-liigan putoamis­karsinnassa hämmentävä näytelmä – kotijoukkueen maskottikin komennettiin suihkuun,Jukurit oli murskaavan ylivoimainen Lahdessa. Se kävi kotijoukkueen tunteisiin.,en,Ice hockey A confusing play in the SM League Running qualifier-the home team's mascot was commanded in the shower,The Jukuri was crushing overwhelming in Lahti. It went to the home team's feelings.,2025-03-25 19:57:00
fi,"Mies, saitko tällaisen viestin? Älä klikkaa – Voit menettää rahasi","Terveysaiheiset huijausviestit ovat yleistyneet, sanoo Suomen Telemarkkinointiliitto. Suomen Telemarkkinointiliitto ry varoittaa tiedotteessaan aiempaa yleisemmiksi käyvistä terveysaiheisista huijauksista. Kyseessä on yhdistyksen mukaan jopa selkeä trendi, ja käyttäjäilmoituksia yhdistyksen ylläpitämään Kilpi-sovellukseen on tehty erilaisista terveyshuijauksista runsaasti viime aikoina. Terveysaiheisissa huijausviesteissä saatetaan esimerkiksi mainostaa ratkaisuja eturauhasvaivoihin tai kehua detox-laastareita. Viestit on laadittu erilaisista vaivoista kärsiville, ja niiden kieli on sävyltään houkuttelevaa.",en,"Man, did you get such a message? Don't click - you can lose your money","Health -related scam messages have become more common, says the Finnish Telemarketing Association. In its announcement, the Finnish Telemarketing Association warns of more common health scams. According to the association, this is even a clear trend, and user announcements for the Kilpi application maintained by the association have made a large number of health scams lately. For example, health-related scam messages may advertise solutions to prostate problems or praise detox patches. The messages are made for people with different ailments and their language is attractive in tone.",2025-03-25 19:55:47
fi,Ukraina ja Venäjä sopuun Mustanmeren tulitauosta – Kreml vaatii lievennyksiä,"Ukraina aikoo pyytää Yhdysvalloilta lisää aseita ja pakotteita Venäjää vastaan, jos Moskova rikkoo sopimusta, Ukrainan presidentti Volodymyr Zelenskyi sanoo.",en,Ukraine and Russia to deal with the Black Sea Customs - Kreml requires mitigation,"Ukraine intends to ask the United States for more weapons and sanctions against Russia if Moscow violates the agreement, says Ukrainian President Volodymyr Zelenskyi.",2025-03-25 19:50:00
fi,Niina vei koiran ulos – vastassa oli mykistävä näky,Lapin taivas leimusi vihreän sävyissä.,en,Niina took the dog out - confronted with a silent sight,The sky of Lapland flared in green shades.,2025-03-25 19:50:00
fi,TPS:n A-nuorilla edustuksen kohtalo – kausi päättyi Lahdessa,,en,TPS's A-young people's fate-the season ended in Lahti,,2025-03-25 19:45:04
fi,Onnettomuudet | Autoilija ajoi ihmisen päälle Helsingin Kasarmikadulla,Jalankulkija loukkaantui tilanteessa lievästi.,en,Accidents The motorist drove on a person on the Kasarmikatu in Helsinki,The pedestrian was slightly injured in the situation.,2025-03-25 19:44:00
fi,Lähi-itä | Harvinainen mielen­osoitus Gazassa: Palestiinalaiset nousivat Hamasia vastaan,Gazan asukkaiden turhautuminen lienee kasvanut Israelin jatkettua viikko sitten pommituksiaan parin kuukauden tulitauon jälkeen.,en,Middle East A rare demonstration in Gaza: Palestinians rose against Hamas,The frustration of Gaza's inhabitants may have increased after Israel continued a week ago after a couple of months after a ceasefire.,2025-03-25 19:44:00
fi,Pekko Pelikaanin touhu oli liikaa – erotuomari komensi suihkuun,Pekko Pelikaani sekoili itsensä ulos.,en,Pekko Pelican's hustle was too much - the referee commanded the shower,Pekko Pelicani confused himself.,2025-03-25 19:44:00
fi,Jalankulkija jäi tilataksin alle Helsingin ydinkeskustassa,Pelastuslaitos sai tehtävän tiistai-iltana kello 20.25.,en,The pedestrian was under space tax in downtown Helsinki,The rescue service received the task on Tuesday evening at 8:25 pm.,2025-03-25 19:41:00
fi,Juuse Saros torjui 200 voittoa täyteen NHL:ssä – ”Aika on mennyt nopeasti”,"Juuse Saros valittiin ottelun ykköstähdeksi, kun Nashville Predators kaatoi kuumavireisen Carolina Hurricanesin. Suomalainen rikkoi samalla hienon merkkipaalun.",en,"Juuse Saros fought 200 wins in the NHL - ""Time has gone fast""","Juuse Saros was chosen as the number one star of the match when the Nashville Predators overthrew the hot carolina Hurricanes. At the same time, the Finn broke the fine milestone.",2025-03-26 05:17:48
fi,Labra tutki käytettyjä kiintolevyjä ja löysi paljon sisältöä,Kiintolevyn puhdistus kannattaa tehdä oikein.,en,Labra explored used hard drives and found a lot of content,It is a good idea to do the hard disk cleaning correctly.,2025-03-26 05:16:00
fi,Asiantuntija lyttää rauhan­neuvottelut – ”Naurettavaa”,"Asiantuntija summaa, että Venäjän ja Ukrainan epäsuorissa aselepo­neuvotteluissa nähtiin tyypillistä venäläistä neuvottelutaktiikkaa: mitään ei sovittu.",en,"The expert is leaving peace talks - ""ridiculous""",The expert sums up that indirect Russian and Ukraine's indirect weapon negotiations saw typical Russian negotiation tactics: nothing was agreed.,2025-03-26 05:15:00
fi,Pörssisähkön hinta pomppasi aamulla hirmulukemiin,,en,The price of a stock market bounced in the morning to the horror figures,,2025-03-26 05:13:36
fi,"Ällistyttävä määrä rahaa – Sara, 28, on maailman rikkain mäkihyppääjä","Sara Takanashista tuli kotimaassaan Japanissa supersankari ja miljonääri. Muistatteko millaisen ilmiön Toni Nieminen synnytti Suomessa 1990-luvun alussa? Kerrotaan Niemis-ilmiö vähintään sadalla, niin ollaan kärryillä Sara Takanashin, 28, suosiosta kotimaassaan.",en,"An amazing amount of money - Sara, 28, is the richest ski jumper in the world","Sara Takanash became a superhero and millionaire in her home country in Japan. Do you remember what kind of phenomenon Toni Nieminen gave birth in Finland in the early 1990s? The phenomenon of the peninsula is told at least a hundred, so the popularity of Sara Takanashi, 28, is in her home country.",2025-03-26 05:12:06
fi,Venäjän lentoliikenne lähestyy kriittistä pistettä,Suurimmalle osalle maan koneista vuosi 2025 voi olla viimeinen käyttövuosi.Artikkeli Venäjän lentoliikenne lähestyy kriittistä pistettä julkaistiin ensimmäisen kerran Verkkouutiset.,en,Russian air traffic is approaching critical points,"For most of the country's machines, 2025 may be the last year of use. Article Russian air traffic approaches Critical Points for the first time.",2025-03-26 05:10:43
fi,Jeremy Clarkson ryöpyttää Elon Muskia – ”Varoitin Tesla-kuskeja jo 17 vuotta sitten”,Entinen Top Gear -tähti ei tunnetusti ole Teslan tai sen nokkamiehen ylin ystävä.,en,"Jeremy Clarkson rumbles Elon Musk-""I warned Tesla riders 17 years ago""",The former Top Gear star is not known to be the top friend of Tesla or its camper.,2025-03-26 05:09:00
fi,”Neuvottelut tulitauosta täysin arvaamattomia”,"Tämä ei ole mikään pieni paikallinen sota, todetaan Ukrainan presidentin kansliasta.Artikkeli ”Neuvottelut tulitauosta täysin arvaamattomia” julkaistiin ensimmäisen kerran Verkkouutiset.",en,“Negotiations of the ceasefire completely unpredictable”,"This is not a small local war, the article of the Ukrainian President is stated.",2025-03-26 05:06:06
fi,Analyysi: Tämä päätös voi järisyttää koko Eurooppaa,"Suomessakin voi iloita siitä, että Saksa näyttää olevan tosissaan rakentamassa Euroopan yhteistä puolustusta. Matkalla riittää kuitenkin mutkia, kirjoittaa ulkomaantoimittaja Jimi Holmberg. Berliinissä tehtiin päätös, joka voi järisyttää koko Eurooppaa. Tiukoista kukkaronnyöreistään tunnettu Saksa on latomassa puolustukseensa miljardeja euroja. Tällaista ei ole nähty sitten kylmän sodan, CNN analysoi.",en,Analysis: This decision can shake up the whole of Europe,"In Finland, too, it can be rejoiced that Germany seems to be serious about building a common European defense. However, there are enough bends on the way, writes foreign journalist Jimi Holmberg. In Berlin, a decision was made to shake up Europe as a whole. Known for its strict purse rods, Germany is a billion euros in its defense. This has not been seen since the Cold War, CNN analyzes.",2025-03-26 05:02:26
fi,Sauli Niinistö HS:lle unionin aseistamisesta uudelleen: Sehän on vain lupa lainata,Presidentti kummastelee EU:n julkaisemaa 800 miljardin euron Euroopan uudelleenaseistamiseen tähtäävää suunnitelmaa.Artikkeli Sauli Niinistö HS:lle unionin aseistamisesta uudelleen: Sehän on vain lupa lainata julkaistiin ensimmäisen kerran Verkkouutiset.,en,Sauli Niinistö to HS about the Union's arrangement: that's just permission to borrow,The President is wondering about the EU -released EUR 800 billion European plan for re -regulation.,2025-03-26 05:01:46
fi,Järkyttävä turma Kemissä: Lapsi raahautui liikkuvan auton perässä liki 200 metrin matkan,Lapsi loukkaantui tilanteessa ja hänet kuljetettiin sairaalahoitoon. Silminnäkijöille tarjottiin kriisiapua.,en,Shocking Turma in Kemi: The child dragged after a moving car for nearly 200 meters,The child was injured in the situation and was transported to hospital. Eyewitnesses were offered crisis assistance.,2025-03-26 19:53:00
fi,Onnettomuudet | Lapsi raahautui liikkuvan auton alla 200 metriä Kemissä,Lapin sosiaalitoimi tarjoaa kriisiapua silminnäkijöille.,en,Accidents The child dragged under a moving car 200 meters in Kemi,Lapland's social service provides crisis assistance to eyewitnesses.,2025-03-26 19:50:00
fi,Ilves vyöryi voittoon Tampereen paikallisessa,Ilves aloitti puolivälierät vahvasti kaatamalla Tapparan selvin 4–0-lukemin. Ilveksen avainhahmoiksi nousivat kolme syöttöpistettä kerännyt Matias Mäntykivi sekä 27 torjunnalla nollapelin tililleen kirjauttanut Dominik Pavlát.,en,Ilves rolled to victory in Tampere's local,"Ilves started the quarterfinals strongly by pouring Tappara's clear 4-0. Ilves' key characters were Matias Mäntykivi, who collected three passes, and Dominik Pavlát, who recorded 27 tackles in his account.",2025-03-26 19:49:19
fi,"Liiga-kierros: Kodýtekin ja Savinaisen hölmöilyt kävivät kalliiksi, Lukko tuhosi Sport-peikkonsa","Liigan puolivälierien avausottelut tarjosivat paljon maaleja, sekä muistutuksia erikoistilanteiden merkityksestä kevään tosipeleissä.",en,"League round: Kodýtek and Savinainen's fools were expensive, Lukko destroyed his Sport troll","The opening match of the league's quarter -finals offered a lot of goals, as well as reminders of the importance of special situations in the spring games.",2025-03-26 19:48:25
fi,Lapsi raahautui auton perässä noin 200 metriä – Silmin­näkijöille kriisiapua,"Poliisi tutkii tapausta vammantuottamuksena ja liikenneturvallisuuden vaarantamisena. Alakouluikäinen lapsi loukkaantui poikkeuksellisessa liikenneonnettomuudessa Kemin Takajärvellä. Onnettomuus tapahtui tänään keskiviikkona alkuillasta. Lapsi nousi autosta Oklaholmankadulla ja jostain syystä siirtyi auton eteen ilman, että kuljettaja huomasi häntä.",en,The child dragged about 200 meters after the car - for eyewitnesses crisis assistance,"Police are investigating the case as injury and endangering road safety. A primary school child was injured in an exceptional traffic accident in Takajärvi, Kemi. The accident happened today on Wednesday evening. The child rose from the car on Oklaholmankatu and for some reason moved in front of the car without the driver noticed him.",2025-03-26 19:46:48
fi,Time: Zelenskyi kommentoi viimein Valkoisen talon kohutapaamista,"Yhdysvaltalaisen Time-lehden haastattelussa selvisi myös, mitä tapahtui nyrkkeilijä Oleksandr Usykin mestaruusvyölle, jonka Zelenskyi vei lahjaksi Trumpille.",en,TIME: Zelenskyi finally commented on the White House's fuss,"An interview with Time from the United States also revealed what happened to the boxer Oleksandr Usyk's championship belt, which Zelenskyi took as a gift to Trump.",2025-03-26 19:45:00
fi,Suomessakin jopa tuhansien ihmisten geenitiedot voivat pian vaihtaa omistajaa – asiantuntija ei näe myynnissä suurta riskiä,,en,"Even in Finland, even thousands of people's genetic records can soon change hands - the expert will not see a great risk of sale",,2025-03-26 19:45:00
fi,"OLS hoiti liigakarsinnan avauksesta tärkeimmän eli voiton avauserän sekoilun jälkeen: ""Ykköskenttä vastasi huutoon""",Oulun Luistinseuran keskiviikkoillan esitystä Kastellin monitoimitalossa voisi kuvailla sanalla sillisalaatti.,en,"OLS took care of the opening of the league qualifier after the most important opening round, ""The number one field responded to the cry""",The Oulu Skating Club's Wednesday night performance at the Kastell Multifunctional House could describe the word herring salad.,2025-03-26 19:39:27
fi,Jokerit on lyöty,Toinen Mestis-finaali pelattiin 1 128 katsojan edessä.,en,The Jokers have been beaten,The second Mestis final was played in front of 1 128 spectators.,2025-03-26 19:39:00
fi,Ruotsin hovi julkaisi syntymäpäiväpotretin 4-vuotiaasta pikkuprinssistä – yksi kommentti toistuu somessa,Prinssi Julian on prinssi Carl Philipin ja prinsessa Sofian toiseksi nuorin lapsi.,en,Hovi of Sweden released a birthday portrait of the 4-year-old little princess-one comment is repeated in Somme,Prince Julian is the second youngest child of Prince Carl Philip and Princess Sofia.,2025-03-26 19:34:00
fi,Ryska krigsfångar väntar på att få återvända hem: ”Alla är trötta på kriget”,Ukrainas största fängelse för ryska krigsfångar ligger på landsbygden i västra Ukraina. Här väntar hundratals män på att bli utbytta mot ukrainare i rysk fångenskap.,en,"Ryska krigsfångar Väntar på att Få Återvända Hem: ""Below Är Trötta på kriget""",Ukraine största fängelse för ryska krigsfångar ligger på landsbygden i Västra Ukraine. Här Väntar hundratals på att blli utbytta mot ukrainare i rysk fångenskap.,2025-03-27 03:40:37
fi,Tapani Kansa antoi IL:lle viimeisen haastattelun reilu viikko ennen kuolemaansa – ”Rakastan niin paljon elämää”,"Iskelmälegenda Tapani Kansa antoi Iltalehdelle viimeiseksi jääneen haastattelunsa, joka tehtiin puolitoista viikkoa ennen hänen kuolemaansa. Iltalehti julkaisee haastattelun Kansan puolison Nina af Enehjelmin pyynnöstä. Tapani Kansa oli viimeisinä aikoinaan onnellisempi kuin koskaan aiemmin. Iltalehti haastatteli legendaa puolitoista viikkoa ennen hänen kuolemaansa. Kansa kuoli sappirakon poistoleikkauksen jälkeisiin komplikaatioihin. Kun häntä yritettiin leikata toistamiseen, laulaja ei enää selvinnyt operaatiosta. Haastattelu julkaistaan postuumisti Kansan puolison Nina af Enehjelmin pyynnöstä.",en,"Tapani Kansa gave IL the last interview just over a week before their death - ""I love so much life""","The stroke legend Tapani Kansa gave Iltalehti the last interview, one and a half weeks before his death. Iltalehti publishes an interview at the request of Nina af Enehjelm, the people of the people. Tapani Kansa was once happier at one time than ever. Iltalehti interviewed the legend a week and a half before his death. The people died in complications after the gallbladder removal surgery. When he was attempted to be cut again, the singer no longer survived the operation. The interview will be published posthumously at the request of Nina af Enehjelm, the people's spouse.",2025-03-27 03:34:37
fi,Näin raskas liikenne sähköistyy – Nyt Suomeen saapuivat sähköiset säiliörekat,Ensimmäinen sähköllä toimiva säiliörekka otetaan käyttöön Kaakkois-Suomessa,en,This is how heavy traffic is electrified - now electronic tank trucks arrived in Finland,The first electric tank truck will be introduced in Southeast Finland,2025-03-27 03:30:00
fi,"Tapani Kansa kiinnitti silmänsä Nina af Enehjelmiin, sitten se oli menoa – tällaisia olivat suhteen viimeiset vuodet",Tapani Kansan ja Nina af Enehjelmin rakkaustarinan voisi kiteyttää ytimekkäästi kolmella sanalla: kaiken se kestää. Tapani Kansan sairaalavuoteelta lähettämät viimeiset viestit hehkuvat yhteenkuuluvuutta.,en,"Tapani Kansa attached their eyes to Nina af of Elehjella, then it was going - these were the last few years of the relationship",The love story of Tapani Kansa and Nina af Enehjelm could concisely sum up in three words: it lasts. The last messages sent by Tapani Kansa from the hospital bed glow together.,2025-03-27 03:30:00
fi,"Anna Perho: Hiljaisuus ja pimeys alkavat olla niin harvinaista pääomaa, että sitä pitäisi varjella kuin aarretta",,en,Anna Perho: Silence and darkness are starting to be so rare capital that it should be protected as a treasure,,2025-03-27 03:05:00
fi,Kulttuuri tukee asukkaiden kiinnittymistä kaupunkiin,,en,Culture supports residents' attachment to the city,,2025-03-27 03:05:00
fi,Näissä käytettynä myytävissä autoissa on eniten epäselvyyksiä – Listan huonoimmasta puhtaat paperit saa vain joka kolmas,"Käytettyjen autojen historiatietoja haaliva CarVertical on listannut ne automerkit, joiden käytetyistä autoista löytyy vähiten ja eniten epäselvyyksiä. Käytettyä autoa ostavan on syytä varautua monenlaisiin asioihin: korjauksiin, ylimääräisiin huoltoihin, uuden rengassarjan hankintaan ja pahimmassa tapauksessa piiloteltujen, isojen vikojen korjaamiseen. Verkossa toimiva, käytettyjen autojen tietokantoja läpi käyvä ja niistä tietoja halukkaille asiakkaille myyvä CarVertival on tutkinut dataa Suomessa tyypillisesti puhtaan historian omaavien automerkkien hauista ja listannut ne, joiden kohdalla on epätodennäköistä törmätä jonkinlaisiin epäselvyyksiin.",en,"When used in these used cars, there are most ambiguities - the worst of the list of clean papers gets only every third","Carvertical, which has been losing the history of used cars, has listed the car brands whose used cars have the least and most ambiguity. Purchases of a used car should be prepared for a variety of things: repairs, extra maintenance, new tire set, and, in the worst case, hidden, big bugs. Carvertval, which is operating online and selling information to customers who are doing information to customers in Finland, has studied data from the searches of car brands typically in Finland and listed those who are unlikely to run into some kind of confusion.",2025-03-27 03:00:18
fi,Yhteistä velkaa vai puolustusinvestoinnit omasta kukkarosta? Näin vastaavat Suomen mepit,,en,Common debt or defense investments from your own purse? This is how the Finnish MEPs correspond to,,2025-03-27 03:00:00
fi,Nälkäkriisi on ratkaistavissa,,en,The hunger crisis can be solved,,2025-03-27 03:00:00
fi,Yksinäisyys on uhka terveydelle ja hyvinvoinnille,,en,Loneliness is a threat to health and well -being,,2025-03-27 03:00:00
fi,Henkilöauto ja suolahappoa kuljettanut säiliöauto kolaroivat Kangasalla – Valtatie 12 suljettiin kokonaan,"Kangasalla Lahdentiellä eli valtatie 12:lla tapahtui torstaina iltapäivällä liikenneonnettomuus, jonka vuoksi koko tie suljettiin liikenteeltä.",en,Passenger car and hydrochloric tanker crashed in Kangasala - Highway 12 was completely closed,"On Thursday afternoon, a traffic accident took place on Thursday afternoon on Kangasala, Lahdentie, or Highway 12, which was why the entire road was closed from traffic.",2025-03-27 19:30:50
fi,Kiekko-Espoo on Suomen mestari,Espoolaiset palasivat mestaruuskantaan.,en,Kiekko-Espoo is Finnish champion,The Espoo residents returned to the championship.,2025-03-27 19:30:00
fi,Kevättä uhkaa tyly käänne: Lunta tupaan etelää myöten?,Lauantaina aurinkoisilla alueilla lämpötilan pitäisi kohota jopa 10:n asteen yläpuolelle.,en,Spring threaten to a stupid turn: snow to the hut to the south?,"On Saturday in sunny areas, the temperature should rise up to 10 degrees Celsius.",2025-03-27 19:30:00
fi,Kiekko-Espoo on Suomen mestari,Auroraliigan mestaruus meni Espooseen. Kiekko-Espoo on voittanut jääkiekon naisten Suomen mestaruuden. K-Espoo voitti HPK:n torstaina ensimmäisessä jatkoerässä syntyneellä maalilla 3–2 ja finaalisarjan varsin selvästi otteluvoitoin 4–1.,en,Kiekko-Espoo is Finnish champion,The Aurora League Championship went to Espoo. Kiekko-Espoo has won the Finnish Hockey Women's Finnish Championship. K-Espoo won the HPK on Thursday with a 3-2 goal in the first round and the finals series quite clearly 4-1.,2025-03-27 19:27:31
fi,Yllätyspudotus Farmilla! Pudonnut kilpailija kuvailee ohjelman olosuhteita tiukin sanoin,"Farmi Suomi -sarjan kaksintaistelussa nähtiin tiukkaakin tiukempi voimaa vaativa tehtävä, joka päättyi yllätyspudotukseen.",en,Surprise drop at Farm! The fallen competitor describes the conditions of the program,The duel of the Farmi Finland series saw a tougher power -demanding task that ended with a surprise drop.,2025-03-27 19:26:00
fi,HIFK:n Kodýtekille pitkä kakku: pelikieltoa jälleen seitsemän ottelua,Liigan kurinpito tiedotti torstai-iltana määränneensä Petr Kodýtekille kauden toisen seitsemän ottelun pelikiellon.,en,For HIFK's Kodýtek long cake: a ban on playing again seven matches,The league discipline announced on Thursday evening that Petr Kodýtek has ordered the second seven match ban of the season.,2025-03-27 19:25:07
fi,Suomalainen Nana päätyi miljoonien katsojien eteen tv-lähetykseen Yhdysvalloissa: ”Video särki sydämeni”,Pienen Lenan unelmasta tulee totta.,en,"Finnish Nana ended up on millions of viewers on a TV broadcast in the United States: ""The video ached my heart""",Little Lena's dream comes true.,2025-03-27 19:24:00
fi,Yhteishaku | Helsingin yliopisto oli suosituin: Yli 35 000 hakijaa,Yliopisto oli suosituin ensisijaisten hakijoiden määrän että hakijoiden kokonaismäärän perusteella.,en,"Common search The University of Helsinki was the most popular: over 35,000 applicants",The university was the most popular number of primary applicants and the total number of applicants.,2025-03-27 19:24:00
fi,Näin Kangasalla surmatun naisen ystävät kuvailevat epäiltyä murhaajaa,"Murhasta epäilty mies oli seurustellut uhrin kanssa reilut kaksi vuotta. Uhrin ystävät kuvailevat miestä sairaalloisen mustasukkaiseksi. 60-vuotiasta miestä epäillään 55-vuotiaan naisystävänsä murhasta. Uhrin pitkäaikainen ystävä kertoo Iltalehdelle pelänneensä naisen puolesta jo pitkään. – Mä olen tiennyt, että näin tapahtuu, ystävätär sanoo.",en,Thus the friends of a woman killed in Kangasa describe the suspect's murderer,"The man suspected of murder had been dating the victim for over two years. Friends of the victim describe the man as morbid jealous. A 60-year-old man is suspected of murdering his 55-year-old female friend. The victim's long -time friend tells Iltalehti that he has been afraid of a woman for a long time. - I knew that happened, says the friend.",2025-03-27 19:21:14
fi,Elon Musk sai välittömästi näpeilleen haukuttuaan uutuuspelin,"Pelistudio käytti hyväkseen maailman rikkaimman miehen ja tunnetun striimaajan keskinäisen nahistelun sosiaalisessa mediassa. Pelistudio Ubisoftin sometiimin jäsen ei pidätellyt itseään, kun Elon Musk haukkui X:ssä uuden Assassin’s Creed Shadows -videopelin sekä peliä mainostaneen striimaajan. Tapauksesta uutisoi muun muassa Forbes. Musk oli arvostellut toisen X-käyttäjän julkaisun alla turkkilaistaustaisen Hasan Pikerin yhteistyötä Ubisoftin kanssa. Musk kutsui striimaajaa muun muassa huijariksi ja väitti tämän mainostavan ”surkeaa” peliä pelkästään rahan vuoksi.",en,Elon Musk immediately got a novelty after barking a novelty game,"The game studio took advantage of the world's richest man and the well -known streaming streaming in social media. Game studio Ubisoft's Ubisoft Somit Team did not hold himself up when Elon Musk barked at X's new Assassin's Creed Shadows video game and a streaming video. Forbes reported the incident. Musk had criticized the collaboration with Ubisoft, a Turkish background, during the publication of another X-user, with Ubisoft. Musk called the streaming, among other things, a cheater and claimed this advertising ""miserable"" game just for the sake of money.",2025-03-27 19:19:02
