iso_code,title,description,lang_tranlation,title_translated,description_translated,pubDate
cy,Πάφος FC: Διάκριση για Γκολδάρ – Τρίτος στους κορυφαίους πέντε του ECL σε συγκεκριμένη κατηγορία!,"Δεν διακρίνεται μόνο για την αγωνιστική εικόνα του ο Νταβίδ Γκολδάρ, αλλά και για συγκεκριμένα στατιστικά, τα οποία οποία αφορούν στις εμφανίσεις του καθόλη τη διάρκεια της σεζόν μέχρι σήμερα στο Europa Conference League. O 30χρονος Ισπανός κεντρικός αμυντικός της Πάφου, ο οποίος θαυμάζεται για... χίλιους λόγους, συγκαταλέγεται λοιπόν, στη λίστα με τους παίκτες-κεντρικούς αμυντικούς [...]The post Πάφος FC: Διάκριση για Γκολδάρ – Τρίτος στους κορυφαίους πέντε του ECL σε συγκεκριμένη κατηγορία! appeared first on Super Sport FM.",en,Paphos FC: Distinction for Goldar - Third in the top five of ECL in a particular category!,"Not only is David Goldar, but also for specific statistics, which relate to his appearances throughout the season to date in the Europa Conference League. The 30-year-old Spanish central defender of Paphos, who is admired for ... a thousand reasons, is therefore on the list of players-central defenders [...] The Post Paphos FC: Golladar-thirds distinction in the top five of ECL! appeared first on Super Sport FM.",2025-03-25 19:26:14
cy,ΟΜΟΝΟΙΑ: Στη Πάφο να... τριτώσει το καλό,"Το έκανε μία, το έκανε δύο, θέλει και τρίτη φορά νίκη κόντρα στη Πάφο στο πρωτάθλημα η Ομόνοια που θα κάνει το ταξίδι για το «Στέλιος Κυριακίδης» στην 2η αγωνιστική των playoffs. Με τον Γιάννη Αναστασίου στον πάγκο, οι «πράσινοι» ήταν η πρώτη ομάδα που ανάγκασε σε ήττα την Πάφο φέτος στον θεσμό του πρωταθλήματος, [...]",en,OMONIA: In Paphos to ... trim the good,"He did it, he did two, he wants a third time a win against Paphos in the league, Omonia who will make the trip to ""Stelios Kyriakidis"" in the 2nd Playoffs. With Yiannis Anastasiou on the bench, the ""Greens"" were the first team to defeat Paphos this year in the championship institution, [...]",2025-03-25 19:25:35
cy,ΒΙΝΤΕΟ: Έρευνα για το «Η Κύπρος είναι Ελληνική....» και το σύνθημα κατά Τουρκίας στην στρατιωτική παρέλαση,CYPRUSTIMES,en,"VIDEO: Research on ""Cyprus is Greek ...."" and the slogan against Turkey at the military parade",Cyprustimes,2025-03-25 19:22:39
cy,Οι όροι της Ρωσίας στη συμφωνία με Ουκρανία στη Μ. Θάλασσα. Τι φοβάται ο Ζελένσκι,CYPRUSTIMES,en,Russia's terms in the Ukraine Agreement in the Great Sea. What is Zelenski scared,Cyprustimes,2025-03-26 05:20:43
cy,Κρίση στην Αϊτή: «Αγνοείται» η τύχη μέλους της πολυεθνικής δύναμης,"Αστυνομικός της υπό κενυατική ηγεσία Πολυεθνικής Αποστολής Υποστήριξης Ασφαλείας (ΠΑΥΑ) αγνοείται έπειτα από επίθεση κακοποιών στην Αϊτή χθες Τρίτη, ανέφερε η δύναμη σε ανακοίνωσή της.Ειδικές δυνάμεις έγιναν στόχος επίθεσης μελών συμμορίας καθώς βοηθούσαν να βγει όχημα της αστυνομίας που είχε κολλήσει σε τάφρο, που πιστεύεται πως είχαν ανοίξει κακοποιοί, σύμφωνα με την ανακοίνωση.Ωστόσο, ΜΜΕ της Αϊτής μεταδίδουν πως το μέλος της ΠΑΥΑ είναι νεκρό. Βίντεο που κυκλοφορούν σε ιστότοπους κοινωνικής δικτύωσης εικονίζουν τον αστυνομικό πεσμένο στο έδαφος, αιμόφυρτο.Πηγή: ΑΠΕ-ΜΠΕ",en,Crisis in Haiti: 'Missing' Member of Multinational Power,"A Kenyan Police Officer Multinational Security Support Mission (PAVA) is missing after the attack of criminals in Haiti Tuesday, the force said in a statement. Special forces were targeted by a gang members as they were helping a police officer. A member of PAVA is dead. Video circulating on social networking sites depict the police officer on the ground, bloodthirsty. Source: RES-EIA",2025-03-26 05:18:48
cy,Η Συρία καταδικάζει φονικούς βομβαρδισμούς του Ισραήλ στο έδαφός της,"Η de facto κυβέρνηση της Συρίας καταδίκασε χθες Τρίτη την «κατάφωρη παραβίαση» της συριακής εθνικής κυριαρχίας μετά τους φονικούς βομβαρδισμούς που εξαπολύθηκαν από το Ισραήλ στο νότιο τμήμα της επικράτειας της χώρας.Οι ισραηλινές ένοπλες δυνάμεις ανακοίνωσαν πως «τρομοκράτες άνοιξαν πυρ προς την κατεύθυνση θέσεων στρατιωτικών τους από τη νότια Συρία» και τα πυρά «ανταποδόθηκαν» από μονάδες τους και κατόπιν την πολεμική αεροπορία.Με ανακοίνωσή του, το συριακό υπουργείο Εξωτερικών τόνισε πως «καταδικάζει τη συνεχιζόμενη ισραηλινή επίθεση εναντίον της συριακής επικράτειας» και την «επικίνδυνη κλιμάκωση» που είχε αποτέλεσμα να σκοτωθούν «έξι άμαχοι» δυτικά της ομώνυμης πρωτεύουσας της επαρχίας Ντεράα.Έκανε λόγο για «κατάφωρη παραβίαση της (συριακής) εθνικής κυριαρχίας».Η αυτοδιοίκηση στην επαρχία Ντεράα έκανε λόγο για πέντε νεκρούς στην κοινότητα Κουάιγια από πυρά των πυροβόλων ισραηλινών αρμάτων μάχης, τα οποία εισέβαλαν κατ’ αυτή στο συριακό έδαφος.Σύμφωνα με τον κυβερνήτη στη Ντεράα, τον Ανουάρ αζ Ζόχμπι, τον οποίο επικαλέστηκε το επίσημο πρακτορείο ειδήσεων SANA, «οι επανειλημμένες παραβιάσεις του ισραηλινού στρατού κατοχής» οδήγησαν σε μάχες με κατοίκους, ακολουθούμενες από «κλιμάκωση με πυρά πυροβολικού και drones» από ισραηλινής πλευράς.Οι τοπικές αρχές ανέφεραν πως κάπου 350 οικογένειες εγκατέλειψαν την κοινότητα Κουάιγια.Μετά την πτώση του Μπασάρ αλ Άσαντ τον Δεκέμβριο, το Ισραήλ έστειλε στρατεύματα σε ουδέτερη ζώνη στο Γκολάν, στη νοτιοδυτική Συρία, στα όρια του τμήματος του υψιπέδου υπό κατοχή του Ισραήλ από το 1967.Η ισραηλινή κυβέρνηση λέει πως διέταξε να τεθεί τον έλεγχο των ισραηλινών ενόπλων δυνάμεων αυτή η ουδέτερη ζώνη για να «υπερασπιστούν» ισραηλινές κοινότητες στο υψίπεδο.Από τον Δεκέμβριο, η μη κυβερνητική οργάνωση Συριακό Παρατηρητήριο Ανθρωπίνων Δικαιωμάτων κάνει λόγο σχεδόν καθημερινά για εισβολές μονάδων του ισραηλινού στρατού στη νότια Συρία.Παράλληλα, η ισραηλινή αεροπορία έχει εξαπολύσει εκατοντάδες πλήγματα εναντίον στρατιωτικών εγκαταστάσεων του προηγούμενου συριακού καθεστώτος το ίδιο διάστημα. Η κυβέρνηση του Μπενιαμίν Νετανιάχου αιτιολογεί τους βομβαρδισμούς τονίζοντας πως θέλει να αποτραπεί κάθε ενδεχόμενο να πέσει το οπλοστάσιο των δυνάμεων του Άσαντ στα χέρια των νέων αρχών, αφού όπως λέει πρόκειται για «τζιχαντιστές».Την 23η Φεβρουαρίου, ο πρωθυπουργός Νετανιάχου απαίτησε «την πλήρη αποστρατιωτικοποίηση της νότιας Συρίας» και διεμήνυσε πως η κυβέρνησή του δεν θα «ανεχτεί» οι δυνάμεις της νέας συριακής εξουσίας να αναπτυχθούν νότια της Δαμασκού.Κατά τη διάρκεια συνόδου του Αραβικού Συνδέσμου στο Κάιρο στις αρχές του μήνα ο σύρος de facto πρόεδρος Άχμαντ αλ Σάρα κάλεσε τη διεθνή κοινότητα να ασκήσει πίεση στο Ισραήλ ώστε να αποσύρει «αμέσως» τα στρατεύματά του από τη νότια Συρία.«Είμαι ανήσυχος για τις ισραηλινές δηλώσεις όσον αφορά την πρόθεση παραμονής στη Συρία και τις απαιτήσεις για πλήρη αποστρατιωτικοποίηση του νότου», επισήμανε χθες ο ειδικός επιτετραμμένος του ΟΗΕ για τη Συρία Γκάιρ Πέντερσεν.Η Ιορδανία καταδίκασε «σθεναρά» την «εισβολή και τον βομβαρδισμό» στη Ντεράα από τον ισραηλινό στρατό.Η Σαουδική Αραβία επίσης στηλίτευσε τα πλήγματα, κατηγορώντας το Ισραήλ πως επιδιώκει να υπονομεύσει «την ασφάλεια και τη σταθερότητα της Συρίας και τις περιφέρειας», διαπράττοντας «κατάφωρες και επανειλημμένες παραβιάσεις του διεθνούς δικαίου».Χθες ο ισραηλινός στρατός ανακοίνωσε πως έπληξε δυο συριακές στρατιωτικές βάσεις στην κεντρική Συρία, που είχε ήδη βάλει στο στόχαστρο την Παρασκευή.Πηγή: ΑΠΕ-ΜΠΕ",en,Syria condemns Israel's deadly bombings on its territory,,2025-03-26 05:17:33
cy,Ο αντιπρόεδρος των ΗΠΑ πάει στη Γροιλανδία,"Ο αμερικανός αντιπρόεδρος Τζέι Ντι Βανς ανακοίνωσε χθες Τρίτη πως θα επισκεφθεί μαζί με τη σύζυγό του Ούσα Βανς τη Γροιλανδία, την αυτόνομη περιοχή της Δανίας που ορέγεται απροκάλυπτα ο Ντόναλντ Τραμπ.«Υπήρχε τόση έξαψη γύρω από την επίσκεψη που θα κάνει η Ούσα στη Γροιλανδία (μεθαύριο) Παρασκευή που αποφάσισα να μην την αφήσω να το ευχαριστηθεί μόνη της και να τη συντροφεύσω», ανέφερε ο αντιπρόεδρος των ΗΠΑ σε βίντεο που μεταφόρτωσε στο X.Ο αμερικανός αντιπρόεδρος, που έχει υιοθετήσει θέσεις εξαιρετικά σκληρές σε ό,τι αφορά την εξωτερική πολιτική, ειδικά όσον αφορά τους ευρωπαίους συμμάχους των ΗΠΑ, θα μεταβεί στην αμερικανική βάση Πιντούφικ, που τυπικά ανήκει στη δύναμη διαστήματος των ΗΠΑ.Διαβάστε ακόμη: Δανία: Η αμερικανική επίσκεψη στη Γροιλανδία συνιστά μια απαράδεκτη πίεσηΗ Ούσα Βανς αρχικά είχε ανακοινώσει πως ήθελε να πάει σε αγώνα δρόμου με έλκηθρα που σέρνουν σκύλοι σε άλλη κοινότητα, όμως ο Λευκός Οίκος τελικά ανακοίνωσε πως το σχέδιο αυτό ακυρώθηκε και θα πάει μαζί με τον σύζυγό της στην αμερικανική βάση όπου βρίσκεται ιδίως ραντάρ έγκαιρης προειδοποίησης για την εκτόξευση βαλλιστικών πυραύλων.Ο Τζέι Ντι Βανς ανέφερε πως θα συζητήσει εκεί ζητήματα που αφορούν την «ασφάλεια» του αχανούς νησιού της Αρκτικής.«Πολλές άλλες χώρες απειλούν τη Γροιλανδία, απειλούν να χρησιμοποιήσουν το έδαφος και τα ύδατά της για να απειλήσουν τις ΗΠΑ», είπε ο αμερικανός αντιπρόεδρος απηχώντας την επιχειρηματολογία του Ντόναλντ Τραμπ.Κατ’ αυτόν τον τελευταίο η προσάρτηση της Γροιλανδίας είναι επιτακτική ανάγκη για την εθνική ασφάλεια των ΗΠΑ.Ο Ρεπουμπλικάνος πρόεδρος έχει υιοθετήσει ιμπεριαλιστικούς όσο και προκλητικούς τόνους αφότου ανέλαβε την εξουσία τον Ιανουάριο για τη δεύτερη θητεία του.Πέρα από την προσάρτηση της Γροιλανδίας, έχει μιλήσει επανειλημμένα για την προσάρτηση του Καναδά και την ανάκτηση του ελέγχου της Διώρυγας του Παναμά από τις ΗΠΑ.Εκτός του κ. Βανς, αναμένονται στη Γροιλανδία ο σύμβουλος εθνικής ασφαλείας Μάικ Γουόλτς και ο υπουργός Ενέργειας Κρις Ράιτ εντός της εβδομάδας, σύμφωνα με τον αμερικανικό Τύπο.Οι επισκέψεις αυτές, που παρουσιάζονται ως ιδιωτικές, έχουν ήδη προκαλέσει οργή πολιτικών στη Δανία και στη Γροιλανδία.«Δεν μπορεί να οργανώνεται ιδιωτική επίσκεψη επίσημων αντιπροσώπων άλλης χώρας», σχολίασε η πρωθυπουργός Μέτε Φρέντεριξεν στον Τύπο. «Η πίεση που αρκείται στη Γροιλανδία και στη Δανία (...) είναι απαράδεκτη», πρόσθεσε, τονίζοντας πως «θα αντισταθούμε» σε αυτή και διαβεβαιώνοντας πως η κυβέρνησή της έχει τη στήριξη των συμμάχων της στην Ευρώπη.Η Γροιλανδία αναμένει τον σχηματισμό νέας κυβέρνησης μετά τις εκλογές της 11ης Μαρτίου στη νήσο, που κέρδισε η κεντροδεξιά. Η απερχόμενη κυβέρνηση της νήσου ξεκαθάρισε μέσω Facebook πως δεν έστειλε «καμιά πρόσκληση για επισκέψεις, ιδιωτικές ή επίσημες». Πρόσθεσε πως καλεί «όλες» τις χώρες να «σεβαστούν τη διαδικασία» σχηματισμού νέας κυβέρνησης που αναμένει η Γροιλανδία.«Κανένα μέλος του επίσημου γροιλανδικού συστήματος δεν προσκάλεσε αυτούς τους λεγόμενους τουρίστες», τόνισε στο Γαλλικό Πρακτορείο η βουλεύτρια Αάγια Κένμιτς, η οποία αντιπροσωπεύει τη Γροιλανδία στο κοινοβούλιο του βασιλείου της Δανίας.Ο αμερικανός πρόεδρος Τραμπ έχει υποστηρίξει από την πλευρά του πως οι επισκέψεις θα γίνουν κατόπιν «πρόσκλησης» Γροιλανδών που θα ήθελαν «να γίνει κάτι» ώστε να «προστατεύονται σωστά».«Είμαστε σύμμαχοι, έχουμε αμυντική συμφωνία για τη Γροιλανδία που είχε υπογραφτεί το 1951», θύμισε η κυρία Φρέντεριξεν. Ουδείς άλλωστε λέει, ούτε στη Δανία, ούτε στη Γροιλανδία, πως «δεν θέλουμε να συνεργαστούμε με τους Αμερικανούς», πρόσθεσε.Από τον Δεκέμβριο, όταν ο Ντόναλντ Τραμπ εξέφρασε τη βούλησή του η χώρα του να «αποκτήσει» το τεράστιο νησί, η πολιτική τάξη στη Δανία και στη Γροιλανδία επαναλαμβάνει πως δεν πωλείται, παρότι «ανοικτό» για επιχειρηματικές ή άλλες συμφωνίες.Σε δημοσκόπηση που διενεργήθηκε στα τέλη Ιανουαρίου, ο πληθυσμός της Γροιλανδίας τάχθηκε στη συντριπτική του πλειοψηφία εναντίον της ιδέας η νήσος να γίνει αμερικανικό έδαφος.Νησί με έκταση τετραπλάσια από αυτήν της Γαλλίας, η Γροιλανδία προκαλεί ενδιαφέρον εκτός των άλλων για τους διόλου ευκαταφρόνητους ορυκτούς πόρους της, που μένουν ουσιαστικά αναξιοποίητοι.Η απερχόμενη κυβέρνηση πέρασε νομοθεσία που απαγορεύει την εξόρυξη ραδιενεργών υλικών, ενώ η εξερεύνηση για κοιτάσματα πετρελαίου και αερίου έχει επίσης ανασταλεί. Οι δυο απαγορεύσεις αυτές, που υποστηρίζονται από τον πληθυσμό, δεν αναμένεται να τεθούν ποτέ υπό αμφισβήτηση, εκτός δραματικού απροόπτου.Πηγή: ΑΠΕ-ΜΠΕ",en,US Vice President goes to Greenland,,2025-03-26 05:12:17
cy,Αντιδράσεις στην Ελλάδα για το «Η Κύπρος είναι ελληνική» των ΣΜΥΝ,CYPRUSTIMES,en,"Reactions in Greece to ""Cyprus is Greek"" by SMYN",Cyprustimes,2025-03-26 05:09:50
cy,Υλικές ζημιές σε επιδρομή της Ρωσίας στη γενέτειρα του προέδρου της Ουκρανίας,"Μαζική επιδρομή ρωσικών drones προκάλεσε «μεγάλη καταστροφή» στην πόλη Κρεβί Ρι της κεντρικής Ουκρανίας, ανακοίνωσε μέσω Telegram ο στρατιωτικός περιφερειάρχης Ολεξάντρ Βίλκουλ τις πρώτες πρωινές ώρες.«Όλοι είναι ζωντανοί, δόξα τω Θεώ. Αληθινό θαύμα. Μεγάλη καταστροφή», ανέφερε.Νωρίτερα, ο κ. Βίλκουλ αναφέρθηκε σε τουλάχιστον 15 εκρήξεις στη γενέτειρα του ουκρανού προέδρου Βολοντίμιρ Ζελένσκι, που μπαίνει συχνά στο στόχαστρο ρωσικών πληγμάτων.Διαβάστε ακόμη: Λαβρόφ: Η συμφωνία για τη Μαύρη Θάλασσα θα φέρει κέρδη στη ΡωσίαΠηγή: ΑΠΕ-ΜΠΕ",en,Material damage to Russia's raid on the birthplace of Ukrainian President,"A mass raid of Russian drones caused a ""great disaster"" in the city of Central Ukraine, announced via a Telegram, the military regional governor Olexandr Vilkul in the early hours of the morning. ""Everyone is alive, thank God. True miracle. Great disaster, ""he said. In no case, Mr Vilkul referred to at least 15 explosions in the birthplace of Ukrainian President Voludimir Zelenski, who often targets Russian bumps. Read more: Lavrov: The Black Sea Agreement",2025-03-26 05:09:36
cy,Ανεβάζουν χειρόφρενο οι οδηγοί ταξί στη Λεμεσό - Τετράωρη στάση εργασίας σήμερα,Η Ομοσπονδία ανακοίνωσε ότι σκοπός δεν είναι η ταλαιπωρία του κοινού αλλά να προβληθούν τα προβλήματα του επαγγέλματος.,en,Taxi drivers upheld handbrakes to Limassol - four -hour work stoppage today,The Federation has announced that the purpose is not to suffer the public but to raise the problems of the profession.,2025-03-26 05:09:04
cy,Λεμεσός: Σε τετράωρη στάση εργασίας οι οδηγοί ταξί - Έκλεισαν τον κυκλικό κόμβο Αγ. Νικολάου (φώτος),Η Ομοσπονδία ανακοίνωσε ότι σκοπός δεν είναι η ταλαιπωρία του κοινού αλλά να προβληθούν τα προβλήματα του επαγγέλματος.,en,Limassol: In a four -hour work stoppage the taxi drivers - closed the round hub of Ag. Nicholas (Photos),The Federation has announced that the purpose is not to suffer the public but to raise the problems of the profession.,2025-03-26 05:09:04
