iso_code,title,description,lang_tranlation,title_translated,description_translated,pubDate
cy,Απόλλων: Μαθηματικά... τα πάντα ρει,"Απομένουν επτά αγώνες στο πρωτάθλημα, με τη διαφορά από την 4η θέση να βρίσκεται στους εννέα βαθμούς. Σημαντικό μειονέκτημα, αλλά όχι αξεπέραστο για τον Απόλλωνα. Η Ομόνοια παραπαίει και αν ο Απόλλωνας συνεχίσει σε νικηφόρο... τροχιά και αν ταυτόχρονα οι πράσινοι χάσουν κι άλλους πόντους, η ανατροπή για την προνομιούχα 4η θέση θα είναι απολύτως [...]The post Απόλλων: Μαθηματικά... τα πάντα ρει appeared first on Super Sport FM.",en,Apollo: Mathematics ... Everything Finds,"Seven matches in the league are left, with the difference from 4th place in nine points. An important disadvantage, but not unmatched for Apollo. Omonia is also a jerk and if Apollo continues in a victorious ... orbit and if the Greens lose more points at the same time, the overthrow for the privileged 4th place will be absolutely [...] The post Apollo: Mathematics ... Everything is appeared first on super sport fm.",2025-04-03 19:06:16
cy,ΠΕΡΙΜΕΝΕΙ ΔΩΡΟ,Περιμένει δώρο από τον Απόλλωνα η Ομόνοια αφού οι γαλάζιοι θα αντιμετωπίσουνε την ΑΕΚ που είναι μπροστά στην βαθμολογία από τους πράσινους. Ο Αναστασίου ξέρει καλά ασφαλώς πως πρώτα θα πρέπει να κερδίσει τον δικό του αγώνα με την Ομόνοια και μετά να περιμένει τι θα γίνει στην Λεμεσό.,en,WAITS GIFT,Apollo is waiting for Omonia as the Blue will face AEK in front of the Greens. Anastasiou knows well that he will first have to win his own fight with Omonia and then wait for what will happen in Limassol.,2025-04-03 19:03:29
cy,Αμερικανός τουρίστας συνελήφθη για απόπειρα επίσκεψης στην πιο απομονωμένη φυλή του κόσμου,"Η φυλή είναι γνωστή για την εχθρότητά της προς τους ξένους, έχει σκοτώσει στο παρελθόν ανθρώπους που πλησίασαν το νησί - Οι ινδικές Αρχές εξοργίστηκαν με τον τουρίστα",en,American tourist arrested for attempting to visit the world's most secluded race,"The race is known for its hostility to foreigners, has killed people who have approached the island in the past - Indian authorities have been outraged by tourist",2025-04-03 19:03:15
cy,"Παναθηναϊκός για... αστέρι, άλωσε το Μονακό με εξωγήινο Ναν και κλείδωσε τρίτη θέση!","Με τον Κέντρικ Ναν να κάνει ένα ακόμη αδιανόητο παιχνίδι, ο Παναθηναϊκός άλωσε το Μονακό με σκορ 88-76, κάλυψε τη διαφορά του πρώτου αγώνα και κλείδωσε (τουλάχιστον) την τρίτη θέση της βαθμολογίας!",en,"Panathinaikos for ... a star, lifted Monaco with alien nan and locked third!","With Center Nan making another unthinkable game, Panathinaikos fired Monaco with a score of 88-76, covered the difference of the first match and locked (at least) the third place in the standings!",2025-04-03 19:03:07
cy,(ΒΙΝΤΕΟ) Κωστή: «Είμαστε στον σωστό δρόμο για να ανέβουμε στην πρώτη κατηγορία»,Ο προπονητής του Ολυμπιακού παραχώρησε δηλώσεις στους εκπροσώπους των ΜΜΕ...,en,"(VIDEO) Kostis: ""We are on the right track to climb the first category""",The coach of Olympiacos gave statements to the media representatives ...,2025-04-03 19:02:50
cy,Ο Ουκρανός ΥΠΕΞ προτρέπει τα μέλη του ΝΑΤΟ να ασκήσουν μεγαλύτερη πίεση στη Ρωσία,CYPRUSTIMES,en,Ukrainian Foreign Minister urges NATO members to exert more pressure on Russia,Cyprustimes,2025-04-03 19:02:01
cy,Χριστοδουλίδης: Πιθανή διέυρυνση δραστηριοτήτων της Senvest στην Κύπρο,"Όπως αναφέρει σε ανάρτηση του στο Χ ο Κυβερνητικός Εκπρόσωπος Κωνσταντίνος Λετυμπιώτης, η παρουσία της Senvest στην Κύπρο με ευρύ χαρτοφυλάκιο δραστηριοτήτων και μακροχρόνια εμπειρία στις παγκόσμιες αγορές, αντικατοπτρίζει την εμπιστοσύνη της στην ανθεκτικότητα του κυπριακού τραπεζικού συστήματος.",en,Christodoulidis: Possible Senvest's Possible Drawing on Cyprus,"According to a post on X, government spokesman Konstantinos Letibiotis, Senvest's presence in Cyprus with a wide portfolio of activities and long -term experience in global markets, reflects its confidence in the durability of the Cypriot banking system.",2025-04-03 19:00:23
cy,Στηρίζει και αναμένει τα λόγια να γίνουν πράξη,Η διοίκηση προσπαθεί να δει την κατρακύλα χωρίς πανικό.,en,Supports and awaits words to become act,The administration is trying to see the slide without panic.,2025-04-03 19:00:09
cy,"Παναθηναϊκός για... αστέρι, άλωσε το Μονακό με εξωγήινο Ναν και κλείδωσε τρίτη θέση","Παναθηναϊκός για... αστέρι, άλωσε το Μονακό με εξωγήινο Ναν και κλείδωσε τρίτη θέση! Με τον Κέντρικ Ναν να κάνει ένα ακόμη αδιανόητο παιχνίδι, ο Παναθηναϊκός άλωσε το Μονακό με σκορ 88-76, κάλυψε τη διαφορά του πρώτου αγώνα και κλείδωσε (τουλάχιστον) την τρίτη θέση της βαθμολογίας! Το ματς Το παιχνίδι ξεκίνησε με καλάθι του Τάις από [...]",en,"Panathinaikos for ... star, lifted Monaco with alien nan and locked third place","Panathinaikos for ... a star, lifted Monaco with alien nan and locked third! With Center Nan making another unthinkable game, Panathinaikos fired Monaco with a score of 88-76, covered the difference of the first match and locked (at least) the third place in the standings! The match the game started with a basket of the Tasis from [...]",2025-04-03 18:57:14
cy,Κόμμα για τα ζώα Κύπρου: Έκκληση προς ΠτΔ για ευημερία των ζώων,"Σχετική ανακοίνωση αναφέρει ότι, παρόλες τις προσπάθειες όλων των Κυβερνήσεων, μέχρι σήμερα δεν κατάφεραν να αναχαιτίσουν την αύξηση των εγκαταλελειμμένων ζώων, κυρίως σκυλιά, γατιά, κουταβάκια και άλλα ζώα.",en,Party for Animals of Cyprus: Appeal to PD for Animal Welfare,"Announcement states that, despite all the efforts of all governments, to date have not been able to stop the increase in abandoned animals, mainly dogs, cats, puppies and other animals.",2025-04-03 18:53:26
cy,ΘΕΛΟΥΝ ΚΥΡΙΑΡΧΙΑ,H Πάφος μπορεί να κάνει μια εκπληκτική χρονιά αλλά αυτό που θέλουν οι Ρώσοι ιδιοκτήτες της ομάδας είναι να καταφέρει η ομάδα τους να πάρει τόσο το πρωτάθλημα αλλά και το Κύπελλο. Οι Λομάκιν και Ντουμπόφ έχουν βάλει στόχο να κάνουν την Πάφο την απολυτά κυρίαρχη ομάδα στην Κύπρο και η πολύ καλή φετινή παρουσία [...],en,They want dominance,Paphos can make a stunning year but what the Russian owners want is to get their team to get both the championship and the cup. Lomakin and Dubov have set the goal of making Paphos the absolute dominant team in Cyprus and the very good presence of this year [...],2025-04-03 20:29:13
cy,Τι σημαίνει για τον Παναθηναϊκό η νίκη στο Μονακό – Δείτε τη βαθμολογία,"Ο Παναθηναϊκός πήρε μεγάλο διπλό στο Μονακό και με τον τρόπο αυτόν, εξασφάλισε τόσο το πλεονέκτημα έδρας, όσο και μία θέση στην πρώτη τριάδα της βαθμολογίας της κανονικής διάρκειας της Euroleague. Οι «πράσινοι» έριξαν τέταρτους τους Μονεγάσκους έχοντας και την ισοβαθμία μαζί τους, καθώς κάλυψαν τη διαφορά με την οποία είχαν ηττηθεί στο ΟΑΚΑ. Είναι [...]",en,What does the victory in Monaco mean to Panathinaikos - see the rating,"Panathinaikos took a big double in Monaco and in this way, secured both the home advantage and a place in the first three of the Euroleague's regular score. The ""Greens"" threw the fourth Monegasus with their tie with them, as they covered the difference with which they had been defeated at the OAKA. It's [...]",2025-04-03 20:21:16
cy,Ένα σημαντικό όπλο στα χέρια του Καρσέδο που αλλάζει την τύχη ενός αγώνα,"Ο Πεπε είναι ο παίκτης που μπορεί στην Πάφο να γίνει το κλειδί για την ομάδα του Καρσέδο και είναι αναμφίβολα είναι ο άνθρωπος που μπορεί να αλλάξει ταχύτητα αλλά και να απειλήσει από μακριά. Ο Πορτογάλος είναι μαζί με τον Σουνιτς, άλλη η δουλειά του Βόσνιου στο γήπεδό, ίσως από τα καλύτερα δίδυμα μέσων [...]",en,An important weapon in the hands of Karsedo that changes the fate of a match,"PEPE is the player who can become the key to Karsedo's team in Paphos and is undoubtedly the man who can change speed and threaten from afar. The Portuguese is with Sunich, another Bosnios' work on the court, perhaps one of the best twins [...]",2025-04-03 20:08:37
cy,Στη φυλακή ο «παλαιοχριστιανός» για κατοχή όπλου και γενετήσιες πράξεις μεταξύ συγγενών,CYPRUSTIMES,en,"In prison the ""Early Christian"" for possession of guns and sexual acts between relatives",Cyprustimes,2025-04-03 20:02:01
cy,"Οι δασμοί είναι πρόβλημα αλλά δεν είναι καταστροφή, λέει η Τζόρτζια Μελόνι",CYPRUSTIMES,en,"Duties are a problem but not a disaster, says Georgia Melon",Cyprustimes,2025-04-03 20:02:01
cy,Από τους καλύτερους..,Είναι από τους καλύτερους αμυντικούς στο πρωτάθλημα και το δείχνει ο Βούρος. Ο Ελλαδίτης του Απόλλωνα πάντοτε σταθερός και με υψηλές πτήσεις.,en,One of the best ..,He is one of the best defenders in the league and Vouros shows it. Apollo's Greek always steady and high flights.,2025-04-03 20:00:54
cy,ΑΕΛ: Δεν επαναπαύεται...,Καλό είναι το κλίμα στην ΑΕΛ μετά τις δύο σερί νίκες στα δύο παιχνίδια των πλέι άουτ. Φυσικά κανείς δεν επαναπαύεται ακόμα από την στιγμή που ακόμα δεν έχει εξασφαλίσει πως δεν θα έχει το μυαλό της στο σενάριο του υποβιβασμού. Ο επικείμενος αγώνας με την Ένωση στο «Αλφαμέγα» (05/04) είναι εξαιρετικά σημαντικός για την [...]The post ΑΕΛ: Δεν επαναπαύεται... appeared first on Super Sport FM.,en,AEL: Not resting ...,The climate in AEL is good after two consecutive wins in the two playoffs. Of course no one is still resting since it has not yet ensured that it does not have its mind in the relegation scenario. The forthcoming match with the Union in Alphamega (05/04) is extremely important for [...] The post AEL: Not resting ... appeared first on Super Sport FM.,2025-04-03 19:59:09
cy,Ομόνοια: Η πρόκληση του Κακουλλή και ο ρόλος του Νεοφύτου,"Ο εκπρόσωπος Τύπου της Ομόνοιας, Ανδρέας Δημητρίου, παραχώρησε δηλώσεις στον Supersport 104 και στην εκπομπή «Καλημέρα στα ΣΠΟΡ» με τους Άλκη Μπότσο και Ανδρέα Πογιατζή για όλα τα θέματα που αφορούν την ομάδα των «πρασίνων». Ο Δημητρίου αναφέρθηκε και στο ζήτημα της μεταγραφής του Ανδρόνικου Κακουλλή που ολοκληρώθηκε από την Ομόνοια στην ΑΪΚ, ενώ εξέφρασε [...]The post Ομόνοια: Η πρόκληση του Κακουλλή και ο ρόλος του Νεοφύτου appeared first on Super Sport FM.",en,Omonia: The challenge of Kakoulis and the role of the neophyte,"Omonia's spokesman Andreas Dimitriou gave statements to SuperSport 104 and the ""Good Morning in Sports"" show with Alkis Botsos and Andrea Pogiatzis on all issues related to the Greens team. Dimitriou also referred to the issue of the transcription of Andronikos Kakoulis, which was completed by Omonia to Aik, while expressing [...] The post Omonia: The challenge of Kakoulis and the role of the neophyte appeared first on Super Sport FM.",2025-04-03 19:55:00
cy,Κατά δικαίων και αδίκων οι δασμοί Τραμπ – Aπό αμερικανικές στρατιωτικές βάσεις μέχρι... νησιά με πιγκουίνους!,CYPRUSTIMES,en,According to the righteous and the offenses Trump - from US military bases to ... islands with penguins!,Cyprustimes,2025-04-03 19:52:01
cy,Κάθειρξη 25 ετών σε Γαλλίδα βρεφονηπιοκόμο που σκότωσε κοριτσάκι 11 μηνών με αποφρακτικό υγρό,CYPRUSTIMES,en,25 year old in a French nursergower who killed 11 -month -old baby girl with obstructive liquid,Cyprustimes,2025-04-03 19:52:01
cy,Τα ζώδια σημέρα Παρασκευή 4 Απριλίου 2025,LADYTIMES,en,The zodiac signs today Friday April 4 2025,Ladytimes,2025-04-04 05:01:27
cy,Ανησυχία στην Άγκυρα για δασμούς Τραμπ - Οι τομείς που επηρεάζονται,"Με αυξημένη ανησυχία παρακολουθεί η Τουρκία τις εξελίξεις στο μέτωπο του διεθνούς εμπορίου, μετά την ανακοίνωση της κυβέρνησης Τραμπ για την επιβολή νέου δασμού 10% σε όλες τις εισαγωγές προς τις Ηνωμένες Πολιτείες. Η απόφαση, που τίθεται σε ισχύ στις 5 Απριλίου, εντάσσεται στο πλαίσιο των ευρύτερων εμπορικών αλλαγών που προωθεί ο πρώην Πρόεδρος των ΗΠΑ, με στόχο, όπως δηλώνει, την «επανεκκίνηση της αμερικανικής παραγωγής» και την «ισοσκελισμένη μεταχείριση στο παγκόσμιο εμπόριο».Ισοζυγισμένο εμπόριο, αλλά χωρίς εξαίρεσηΤο ετήσιο διμερές εμπόριο Τουρκίας–ΗΠΑ ανήλθε στα 32,58 δισεκατομμύρια δολάρια το 2024, σύμφωνα με την Τουρκική Στατιστική Υπηρεσία (TÜİK), με τις τουρκικές εξαγωγές να διαμορφώνονται στα $16,35 δισ. και τις εισαγωγές στα $16,23 δισ. Παρά την σχεδόν απόλυτη ισορροπία, η Τουρκία εντάσσεται στη λίστα των περισσότερων από 100 χωρών που επηρεάζονται από το νέο μέτρο.Οι κύριοι τομείς τουρκικών εξαγωγών προς τις ΗΠΑ περιλαμβάνουν αυτοκινητοβιομηχανία, οικιακές συσκευές, χάλυβα, κλωστοϋφαντουργία και μηχανήματα. Οι επιχειρήσεις και οι εξαγωγείς της χώρας εκφράζουν φόβους για μείωση της ανταγωνιστικότητας και αύξηση του κόστους, λόγω των νέων επιβαρύνσεων.Το βαρύ χτύπημα στην αυτοκινητοβιομηχανίαΗ κατάσταση επιδεινώνεται από την ταυτόχρονη επιβολή δασμού 25% σε όλα τα εισαγόμενα οχήματα και ανταλλακτικά, που τίθεται άμεσα σε εφαρμογή. Με εξαγωγές ύψους $1,2 δισ. το 2024 στον τομέα της αυτοκίνησης προς τις ΗΠΑ, η Τουρκία κινδυνεύει να δει σημαντική απώλεια μεριδίου αγοράς.Ο δασμός αφορά τόσο τα έτοιμα οχήματα όσο και τα εξαρτήματα – ακόμη και όσα συναρμολογούνται σε τρίτες χώρες, όπως ο Καναδάς και το Μεξικό. Σύμφωνα με αναλυτές, η αύξηση του κόστους ενδέχεται να μεταφραστεί σε ανατιμήσεις έως και $6.000 ανά όχημα για τον Αμερικανό καταναλωτή.Η κλωστοϋφαντουργία σε αναμονήΑνησυχίες εκφράζονται και στον κλάδο των υφασμάτων και ενδυμάτων, που γνώρισε άνοδο 14% στις εξαγωγές προς τις ΗΠΑ στις αρχές του 2025. Οι παραγωγοί φοβούνται ότι οι δασμοί θα μειώσουν τη ζήτηση και θα συρρικνώσουν τα περιθώρια κέρδους.Η Ένωση Τούρκων Εξαγωγέων ανέφερε ότι οι ΗΠΑ αποτελούν περίπου το 6% των συνολικών τουρκικών εξαγωγών — ένα ποσοστό που θεωρείται μεν σημαντικό, όχι όμως κυρίαρχο.Διαβάστε επίσης: «Μετασεισμοί» στις αγορές από δασμούς Τραμπ – Βουτιά σε διεθνή χρηματιστήριαΣύμφωνα με τουρκικά μέσα ενημέρωσης, οι αρμόδιοι υπουργοί Εμπορίου και Οικονομικών επιδιώκουν να εξασφαλίσουν εξαίρεση, τονίζοντας ότι η Άγκυρα δεν επιβάλλει παρόμοιους δασμούς σε αμερικανικά προϊόντα.Η τουρκική λίρα παρέμεινε σχετικά σταθερή μετά την ανακοίνωση, ωστόσο αναλυτές προειδοποιούν ότι παρατεταμένη αβεβαιότητα στο εμπόριο θα μπορούσε να αυξήσει την πίεση στο νόμισμα και να επηρεάσει την επενδυτική εμπιστοσύνη.«Δασμοί... επί δικαίων και αδίκων»Αξίζει να σημειωθεί ότι η Τουρκία, με ισοζυγισμένο εμπορικό ισοζύγιο και σχετικά χαμηλούς δασμούς έναντι των ΗΠΑ, εντάσσεται στην ίδια δασμολογική πολιτική με χώρες όπως η Κίνα (54%) και η ΕΕ (20%). Όπως επισημαίνουν αναλυτές, το σύστημα των «αντιστρόφων δασμών» του Τραμπ βασίζεται όχι σε πραγματικά ποσοστά, αλλά στο εμπορικό έλλειμμα με κάθε χώρα.Πλέον, η τουρκική επιχειρηματική κοινότητα καλείται να προσαρμοστεί άμεσα στα νέα δεδομένα και να επαναπροσδιορίσει τη στρατηγική της στις αγορές του εξωτερικού, καθώς οι δασμοί καθιστούν πολλές εξαγωγές λιγότερο συμφέρουσες και περισσότερο επισφαλείς.",en,Anxiety in Ankara for Trump duties - areas affected,"Turkey is following an increased concern about developments on the front of international trade, following the announcement by the Trump government to impose a new 10% duty on all imports to the United States. The decision, in force on April 5, is part of the broader commercial changes promoted by the former US president, with the aim, as he states, the ""restart of American production"" and ""balanced treatment in world trade"". 2024, according to the Turkish Statistical Service (TüİK), with Turkish exports amounting to $ 16.35 billion and imports of $ 16.23 billion despite the almost absolute balance, Turkey is on the list of more than 100 countries affected by the new measure. Steel, textile and machinery. Businesses and exporters of the country express fears of reducing competitiveness and increasing costs due to new charges. The heavy blow to the automotive situation is exacerbated by the simultaneous imposition of a 25% duty on all imported vehicles and spare parts. With $ 1.2 billion exports in 2024 in the US, Turkey is in danger of seeing a significant market share loss. The duty is for both ready -made vehicles and components - even those assembled in third countries, such as Canada and Mexico. According to analysts, the cost increase may be translated into rates of up to $ 6,000 per vehicle for the American consumer. The textile industry is also expressed in the fabrics and clothing industry, which has increased 14% to exports to the US in early 2025. Union of Turkish exporters said that the US is about 6% of total Turkish exports - a percentage that is considered important, but not dominant.",2025-04-04 05:01:13
cy,Ευκαιρίες επένδυσης και ιδιοκατοίκησης από την AstroBank,"Το χαρτοφυλάκιο της Τράπεζας περιλαμβάνει επίσης μεγάλη γκάμα ακινήτων όπως βιομηχανικά, αγροτικά, εμπορικά και οικιστικά τεμάχια γης και κατοικίες σε αστικές και αγροτικές περιοχές, παρέχοντας εύρος επιλογής για τους ενδιαφερόμενους αγοραστές ώστε να βρουν εκείνο που ανταποκρίνεται καλύτερα στις ανάγκες τους.",en,Investment and Ownership Opportunities by Astrobank,"The bank's portfolio also includes a wide range of real estate such as industrial, agricultural, commercial and residential land and residences in urban and rural areas, providing a range of selection for interested buyers to find the one that best responds to their needs.",2025-04-04 05:00:00
