iso_code,title,description,lang_tranlation,title_translated,description_translated,pubDate
pt,Turco Akgun visto como o novo Di María,Atacante tem estado em plano de destaque e pode ser alternativa ao argentino na próxima temporada.,en,Turkish akgun seen as the new di maría,Striker has been in a prominent plan and may be an alternative to the Argentine next season.,2025-04-16 00:30:00
pt,"Trump volta a acusar Zelensky de ""começar"" a guerra","Putin e Biden também são culpados, disse o presidente dos EUA.",en,"Trump again accuses Zelensky of ""starting"" the war","Putin and Biden are also guilty, the US president said.",2025-04-16 00:30:00
pt,Ministério do Ambiente está a avaliar controlo dos REEE,"O Ministério do Ambiente e Energia informa, em comunicado, que foi concluída pela Inspeção-Geral da Agricultura, do Mar, do Ambiente e do Ordenamento do Território (IGAMAOT) uma auditoria ao fluxo específico dos Resíduos de Equipamentos Elétricos e Eletrónicos (REEE).",en,Ministry of Environment is evaluating Ree control,"The Ministry of Environment and Energy informs, in a statement, which was completed by the General Inspection of Agriculture, Sea, Environment and Spatial Planning (Igamaot) an audit to the specific flow of electrical and electronic equipment waste (REEE).",2025-04-16 21:47:46
pt,"No debate dos suplentes, Joana Mortágua foi melhor que Nuno Melo: as notas dos comentadores do Expresso","Nuno Melo e Joana Mortágua foram os protagonistas de um bom debate em que todos os comentadores deram positiva a ambos, mas com vantagem para a escolha do Bloco para suplente da coordenadora do partido",en,"In the debate of the alternates, Joana Mortágua was better than Nuno Melo: the notes of the commentators of Expresso","Nuno Melo and Joana Mortágua were the protagonists of a good debate in which all the commentators gave both positive, but with the advantage of choosing the bloc to party coordinator alternate",2025-04-16 21:47:18
pt,Descoberto planeta com órbita perpendicular à das suas duas “estrelas”,O astrofísico português Alexandre Correia realça que a descoberta põe em causa muitas das teorias de formação planetária.,en,"Discovered planet with orbit perpendicular to that of its two ""stars""",Portuguese astrophysicist Alexandre Correia emphasizes that the discovery calls into question many of the theories of planetary formation.,2025-04-16 21:47:17
pt,Vamos ter novo campeão da Europa: Arsenal elimina Real Madrid,Exibição dominante a nível defensivo terminou com vitória por 2-1 no Bernabéu e o passaporte para as meias-finais da UEFA Champions League,en,Let's have a new European champion: Arsenal Eliminates Real Madrid,Dominant display at the defensive level ended with 2-1 win at Bernabéu and the passport to the UEFA Champions League semi-finals,2025-04-16 21:46:48
pt,Fogo na cabine força aterragem de avião no Porto,"Para o local foram acionados os bombeiros de Gondomar, Leça do Balio, São Mamede e Infesta, Moreira da Maia, Portuenses, Vila do Conde, Paredes, Ermesinde, Matosinhos-Leça, Pedrouços e Leixões.",en,Fire in the Cabin Force Plane Landing in Porto,"To the scene were fired the firefighters of Gondomar, Leça do Balio, São Mamede and Infesta, Moreira da Maia, Portuenses, Vila do Conde, Paredes, Ermesinde, Matosinhos-Leça, Pedrouços and Leixões.",2025-04-16 21:46:39
pt,Inter segura vantagem e acaba com o sonho do Bayern jogar nova final em casa,"Triunfo italiano em Munique prova-se decisivo. Dupla inglesa Kane e Dier marcaram, mas o Inter confirma a passagem.",en,Inter holds advantage and ends Bayern's dream to play a new final at home,"Italian triumph in Munich proves decisive. English duo Kane and Dier scored, but Inter confirms the passage.",2025-04-16 21:45:27
pt,Tribunal de Contas aponta falhas no controlo do fisco ao regime fiscal dos fundos imobiliários,Relatório revela falhas no controlo efetuado pela Autoridade Tributária e Aduaneira ao regime fiscal de que beneficiam os fundos de investimento imobiliário.,en,Court of Auditors points failures in the control of the tax authorities to the tax regime of real estate funds,Report reveals failures in the control made by the Tax and Customs Authority to the tax regime that benefit the real estate investment funds.,2025-04-16 21:45:26
pt,Série dirigida por cineasta indígena de MS será lançada em plataforma de streaming gratuito,"Futuro da Terra tem direção de Alberto Alvares, nascido na aldeia Porto LindoOriginalmente publicado em Série dirigida por cineasta indígena de MS será lançada em plataforma de streaming gratuito, Conteúdo original de Jornal Midiamax | Notícias de Campo Grande e Mato Grosso do Sul.",en,Series directed by MS indigenous filmmaker will be released on a free streaming platform,"Future of the Earth is directed by Alberto Alvares, born in the village Porto Lindooriginally published in series directed by MS indigenous filmmaker will be released on a free streaming platform, original content from Midiamax newspaper | News from Campo Grande and Mato Grosso do Sul.",2025-04-16 21:45:13
pt,Avião aterra de emergência no Porto devido a fogo na cabine,"Um avião Airbus A320 teve uma emergência abordo devido a fogo na cabine e aterrou no Aeroporto Francisco Sá Carneiro, com duas pessoas a terem que ser assistidas devido a inalação de fumo.",en,Emergency Landing aircraft in Porto due to fire in the cabin,"An Airbus A320 plane had an emergency approached due to fire in the cabin and landed at Francisco Sá Carneiro airport, with two people having to be assisted due to inhalation of smoke.",2025-04-16 21:43:01
pt,Nuno Melo diz que fim da PPP em Braga foi “quase criminoso”,Debate com Joana MortáguaO conteúdo Nuno Melo diz que fim da PPP em Braga foi “quase criminoso” aparece primeiro em O MINHO.,en,Nuno Melo says that PPP end in Braga was “almost criminal”,Debate with Joana Mortáguao Content Nuno Melo says that PPP end in Braga was “almost criminal” first appears in Minho.,2025-04-16 21:42:29
pt,"Páscoa: chocolate artesanal tem mais procura, mas aumento dos preços retrai consumo","Há mais apreciadores de chocolate artesanal e também há mais oferta, mas os tempos não são bons para a bolsa dos gulosos. Os chocolateiros artesanais trabalham com cacau de diferentes origens e todo o processo passa por detalhes, que diferenciam o chocolate artesanal das ofertas mais comerciais.",en,"Easter: handmade chocolate has more demand, but increased prices retract consumption","There are more craft chocolate lovers and there is also more offer, but the times are not good for the scholarship of the greedy. Craft chocolates work with cocoa from different origins and the whole process goes through details, which differentiate the artisanal chocolate from the most commercial offers.",2025-04-16 22:35:42
pt,El Salvador impede senador dos EUA de visitar homem deportado por “erro administrativo”,"Vice-presidente de El Salvador afirmou que não poderia autorizar visita ou qualquer tipo de contacto com Abrego Garcia, já que “os Estados Unidos estão a pagar para o manter encarcerado”.",en,El Salvador prevents US senator from visiting man deported for “administrative error”,,2025-04-16 22:34:50
pt,"Com perna quebrada e buracos no corpo, cadelinha Vitória conta com doação para tratamento","A expectativa é arrecadar cerca de R$ 3 milOriginalmente publicado em Com perna quebrada e buracos no corpo, cadelinha Vitória conta com doação para tratamento, Conteúdo original de Jornal Midiamax | Notícias de Campo Grande e Mato Grosso do Sul.",en,"With broken leg and holes in the body, dog Vitória has donation for treatment","The expectation is to raise about R $ 3 myriginally published in broken leg and holes in the body, dog Vitória has donation for treatment, original content of newspaper Midiamax | News from Campo Grande and Mato Grosso do Sul.",2025-04-16 22:34:32
pt,Beira-Mar: Bernardo Lourenço faz balanço da época e aguarda definição do futuro,"Bernardo Lourenço foi um dos jogadores determinantes na recuperação que o Beira-Mar encetou na ponta final do Campeonato de Portugal, invertendo um rumo negativo que teve como corolário a manutenção. A NotíciasdeAveiro.pt , o jogador conta como foi a fase crucial da época, com golos decisivos que, certamente, também despertaram olhares mais atentos para o [...]O conteúdo Beira-Mar: Bernardo Lourenço faz balanço da época e aguarda definição do futuro aparece primeiro em Notícias de Aveiro.",en,Beira-Mar: Bernardo Lourenço takes stock of the time and awaits definition of the future,"Bernardo Lourenço was one of the determining players in the recovery that Beira-Mar stained at the end of the Portugal Championship, reversing a negative course that had the corollary of maintenance. The newsdeaveiro.pt, the player tells how was the crucial phase of the time, with decisive goals that certainly also aroused close eyes to [...] the content Beira-Mar: Bernardo Lourenço takes stock of the time and awaits definition of the future appears first in Aveiro news.",2025-04-16 22:33:49
pt,Ministra da Saúde entrega medicamentos e consumíveis a São Tomé,"A ministra da Saúde de Portugal entregou hoje a São Tomé um lote de medicamentos, reagentes, consumíveis hospitalares e acessórios para aparelho de Raio X avaliados em quase 305 mil euros, no âmbito do projeto Saúde Para Todos.",en,Minister of Health Delivery Medicines and Consumables to São Tomé,"The Minister of Health of Portugal gave today to São Tomé a lot of medicines, reagents, hospital consumables and accessories for X -ray device evaluated in almost 305 thousand euros, under the Health for All project.",2025-04-16 22:33:35
pt,"Pedro Nuno 'arranca' debate: Chega quer ""explicações"", CDU ""investigação""","O presidente do Chega comparou hoje a situação do líder do PS, alvo de averiguação prévia pelo Ministério Público sobre a compra de casas, à do primeiro-ministro, enquanto o secretário-geral do PCP defendeu uma investigação rápida.",en,"Pedro Nuno 'Discuss' Debate: Arrives Want ""Explanations"", CDU ""Investigation""","The president of the arrival today compared the situation of the leader of the PS, the target of prior investigation by the prosecutor about the purchase of houses, to the prime minister, while the secretary general of the PCP defended a rapid investigation.",2025-04-16 22:33:34
pt,"Macron vai lançar projeto de memória sobre ""a injustiça imposta ao Haiti""","O Presidente francês, Emmanuel Macron, deverá lançar um projeto na quinta-feira para reconhecer a ""injustiça inicial"" imposta ao Haiti, que teve de pagar uma indemnização exigida pela França em troca da sua independência.",en,"Macron will launch memory project on ""The injustice imposed on Haiti""","French President Emmanuel Macron is expected to launch a project on Thursday to recognize the ""initial injustice"" imposed on Haiti, who had to pay compensation required by France in exchange for his independence.",2025-04-16 22:33:34
pt,Sai do Real Madrid no final da época? A resposta inflamada de Ancelotti,Merengues foram eliminados da Liga dos Campeões pelo Arsenal.,en,Get out of Real Madrid at the end of the season? Ancelotti's inflamed response,Meringues were eliminated from the Arsenal Champions League.,2025-04-16 22:33:34
pt,"Ex-Real Madrid nunca foi convidado para festas de Ronaldo: ""Não era...""",Avançado espanhol recordou passagem pelo Real Madrid.,en,"Former Real Madrid was never invited to Ronaldo's parties: ""It wasn't ...""",Spanish striker recalled a pass through Real Madrid.,2025-04-16 22:33:34
pt,"Antes de ir dormir, beba um copo deste 'smoothie' de coco e banana",Veja como é simples.,en,"Before you go to sleep, drink a glass of this 'smoothie' and banana",See how simple it is.,2025-04-16 22:33:32
pt,3h. Sondagem. AD à frente do PS com 33% das intenções de voto,"Se as eleições fossem esta sexta-feira, a AD voltaria a vencer (33%) e desta vez com uma margem superior à registada no ano passado. PS regista 29% e Chega 21% das intenções de voto.",en,3h. Poll. AD Ahead of PS with 33% of voting intentions,"If the elections were this Friday, AD would win again (33%) and this time with a higher margin than last year. PS registers 29% and comes 21% of voting intentions.",2025-04-18 02:13:19
pt,Quatro mortos e um ferido grave em desastre com teleférico em Nápoles,"Quatro pessoas morreram ontem e uma ficou gravemente ferida depois de um teleférico ter colapsado em Nápoles, no sul de Itália, devido a um cabo partido, adiantaram as autoridades italianas.As cinco pessoas envolvidas no incidente são quatro turistas e um funcionário da empresa que gere a infraestrutura, a Ente Autonomo Volturno (EAV), destacam as fontes de segurança à agência Efe.Um deles ficou gravemente ferido --- o maquinista, de acordo com meios de comunicação social locais --- e foi imed",en,Four dead and a severe disaster wounded with cable car in Naples,"Four people died yesterday and one was seriously injured after a cable car collapsed in Naples, southern Italy, due to a broken cable, the Italian authorities advanced. Five people involved in the incident are four tourists and an employee who manages the infrastructure, the entity's Volturno (EAV), highlight the sources of safety to the EFE agency. with local media --- and was imped",2025-04-18 02:09:00
pt,ONU alerta para aumento de racismo e violência contra imigrantes na Líbia,"A representante especial da ONU para a Líbia alertou hoje para o aumento do discurso de ódio ""xenófobo e racista"" no país, que incita à violência contra imigrantes, requerentes de asilo, refugiados e organizações humanitárias. Numa reunião do Conselho de Segurança da ONU focada na situação na Líbia, Hanna Tetteh - que desde o início do ano chefia também a missão de apoio da ONU no país (Unsmil) - denunciou que uma das ""consequências trágicas"" das instituições divididas da Líbia ""é o vazio em q",en,UN warns of increasing racism and violence against immigrants in Libya,"The UN special representative to Libya warned today to the increase in ""xenophobic and racist"" hatred discourse in the country, which incites violence against immigrants, asylum applicants, refugees and humanitarian organizations. At a UN Security Council meeting focused on the situation in Libya, Hanna Tetteh - which since the beginning of the year has also headed the UN support mission in the country (Unsmil) - denounced that one of the ""tragic consequences"" of Libyan divided institutions ""is the void in Q",2025-04-18 01:43:00
pt,CRB vence Volta Redonda e é o único clube com 100% de aproveitamento na Série B,"CRB venceu o Volta Redonda no estádio Rei PeléOriginalmente publicado em CRB vence Volta Redonda e é o único clube com 100% de aproveitamento na Série B, Conteúdo original de Jornal Midiamax | Notícias de Campo Grande e Mato Grosso do Sul.",en,CRB wins Volta Redonda and is the only club with 100% success in Serie B,"CRB won Volta Redonda at Rei Peléoriginally published CRB Stadium wins Volta Redonda and is the only 100% use in Serie B, Original Midiamax newspaper content | News from Campo Grande and Mato Grosso do Sul.",2025-04-18 01:34:04
pt,"Morto em confronto no Jardim Monumento carregava sacola com crack e portava arma, afirma GCM","Caso aconteceu no Jardim Monumento, nesta quintaOriginalmente publicado em Morto em confronto no Jardim Monumento carregava sacola com crack e portava arma, afirma GCM, Conteúdo original de Jornal Midiamax | Notícias de Campo Grande e Mato Grosso do Sul.",en,"Dead in a confrontation in Jardim Monument carried bag with crack and carried gun, says GCM","If it happened in Jardim Monumento, this Thursday published in a dead in confrontation in Jardim Monument was carrying bag with crack and carried gun, says GCM, original content of newspaper Midiamax | News from Campo Grande and Mato Grosso do Sul.",2025-04-18 01:28:14
pt,"Bolsa de Tóquio abre com subida muito ligeira de 0,02%","A bolsa de Tóquio abriu hoje em subida muito ligeira, com o principal índice, o Nikkei, a ganhar 0,02% para os 34.385, 05 pontos, logo na abertura, às 09h01 locais (01h01 em Lisboa).",en,Tokyo bag opens with very light climb of 0.02%,"The Tokyo Exchange opened today very lightly climbing, with the main index, Nikkei, gaining 0.02% to 34,385, 05 points, at the opening at 09h01 local (01h01 in Lisbon).",2025-04-18 01:06:19
pt,O poder da desinformação,"No nosso dia-a-dia, deparamo-nos com várias situações de desinformação que nos fazem pensar que não será fácil livrarmo-nos tão cedo desse flagelo que nos atormenta diariamente e que parece estar cada vez mais poderoso.Reportando-nos apenas a acontecimentos recentes, constatamos que os conteúdos desinformativos circulam com diferentes propósitos como influenciar o mercado ou gerar cliques, tráfego ou receitas publicitárias.Conteúdo ReservadoOs anúncios feitos pelo Presidente dos EUA sobre as",en,The power of misinformation,"In our daily lives, we are faced with various disinformation situations that make us think that it will not be easy to deliver ourselves so early from this scourge that plagues us daily and that seems to be increasingly powerful. Reviewing only recent events, we find that the misinformation content circulates with different purposes such as influencing the market or generating clicks, traffic or advertising revenues. ads made by the US president about",2025-04-18 01:00:00
pt,“E viva o velho!”,"A sorte e o azar são uma única e uma mesma coisa! Tal qual uma moeda! Que tem duas faces, opostas e sempre diferentes! E quer a sorte quer o azar, podem-se encontrar, um ou outro, como também se podem evitar, de acordo com as circunstâncias, e será melhor evitar o azar!Conteúdo ReservadoUsando um exemplo banalíssimo mas muito lógico para evitar o azar, poderá ser o uso de calçado ortopédico com sola de borracha, de tal modo que não escorregue durante a marcha ou a corrida. Para além do confort",en,"""And live the old man!""","Luck and bad luck are one and one thing! Like a coin! That has two faces, opposite and always different! And whether lucky or unlucky, one or the other can be found, as can be avoided, according to the circumstances, and it will be better to avoid unlucky content by reserving a very banal but very logical example to avoid unlucky, it can be the use of orthopedic shoe with rubber soles so that it does not slip while marching or running. Beyond Confort",2025-04-18 01:00:00
pt,Cruzeiro supera Inter para assumir vice-liderança do BR feminino,"A vitória do Cruzeiro começou a ser construída ainda no primeiro tempoOriginalmente publicado em Cruzeiro supera Inter para assumir vice-liderança do BR feminino, Conteúdo original de Jornal Midiamax | Notícias de Campo Grande e Mato Grosso do Sul.",en,Cruzeiro surpasses Inter to assume vice-leadership of BR Female,"Cruzeiro's victory began to be built in the first time tooriginally published in Cruzeiro surpasses Inter to assume vice-leadership of the female BR, original content of Midiamax newspaper | News from Campo Grande and Mato Grosso do Sul.",2025-04-18 00:52:33
pt,Jovem fica em estado grave ao ser esfaqueado durante briga por dívida,"Discussão por causa de uma dívida de R$ 50Originalmente publicado em Jovem fica em estado grave ao ser esfaqueado durante briga por dívida, Conteúdo original de Jornal Midiamax | Notícias de Campo Grande e Mato Grosso do Sul.",en,Young man is in serious condition when being stabbed during a fight for debt,"Discussion because of a debt of R $ 50originally published in a young man is in serious condition when being stabbed during a fight for debt, original content of newspaper Midiamax | News from Campo Grande and Mato Grosso do Sul.",2025-04-18 00:48:24
pt,"Sporting-Moreirense, 3-1 Rui Borges: «Deixámos o Moreirense acreditar um bocadinho»",Treinador do Sporting não quis destacar o hat trick de Gyokeres,en,"Sporting-Moreirense, 3-1 Rui Borges: ""We let the Moreirense believe a little.""",Sporting coach declined to highlight the Gyokeres Hat Trick,2025-04-18 21:52:31
pt,Operação Pactum. Diretor do Banco de Portugal é arguido e MEO também foi visada pelas buscas,"Carlos Moura, antigo quadro da Portugal Telecom e atual diretor do Departamento de Sistemas e Tecnologias de Informação do organismo, é um dos 43 arguidos da investigação da PJ e do DCIAP.",en,Operation Pactum. Director of Banco de Portugal is defendant and Meo was also aimed at the searches,"Carlos Moura, former board of Portugal Telecom and current director of the body's Department of Information Systems and Technologies, is one of 43 defendants of the PJ and DCIAP investigation.",2025-04-18 21:52:01
pt,'Hat-trick' de Gyökeres garante vitória do Sporting sobre o Moreirense,"O sueco Viktor Gyökeres marcou hoje os três golos do Sporting na vitória sobre o Moreirense, por 3-1, que permitiu aos 'leões' isolarem-se, à condição, na liderança da I Liga portuguesa de futebol, em jogo da 30.a jornada.No Estádio José Alvalade, o avançado marcou aos 12, 25 e 52 minutos, e reforçou ainda mais a liderança dos goleadores da prova, com 34 golos, além de ter chegado aos 90 tentos em 96 partidas oficiais pelos 'leões', antes de Cédric Teguia reduzir para os minhotos, aos 56.Após",en,Gyökeres 'hat-trick' guarantees Sporting's victory over Moreirense,"The Swedish Viktor Gyökeres today scored Sporting's three goals in the 3-1 victory over Moreirense, which allowed the 'lions' to isolate themselves to the condition of the 1st Portuguese Football League, in the match of the 30th. In Jose Alvalade Stadium, the striker scored at 12, 25 and 52 minutes, and further reinforced the leaders' leaders with 34 Goals, in addition to reaching the 90 goals in 96 official matches for the 'lions', before Cédric Teguia reduced to the worms at 56.Afós",2025-04-18 21:49:51
pt,"Gyokeres responde ao interesse do Arsenal: ""Gosto de Lisboa""",Avançado marcou três golos na vitória sobre o Moreirense.,en,"Gyokeres responds to Arsenal's interest: ""I like Lisbon""",Advanced scored three goals in the victory over Moreirense.,2025-04-18 21:49:30
pt,"Ivo Rodrigues: ""A resposta já veio tarde e não conseguimos reagir""","Jogador do Moreirense analisou, aos microfones da Sport TV, a derrota desta sexta-feira frente ao Sporting (3-1), no Estádio de Alvalade.",en,"Ivo Rodrigues: ""The answer has already come late and we could not react""","Player of Moreirense analyzed, to the microphones of Sport TV, the defeat on Friday against Sporting (3-1), at Alvalade Stadium.",2025-04-18 21:49:29
pt,GNR surpreende idosos isolados do Alto Minho com cabazes de Páscoa,"""A solidariedade nunca é demais""O conteúdo GNR surpreende idosos isolados do Alto Minho com cabazes de Páscoa aparece primeiro em O MINHO.",en,GNR surprises elderly isolated from Alto Minho with Easter Kabies,"""Solidarity is never too much"" GNR content surprises elderly isolated from Alto Minho with Easter Cabazes first appears in Minho.",2025-04-18 21:49:15
pt,"Sporting-Moreirense, 3-1 «É muita gente, é muito apoio, Sporting é grande equipa»","Ivo Rodrigues, jogador do Moreirense, lembra diferença de qualidade entre as duas equipas",en,"Sporting-Moreirense, 3-1 «It's a lot of people, it's a lot of support, Sporting is a great team»","Ivo Rodrigues, player from Moreirense, remembers quality difference between the two teams",2025-04-18 21:48:22
pt,"Com desabrigados e rastro de destruição pela chuva, Jardim pode declarar estado de emergência","Há pessoas desabrigadas pela água que invadiu as casas, além de quedas de árvores e queda de energiaOriginalmente publicado em Com desabrigados e rastro de destruição pela chuva, Jardim pode declarar estado de emergência, Conteúdo original de Jornal Midiamax | Notícias de Campo Grande e Mato Grosso do Sul.",en,"With homeless and trail of rain destruction, garden can declare state of emergency","There are people homeless by the water that has invaded the houses, as well as tree falls and a drop in theoriginally published in homeless and trail of rain destruction, garden can declare state of emergency, original content of newspaper Midiamax | News from Campo Grande and Mato Grosso do Sul.",2025-04-18 21:47:12
pt,"Associação Transparência Internacional manifesta ""profundo pesar"" pela morte de João Cravinho","Associação considerou o antigo ministro socialista ""uma das vozes pioneiras na defesa de uma cultura política baseada na transparência"".",en,"International Transparency Association manifests ""deep grief"" for the death of João Cravinho","Association considered the former socialist minister ""one of the pioneering voices in defending a political culture based on transparency"".",2025-04-18 21:46:53
pt,Ivo Rodrigues: «Jogo contra o Sporting? O nosso campeonato é outro»,Jogador do Moreirense lamentou a forma como os cónegos entraram em campo e apontou já para o próximo desafio,en,Ivo Rodrigues: «Game against Sporting? Our championship is another »,Moreirense player lamented the way the canons entered the field and already pointed to the next challenge,2025-04-18 21:46:42
