iso_code,title,description,lang_tranlation,title_translated,description_translated,pubDate
gb,Ireland's privacy regulator is investigating X's use of public data to train Grok,"Ireland's data privacy regulator is investigating Elon Musk's X. The country's Data Protection Commission (DPC) said on Friday (via Reuters) that it's opening an inquiry into the social platform's use of European users' public posts to train its Grok AI chatbot. In this case, Ireland handles EU regulation enforcement because X's European headquarters are in Dublin.The DPC said it will probe ""the processing of personal data comprised in publicly-accessible posts posted on the 'X' social media platform by EU/EEA users."" Under Europe's General Data Protection Regulation (GDPR) rules, Ireland has the legal muscle to fine X up to four percent of its global revenue.""The purpose of this inquiry is to determine whether this personal data was lawfully processed in order to train the Grok LLMs,"" Ireland's DPC said.If this sounds familiar, the DPC took X to court in 2024, seeking an order to stop it from training Grok on EU user data without consent. That followed a platform policy change in July that let the social site use public posts to train its AI chatbot. However, Ireland's data regulator ended the legal proceedings weeks later, saying the company had agreed to permanently limit its use of EU users' personal data in Grok. The DPC hasn't specified why it now believes the company may be violating GDPR rules.The DPC's last fine against the company (then known as Twitter) was a €450,000 penalty in 2020 for failing to notify the regulator about a data breach within the 72-hour window.This article originally appeared on Engadget at https://www.engadget.com/big-tech/irelands-privacy-regulator-is-investigating-xs-use-of-public-data-to-train-grok-182010855.html?src=rss",en,Ireland's privacy regulator is investigating X's use of public data to train Grok,"Ireland's data privacy regulator is investigating Elon Musk's X. The country's Data Protection Commission (DPC) said on Friday (via Reuters) that it's opening an inquiry into the social platform's use of European users' public posts to train its Grok AI chatbot. In this case, Ireland handles EU regulation enforcement because X's European headquarters are in Dublin.The DPC said it will probe ""the processing of personal data comprised in publicly-accessible posts posted on the 'X' social media platform by EU/EEA users."" Under Europe's General Data Protection Regulation (GDPR) rules, Ireland has the legal muscle to fine X up to four percent of its global revenue.""The purpose of this inquiry is to determine whether this personal data was lawfully processed in order to train the Grok LLMs,"" Ireland's DPC said.If this sounds familiar, the DPC took X to court in 2024, seeking an order to stop it from training Grok on EU user data without consent. That followed a platform policy change in July that let the social site use public posts to train its AI chatbot. However, Ireland's data regulator ended the legal proceedings weeks later, saying the company had agreed to permanently limit its use of EU users' personal data in Grok. The DPC hasn't specified why it now believes the company may be violating GDPR rules.The DPC's last fine against the company (then known as Twitter) was a €450,000 penalty in 2020 for failing to notify the regulator about a data breach within the 72-hour window.This article originally appeared on Engadget at https://www.engadget.com/big-tech/irelands-privacy-regulator-is-investigating-xs-use-of-public-data-to-train-grok-182010855.html?src=rss",2025-04-11 18:20:10
gb,Rageh Omaar goes on first foreign assignment for ITV News since on-air illness,Rageh Omaar has gone on his first foreign assignment for ITV News since he appeared to be taken ill on-air a year ago.,en,Rageh Omaar goes on first foreign assignment for ITV News since on-air illness,Rageh Omaar has gone on his first foreign assignment for ITV News since he appeared to be taken ill on-air a year ago.,2025-04-11 18:20:08
gb,ITV News presenter Rageh Omaar to feature in bulletin for first time in a year,Rageh Omaar will feature in an ITV News broadcast bulletin for the first time since he appeared to be taken ill on-air a year ago.,en,ITV News presenter Rageh Omaar to feature in bulletin for first time in a year,Rageh Omaar will feature in an ITV News broadcast bulletin for the first time since he appeared to be taken ill on-air a year ago.,2025-04-11 18:20:07
gb,Rory McIlroy takes two-shot lead into final round of Masters,"McIlroy fired two eagles and four birdies in a thrilling 66 to lead Bryson DeChambeau, who beat him to win the US Open last year.",en,Rory McIlroy takes two-shot lead into final round of Masters,"McIlroy fired two eagles and four birdies in a thrilling 66 to lead Bryson DeChambeau, who beat him to win the US Open last year.",2025-04-12 23:21:38
gb,Rory McIlroy takes two-shot lead into final round of Masters,"McIlroy fired two eagles and four birdies in a thrilling 66 to lead Bryson DeChambeau, who beat him to win the US Open last year.",en,Rory McIlroy takes two-shot lead into final round of Masters,"McIlroy fired two eagles and four birdies in a thrilling 66 to lead Bryson DeChambeau, who beat him to win the US Open last year.",2025-04-12 23:21:38
gb,Rory McIlroy takes two-shot lead into final round of Masters,"McIlroy fired two eagles and four birdies in a thrilling 66 to lead Bryson DeChambeau, who beat him to win the US Open last year.",en,Rory McIlroy takes two-shot lead into final round of Masters,"McIlroy fired two eagles and four birdies in a thrilling 66 to lead Bryson DeChambeau, who beat him to win the US Open last year.",2025-04-12 23:21:38
gb,Rory McIlroy takes two-shot lead into final round of Masters,"Rory McIlroy will take a two-shot lead into the final day of the 89th Masters following a sensational third round at Augusta National. McIlroy, who needs to win a coveted green jacket to complete the career grand slam, fired two eagles and four birdies in a thrilling 66 to reach 12 under par, the same [...]The post Rory McIlroy takes two-shot lead into final round of Masters appeared first on Jersey Evening Post.",en,Rory McIlroy takes two-shot lead into final round of Masters,"Rory McIlroy will take a two-shot lead into the final day of the 89th Masters following a sensational third round at Augusta National. McIlroy, who needs to win a coveted green jacket to complete the career grand slam, fired two eagles and four birdies in a thrilling 66 to reach 12 under par, the same [...]The post Rory McIlroy takes two-shot lead into final round of Masters appeared first on Jersey Evening Post.",2025-04-12 23:21:38
gb,The Breakfast Club cast reunite after 40 years and share memories from filming,The Breakfast Club was released in 1985 and went on to become a cult classic about five high school students from different social groups who spend a Saturday in detention together,en,The Breakfast Club cast reunite after 40 years and share memories from filming,The Breakfast Club was released in 1985 and went on to become a cult classic about five high school students from different social groups who spend a Saturday in detention together,2025-04-12 23:19:12
gb,"Elizabeth Hurley, 59, puts on a glamorous display in a plunging silver shimmering gown as she poses with son Damian, 23, at the SPA Awards in Germany","The actress, 59, was joined by her son Damian, 23, at the swanky event, which took place at the Steigenberger Icon Grand Hotel & Spa Petersberg.",en,"Elizabeth Hurley, 59, puts on a glamorous display in a plunging silver shimmering gown as she poses with son Damian, 23, at the SPA Awards in Germany","The actress, 59, was joined by her son Damian, 23, at the swanky event, which took place at the Steigenberger Icon Grand Hotel",2025-04-12 23:18:50
gb,Rory McIlroy makes most of moving day to open up two-shot Masters lead - The Guardian,"Rory McIlroy makes most of moving day to open up two-shot Masters lead The GuardianMasters 2025: Rory McIlroy leads Bryson DeChambeau by two after three rounds at Augusta National BBCRory McIlroy's date with destiny has arrived after a stunning third round surge at Augusta - but old foe Bryso Daily MailThe Masters Golf 2025 LIVE: Round 3 leaderboard, tee times, scores & radio from Augusta BBCThe Masters 2025: day three – as it happened The Guardian",en,Rory McIlroy makes most of moving day to open up two-shot Masters lead - The Guardian,"Rory McIlroy makes most of moving day to open up two-shot Masters lead The GuardianMasters 2025: Rory McIlroy leads Bryson DeChambeau by two after three rounds at Augusta National BBCRory McIlroy's date with destiny has arrived after a stunning third round surge at Augusta - but old foe Bryso Daily MailThe Masters Golf 2025 LIVE: Round 3 leaderboard, tee times, scores",2025-04-12 23:18:00
gb,How Rory McIlroy seized control of the Masters to set up final-round duel with Bryson DeChambeau,McIlroy takes a lead into the final round with another duel with the dangerous DeChambeau two shots back,en,How Rory McIlroy seized control of the Masters to set up final-round duel with Bryson DeChambeau,McIlroy takes a lead into the final round with another duel with the dangerous DeChambeau two shots back,2025-04-12 23:17:23
gb,How Rory McIlroy seized control of the Masters to set up final-round duel with Bryson DeChambeau,McIlroy takes a lead into the final round with another duel with the dangerous DeChambeau two shots back,en,How Rory McIlroy seized control of the Masters to set up final-round duel with Bryson DeChambeau,McIlroy takes a lead into the final round with another duel with the dangerous DeChambeau two shots back,2025-04-12 23:17:23
gb,Rory McIlroy makes Masters history as stunning scoring streak leaves him with one arm in elusive Green Jacket,,en,Rory McIlroy makes Masters history as stunning scoring streak leaves him with one arm in elusive Green Jacket,,2025-04-12 23:17:14
gb,Donald Trump insists there will be NO tariff exemptions in dramatic u-turn,"Just days after economic experts saw a glimmer of hope among Donald Trump's raft of tariffs with a potential exemption on electronic goods, the US President has now clarified this is not the case",en,Donald Trump insists there will be NO tariff exemptions in dramatic u-turn,"Just days after economic experts saw a glimmer of hope among Donald Trump's raft of tariffs with a potential exemption on electronic goods, the US President has now clarified this is not the case",2025-04-14 00:32:44
gb,Watch: McIlroy celebrates with family after Augusta win,Watch Rory McIlroy presented with his Green Jacket and celebrate with his family and caddie,en,Watch: McIlroy celebrates with family after Augusta win,Watch Rory McIlroy presented with his Green Jacket and celebrate with his family and caddie,2025-04-14 00:32:25
gb,"Sonic Price Sees Slow Growth As Smart Money Shift Focus To FloppyPepe, The Next 100X AI Coin","The Sonic price has been struggling to gain momentum, and investors are starting to look elsewhere for bigger opportunities. Many are now turning to FloppyPepe (FPPE), an AI coin that’s been gaining serious momentum. At a budget-friendly $0.0000002, it’s attracting smart money and building strong community support. With these prominent investors shifting their focus, this [...]The post Sonic Price Sees Slow Growth As Smart Money Shift Focus To FloppyPepe, The Next 100X AI Coin appeared first on TechBullion.",en,"Sonic Price Sees Slow Growth As Smart Money Shift Focus To FloppyPepe, The Next 100X AI Coin","The Sonic price has been struggling to gain momentum, and investors are starting to look elsewhere for bigger opportunities. Many are now turning to FloppyPepe (FPPE), an AI coin that’s been gaining serious momentum. At a budget-friendly $0.0000002, it’s attracting smart money and building strong community support. With these prominent investors shifting their focus, this [...]The post Sonic Price Sees Slow Growth As Smart Money Shift Focus To FloppyPepe, The Next 100X AI Coin appeared first on TechBullion.",2025-04-14 00:30:43
gb,Masters 2025 winner Rory McIlroy's huge net worth including enormous property portfolio,"Rory McIlroy has joined Tiger Woods, Ben Hogan, Gary Player, Gene Sarazen and Jack Nicklaus as the only winners of all four men's major championships after a tense play-off at the Augusta National",en,Masters 2025 winner Rory McIlroy's huge net worth including enormous property portfolio,"Rory McIlroy has joined Tiger Woods, Ben Hogan, Gary Player, Gene Sarazen and Jack Nicklaus as the only winners of all four men's major championships after a tense play-off at the Augusta National",2025-04-14 00:30:39
gb,Incumbent Daniel Noboa takes lead in Ecuador’s presidential run-off election,Electoral authorities reported more than 80% of voter participation during Sunday’s election.,en,Incumbent Daniel Noboa takes lead in Ecuador’s presidential run-off election,Electoral authorities reported more than 80% of voter participation during Sunday’s election.,2025-04-14 00:30:37
gb,Incumbent Daniel Noboa takes lead in Ecuador’s presidential run-off election,Electoral authorities reported more than 80% of voter participation during Sunday’s election.,en,Incumbent Daniel Noboa takes lead in Ecuador’s presidential run-off election,Electoral authorities reported more than 80% of voter participation during Sunday’s election.,2025-04-14 00:30:37
gb,Incumbent Daniel Noboa takes lead in Ecuador’s presidential run-off election,Electoral authorities reported more than 80% of voter participation during Sunday’s election.,en,Incumbent Daniel Noboa takes lead in Ecuador’s presidential run-off election,Electoral authorities reported more than 80% of voter participation during Sunday’s election.,2025-04-14 00:30:37
gb,Incumbent Daniel Noboa takes lead in Ecuador’s presidential run-off election,Electoral authorities reported more than 80% of voter participation during Sunday’s election.,en,Incumbent Daniel Noboa takes lead in Ecuador’s presidential run-off election,Electoral authorities reported more than 80% of voter participation during Sunday’s election.,2025-04-14 00:30:37
gb,Incumbent Daniel Noboa takes lead in Ecuador’s presidential run-off election,Electoral authorities reported more than 80% of voter participation during Sunday’s election.,en,Incumbent Daniel Noboa takes lead in Ecuador’s presidential run-off election,Electoral authorities reported more than 80% of voter participation during Sunday’s election.,2025-04-14 00:30:37
gb,Incumbent Daniel Noboa takes lead in Ecuador’s presidential run-off election,Electoral authorities reported more than 80% of voter participation during Sunday’s election.,en,Incumbent Daniel Noboa takes lead in Ecuador’s presidential run-off election,Electoral authorities reported more than 80% of voter participation during Sunday’s election.,2025-04-14 00:30:37
gb,Expert shares 30p 'secret' for keeping flowers alive for longer,"Have you tried this 30p hack that will help keep your fresh flowers, such as lilies, alive for longer? All you need is water and a lemon.",en,Expert shares 30p 'secret' for keeping flowers alive for longer,"Have you tried this 30p hack that will help keep your fresh flowers, such as lilies, alive for longer? All you need is water and a lemon.",2025-04-14 13:00:00
gb,Meet Gloucestershire’s new Vice Lord-Lieutenant,A FORMER police officer has been appointed the Vice Lord-Lieutenant of Gloucestershire.,en,Meet Gloucestershire’s new Vice Lord-Lieutenant,A FORMER police officer has been appointed the Vice Lord-Lieutenant of Gloucestershire.,2025-04-14 13:00:00
gb,How The Roborock Saros Z70 Solves The Biggest Problem With Robot Vacuums,"Roborock's Saros Z70 is pushing the envelop for smart vacuums - especially with its OmniGrip claw, capable of picking up and tossing all sorts of garbage.",en,How The Roborock Saros Z70 Solves The Biggest Problem With Robot Vacuums,"Roborock's Saros Z70 is pushing the envelop for smart vacuums - especially with its OmniGrip claw, capable of picking up and tossing all sorts of garbage.",2025-04-14 13:00:00
gb,27 adorable pictures of dogs at Bishop Auckland Food Festival,"Bishop Auckland Food Festival came back with a bang in 2025, with glorious weather helping people along. Here are some great pictures of dogs we snapped.",en,27 adorable pictures of dogs at Bishop Auckland Food Festival,"Bishop Auckland Food Festival came back with a bang in 2025, with glorious weather helping people along. Here are some great pictures of dogs we snapped.",2025-04-14 13:00:00
gb,Ipswich café applies to council for alcohol and live music licence,Cafe Myra on St Nicholas Street has applied to Ipswich Borough Council for a new premises licence for alcohol and live music.,en,Ipswich café applies to council for alcohol and live music licence,Cafe Myra on St Nicholas Street has applied to Ipswich Borough Council for a new premises licence for alcohol and live music.,2025-04-14 13:00:00
gb,Meet Gloucestershire’s new Vice Lord-Lieutenant,A FORMER police officer has been appointed the Vice Lord-Lieutenant of Gloucestershire.,en,Meet Gloucestershire’s new Vice Lord-Lieutenant,A FORMER police officer has been appointed the Vice Lord-Lieutenant of Gloucestershire.,2025-04-14 13:00:00
gb,The 'secret' Netflix codes that could help you find 'hidden' content this Easter,A Reddit user has shared a guide to secret codes that will allow you to quickly narrow down your Netflix search,en,The 'secret' Netflix codes that could help you find 'hidden' content this Easter,A Reddit user has shared a guide to secret codes that will allow you to quickly narrow down your Netflix search,2025-04-14 13:00:00
gb,Expert shares cheap hacks to help your houseplants thrive including 'touch test',Warmer weather will mean your houseplants need more water and you'll need to give them all the right nutrients to flourish - try these hacks.,en,Expert shares cheap hacks to help your houseplants thrive including 'touch test',Warmer weather will mean your houseplants need more water and you'll need to give them all the right nutrients to flourish - try these hacks.,2025-04-14 13:00:00
gb,Several Annabel Murcott students were kings and queens at Kettering tournament,The Annabel Murcott Schools of Tae Kwon Do had some outstanding results at the recent Midlands Championships in Kettering,en,Several Annabel Murcott students were kings and queens at Kettering tournament,The Annabel Murcott Schools of Tae Kwon Do had some outstanding results at the recent Midlands Championships in Kettering,2025-04-14 13:00:00
gb,Harry Potter TV series officially confirms 6 ‘extraordinary’ stars joining reboot cast,Several stars are officially joining the Wizarding World.,en,Harry Potter TV series officially confirms 6 ‘extraordinary’ stars joining reboot cast,Several stars are officially joining the Wizarding World.,2025-04-14 13:00:00
gb,'He's got something special' - Everton fans all saying the same thing as former Linfield teen Braiden Graham scores four times in Tottenham Hotspur win,Braiden Graham’s impressive start to life at Everton continued on Monday evening as the former Linfield teenage sensation scored four goals for their U21 side in a dramatic 5-4 Premier League Two victory over Tottenham Hotspur.,en,'He's got something special' - Everton fans all saying the same thing as former Linfield teen Braiden Graham scores four times in Tottenham Hotspur win,Braiden Graham’s impressive start to life at Everton continued on Monday evening as the former Linfield teenage sensation scored four goals for their U21 side in a dramatic 5-4 Premier League Two victory over Tottenham Hotspur.,2025-04-14 20:37:55
gb,Hertz stock falls on data breach concerns,,en,Hertz stock falls on data breach concerns,,2025-04-14 20:36:08
gb,Valneva shares leap on Brazilian approval of chikungunya vaccine,,en,Valneva shares leap on Brazilian approval of chikungunya vaccine,,2025-04-14 20:36:07
gb,Netflix unleashes gripping new crime drama about ‘chilling’ abduction story,Here's everything you need to know about the chilling Scandi thriller series that is coming to Netflix.,en,Netflix unleashes gripping new crime drama about ‘chilling’ abduction story,Here's everything you need to know about the chilling Scandi thriller series that is coming to Netflix.,2025-04-14 20:36:00
gb,U.S. shares higher at close of trade; Dow Jones Industrial Average up 0.78%,,en,U.S. shares higher at close of trade; Dow Jones Industrial Average up 0.78%,,2025-04-14 20:36:00
gb,Prosecutor says Sean 'Diddy' Combs’ lawyers are looking for reasons to delay his May trial,A federal prosecutor says lawyers for music mogul Sean “Diddy” Combs are looking for reasons to delay a sex trafficking trial slated to start in three weeks,en,Prosecutor says Sean 'Diddy' Combs’ lawyers are looking for reasons to delay his May trial,A federal prosecutor says lawyers for music mogul Sean “Diddy” Combs are looking for reasons to delay a sex trafficking trial slated to start in three weeks,2025-04-14 20:35:48
gb,Premier League clubs splashed £409MILLION on agent fees as Chelsea top spending table on 44 stars and axed manager,,en,Premier League clubs splashed £409MILLION on agent fees as Chelsea top spending table on 44 stars and axed manager,,2025-04-14 20:35:24
gb,Premier League clubs splashed £409MILLION on agent fees as Chelsea top spending table on 44 stars and axed manager,,en,Premier League clubs splashed £409MILLION on agent fees as Chelsea top spending table on 44 stars and axed manager,,2025-04-14 20:35:24
gb,Where Albion stand in table of money paid to agents (no surprises who are top),Brighton's big-spending summer is not reflected in the table for payments to agents,en,Where Albion stand in table of money paid to agents (no surprises who are top),Brighton's big-spending summer is not reflected in the table for payments to agents,2025-04-14 20:35:06
gb,ITV Emmerdale viewers share support as they realise star's relationship news as episode airs,"Viewers offered their congratulations as one star said: ""Screaming, crying and throwing up""",en,ITV Emmerdale viewers share support as they realise star's relationship news as episode airs,"Viewers offered their congratulations as one star said: ""Screaming, crying and throwing up""",2025-04-14 20:34:50
gb,"It's tragic that a once great industrial power has to scrabble around the world for coal, writes ROSS CLARK",The Scunthorpe steelworks are barely a few dozen miles from the rich coal deposits of South Yorkshire.,en,"It's tragic that a once great industrial power has to scrabble around the world for coal, writes ROSS CLARK",The Scunthorpe steelworks are barely a few dozen miles from the rich coal deposits of South Yorkshire.,2025-04-16 00:49:43
gb,Pupy the elephant heads to a vast Brazilian sanctuary after 30 years in an Argentine zoo,"An unusual convoy is nearing Argentina’s lush border with Brazil, after snaking through traffic-snarled roads for hours",en,Pupy the elephant heads to a vast Brazilian sanctuary after 30 years in an Argentine zoo,"An unusual convoy is nearing Argentina’s lush border with Brazil, after snaking through traffic-snarled roads for hours",2025-04-16 00:49:34
gb,EU blackmailing Serbia’s Vucic over Moscow visit – media,EU states have reportedly threatened to shut down accession talks if Serbian leader visits Moscow Read Full Article at RT.com,en,EU blackmailing Serbia’s Vucic over Moscow visit – media,EU states have reportedly threatened to shut down accession talks if Serbian leader visits Moscow Read Full Article at RT.com,2025-04-16 00:49:32
gb,Meta Faces Antitrust Trial Over Instagram and WhatsApp Acquisitions,Meta is on trial for its acquisitions of Instagram and WhatsApp.The FTC accuses Meta of creating a social media monopoly.The trial could require Meta to sell its major platforms.,en,Meta Faces Antitrust Trial Over Instagram and WhatsApp Acquisitions,Meta is on trial for its acquisitions of Instagram and WhatsApp.The FTC accuses Meta of creating a social media monopoly.The trial could require Meta to sell its major platforms.,2025-04-16 00:49:23
gb,PHOTO COLLECTION: Jackie Robinson Day Baseball,This is a photo collection curated by AP photo editors.,en,PHOTO COLLECTION: Jackie Robinson Day Baseball,This is a photo collection curated by AP photo editors.,2025-04-16 00:49:00
gb,Northern Lights set to be visible in Cumbria skies TONIGHT,The Met Office has said that the Northern Lights will be visible across parts of Cumbria tonight and tomorrow. - www.thewestmorlandgazette.co.uk,en,Northern Lights set to be visible in Cumbria skies TONIGHT,The Met Office has said that the Northern Lights will be visible across parts of Cumbria tonight and tomorrow. - www.thewestmorlandgazette.co.uk,2025-04-16 00:48:52
gb,"Lake District food review: Wild Boar Estate, Windermere","Our series of Lake District food reviews kicks off with a visit to the Wild Boar Estate, Windermere. - www.thewestmorlandgazette.co.uk",en,"Lake District food review: Wild Boar Estate, Windermere","Our series of Lake District food reviews kicks off with a visit to the Wild Boar Estate, Windermere. - www.thewestmorlandgazette.co.uk",2025-04-16 00:48:51
gb,Lake District: Runner taking on 10 marathons in 10 days for charity,Runner taking on 10 marathons in 10 days to raise money for the Brathay Trust - www.thewestmorlandgazette.co.uk,en,Lake District: Runner taking on 10 marathons in 10 days for charity,Runner taking on 10 marathons in 10 days to raise money for the Brathay Trust - www.thewestmorlandgazette.co.uk,2025-04-16 00:48:51
