iso_code,title,description,lang_tranlation,title_translated,description_translated,pubDate
gb,TICKETS ALERT: Madness 2025 Hits Parade UK tour heading this way - here's how to get tickets!,One of the UK’s most beloved British bands Madness have announced ‘Hits Parade’ a major UK arena tour for December 2025 - and its heading this way!,en,TICKETS ALERT: Madness 2025 Hits Parade UK tour heading this way - here's how to get tickets!,One of the UKs most beloved British bands Madness have announced Hits Parade a major UK arena tour for December 2025 - and its heading this way!,2025-03-25 19:29:45
gb,TICKETS ALERT: Madness 2025 Hits Parade UK tour heading this way - here's how to get tickets!,One of the UK’s most beloved British bands Madness have announced ‘Hits Parade’ a major UK arena tour for December 2025 - and its heading this way!,en,TICKETS ALERT: Madness 2025 Hits Parade UK tour heading this way - here's how to get tickets!,One of the UKs most beloved British bands Madness have announced Hits Parade a major UK arena tour for December 2025 - and its heading this way!,2025-03-25 19:29:45
gb,Trent Alexander-Arnold handed clear Liverpool response to Real Madrid transfer decision,Trent Alexander-Arnold is reportedly closing in on a transfer from Liverpool to Real Madrid this summer,en,Trent Alexander-Arnold handed clear Liverpool response to Real Madrid transfer decision,Trent Alexander-Arnold is reportedly closing in on a transfer from Liverpool to Real Madrid this summer,2025-03-25 20:00:00
gb,Angler 'at it again' with SECOND monster catch from Oxfordshire fisheries,"Several huge carp catches were made at Linear Fisheries near Witney this week, with one angler making his second monster catch this month.",en,Angler 'at it again' with SECOND monster catch from Oxfordshire fisheries,"Several huge carp catches were made at Linear Fisheries near Witney this week, with one angler making his second monster catch this month.",2025-03-25 20:00:00
gb,New Hollywood Bowl to open in The Oracle in Summer 2025,"Hollywood Bowl has announced that their new bowling alley will be opening in Summer 2025. Following the closure of the House of Fraser in The Oracle, it was announced that the bowling and entertainment chain would replace the shops lower ground floor unit.",en,New Hollywood Bowl to open in The Oracle in Summer 2025,"Hollywood Bowl has announced that their new bowling alley will be opening in Summer 2025. Following the closure of the House of Fraser in The Oracle, it was announced that the bowling and entertainment chain would replace the shops lower ground floor unit.",2025-03-25 20:00:00
gb,Greek man tending million-pound cannabis farm in former steakhouse faces deportation,A,en,Greek man tending million-pound cannabis farm in former steakhouse faces deportation,A,2025-03-25 20:00:00
gb,Plans for testing site near Oxfordshire town business park progress,Plans for a new water distribution testing site have been assessed for environmental impact ahead of an application in Wallingford.,en,Plans for testing site near Oxfordshire town business park progress,Plans for a new water distribution testing site have been assessed for environmental impact ahead of an application in Wallingford.,2025-03-25 20:00:00
gb,County Durham restaurant loses licence for employing illegal workers,"A County Durham restaurant, Baylead, has warned it could be forced to close after losing its licence for employing illegal workers.",en,County Durham restaurant loses licence for employing illegal workers,"A County Durham restaurant, Baylead, has warned it could be forced to close after losing its licence for employing illegal workers.",2025-03-25 20:00:00
gb,Strategy for thousands of new homes in Reading due to be submitted,A strategy that determines where thousands of new homes will be built in Reading is due to be submitted in the coming weeks.,en,Strategy for thousands of new homes in Reading due to be submitted,A strategy that determines where thousands of new homes will be built in Reading is due to be submitted in the coming weeks.,2025-03-25 20:00:00
gb,Martin Keown makes worrying prediction about Cole Palmer's future at Chelsea - The Chelsea Chronicle - Chelsea FC News,"Martin Keown makes worrying prediction about Cole Palmer's future at Chelsea The Chelsea Chronicle - Chelsea FC News‘Making noise’ – Simon Jordan claps back at Jamie Carragher for comment on Cole Palmer and his Chelsea cont... talkSPORTHow Chelsea can fix Cole Palmer: Patience, empathy and a clear set of aims The New York TimesFrustrated Palmer has 'outgrown Chelsea and may regret new contract' Evening StandardMartin Keown warns Chelsea that star player could leave after worrying slump Metro.co.uk",en,Martin Keown makes worrying prediction about Cole Palmer's future at Chelsea - The Chelsea Chronicle - Chelsea FC News,"Martin Keown makes worrying prediction about Cole Palmer's future at Chelsea The Chelsea Chronicle - Chelsea FC News‘Making noise’ – Simon Jordan claps back at Jamie Carragher for comment on Cole Palmer and his Chelsea cont... talkSPORTHow Chelsea can fix Cole Palmer: Patience, empathy and a clear set of aims The New York TimesFrustrated Palmer has 'outgrown Chelsea and may regret new contract' Evening StandardMartin Keown warns Chelsea that star player could leave after worrying slump Metro.co.uk",2025-03-25 20:00:00
gb,Coronation Street Theo's secret exposed as Todd Grimshaw makes bombshell discovery,Coronation Street newcomer Theo Silverton causes drama this week on the ITV soap and soon there's a connection with Todd Grimshaw - with a big secret yet to be revealed,en,Coronation Street Theo's secret exposed as Todd Grimshaw makes bombshell discovery,Coronation Street newcomer Theo Silverton causes drama this week on the ITV soap and soon there's a connection with Todd Grimshaw - with a big secret yet to be revealed,2025-03-25 20:00:00
gb,TV star Paddy McGuinness spotted with parmo at North East restaurant,Paddy McGuinness was pictured on the Manjaros Middlesbrough social media account with a large takeaway of parmos.,en,TV star Paddy McGuinness spotted with parmo at North East restaurant,Paddy McGuinness was pictured on the Manjaros Middlesbrough social media account with a large takeaway of parmos.,2025-03-25 20:00:00
gb,City AM readers: Join the fight for the centre right,"Simon Clarke is calling on City AM readers to play their part in a once-in-a-lifetime battle for the survival of the centre right. Unless Conservatives can renew their arguments, they will be replaced by populists who only offer anger an no ideas “Strategy is an overworked and thus devalued word, and strategic thinking can be [...]",en,City AM readers: Join the fight for the centre right,"Simon Clarke is calling on City AM readers to play their part in a once-in-a-lifetime battle for the survival of the centre right. Unless Conservatives can renew their arguments, they will be replaced by populists who only offer anger an no ideas “Strategy is an overworked and thus devalued word, and strategic thinking can be [...]",2025-03-26 05:21:00
gb,"No Annamalai ouster, no opposition to Sasikala: BJP’s terms for AIADMK return | INSIDE SCOOP on EPS-Amit Shah meet","AIADMK leader Edappadi K Palaniswami met Union Home Minister Amit Shah in Delhi for nearly two hours on Tuesday, initiating formal talks on a possible alliance for the 2026 Assembly polls. AIADMK has demanded a high-powered committee to oversee BJP dealings, sidelining state chief K Annamalai. The party also wants BJP to drop ties with rebels T T V Dhinakaran and O Panneerselvam. While multiple rounds of talks are expected, sources suggest both sides are moving toward a renewed partnership.",en,"No Annamalai ouster, no opposition to Sasikala: BJP’s terms for AIADMK return | INSIDE SCOOP on EPS-Amit Shah meet","AIADMK leader Edappadi K Palaniswami met Union Home Minister Amit Shah in Delhi for nearly two hours on Tuesday, initiating formal talks on a possible alliance for the 2026 Assembly polls. AIADMK has demanded a high-powered committee to oversee BJP dealings, sidelining state chief K Annamalai. The party also wants BJP to drop ties with rebels T T V Dhinakaran and O Panneerselvam. While multiple rounds of talks are expected, sources suggest both sides are moving toward a renewed partnership.",2025-03-26 05:21:00
gb,Donald Trump says he was 'activated' last week in disturbing slip amid Kremlin spy fears,"Donald Trump made a disturbing slip of the tongue during a cabinet meeting, where he joked he was ""activated"" last week sparking fears he is a Russian asset",en,Donald Trump says he was 'activated' last week in disturbing slip amid Kremlin spy fears,"Donald Trump made a disturbing slip of the tongue during a cabinet meeting, where he joked he was ""activated"" last week sparking fears he is a Russian asset",2025-03-26 05:21:00
gb,SkyNews busted watching Married At First Sight during 2025 Federal Budget lock-up - in shock image shared online,SkyNews Australia staff were busted watching Married At First Sight on Tuesday night amid the 2025-2026 Federal Budget lockup.,en,SkyNews busted watching Married At First Sight during 2025 Federal Budget lock-up - in shock image shared online,SkyNews Australia staff were busted watching Married At First Sight on Tuesday night amid the 2025-2026 Federal Budget lockup.,2025-03-26 05:20:37
gb,Myton Hospice calls for urgent donations for Easter Eggs towards annual tombola,The Easter egg tombola is held yearly at Myton Hospice in Coventry,en,Myton Hospice calls for urgent donations for Easter Eggs towards annual tombola,The Easter egg tombola is held yearly at Myton Hospice in Coventry,2025-03-26 05:20:00
gb,Work begins on Coventry site with plans for 182 new homes,The first homes are expected to be ready from spring 2026,en,Work begins on Coventry site with plans for 182 new homes,The first homes are expected to be ready from spring 2026,2025-03-26 05:19:00
gb,"Gold prices fall slightly, copper whipsaws on Trump tariff report",,en,"Gold prices fall slightly, copper whipsaws on Trump tariff report",,2025-03-26 05:18:06
gb,FTSE 100 index technical analysis points to more gains this year,"The FTSE 100 index has remained in a consolidation phase in the past few weeks as investors focus on the Bank of England (BoE) actions and the upcoming tariffs by the Donald Trump administration. The index was trading at £8,665 on Wednesday, a few points below its all-time high of £8,910. Bank of England actions [...]",en,FTSE 100 index technical analysis points to more gains this year,"The FTSE 100 index has remained in a consolidation phase in the past few weeks as investors focus on the Bank of England (BoE) actions and the upcoming tariffs by the Donald Trump administration. The index was trading at £8,665 on Wednesday, a few points below its all-time high of £8,910. Bank of England actions [...]",2025-03-26 05:18:00
gb,Brits to bask in 21C weather next week as Met Office heralds huge change,"The UK is set to bask in glorious spring sunshine as a band of high pressure moves eastwards across the country, sending temperatures soaring to 21C",en,Brits to bask in 21C weather next week as Met Office heralds huge change,"The UK is set to bask in glorious spring sunshine as a band of high pressure moves eastwards across the country, sending temperatures soaring to 21C",2025-03-26 05:17:00
gb,Yuki Tsunoda to replace Liam Lawson at F1 Red Bull team: Reports - Al Jazeera English,"Yuki Tsunoda to replace Liam Lawson at F1 Red Bull team: Reports Al Jazeera EnglishF1 Q&A: Lawson future at Red Bull, Ferrari, Hamilton, Leclerc and Racing Bulls BBC.comWhy Lawson has paid the price for Perez's failings The RaceRed Bull drop Liam Lawson and bring in Yuki Tsunoda as replacement The TelegraphMax Verstappen 'not happy' with Red Bull decision to axe team-mate Liam Lawson after just two races of the F1 Daily Mail",en,Yuki Tsunoda to replace Liam Lawson at F1 Red Bull team: Reports - Al Jazeera English,Yuki Tsunoda to replace Liam Lawson at F1 Red Bull team: Reports Al Jazeera EnglishF1 Q,2025-03-26 05:16:25
gb,Rachel Reeves urged not to devastate services in hunt for savings,"The Chancellor has been warned that the courts, farming and prisons all face a crisis",en,Rachel Reeves urged not to devastate services in hunt for savings,"The Chancellor has been warned that the courts, farming and prisons all face a crisis",2025-03-26 19:54:00
gb,BBC Antiques Road Trip expert shares unusual trick to help you make a fortune,Jewellery pro Hettie Jago was on hand to share her professional insight on BBC's Antiques Road Trip - with one very valuable tip.,en,BBC Antiques Road Trip expert shares unusual trick to help you make a fortune,Jewellery pro Hettie Jago was on hand to share her professional insight on BBC's Antiques Road Trip - with one very valuable tip.,2025-03-26 19:54:00
gb,"Found Out P﻿atrick Schwarzenegger's Net Worth, Might Never Recover",List of things I find shocking: 1) The White Lotus incest scene. 2) This man's bank account.,en,"Found Out P﻿atrick Schwarzenegger's Net Worth, Might Never Recover",List of things I find shocking: 1) The White Lotus incest scene. 2) This man's bank account.,2025-03-26 19:54:00
gb,"Attack on Muslim woman as she waited for children’s bus should be probed as hate crime, says pressure group","Somali woman was attacked by four suspects outside apartment building in Columbus, Ohio, says Council on American-Islamic Relations",en,"Attack on Muslim woman as she waited for children’s bus should be probed as hate crime, says pressure group","Somali woman was attacked by four suspects outside apartment building in Columbus, Ohio, says Council on American-Islamic Relations",2025-03-26 19:54:00
gb,Brit tourist airlifted from cruise ship & rushed to hospital after suffering ‘heart problems’ off coast of Spain,,en,Brit tourist airlifted from cruise ship,,2025-03-26 19:53:33
gb,Brit tourist airlifted from cruise ship & rushed to hospital after suffering ‘heart problems’ off coast of Spain,,en,Brit tourist airlifted from cruise ship,,2025-03-26 19:53:33
gb,Trump will announce auto tariffs at a White House news conference,"President Donald Trump will announce tariffs on auto imports, a move the White Houses claims would foster domestic manufacturing that could also put a financial squeeze on automakers that depend on global supply chains",en,Trump will announce auto tariffs at a White House news conference,"President Donald Trump will announce tariffs on auto imports, a move the White Houses claims would foster domestic manufacturing that could also put a financial squeeze on automakers that depend on global supply chains",2025-03-26 19:53:31
gb,Walsall Council legally challenges government over controversial development on Great Barr green belt,"If successful, the court will overturn the decision made by the planning inspectorate",en,Walsall Council legally challenges government over controversial development on Great Barr green belt,"If successful, the court will overturn the decision made by the planning inspectorate",2025-03-26 19:53:28
gb,Palestinian journalists protest targeting of colleagues in Gaza,Palestinian journalists protested in front of Nasser Hospital in Gaza's Khan Younis.,en,Palestinian journalists protest targeting of colleagues in Gaza,Palestinian journalists protested in front of Nasser Hospital in Gaza's Khan Younis.,2025-03-26 19:53:18
gb,Five arrested after man spotted with 'gun',A forensic examination of the scene is ongoing,en,Five arrested after man spotted with 'gun',A forensic examination of the scene is ongoing,2025-03-26 19:53:17
gb,Three young children - including a baby - killed at home in Pembroke Park shooting,"Pembroke Park Police and Broward Sheriff’s Office deputies responded to reports of a shooting at an apartment in Pembroke Park, which is around 20 miles north of Miami in Florida",en,Three young children - including a baby - killed at home in Pembroke Park shooting,"Pembroke Park Police and Broward Sheriff’s Office deputies responded to reports of a shooting at an apartment in Pembroke Park, which is around 20 miles north of Miami in Florida",2025-03-27 03:41:34
gb,DRI makes third arrest in gold smuggling case involving Kannada actor Ranya Rao,"A gold dealer, a native of Ballari, was questioned in connection with the case following which he was arrested by the Directorate of Revenue Intelligence on Wednesday.",en,DRI makes third arrest in gold smuggling case involving Kannada actor Ranya Rao,"A gold dealer, a native of Ballari, was questioned in connection with the case following which he was arrested by the Directorate of Revenue Intelligence on Wednesday.",2025-03-27 03:41:00
gb,"Young Aussie couple on $300,000 income reveal how they got into massive debt",Toneille Rowlands said her financial troubles started when she was a student working in retail.,en,"Young Aussie couple on $300,000 income reveal how they got into massive debt",Toneille Rowlands said her financial troubles started when she was a student working in retail.,2025-03-27 03:40:20
gb,"Dana White, Khabib Nurmagomedov, and Many UFC Stars United Once Came in Support of Cain Velasquez with a Letter to the Court","Following the sentencing of ex-UFC star Cain Velasquez, a letter of support submitted by a host of fighting stars has once more surfaced this week. Velasquez, a former two-time heavyweight champion in the Octagon, received his prison sentence following his part in a shooting three years ago. The Salinas native was hit with charges including [...]The post Dana White, Khabib Nurmagomedov, and Many UFC Stars United Once Came in Support of Cain Velasquez with a Letter to the Court appeared first on The SportsRush.",en,"Dana White, Khabib Nurmagomedov, and Many UFC Stars United Once Came in Support of Cain Velasquez with a Letter to the Court","Following the sentencing of ex-UFC star Cain Velasquez, a letter of support submitted by a host of fighting stars has once more surfaced this week. Velasquez, a former two-time heavyweight champion in the Octagon, received his prison sentence following his part in a shooting three years ago. The Salinas native was hit with charges including [...]The post Dana White, Khabib Nurmagomedov, and Many UFC Stars United Once Came in Support of Cain Velasquez with a Letter to the Court appeared first on The SportsRush.",2025-03-27 03:39:28
gb,"Flash deal: Grab an M4 Pro Mac mini for $1,199, record low price","Amazon's Big Spring Sale is in full swing, and the latest Apple device to receive a steep discount is the M4 Pro Mac mini. Snag the lowest price ever thanks to a price war between Amazon and B&H.Get the lowest price ever on an M4 Pro Mac mini.Equipped with Apple's M4 Pro chip with a 12-core CPU and 16-core GPU, this configuration also has 24GB of unified memory and 512GB of storage, making it a solid option at the discounted price of $1,199. This markdown, which is $200 off MSRP, is available at both Amazon and B&H as the retailers compete for your business at the end of Q1 2025. Continue Reading on AppleInsider | Discuss on our Forums",en,"Flash deal: Grab an M4 Pro Mac mini for $1,199, record low price","Amazon's Big Spring Sale is in full swing, and the latest Apple device to receive a steep discount is the M4 Pro Mac mini. Snag the lowest price ever thanks to a price war between Amazon and B",2025-03-27 03:38:16
gb,Furious fans call out influencer Remi Bader for 'lying' after weight loss bombshell,Plus-size influencer Remi Bader is currently under fire after she recently admitted to undergoing weight-loss surgery in 2023.,en,Furious fans call out influencer Remi Bader for 'lying' after weight loss bombshell,Plus-size influencer Remi Bader is currently under fire after she recently admitted to undergoing weight-loss surgery in 2023.,2025-03-27 03:36:36
gb,Battling Raducanu defeated by Pegula in high-quality contest,Highlights of Emma Raducanu against Jessica Pegula from the quarter-final of the Miami Open.,en,Battling Raducanu defeated by Pegula in high-quality contest,Highlights of Emma Raducanu against Jessica Pegula from the quarter-final of the Miami Open.,2025-03-27 03:35:00
gb,"'Great start' for housing market in 2025, says Bradford district estate agent",A KEIGHLEY estate agent says the housing market has seen a buoyant start to 2025.,en,"'Great start' for housing market in 2025, says Bradford district estate agent",A KEIGHLEY estate agent says the housing market has seen a buoyant start to 2025.,2025-03-27 03:35:00
gb,"Europeans Are Pointing Out The Weirdest Things About American Restaurants, And It's Brutal","""It's wild how Americans eat quickly at restaurants and leave. In Europe, sitting around and talking for an hour or more after eating in a restaurant was normal.""View Entire Post ›",en,"Europeans Are Pointing Out The Weirdest Things About American Restaurants, And It's Brutal","""It's wild how Americans eat quickly at restaurants and leave. In Europe, sitting around and talking for an hour or more after eating in a restaurant was normal.""View Entire Post ›",2025-03-27 03:31:03
gb,Musk's 'what did you do last week' email to government staffers suffers spectacular fail as DOGE buckles,'First Buddy' Elon Musk 's order for all federal employees to send a weekly list of their accomplishments has hit a snag.,en,Musk's 'what did you do last week' email to government staffers suffers spectacular fail as DOGE buckles,'First Buddy' Elon Musk 's order for all federal employees to send a weekly list of their accomplishments has hit a snag.,2025-03-27 03:30:25
gb,Warzone Season 3 brings back controversial Roze skin without fixing pay-to-win issue,"Roze returns in Warzone Season 3, but players have to spend $30 if they want the controversial pay-to-win operator skin.",en,Warzone Season 3 brings back controversial Roze skin without fixing pay-to-win issue,"Roze returns in Warzone Season 3, but players have to spend $30 if they want the controversial pay-to-win operator skin.",2025-03-27 19:31:51
gb,Listen to the eerie audio that reveals what sharks SOUND like for the first time – leaving scientists astounded,,en,Listen to the eerie audio that reveals what sharks SOUND like for the first time – leaving scientists astounded,,2025-03-27 19:31:44
gb,Listen to the eerie audio that reveals what sharks SOUND like for the first time – leaving scientists astounded,,en,Listen to the eerie audio that reveals what sharks SOUND like for the first time – leaving scientists astounded,,2025-03-27 19:31:44
gb,Luke Littler brutally BOOED at Premier League Darts in Newcastle but has perfect response,,en,Luke Littler brutally BOOED at Premier League Darts in Newcastle but has perfect response,,2025-03-27 19:31:36
gb,Luke Littler brutally BOOED at Premier League Darts in Newcastle but has perfect response,,en,Luke Littler brutally BOOED at Premier League Darts in Newcastle but has perfect response,,2025-03-27 19:31:36
