iso_code,title,description,lang_tranlation,title_translated,description_translated,pubDate
gb,TK Maxx at Imperial Retail Park opening date unveiled,Shoppers only have a few days left to wait,en,TK Maxx at Imperial Retail Park opening date unveiled,Shoppers only have a few days left to wait,2025-03-18 05:04:00
gb,"'Shocked' and 'angry,' captive families say Israel must return to the ceasefire","'Shocked' and 'angry,' captive families say Israel must return to the ceasefire Families of Israeli captives said they are ""shocked, angry, and terrified by the deliberate dismantling of the (ceasefire) process"" as they condemned Israel's renewed attacks on Gaza.The claim that the war is being renewed for the release of the captives is a ""complete deception"" – military pressure endangers the captives and soldiers, the families said in a statement. ""We must return to the cease-fire.""The families' statement directly addressed the Israeli government: ""Why aren't you fighting in the negotiating room? Why did you pull out of the deal that could have brought everyone home?"" They also called on President Trump to release all the captives.""The greatest fear of the families, the hostages and the citizens of Israel has come true – The Israeli government has chosen to give up on the hostages,"" the statement read.""Returning to fighting before the last person is released will come at the cost of the 59 hostages who are still in Gaza and could be saved and returned,"" the statement read.""The Israeli government has refused to declare an end to the war in order to implement the next steps in the deal and return all the hostages .""",en,"'Shocked' and 'angry,' captive families say Israel must return to the ceasefire","'Shocked' and 'angry,' captive families say Israel must return to the ceasefire Families of Israeli captives said they are ""shocked, angry, and terrified by the deliberate dismantling of the (ceasefire) process"" as they condemned Israel's renewed attacks on Gaza.The claim that the war is being renewed for the release of the captives is a ""complete deception""  military pressure endangers the captives and soldiers, the families said in a statement. ""We must return to the cease-fire.""The families' statement directly addressed the Israeli government: ""Why aren't you fighting in the negotiating room? Why did you pull out of the deal that could have brought everyone home?"" They also called on President Trump to release all the captives.""The greatest fear of the families, the hostages and the citizens of Israel has come true  The Israeli government has chosen to give up on the hostages,"" the statement read.""Returning to fighting before the last person is released will come at the cost of the 59 hostages who are still in Gaza and could be saved and returned,"" the statement read.""The Israeli government has refused to declare an end to the war in order to implement the next steps in the deal and return all the hostages .""",2025-03-18 06:20:00
gb,Chaitra month 2025: What to do and avoid for a prosperous and harmonious life,"Chaitra month 2025 holds great spiritual significance. Know the key do’s and don’ts, including sacred rituals and forbidden activities, to attract prosperity and divine blessings.",en,Chaitra month 2025: What to do and avoid for a prosperous and harmonious life,"Chaitra month 2025 holds great spiritual significance. Know the key dos and donts, including sacred rituals and forbidden activities, to attract prosperity and divine blessings.",2025-03-18 06:48:00
gb,Scotland braces for UK PIP disability cut announcements,The UK Labour Government is expected to announce a package of disability benefit reforms on Tuesday.,en,Scotland braces for UK PIP disability cut announcements,The UK Labour Government is expected to announce a package of disability benefit reforms on Tuesday.,2025-03-18 06:47:47
gb,Injured Messi to miss Argentina’s FIFA World Cup qualifiers,The world champions will face Uruguay on March 21 and Brazil on March 25 without their influential captain.,en,Injured Messi to miss Argentinas FIFA World Cup qualifiers,The world champions will face Uruguay on March 21 and Brazil on March 25 without their influential captain.,2025-03-18 06:47:44
gb,'Discarded like a dirty rag': Chinese state media hails Trump cuts to Voice of America,"State newspaper gloated that the network has ""now been discarded by its own government like a dirty rag"".",en,'Discarded like a dirty rag': Chinese state media hails Trump cuts to Voice of America,"State newspaper gloated that the network has ""now been discarded by its own government like a dirty rag"".",2025-03-18 06:47:06
gb,Donald Trump Addresses Failure To Meet Signature Campaign Pledge,"President Donald Trump sits for an interview with ""Full Measure with Sharyl Attkisson"" broadcast on March 16, 2025.US President Donald Trump has addressed the failure to meet one of his most significant campaign pledges.During his 2024 presidential bid, Trump repeatedly pledged to end the war in Ukraine in “24 hours.” Now, nearly two months after his inauguration, the three-year conflict continues to rage.In an interview broadcast on Sunday, Trump, though, claimed he didn’t mean that campaign promise literally.“Well, I was being a little bit sarcastic when I said that,” Trump told Full Measure. “What I really mean is I’d like to get it settled, and I think I’ll be successful.”Still, during the buildup to the 2024 presidential race, Trump appeared unequivocal in his assertions that he could bring a prompt closure to the war, telling Fox News’ Sean Hannity in March 2023 he could “fix” the conflict as soon as he won the presidential election.“I would fix that within 24 hours, and if I win, before I get into the office, I will have that war settled,” he added. “One hundred percent sure.”Since then, he has made similar claims multiple times, including during the ABC News debate with former Vice President Kamala Harris in September.“If I’m president-elect, I’ll get it done before even becoming president,” Trump said at the time.During the Full Measure interview, Trump also referred to the 30-day ceasefire proposal the US has made to both Ukraine and Russia. Kyiv has already green-lit the plan, but the Kremlin has yet to confirm its approval.Asked about what he is prepared to do if Russian President Vladimir Putin refuses to back the ceasefire, Trump didn’t offer a direct response, noting that it would be “bad news for this world.”“I think he’s going to agree, I really do,” Trump said of Putin. “I think I know him pretty well, and I think he’s going to agree.”We just finished interviewing President Trump. He spent the day negotiating over Ukraine and seemed optimistic. Here’s how to watch Sunday: https://t.co/1zR7xf8Vn9pic.twitter.com/ErIN03uS6R— Full Measure News (@FullMeasureNews) March 14, 2025Trump told reporters Sunday evening on Air Force One that he would speak to Putin on Tuesday after his envoy Steve Witkoff travelled to Moscow to meet with the Russian president last week.The Kremlin on Monday also confirmed the planned talks.Trump added that he believes his administration has a “very good chance” at bringing the war to a close.“We will be talking about land. We will be talking about power plants,” he said.Related...Trump Praises Jeff Bezos For Doing 'A Real Job' At The Washington Post Amid Controversial Changes'Dictator S**t': Trump's Middle-Of-The-Night Meltdown Nulling Biden Pardons Is SlammedDonald Trump To Hold Talks With Vladimir Putin In Bid To Agree Ukraine Peace Deal",en,Donald Trump Addresses Failure To Meet Signature Campaign Pledge,"President Donald Trump sits for an interview with ""Full Measure with Sharyl Attkisson"" broadcast on March 16, 2025.US President Donald Trump has addressed the failure to meet one of his most significant campaign pledges.During his 2024 presidential bid, Trump repeatedly pledged to end the war in Ukraine in 24 hours. Now, nearly two months after his inauguration, the three-year conflict continues to rage.In an interview broadcast on Sunday, Trump, though, claimed he didnt mean that campaign promise literally.Well, I was being a little bit sarcastic when I said that, Trump told Full Measure. What I really mean is Id like to get it settled, and I think Ill be successful.Still, during the buildup to the 2024 presidential race, Trump appeared unequivocal in his assertions that he could bring a prompt closure to the war, telling Fox News Sean Hannity in March 2023 he could fix the conflict as soon as he won the presidential election.I would fix that within 24 hours, and if I win, before I get into the office, I will have that war settled, he added. One hundred percent sure.Since then, he has made similar claims multiple times, including during the ABC News debate with former Vice President Kamala Harris in September.If Im president-elect, Ill get it done before even becoming president, Trump said at the time.During the Full Measure interview, Trump also referred to the 30-day ceasefire proposal the US has made to both Ukraine and Russia. Kyiv has already green-lit the plan, but the Kremlin has yet to confirm its approval.Asked about what he is prepared to do if Russian President Vladimir Putin refuses to back the ceasefire, Trump didnt offer a direct response, noting that it would be bad news for this world.I think hes going to agree, I really do, Trump said of Putin. I think I know him pretty well, and I think hes going to agree.We just finished interviewing President Trump. He spent the day negotiating over Ukraine and seemed optimistic. Heres how to watch Sunday: https://t.co/1zR7xf8Vn9pic.twitter.com/ErIN03uS6R Full Measure News (@FullMeasureNews) March 14, 2025Trump told reporters Sunday evening on Air Force One that he would speak to Putin on Tuesday after his envoy Steve Witkoff travelled to Moscow to meet with the Russian president last week.The Kremlin on Monday also confirmed the planned talks.Trump added that he believes his administration has a very good chance at bringing the war to a close.We will be talking about land. We will be talking about power plants, he said.Related...Trump Praises Jeff Bezos For Doing 'A Real Job' At The Washington Post Amid Controversial Changes'Dictator S**t': Trump's Middle-Of-The-Night Meltdown Nulling Biden Pardons Is SlammedDonald Trump To Hold Talks With Vladimir Putin In Bid To Agree Ukraine Peace Deal",2025-03-18 06:46:18
gb,Israel's Democrats party chief says Netanyahu resumed Gaza war to stay in power,"Israel's Democrats party chief says Netanyahu resumed Gaza war to stay in power Israeli Democrats party leader Yair Golan accused Prime Minister Benjamin Netanyahu of resuming the war in Gaza for political survival, saying soldiers and captives are “just cards in his game of survival.“Netanyahu is using the lives of our citizens and soldiers because he trembles in fear of us — the public protest against the dismissal of the head of the Shin Bet,” the left-wing leader said, referring to Netanyahu’s recent announcement that he will terminate Shin Bet chief Ronen Bar.Israelis “must not let the madness win” and instead protest in order to save the state of Israel “from the hands of this corrupt and dangerous man,” he said as he called for protests.",en,Israel's Democrats party chief says Netanyahu resumed Gaza war to stay in power,"Israel's Democrats party chief says Netanyahu resumed Gaza war to stay in power Israeli Democrats party leader Yair Golan accused Prime Minister Benjamin Netanyahu of resuming the war in Gaza for political survival, saying soldiers and captives are just cards in his game of survival.Netanyahu is using the lives of our citizens and soldiers because he trembles in fear of us  the public protest against the dismissal of the head of the Shin Bet, the left-wing leader said, referring to Netanyahus recent announcement that he will terminate Shin Bet chief Ronen Bar.Israelis must not let the madness win and instead protest in order to save the state of Israel from the hands of this corrupt and dangerous man, he said as he called for protests.",2025-03-18 06:46:00
gb,I'm hooked on wellness retreats – despite the midlife clichés,"Costs can be prohibitive, and some are exploitative – but the seven I've tried have transformed my life - inews.co.uk",en,I'm hooked on wellness retreats  despite the midlife cliches,"Costs can be prohibitive, and some are exploitative  but the seven I've tried have transformed my life - inews.co.uk",2025-03-18 06:45:58
gb,Ukraine Kursk offensive branded a costly mistake as troops withdraw,Russian forces could push over the border into northern Ukraine after regaining occupied territory - inews.co.uk,en,Ukraine Kursk offensive branded a costly mistake as troops withdraw,Russian forces could push over the border into northern Ukraine after regaining occupied territory - inews.co.uk,2025-03-18 06:45:58
gb,Contraception and home deliveries could be axed from local pharmacies,"The National Pharmacy Association has recommended its 6,000 members take collective action for the first time in its history from April 1 if there is no sufficient package agreed with the Government - inews.co.uk",en,Contraception and home deliveries could be axed from local pharmacies,"The National Pharmacy Association has recommended its 6,000 members take collective action for the first time in its history from April 1 if there is no sufficient package agreed with the Government - inews.co.uk",2025-03-18 06:45:58
gb,"As mortgage interest is so high, is it still worth getting on the property ladder?",Choosing to buy rather than rent is not the obvious decision it once was - Nick Mendes ponders a reader's dilemma - inews.co.uk,en,"As mortgage interest is so high, is it still worth getting on the property ladder?",Choosing to buy rather than rent is not the obvious decision it once was - Nick Mendes ponders a reader's dilemma - inews.co.uk,2025-03-18 06:45:58
gb,Martin Lewis: the bills going up in April 2025 and how to beat them,"From energy bills to the TV Licence, Council Tax to water and energy bills, Martin Lewis is busting bills on his show this week",en,Martin Lewis: the bills going up in April 2025 and how to beat them,"From energy bills to the TV Licence, Council Tax to water and energy bills, Martin Lewis is busting bills on his show this week",2025-03-18 09:25:00
gb,Luke Littler claim labelled 'absolute b******s' as darts icon has say on Phil Taylor match,Chris Mason - a former rival of Phil Taylor - has rubbished claims that the Power in his prime would have been no match for world champion Luke Littler.,en,Luke Littler claim labelled 'absolute b******s' as darts icon has say on Phil Taylor match,Chris Mason - a former rival of Phil Taylor - has rubbished claims that the Power in his prime would have been no match for world champion Luke Littler.,2025-03-18 09:25:00
gb,Martin Lewis: the bills going up in April 2025 and how to beat them,"From energy bills to the TV Licence, Council Tax to water and energy bills, Martin Lewis is busting bills on his show this week",en,Martin Lewis: the bills going up in April 2025 and how to beat them,"From energy bills to the TV Licence, Council Tax to water and energy bills, Martin Lewis is busting bills on his show this week",2025-03-18 09:25:00
gb,Satellites powered by solid metal could one day use space junk for fuel - CNN,Satellites powered by solid metal could one day use space junk for fuel CNN,en,Satellites powered by solid metal could one day use space junk for fuel - CNN,Satellites powered by solid metal could one day use space junk for fuel CNN,2025-03-18 09:25:00
gb,Martin Lewis: the bills going up in April 2025 and how to beat them,"From energy bills to the TV Licence, Council Tax to water and energy bills, Martin Lewis is busting bills on his show this week",en,Martin Lewis: the bills going up in April 2025 and how to beat them,"From energy bills to the TV Licence, Council Tax to water and energy bills, Martin Lewis is busting bills on his show this week",2025-03-18 09:25:00
gb,Darts star hits incredible nine-darter but referee leaves players confused with reaction,Ryan Searle hit a nine-darter in the opening leg of his Players Championship 7 clash with Josh Richardson.,en,Darts star hits incredible nine-darter but referee leaves players confused with reaction,Ryan Searle hit a nine-darter in the opening leg of his Players Championship 7 clash with Josh Richardson.,2025-03-18 09:25:00
gb,Top 6 Industry-Recognized Data Analytics Certifications,"In today’s world, where everything is driven by data, companies continue to search for the most qualified candidates who can extract insights from raw data for business decision-making. It is essential to have something that could be a “plus” to anyone who wants to become a data analyst or even for someone already in the [...]The post Top 6 Industry-Recognized Data Analytics Certifications appeared first on TechBullion.",en,Top 6 Industry-Recognized Data Analytics Certifications,"In todays world, where everything is driven by data, companies continue to search for the most qualified candidates who can extract insights from raw data for business decision-making. It is essential to have something that could be a plus to anyone who wants to become a data analyst or even for someone already in the [...]The post Top 6 Industry-Recognized Data Analytics Certifications appeared first on TechBullion.",2025-03-18 09:24:57
gb,Paul Young recalls waiting in Greek hospital for nine hours in ‘tremendous pain’ after serious accident,69-year-old singer required three blood tranfusions,en,Paul Young recalls waiting in Greek hospital for nine hours in tremendous pain after serious accident,69-year-old singer required three blood tranfusions,2025-03-18 09:24:54
gb,BBC Escape to the Country buyer says 'it's perfect' as couple find dream home,A couple looking for a rural residence were left in awe after being shown around a modern detached property,en,BBC Escape to the Country buyer says 'it's perfect' as couple find dream home,A couple looking for a rural residence were left in awe after being shown around a modern detached property,2025-03-18 09:24:47
gb,Rangers fan fulfils bizarre Nico Raskin tattoo promise as he commits to more ink if Gers lift Europa League,"The Belgian midfielder starred at Parkhead with a goal and assist, with one fan following through on a bold pre-match pledge",en,Rangers fan fulfils bizarre Nico Raskin tattoo promise as he commits to more ink if Gers lift Europa League,"The Belgian midfielder starred at Parkhead with a goal and assist, with one fan following through on a bold pre-match pledge",2025-03-18 09:24:46
gb,New shoe shop to open at Oxfordshire shopping centre,A new shoe shop is opening at Witney's Marriotts Walk Shopping Centre in Oxfordshire.,en,New shoe shop to open at Oxfordshire shopping centre,A new shoe shop is opening at Witney's Marriotts Walk Shopping Centre in Oxfordshire.,2025-03-18 12:30:00
gb,Oxfordshire town is named as the poshest in Britain,"Henley-On-Thames, which is situated just over the Berkshire border in Oxfordshire, is famed for its yearly regatta and particularly pricey properties.",en,Oxfordshire town is named as the poshest in Britain,"Henley-On-Thames, which is situated just over the Berkshire border in Oxfordshire, is famed for its yearly regatta and particularly pricey properties.",2025-03-18 12:30:00
gb,Town near Reading named POSHEST in Britain,"Henley-On-Thames, which is situated just over the Berkshire border in Oxfordshire, is famed for its yearly regatta and particularly pricey properties.",en,Town near Reading named POSHEST in Britain,"Henley-On-Thames, which is situated just over the Berkshire border in Oxfordshire, is famed for its yearly regatta and particularly pricey properties.",2025-03-18 12:30:00
gb,Dozens of exotic green birds spotted across Berkshire by residents,Residents have been sending in pictures of mysterious exotic birds that continuously appear in their back gardens.,en,Dozens of exotic green birds spotted across Berkshire by residents,Residents have been sending in pictures of mysterious exotic birds that continuously appear in their back gardens.,2025-03-18 12:30:00
gb,"It's D-Day for social care. If NI rise passes, the consequence will be devastating","Ahead of tomorrow's Commons vote on the National Insurance Contributions Bill, a leading provider warns that, if the over-stretched care sector is not exempted, it will be at risk of total collapse",en,"It's D-Day for social care. If NI rise passes, the consequence will be devastating","Ahead of tomorrow's Commons vote on the National Insurance Contributions Bill, a leading provider warns that, if the over-stretched care sector is not exempted, it will be at risk of total collapse",2025-03-18 12:30:00
gb,Boots shoppers 'on third tub' of £30 L'Oreal cream that 'plumps lines around lips' - and now it's £10,The £30 wrinkle cream has been reduced to £10 - but you've only got a few hours,en,Boots shoppers 'on third tub' of 30 L'Oreal cream that 'plumps lines around lips' - and now it's 10,The 30 wrinkle cream has been reduced to 10 - but you've only got a few hours,2025-03-18 12:30:00
gb,Dozens of exotic green birds spotted across Berkshire by residents,Residents have been sending in pictures of mysterious exotic birds that continuously appear in their back gardens.,en,Dozens of exotic green birds spotted across Berkshire by residents,Residents have been sending in pictures of mysterious exotic birds that continuously appear in their back gardens.,2025-03-18 12:30:00
gb,"Chocolate box cottage near Stowmarket for sale at £495,000 guide","A chocolate box cottage near Stowmarket is for sale at a guide price of £495,000.",en,"Chocolate box cottage near Stowmarket for sale at 495,000 guide","A chocolate box cottage near Stowmarket is for sale at a guide price of 495,000.",2025-03-18 12:30:00
gb,Huntingdon Rowers secure four wins at Lincoln Head,Huntingdon Boat Club triumphed at the Lincoln Rowing Head and picking up wins at at nine events.,en,Huntingdon Rowers secure four wins at Lincoln Head,Huntingdon Boat Club triumphed at the Lincoln Rowing Head and picking up wins at at nine events.,2025-03-18 12:30:00
gb,Aquarium extension and modernisation construction work ready to commence,Construction work on an extension and modernisation of the award-winning Macduff Marine Aquarium is about to get under way.,en,Aquarium extension and modernisation construction work ready to commence,Construction work on an extension and modernisation of the award-winning Macduff Marine Aquarium is about to get under way.,2025-03-18 12:30:00
gb,'Worse than North Korea': Trump Derangement Syndrome bill sparks furious US backlash,The legislation proposes to make the syndrome recognised as a mental illness in Minnesota.,en,'Worse than North Korea': Trump Derangement Syndrome bill sparks furious US backlash,The legislation proposes to make the syndrome recognised as a mental illness in Minnesota.,2025-03-18 13:03:00
gb,Truth behind Louis Tomlinson and Zara McDermott's two-week romance as 'he makes her smile',Louis Tomlinson and Zara McDermott are said to have been dating for a couple of weeks and are already apparently getting on like a house on fire - with the One Direction singer making the TV star 'smile'.,en,Truth behind Louis Tomlinson and Zara McDermott's two-week romance as 'he makes her smile',Louis Tomlinson and Zara McDermott are said to have been dating for a couple of weeks and are already apparently getting on like a house on fire - with the One Direction singer making the TV star 'smile'.,2025-03-18 13:02:57
gb,"Alexander Isak: Arsenal, Liverpool, Barcelona 'suffer major transfer blow' as stance of Newcastle chief becomes clear","Arsenal, Liverpool and Barcelona all suffer a major blow in their pursuit of Newcastle striker Alexander Isak ahead of the summer transfer window, according to a report.",en,"Alexander Isak: Arsenal, Liverpool, Barcelona 'suffer major transfer blow' as stance of Newcastle chief becomes clear","Arsenal, Liverpool and Barcelona all suffer a major blow in their pursuit of Newcastle striker Alexander Isak ahead of the summer transfer window, according to a report.",2025-03-18 13:02:47
gb,Netflix star Millie Bobby Brown says she still ‘refuses’ to pay for her account,"‘I’m still using my parent’s account,’ admitted the actor",en,Netflix star Millie Bobby Brown says she still refuses to pay for her account,"Im still using my parents account, admitted the actor",2025-03-18 13:02:45
gb,Beamish sales double as Northern Ireland drinkers tap into new stout favourite,"Irish stout brand Beamish is definitely striking a chord with drinkers in Northern Ireland, having experienced double-digit growth in the local on- and off- trades, driven largely by the brand’s strong associations with music and comedy.",en,Beamish sales double as Northern Ireland drinkers tap into new stout favourite,"Irish stout brand Beamish is definitely striking a chord with drinkers in Northern Ireland, having experienced double-digit growth in the local on- and off- trades, driven largely by the brands strong associations with music and comedy.",2025-03-18 13:02:43
