iso_code,title,description,lang_tranlation,title_translated,description_translated,pubDate
de,28 Minuten - Rückkehr der Antipersonenminen / Haushaltsdefizit (23.04.2025) - 29. April 2025 um 03:50 Uhr,"Magazin (F 2025, 46 Min)Seit dem 18. März haben fünf europäische Länder entschieden, aus dem Ottawa-Abkommen auszusteigen, das seit 1997 Antipersonenminen verbietet. Gespräch mit Anne Héry (Handicap International) / Haushaltsdefizit: Sollen die Rentner zur Kasse gebeten werden? Für die Regierung von François Bayrou ist das politische und finanzielle Gleichgewicht in Gefahr.",en,"28 minutes - Return of the anti -person mines / budget deficit (April 23, 2025) - April 29, 2025 at 03:50 a.m.","Magazine (f 2025, 46 min) Since March 18, five European countries have decided to get out of the Ottawa Agreement, which has been banned since 1997. Conversation with Anne Héry (Handicap International) / Budget deficit: Should the pensioners be asked to checkout? For the government of François Bayrou, the political and financial balance is in danger.",2025-04-28 04:34:48
de,Mit offenen Augen - 29. April 2025 um 03:40 Uhr,"Magazin (F 2025, 11 Min)In einem Werbespot seiner liberalen Partei im Vorfeld der kanadischen Parlamentswahlen tritt Premierminister Mark Carney neben Schauspieler Mike Myers auf – und liefert eine klare Antwort auf die Expansionspläne Donald Trumps und den wachsenden Druck der USA auf Kanada.",en,"With open eyes - April 29, 2025 at 3:40 a.m.","Magazine (f 2025, 11 min) In a commercial of his liberal party in the run -up to the Canadian parliamentary elections, Prime Minister Mark Carney appears alongside actors Mike Myers - and provides a clear answer to Donald Trump's expansion plans and the growing pressure of the United States on Canada.",2025-04-28 04:34:48
de,Mit offenen Karten - Im Fokus - 29. April 2025 um 03:35 Uhr,"Magazin (F 2025, 3 Min)""Mit offenen Karten im Fokus"": Täglich drei Minuten Aktuelles und Analysen.",en,"With open cards - in the focus - April 29, 2025 at 3:35 a.m.","Magazine (f 2025, 3 min) ""With open cards in focus"": three minutes of current and analyzes every day.",2025-04-28 04:34:48
de,"Mit Kompass und Köpfchen auf hoher See - Senegal, Dakar - 29. April 2025 um 03:05 Uhr","Dokureihe, Regie: Laurent Sardi (F 2017, 27 Min)Der Katamaran ""Nomade des Mers"" setzt seine Reise über den Atlantik fort und nimmt Kurs nach Süden. Die Sahara-Küsten und Saint-Louis im Senegal wurden erfolgreich umschifft, nun legt Abenteurer Corentin einen Zwischenstopp in Dakar ein. Er will ein Mittel zur Stromversorgung finden – und zwar mit Lowtech-Verfahren. Im Senegal ist der Zugang zu Elektrizität ein Riesenproblem.",en,"With compass and head on the high seas - Senegal, Dakar - April 29, 2025 at 03:05 a.m.","Documentary, director: Laurent Sardi (f 2017, 27 min) The catamaran ""Nomade des Mers"" continues his journey through the Atlantic and takes course south. The Sahara Coasts and Saint-Louis in Senegal were successfully awarded, now adventurer Corentin is making a stopover in Dakar. He wants to find a means of power supply-with low-tech procedures. In Senegal, access to electricity is a huge problem.",2025-04-28 04:34:47
de,Donizetti: Don Pasquale - Staatsoper Hamburg - 29. April 2025 um 01:00 Uhr,"Oper (D 2022, 150 Min)Unter der Regie von David Bösch ist Gaetano Donizettis Opera buffa ""Don Pasquale"" als Neuproduktion an der Staatsoper Hamburg zu sehen. Im Mittelpunkt der komisch-turbulenten Handlung stehen der italienische Star-Bariton Ambrogio Maestri und die australische Sopranistin Danielle de Niese. Die musikalische Leitung des Philharmonischen Staatsorchesters Hamburg hat Matteo Beltrami.",en,"Donizetti: Don Pasquale - State Opera Hamburg - April 29, 2025 at 01:00 a.m.","Opera (D 2022, 150 min) directed by David Bösch can be seen Gaetano Donizetti's Opera Buffa ""Don Pasquale"" as a new production at the Hamburg State Opera. The focus of the strange-turbulent action is the Italian star baritone Ambrogio Maestri and the Australian soprano Danielle de Niese. Matteo Beltrami has the musical direction of the Philharmonic State Orchestra Hamburg.",2025-04-28 04:34:47
de,Afrin und die große Flut - 28. April 2025 um 23:35 Uhr,"Dokumentarfilm von Angelos Rallis (GR 2021, 83 Min)Das 12-jährige Waisenmädchen Afrin lebt in Bangladesch auf den Schlamminseln im Brahmaputra. Jedes Jahr werden die Inseln von Wassermassen überflutet. Hier ist die Naturkatastrophe kein außergewöhnliches Ereignis mehr, sondern Alltag. Wenn die Fluten wieder kommen, wird Afrin im Kampf um das Überleben im Wasser zu einer kleinen Heldin ...",en,"Afrin and the big flood - April 28, 2025 at 11:35 p.m.","Documentary by Angelos Rallis (Gr 2021, 83 min) The 12-year-old orphan girl Afrin lives in Bangladesh on the mud islands in Brahmaputra. The islands are flooded by water masses every year. Here the natural disaster is no longer an exceptional event, but everyday life. When the floods come back, Afrin becomes a little heroine in the fight for survival in the water ...",2025-04-28 04:34:47
de,Spurlos verschwunden - 28. April 2025 um 21:50 Uhr,"Spielfilm von George Sluizer (F/D/NL 1988, 103 Min)Während eines Sommerurlaubs in Frankreich verschwindet die Niederländerin Saskia spurlos an einer Raststätte. Verzweifelt gibt ihr Partner Rex sein berufliches und soziales Leben auf, um sich ausschließlich der Suche nach ihr zu widmen. Nach drei Jahren erfolgloser Nachforschungen erhält er eine seltsame Postkarte ... - Thriller von George Sluizer (1988)",en,"Disappeared without a trace - April 28, 2025 at 9:50 p.m.","Feature film by George Sluizer (F/D/NL 1988, 103 min) During a summer vacation in France, the Dutchman Saskia disappears without a trace at a rest area. Your partner Rex desperately gives up his professional and social life in order to only devote himself to the search for her. After three years of unsuccessful research, he receives a strange postcard ... - Thriller from George Sluizer (1988)",2025-04-28 04:34:47
de,Viper in der Faust - 28. April 2025 um 20:15 Uhr,"Spielfilm von Philippe de Broca (F/GB 2004, 95 Min)1922 in einem Château bei Angers: Nach dem Tod der fürsorglichen Großmutter kehren die Eltern der Brüder Jean und Ferdinand aus Indochina zurück. Doch das freudige Wiedersehen kippt rasch in einen Alptraum: Ihre Mutter entfaltet eine sadistische Grausamkeit. - Philippe de Brocas letztes Werk (2004) und eine der letzten Rollen des gefeierten Jacques Villeret.",en,"Viper in the Faust - April 28, 2025 at 8:15 p.m.","Feature film by Philippe de Broca (f/GB 2004, 95 min) in 1922 in a Château near Angers: After the death of the caring grandmother, the parents of the brothers Jean and Ferdinand from Indochina return. But the joyful reunion quickly tips into a nightmare: her mother unfolds sadistic cruelty. - Philippe de Broca's last work (2004) and one of the last roles of the celebrated Jacques Villeret.",2025-04-28 04:34:47
de,"Re: Bulgariens Winterbräute, zwischen Tradition und Trend - 28. April 2025 um 19:40 Uhr","Reportage (D 2025, 31 Min)Es ist ein farbenfrohes Hochzeitsritual voller spiritueller Metaphern und weltweit einmalig. Die Pomaken, bulgarische Muslime, heiraten nach einem vorislamischen Ritual im Winter. Mustafa Emin setzt sich dafür ein, dass diese Tradition als immaterielles Weltkulturerbe der UNESCO anerkannt wird. Zum Brauch gehört auch eine besonders große Mitgift: ein kompletter Hausstand.",en,"Re: Bulgaria's winter brides, between tradition and trend - April 28, 2025 at 7:40 p.m.","Reportage (D 2025, 31 min) It is a colorful wedding ritual full of spiritual metaphors and unique in the world. The pomakes, Bulgarian Muslims, marry after a pre -Islamic ritual in winter. Mustafa Emin is committed to ensuring that this tradition is recognized as an intangible UNESCO World Heritage Site. The custom also includes a particularly large dowry: a complete household.",2025-04-28 04:34:47
de,morgen|stern: Könnte ein Blackout wie in Spanien auch uns treffen? Die Lage am Morgen,Ein Blackout stürzte den Süden Europas am Montag ins Chaos. Ein mögliches Szenario für Deutschland? Die Bundesnetzagentur ordnet die Lage ein. Was noch wichtig wird.,en,Tomorrow | Stern: Could a Blackout hit us like in Spain too? The situation in the morning,A blackout plunged the south of Europe into chaos on Monday. A possible scenario for Germany? The Federal Network Agency classifies the situation. What is still important.,2025-04-29 03:53:00
de,Geht es den Menschen linksrheinisch besser als rechtsrheinisch?,"Wissenschaftler haben herausgefunden, dass der Einfluss der Römer am Niederrhein immer noch nachzuweisen ist. Was das für uns bedeutet.",en,Is it better for people to the left bank of the Rhine than right bank of the Rhine?,Scientists have found that the influence of the Romans on the Lower Rhine can still be proven. What that means for us.,2025-04-29 03:53:00
de,Notdienst heute in Potsdam: Sprechzeiten am 29.04.2025 - Bereitschaftsärzte und Notapotheken,"Wenn Hausarzt oder Apotheke geschlossen sind: Welche Notaufnahmen, Bereitschaftsärzte und Apotheken-Notdienste am 29.04.2025 in Potsdam zuständig sind, lesen Sie hier.",en,"Emergency service today in Potsdam: Office hours on April 29, 2025 - on -call doctors and emergency pharmacies","If the family doctor or pharmacy are closed: Which emergency rooms, on-call doctors and pharmacy emergency services on April 29, 2025 are responsible in Potsdam, read here.",2025-04-29 03:52:57
de,Notdienst heute in Frankfurt (Oder): Diese Notapotheken und Bereitschaftspraxen haben am 29.04.2025 geöffnet,Ob akute Beschwerden oder dringender Medikamentenbedarf: Auch außerhalb der Sprechzeiten gibt es in Frankfurt (Oder) passende medizinische Anlaufstellen. Adressen und Öffnungszeiten für Apotheken-Notdienst und Bereitschaftsärzte am 29.04.2025 hier im Überblick.,en,"Emergency service today in Frankfurt (Oder): These emergency pharmacies and standby practices are open on April 29, 2025","Whether acute complaints or urgent need for medication: there are also suitable medical contact points in Frankfurt (Oder) outside of office hours. Addresses and opening times for pharmacy emergency service and on-Approval doctors on April 29, 2025 at a glance.",2025-04-29 03:52:53
de,Notdienst heute in Cottbus: Ihre Notfallkontakte am 29.04.2025,"Auch außerhalb der Sprechzeiten steht Ihnen in Cottbus medizinische Hilfe zur Verfügung. Erfahren Sie hier Adressen und Öffnungszeiten für den Apotheken-Notdienst, Notaufnahmen und Bereitschaftsärzte am 29.04.2025 in Ihrer Nähe.",en,"Emergency service today in Cottbus: Your emergency contacts on April 29, 2025","Medical help is also available in Cottbus outside of office hours. Find out addresses and opening times for the pharmacy emergency service, emergency rooms and standby doctors on April 29, 2025 near you.",2025-04-29 03:52:51
de,Notdienst heute in Brandenburg an der Havel: Sprechzeiten am 29.04.2025 - Bereitschaftsärzte und Notapotheken,"Ob akute Beschwerden oder dringender Medikamentenbedarf: Auch außerhalb der Sprechzeiten gibt es in Brandenburg an der Havel passende medizinische Anlaufstellen. Adressen und Öffnungszeiten für Apotheken-Notdienst, Notaufnahmen und Bereitschaftsärzte am 29.04.2025 hier im Überblick.",en,"Emergency service today in Brandenburg an der Havel: Office hours on April 29, 2025 - on -call doctor and emergency pharmacies","Whether acute complaints or urgent need for medication: there are also suitable medical contact points outside of office hours in Brandenburg an der Havel. Addresses and opening times for pharmacy emergency service, emergency rooms and standby doctors on April 29, 2025 at a glance.",2025-04-29 03:52:46
de,Notdienst heute in Berlin: Ihre Notfallkontakte am 29.04.2025,"Auch außerhalb der Sprechzeiten steht Ihnen in Berlin medizinische Hilfe zur Verfügung. Erfahren Sie hier Adressen und Öffnungszeiten für den Apotheken-Notdienst, Notaufnahmen und Bereitschaftsärzte am 29.04.2025 in Ihrer Nähe.",en,"Emergency service today in Berlin: Your emergency contacts on April 29, 2025","Medical help is also available in Berlin outside of office hours. Find out addresses and opening times for the pharmacy emergency service, emergency rooms and standby doctors on April 29, 2025 near you.",2025-04-29 03:52:44
de,Witz des Tages: Treffen sich zwei Autofahrer auf der Straße ...,"Damit Sie voller Freude in den Dienstag starten, haben wir auch heute drei geniale Witze für Sie. Willkommen zu unserer Rubrik Witz des Tages!",en,Joke of the day: two drivers meet on the street ...,"So that you can start Tuesday with joy, we still have three brilliant jokes for you today. Welcome to our joke section of the day!",2025-04-29 03:52:38
de,Notdienst heute im Landkreis St. Wendel: Die Notapotheken und Bereitschaftsärzte am 29.04.2025,"Wenn Hausarzt oder Apotheke geschlossen sind: Welche Bereitschaftsärzte und Apotheken-Notdienste am 29.04.2025 im Landkreis St. Wendel zuständig sind, lesen Sie hier.",en,"Emergency service today in the St. Wendel district: The emergency pharmacies and on -call doctors on April 29, 2025","If the family doctor or pharmacy are closed: Which on-call doctors and pharmacy emergency services are responsible on April 29, 2025 in the St. Wendel district, read here.",2025-04-29 03:52:04
de,Was im Leben wichtig ist: Mutter (100) und Sohn (80) bilden in Mechernich ein eingespieltes Duo,Mutter und Sohn leben in Mechernich Tür an Tür und unterstützen sich gegenseitig. Beide blicken auf bewegte Zeiten zurück.,en,What is important in life: mother (100) and son (80) form a well -established duo in Mechernich,Mother and son live in the door in Mechernich and support each other. Both look back on moving times.,2025-04-29 03:52:00
de,Notfälle: Teile Ost-Berlins nach Rohrbruch ohne Wasser,Nach einem Rohrbruch am Platz der Vereinten Nationen blieb in vielen Haushalten der Wasserhahn trocken.,en,Emergencies: parts of East Berlin after breaking the pipe without water,"After a pipe break on the United Nations Square, the tap remained dry in many households.",2025-04-30 04:22:33
de,Bis zu 400 Euro pro Paar - Kann man in teuren Superschuhen schneller laufen?,"Superschuhe revolutionieren den Laufsport. BILD weiß, ob sie sich auch für Hobby-Läufer eignen.",en,Up to 400 euros per couple - can you run faster in expensive super shoes?,Super shoes revolutionize running. Image knows whether they are also suitable for hobby runners.,2025-04-30 04:22:16
de,Auf diesen Strecken in Frankreich ist der Zug fast doppelt so schnell wie ein Flugzeug,"Im Jahr 2023 hat Frankreich ein Verbot von Kurzstreckenflügen im Inland eingeführt, wenn es eine Bahnalternative von weniger als zweieinhalb Stunden gibt.",en,"On these routes in France, the train is almost twice as fast as an aircraft","In 2023, France introduced a ban on short -haul flights in Germany if there is a rail alternative of less than two and a half hours.",2025-04-30 04:22:13
de,Tag gegen Lärm: Diese Tipps aus dem Karlsruher Norden sorgen für mehr Ruhe und Konzentration im Alltag,"Lärm im Alltag belastet viele Menschen in Karlsruhe spürbar. Fachleute geben nun konkrete Tipps, wie Ruhe und Fokus wieder gelingen.",en,Day against noise: These tips from the north of Karlsruhe ensure more peace and concentration in everyday life,Noise in everyday life is noticeable in many people in Karlsruhe. Experts now provide concrete tips on how to succeed in peace and focus.,2025-04-30 04:22:00
de,Beschäftigte der Stadtwerke sehnen Rückkauf herbei,Der Rückkauf der Bielefelder Anteile an den Stadtwerken Gütersloh nimmt Formen an. Ein erster Schritt ist erfolgt.,en,Employees of Stadtwerke Tende Corporate Corporation,The buyback of the Bielefeld shares in the Gütersloh municipal utility company takes on forms. A first step has taken place.,2025-04-30 04:22:00
de,"Polizei Hameln: Unfälle, Verbrechen, Vermisstenmeldungen – aktuelle Meldungen aus der Region (30.04.2025)","Ob Verkehrsunfälle, Sperrungen, Vermisstenmeldungen, Gewaltdelikte oder anderweitige Verbrechen. Aktuelle Polizei- und Verkehrsmeldungen aus Hameln finden Sie ab sofort rund um die Uhr auch in unserem Liveticker.",en,"Police Hameln: accidents, crimes, missing persons - current reports from the region (04/30/2025)","Whether traffic accidents, closures, missing persons, violent crimes or other crimes. Current police and traffic reports from Hameln can now also be found around the clock in our live ticker.",2025-04-30 04:21:45
de,Erste Schätzungen: JAPAN POST BANK stellt Quartalsergebnis zum abgelaufenen Jahresviertel vor,"JAPAN POST BANK wird voraussichtlich am 15.05.2025 Zahlen zum jüngsten Quartal vorlegen, das am 31.03.2025 abgelaufen ist.Die Schätzungen von 3 Analysten belaufen sich beim EPS auf durchschnittlich 24,10 JPY ...",en,First estimates: Japan Post Bank introduces a quarterly result for the past annual quarter,"Japan Post Bank is expected to be presented on May 15, 2025 for the recent quarter, which expired on March 31, 2025.",2025-04-30 04:21:34
de,Erste Schätzungen: JAPAN POST veröffentlicht Zahlen zum vergangenen Quartal,"JAPAN POST stellt voraussichtlich am 15.05.2025 die jüngste Quartalsbilanz zum am 31.03.2025 abgelaufenen Quartal vor.Die Prognose von 1 Analyst erwartet beim Ergebnis je Aktie für das vergangene Quartal 34,42 JPY. ...",en,First estimates: Japan Post published numbers for the past quarter,"Japan Post is expected to present the recent quarterly balance on May 31, 2025 on May 15, 2025. ...",2025-04-30 04:21:34
de,Erste Schätzungen: Endurance Technologies veröffentlicht Zahlen zum vergangenen Quartal,"Endurance Technologies präsentiert voraussichtlich am 15.05.2025 die Bilanzzahlen zum am 31.03.2025 beendeten Jahresviertel.Die Schätzungen von 5 Analysten belaufen sich im Durchschnitt auf 14,76 INR ...",en,First estimates: Endurance Technologies published numbers for the past quarter,"Endurance Technologies presents on May 15, 2025 to present the balance sheet figures for the annual quarter of the year. The estimates of 5 analysts amount to an average of 14.76 inr ...",2025-04-30 04:21:34
de,Erste Schätzungen: Addtech Registered B legt die Bilanz zum abgelaufenen Quartal vor,Addtech Registered B veröffentlicht voraussichtlich am 15.05.2025 auf der all-dreimonatlichen Finanzkonferenz die Zahlen zum am 31.03.2025 abgelaufenen Jahresviertel.5 Analysten erwarten beim EPS im Schnitt ...,en,First estimates: Addtech Registered B submits the balance to the past quarter,"Addtech Registered B is expected to publish the figures for the annual quarter of the year on March 31, 2025.",2025-04-30 04:21:34
de,Bolivien: Verfahren gegen Evo Morales wird eingestellt,"Boliviens Ex-Präsidenten wurde Missbrauch und Menschenhandel vorgeworfen. Jetzt werden alle Ermittlungen ausgesetzt, Morales will erneut kandidieren.",en,Bolivia: Procedure against Evo Morales is discontinued,"Bolivia's ex-president was accused of abuse and human trafficking. Now all investigations are being suspended, Morales wants to run again.",2025-05-01 05:17:59
de,Cristiano Ronaldo: Star fliegt mit Al-Nassr aus AFC Champions League,"Mit Al-Nassr stand Cristiano Ronaldo unter den letzten Vier der asiatischen Champions League. Der Gegner dort war aber zu stark. Nach dem Spiel äußert sich ""CR7"" emotional.",en,Cristiano Ronaldo: Star flies with al-wet rass from AFC Champions League,"With Al-Nassr, Cristiano Ronaldo was among the last four of the Asian Champions League. The opponent there was too strong. After the game, ""CR7"" comments emotionally.",2025-05-01 05:17:38
de,Mannheim - Balkon stürzt ein,Mannheim – In Mannheim-Käfertal stürzte am 30.04.2025 gegen 21 Uhr ein Balkon im zweiten Stock eines Gebäudes unerwartet ein. Zum Gl...,en,Mannheim - balcony collapses,"Mannheim-In Mannheim-Käfertal, a balcony on the second floor of a building unexpectedly collapsed on April 30, 2025. To GL ...",2025-05-01 05:17:38
de,In eigenem Namen: Stefan Kornelius wird Regierungssprecher von Friedrich Merz – Politik,"Stefan Kornelius, lange Abteilungsleiter des Abteilungs Süddeutsche Zeitungwird ein Sprecher der Bundesregierung. Kornelius ist seit 1991 bei der SZ, zuerst als Korrespondent in Bonn, während der Präsidentschaft von Bill Clinton in Washington und dann als stellvertretender Büroleiter in Berlin. Im Jahr 2000 übernahm Kornelius das Management der außenpolitischen Abteilung und war seit 2021 Leiter der ...",en,In its own name: Stefan Kornelius becomes government spokesman for Friedrich Merz - Politics,"Stefan Kornelius, long department head of the Süddeutsche Zeitung department, a spokesman for the federal government. Kornelius has been at the SZ since 1991, first as a correspondent in Bonn, during the presidency of Bill Clinton in Washington and then as deputy office manager in Berlin. In 2000, Kornelius took over the management of the foreign policy department and had been head of ... since 2021",2025-05-01 05:17:12
de,Krebsgefahr: Darf man geräucherte Wurst grillen?,"Fleisch gehört für viele zu einer Grillparty dazu. Doch einige Produkte können zur Gefahr für die Gesundheit werden, sobald sie auf dem Rost landen.",en,Cancer risk: Can you grill smoked sausage?,"For many, meat is part of a grill party. But some products can become a danger to health as soon as they land on the rust.",2025-05-01 05:17:00
de,Lakers fliegen aus den Playoffs,Der Deutsche spielt erstmals für die Lakers. Doch das Team um James und Doncic verpasst die zweite Runde der NBA-Play-offs.,en,Lakers fly out of the playoffs,The German plays for the first time for the Lakers. But the team around James and Doncic missed the second round of the NBA play-offs.,2025-05-01 05:17:00
de,1. Mai 2025 - Demos im Live-Ticker: Welle des Protests heute am 1. Mai – Polizei rüstet sich gegen Gewalt,"PanoramaDer Tag der Arbeit gilt traditionell als Anlass für zahlreiche Mai-Demonstrationen in ganz Deutschland. Berlin, Leipzig, Chemnitz und Hamburg gelten als Brennpunkte. Aber auch anderorts...",en,"May 1, 2025 - Demos in the live ticker: Wave of the protest today on May 1st - police are preparing against violence","Panoramada Day of work is traditionally considered a reason for numerous May demonstrations across Germany. Berlin, Leipzig, Chemnitz and Hamburg are the focal points. But also elsewhere ...",2025-05-01 05:16:45
de,Ingersleben - Einbrecher erbeutet 16 000 Euro aus Haus,Ingersleben – Ein Einbruch in ein Einfamilienhaus in der Mühlgasse sorgte am Abend für Aufregung. Zwischen 18 Uhr und 18:45 Uhr ver...,en,"Ingersleben - burglars captured 16,000 euros from the house",Ingersleben - A break -in into a family home in Mühlgasse caused excitement in the evening. Between 6 p.m. and 6:45 p.m.,2025-05-01 05:16:31
de,"Kretschmann fordert ""Mentalitätsschub""","Baden-Württembergs Ministerpräsident Kretschmann mahnt, die Menschen in Deutschland müssten aufwachen. Konkret spricht der Grünen-Politiker über Arbeitszeiten und die Rente mit 63.",en,"Kretschmann calls for ""Mentality boost""","Baden-Württemberg's Prime Minister Kretschmann warns that people in Germany should wake up. Specifically, the Green politician talks about working hours and the pension at 63.",2025-05-01 05:16:00
de,„Das Supertalent“: Das macht Gewinner Jayden mit 50.000 Euro,Jayden (17) hat die RTL-Show „Das Supertalent“ gewonnen. Jetzt spricht der Duisburger über seine Musikpläne und seinen Berufswunsch.,en,"""The Supertalent"": This makes winners Jayden with 50,000 euros","Jayden (17) won the RTL show ""The Super Talent"". Now the Duisburger talks about his music plans and his career aspiration.",2025-05-01 05:16:00
de,„Völlig daneben“ - Deutliche Kritik an Toni Kroos!,Klare Worte an die Real-Legende.,en,"""Completely wrong"" - clear criticism of Toni Kroos!",Clear words to the real legend.,2025-05-02 05:46:53
de,Franz Wagner lässt EM-Teilnahme offen,Nach dem Aus in den Playoffs der NBA ist Franz Wagner einem klaren Bekenntnis zu einer Teilnahme an der Europameisterschaft mit der deutschen Nationalmannschaft ausgewichen.,en,Franz Wagner leaves the EM participation open,"After the end of the NBA's playoffs, Franz Wagner gave a clear commitment to participating in the European Championship with the German national team.",2025-05-02 05:46:37
de,Haseloff: Ost-West-Unterschiede noch Jahrzehnte sichtbar,,en,Haseloff: East-West differences still visible for decades,,2025-05-02 05:46:25
de,Wiedervereinigung: Haseloff: Ost-West-Unterschiede noch Jahrzehnte sichtbar,"Auch 35 Jahre nach dem Mauerfall wird in Deutschland weiter über Ost und West debattiert. Sachsen-Anhalts Regierungschef Haseloff geht davon aus, dass Unterschiede noch lange erkennbar sein werden.",en,Reunification: Haseloff: East-West differences still visible for decades,"Even 35 years after the fall of the Berlin Wall, there is a debate in Germany via East and West. Saxony-Anhalt Prime Minister Haseloff assumes that differences will be recognizable for a long time.",2025-05-02 05:46:25
de,Haseloff: Ost-West-Unterschiede noch Jahrzehnte sichtbar,,en,Haseloff: East-West differences still visible for decades,,2025-05-02 05:46:25
de,Wiedervereinigung: Haseloff: Ost-West-Unterschiede noch Jahrzehnte sichtbar,,en,Reunification: Haseloff: East-West differences still visible for decades,,2025-05-02 05:46:25
