iso_code,title,description,lang_tranlation,title_translated,description_translated,pubDate
cz,"Povedu poklidný, demokratický boj jako Luther King, řekla odsouzená Le Penová","Vůdkyně francouzské krajně pravicové strany Národní sdružení (RN) Marine Le Penová, které v pondělí soud uložil zákaz výkonu veřejných funkcí, slíbila, že povede poklidný a demokratický boj. Inspirací je jí vůdce hnutí za práva černochů v USA Martin Luhter King, řekla na sjezdu krajně pravicové strany Liga. Rozsudek, který jí uznal vinnou ze zpronevěry fondů Evropské unie, označila za násilí a konec fungování demokracie ve Francii.",en,"I will lead a peaceful, democratic struggle like Luther King, said convicted Le Pen","The leader of the French far -right party of the National Association (RN) Marine Le Pen, who imposed a ban on public office on Monday, promised to run a peaceful and democratic struggle. It is inspired by the leader of the Black Rights Movement in the US Martin Luhter King, said at the congress of the far -right party league. The verdict, which recognized her guilty of embezzlement of the European Union funds, described as violence and the end of the functioning of democracy in France.",2025-04-06 18:47:00
cz,Sparta znovu ukázala na Kováře: perfektní výkon i vteřiny strachu,"V těžkých chvílích do něj realizační tým vkládá důvěru, kterou splácí skvělými výkony. Brankář Jakub Kovář úspěšně čelil všem střelám hokejistů Komety Brno a zasadil se o výhru 1:0. Pražané srovnali stav semifinálové série na 2:2 na zápasy.",en,Sparta again pointed to the blacksmith: perfect performance and second of fear,"In difficult moments, the implementation team puts confidence in it, which is repaid with great performances. Goalkeeper Jakub Kovář successfully faced all shots of hockey players Kometa Brno and planted for a win 1: 0. Praguers compared the status of the semi -final series to the 2: 2 for matches.",2025-04-06 18:46:34
cz,"Farmáři nedodržují nařízení, Slovensko zpřísní kontroly kvůli slintavce",Zpřísnění kontrol se na Slovensku dotkne více než 90 velkochovů skotu a prasat. Podle ministra zemědělství Richarda Takáče někteří zemědělci nedodržují doposud zavedená opatření.,en,"Farmers do not comply with the regulation, Slovakia tightens checks for a drool","The tightening of the inspections in Slovakia will affect more than 90 large -scale cattle and pigs. According to the Minister of Agriculture Richard Takáč, some farmers do not follow the measures established so far.",2025-04-06 18:45:42
cz,"Tlak je obrovský, cítí v Boleslavi po další porážce. Budoucnost? Brännström odpoví později","Toužili znovu po pohárech, místo toho se však klepou, aby neskončili ve skupině o záchranu. Krize fotbalistů Mladé Boleslavi se prohlubuje, nedělní porážka 0:1 s Duklou pro ně byla v lize pátá za sebou. „Skousnout to nějak musíme. Výsledky nemusejí být vždy fér, ale celkově fotbal spravedlivý je. A my teď nehrajeme dobře,“ pronesl trenér Středočechů Andreas Brännström.",en,"The pressure is huge, it feels in Boleslav after another defeat. Future? Brännström replies later","They longed for the cups again, but instead they are knocking not to end up in the group to rescue. The crisis of footballers Mladá Boleslav is deepening, Sunday defeat 0: 1 with Dukla was fifth in the league. ""We have to bite it somehow. The results may not always be fair, but overall football is fair. And we are not playing well now,"" said Central Bohemian coach Andreas Brännström.",2025-04-07 04:06:52
cz,Jak se orientovat na amerických trzích v roce 2025 podle Fidelity?,"Po období velmi dobré výkonnosti nyní americké trhy vstoupily do období zvýšené volatility, protože trhy řeší chování současné administrativy. USA i tak zůstávají pro investory atraktivním trhem.",en,How to focus on the American markets in 2025 according to Fidelity?,"After a period of very good performance, US markets have now entered the period of increased volatility because the markets are dealing with the behavior of contemporary administration. The US still remains an attractive market for investors.",2025-04-07 04:06:00
cz,Ministr Kupka: První autonomní vlak se poprvé rozjel na české železnici,Komentář na svém veřejném facebookovém profilu k prvnímu autonomnímu vlaku v ČR.,en,Minister Kupka: The first autonomous train first started on Czech railway,Commentary on his public Facebook profile for the first autonomous train in the Czech Republic.,2025-04-07 04:04:00
cz,"Zub, který nebolí, je zdravý a další mýty o našem chrupu",Máme nejhorší zuby v Evropě. Minimálně jeden kaz mělo podle průzkumů WHO přes osmdesát procent Čechů. Co opomíjíme u sebe i u dětí? A jak lze zabránit parodontóze?,en,A tooth that does not hurt is healthy and other myths about our teeth,"We have the worst teeth in Europe. According to WHO surveys, over eighty percent of Czechs had at least one decay. What do we neglect with ourselves and children? And how can you prevent periodontitis?",2025-04-07 04:02:00
cz,"Poprvé rakovinu porazila, podruhé Anička Slováčková hrála o každý den","Když se v roce v říjnu roku 2019 Anička Slováčková svěřila médiím, že má rakovinu prsu, asi nikdo netušil, jaký konec to mladé zpěvačce přinese. Zápas s nemocí sváděla statečně šest let, ale byl to boj, který nemohla vyhrát.",en,"For the first time she defeated cancer, for the second time Anna Slováčková played for every day","When Anna Slováčková confided to the media in October 2019 that she had breast cancer, no one knew what the end of the young singer would bring. She had been bravely for six years, but it was a struggle that she couldn't win.",2025-04-07 04:01:00
cz,"Po Menšíkově triumfu přišla tvrdá kritika hry. Tímhle škodí tenisu, tvrdí Mouratoglou","Byla to hodně překvapivá slova jen pár dnů poté, co Jakub Menšík v 19 letech zvedl nad hlavu trofej pro vítěze Miami Open.",en,"After Menšík's triumph came hard criticism of the game. This is harmful to tennis, says Mouratogle",They were very surprising words just a few days after Jakub Menšík raised the trophy for the winners of Miami Open at the age of 19.,2025-04-07 04:00:52
cz,"České firmy v éře Trumpova chaosu: Exportéři se probouzejí z amerického snu, investoři sní dál","Na současnou éru Trumpova úřadování budou mít jednou čeští podnikatelé nejrůznější vzpomínky. Některým exportérům se zhroutí dříve lákavé americké plány, jiné firmy možná pozastaví přímou expanzi do USA. Nadšení investoři, kteří nepřestávají sázet na dlouhodobé přednosti největší světové ekonomiky, ale stále věří, že budou oslavovat.Velké téma o přesunu českého byznysu do USA čtěte v novém e15 magazínu, který vychází v pondělí 7. dubna.",en,"Czech companies in the era of Trump's chaos: Exporters are waking up from the American dream, investors eat further","Czech entrepreneurs will have various memories of the current era of Trump's office. Some exporters will collapse the previously tempting US plans, other companies may suspend direct expansion to the US. Enthusiastic investors who continue to bet on the long -term advantages of the world's largest economy, but still believe that they will celebrate. Read the E15 magazine, which is published on Monday 7 April.",2025-04-07 04:00:00
cz,Ještěd v šatníku? Trojice přátel propojila módu a lásku ke krásám Česka,"Láska k cestování, objevování a kráse přírody se snoubila s touhou tvořit srdcem. Tak vznikla severočeská značka RaJOn, která odráží hrdost k vlasti a obdiv k městům, historii a kultuře. Prvním motivem se stal Ještěd.",en,Ještěd in the wardrobe? Trinity friends connected fashion and love for the beauty of the Czech Republic,"The love of traveling, discovering and the beauty of nature has combined with a desire to form a heart. This is how the North Bohemian Rajon brand was created, which reflects the pride in the homeland and admiration for cities, history and culture. Ještěd was the first motive.",2025-04-07 04:00:00
cz,"Nové dávky 2026 a 2027: hlídačkovné pro studující rodiče, příspěvek na studium pro chudší studenty i prodloužení výplaty náhradního výživného","Studenti ze sociálně slabších rodin budou moci žádat o příspěvek na vysokoškolské studium. Studenti, kteří mají dítě do 3 let věku a pobírají RP, získají nárok na tzv. hlídačkovné. Maximální počet výplat náhradního výživného se zvýší na 72 měsíců.",en,"New doses 2026 and 2027: Watchtail for students, study allowance for poorer students and extension of substitute maintenance payments",Students from socially weaker families will be able to apply for a contribution to higher education. Students who have a child under 3 years of age and receive RP will be entitled to a so -called guard. The maximum number of substitute maintenance payments will be increased to 72 months.,2025-04-07 04:00:00
cz,Voda z Česka teče do tří moří,"Také voda má na zemském povrchu své místo. I když v Česku tvoří pouze 2,2 % celkové rozlohy, její význam rozhodně není zanedbatelný. Vodní toky na území České republiky rozděluje Ministerstvo zemědělství na významné vodní toky v celkové délce 16 326.",en,Water from the Czech Republic flows into three seas,"Also, water has its place on the Earth's surface. Although only 2.2 % of the total area in the Czech Republic, its meaning is certainly not negligible. Watercourses in the Czech Republic are divided by the Ministry of Agriculture into important watercourses in a total length of 16 326.",2025-04-07 04:00:00
cz,Jak reagovat na americká cla. Ministři obchodu EU se sejdou v Lucemburku,"Evropská unie řeší, jak se postavit k clům vyhlášeným americkým prezidentem Donaldem Trumpem. V pondělí se kvůli tomu sejdou v Lucemburku unijní ministři obchodu. Česko zastoupí ministr Lukáš Vlček (STAN). Ten zavedení cel považuje za velkou chybu.",en,How to respond to the American CLA. EU trade ministers will meet in Luxembourg,"The European Union is dealing with how to stand up to the Clems renowned by US President Donald Trump. On Monday, EU Ministers of trade will meet in Luxembourg. The Czech Republic will be represented by Minister Lukáš Vlček (STAN). He considers the introduction of cells a big mistake.",2025-04-07 04:37:38
cz,Obchodní centra prožívají renesanci. Investoři do nich vkládají miliardy,"Po letech nejistoty způsobených pandemií a inflací se obchodní centra v Česku opět dostala do popředí zájmu. Lidé se do nich vracejí nejen za nákupy, ale i za zábavou. Utrácí tam navíc stále více peněz, což přitahuje investory, pro něž nákupní domy představují šanci, jak zhodnotit své peníze.",en,The shopping centers are experiencing a Renaissance. Investors put billions of,"After years of uncertainty caused by pandemies and inflation, shopping centers in the Czech Republic again came to the forefront. People return to them not only for shopping but also for fun. Moreover, he is spending more and more money there, which attracts investors for which shopping houses are a chance to appreciate their money.",2025-04-07 04:30:00
cz,"GLOSA: Živě z New Yorku, je sobota večer! Aneb takto se dělá televizní zábava","Nikdo jim nevěřil a jejich show dost možná nikdy neměla spatřit světlo světa. Měli se stát dočasnou loutkou v rukou televizních mocipánů své doby. Odhodlání, odvaha i talent si však svou cestu prorazily a Spojené státy americké díky tomu už 50 let v sobotu večer slýchají známou větu: „Live from New York, it’s Saturday Night.“",en,"Glosa: Live from New York, it's Saturday evening! Or this is done by television entertainment","No one believed them and their show may have never seen the light of day. They were supposed to become a temporary puppet in the hands of the TV power of their time. However, determination, courage and talent have broken their way, and the United States has been hearing a well -known sentence for 50 years on Saturday evening: ""Live from New York, It’s Saturday Night.""",2025-04-07 04:30:00
cz,Na sítích zabodovali s kamennou kuchyní. Díky neobvyklé volbě svůj dům milují,"Manželský pár proslavila jejich kamenná kuchyně navozující nejen středomořskou atmosféru. Proč jim někteří nevěří, že přestavbu zvládli svépomocí?",en,They scored a stone kitchen on the nets. Thanks to the unusual choice they love their house,"The married couple became famous for their stone cuisine, which evokes not only the Mediterranean atmosphere. Why don't some trust them that they managed to convert themselves by their own?",2025-04-07 04:30:00
cz,"🎧 Správný odpočinek je dnes pro sportovce větší věda než trénink, říká Jan Koukal","MediCast je podcastová série e15, ve které šéfredaktor Nikita Poljakov se spolumoderátorem Tomášem Drbalem ze společnosti BTL probírají témata spojená se světem medicíny, technologií a byznysu. Hostem dalšího dílu podcastu byl Jan Koukal, historicky nejúspěšnější český squashista, který se v současnosti věnuje sport managementu a práci s mladými talenty.",en,"🎧 The right rest is more science for athletes today than training, says Jan Koukal","Medicast is a podcast series E15, in which the editor -in -chief Nikita Poljakov with co -moderator Tomáš Drbal of BTL discusses topics associated with the world of medicine, technology and business. The guest of another episode of the podcast was Jan Koukal, the most successful Czech squash player, who is currently engaged in sport management and work with young talents.",2025-04-07 04:30:00
cz,"Někdy si musíte vzít lék, prohlásil Trump. Pokles trhů ho neznepokojuje","Základní desetiprocentní clo na dovozy ze zahraničí začaly USA uplatňovat od soboty. Od středy mají začít platit zvýšená cla. Ta se týkají jen některých zemí, mezi nimi i EU, na kterou budou USA uplatňovat dvacetiprocentní clo.",en,"Sometimes you have to take a medicine, Trump said. The drop in markets does not worry him","The US has begun to apply the basic 10 % customs duties from abroad since Saturday. From Wednesday, increased duties are to start to pay. This applies only to some countries, including the EU, to which the US will apply 20 % duty.",2025-04-07 04:24:18
cz,"Nahradí roboti lékaře? V budoucnu značnou část práce převezmou, tvrdí expert","Lékařství je jednou z oblastí, kde je často vidět nové úspěchy technologií. Od chytrých umělých končetin po algoritmy schopné odhalit nádory na rentgenových snímcích. Velký prostor pro růst má také robotika a chytrá kybernetika.",en,"Will the robots replace the doctor? A large part of the work will be taken over in the future, the expert says",Medicine is one of the areas where new technology achievements are often seen. From smart artificial limbs to algorithms capable of detecting tumors on X -ray images. Robotics and smart cybernetics also have a large space for growth.,2025-04-07 04:20:00
cz,Jihočech naučil hvězdy oblékat české kimono. Nosí ho i bojovník UFC Procházka,Miloslav Schwarz proměnil svou lásku ke karate v mezinárodně uznávanou značku Kaze. Začínal skromně ve Slavonicích v jižních Čechách. Záhy se však jeho kimona a sportovní vybavení staly synonymem kvality a používají je světoví šampioni i hollywoodské hvězdy.,en,South Bohemia taught the stars to dress Czech kimono. The UFC Warrier Wears him,"Miloslav Schwarz has transformed his love for karate into an internationally recognized Kaze brand. He started modestly in Slavonice in South Bohemia. Soon, however, his kimonos and sports equipment have become synonymous with quality and are used by world champions and Hollywood stars.",2025-04-07 04:20:00
cz,Jak reagovat na americká cla. Ministři obchodu EU se sejdou v Lucemburku,"Evropská unie řeší, jak se postavit k clům vyhlášeným americkým prezidentem Donaldem Trumpem. V pondělí se kvůli tomu sejdou v Lucemburku unijní ministři obchodu. Česko zastoupí ministr Lukáš Vlček (STAN). Ten zavedení cel považuje za velkou chybu.",en,How to respond to the American CLA. EU trade ministers will meet in Luxembourg,"The European Union is dealing with how to stand up to the Clems renowned by US President Donald Trump. On Monday, EU Ministers of trade will meet in Luxembourg. The Czech Republic will be represented by Minister Lukáš Vlček (STAN). He considers the introduction of cells a big mistake.",2025-04-07 04:17:00
cz,Legendární zápasník MMA McGregor chce být prezidentem. Má šanci?,"Conora McGregora znají zejména fanoušci sportu, konkrétně smíšených bojových umění, fungujících pod zkratkou MMA. Asi největší světová legenda tohoto stále populárnějšího bojového sportu se nyní rozhodla vstoupit do světa politiky. Na konci března totiž nyní třiceti šestiletý sportovec oznámil, že bude kandidovat na funkci irského prezidenta. Nejbližší hlasování o nové irské hlavě státu se při tom musí uskutečnit do letošního 11. listopadu.",en,The legendary wrestler MMA McGregor wants to be president. Does he have a chance?,"Conor McGregor is known mainly by sports fans, namely mixed martial arts, operating under the abbreviation MMA. Perhaps the world's greatest legend of this increasingly popular combat sport has now decided to enter the world of politics. At the end of March, the thirty -six -year -old athlete has now announced that he will run for the post of Irish president. The closest vote on the new Irish head of the state must take place in this year's 11th November.",2025-04-07 04:15:00
cz,Pardubice přehrály ve třetím semifinále Hradec,"Pardubice - Hokejisté Pardubic porazili ve třetím semifinále doma Hradec Králové 4:0 a ujali se v sérii na čtyři vítězné zápasy vedení 2:1. Dynamo rozhodlo třemi góly mezi 12. a 17. minutou, o které...",en,Pardubice lost in the third semifinal Hradec,"Pardubice - Hockey players of Pardubice defeated Hradec Králové 4: 0 in the third semifinals and took the series for four winning matches 2: 1. Dynamo decided three goals between the 12th and 17th minute, which ...",2025-04-07 18:34:00
cz,"Pardubický Sedlák po faulu nedohrál zápas s Hradcem Králové. ‚Je stabilizovaný v nemocnici,‘ hlásí klub",Kapitán hokejistů Pardubic Lukáš Sedlák skončil po pár minutách třetího semifinále extraligy v nemocnici a podle informací klubu je ve stabilizovaném stavu. Led opustil na nosítkách v 7. minutě po faulu královéhradeckého obránce Martina Pláňka.,en,"Pardubice farmer after foul did not play match with Hradec Králové. 'Is stabilized in the hospital,'",Pardubice hockey captain Lukáš Sedlák ended after a few minutes of the third semi -final of the extra -league in the hospital and according to the club's information he is in a stabilized state. He left the ice on a stretcher in the 7th minute after the foul of Hradec Králové defender Martin Pláňka.,2025-04-07 18:34:00
cz,"Druhé vítězství, ale i ztráta kapitána. Pardubice přehrály Mountfield 4:0","Jasné vitězství ale také strach o spoluhráče přinesl hokejistům Pardubic třetí duel semifinálového derby proti Hradci Králové. Hráči z města perníku rozhodli o svém triumfu třemi brankami už v první dvacetiminutovce, v ní ale také ztratili Lukáše Sedláka, jehož museli po ataku protihráče odvážet z ledu na nosítkách a skončil v nemocnici.",en,"The second victory, but also the loss of the captain. Pardubice played Mountfield 4: 0","But the third duel of the semifinal derby against Hradec Králové also brought clear Vitusism to the teammates. Players from the city of Gingerbread decided on their triumph with three goals already in the first 20 minutes, but also lost Lukáš Sedlak, who had to take the opponent from the ice on the stretcher and ended up in the hospital.",2025-04-07 18:33:00
cz,Pardubice - Hradec 4:0. Hladký návrat Dynama do vedení. Ztráta Sedláka spustila lavinu,"Hokejisté Pardubic ve třetím semifinále play off Tipsport extraligy zvítězili 4:0 nad Hradcem Králové a dostali se do vedení 2:1 na zápasy. Duel na hřišti Dynama výrazně ovlivnila ztráta domácího kapitána Lukáše Sedláka, který ošklivě upadl hlavou na led po zásahu od obránce Martina Pláňka a zdravotníky byl následně odvezen na nosítkách. Výběr kouče Miloslava Hořavy sice nevyužil dlouhé přesilovky, ale krátce po jejím konci rozjel gólovou show Patrik Poulíček. Brankář Roman Will vychytal čisté konto.",en,Pardubice - Hradec 4: 0. Smooth return Dynamo to the lead. The loss of the farmer triggered an avalanche,"Pardubice hockey players in the third playoff semi -finals won 4: 0 over Hradec Králové and got into the lead 2: 1 for matches. The duel on the Dynamo playground was significantly influenced by the loss of home captain Lukáš Sedlák, who was ugly his head on the ice after the intervention of the defender Martin Pláňka and the medical workers were subsequently taken on a stretcher. The selection of coach Miloslav Hořava did not use long power plays, but shortly after its end, Patrik Poulíček scored a goal show. Goalkeeper Roman Will took a clean account.",2025-04-07 18:31:00
cz,"V Japonsku se do moře zřítila záchranářská helikoptéra, tři mrtví","Tři lidé zemřeli poté, co se v pondělí v Japonsku v prefektuře Nagasaki zřítila do moře helikoptéra letecké záchranné služby. Informuje o tom agentura AP, podle níž zbylí tři pasažéři přežili. Z helikoptéry se jim podařilo dostat a na pomoc vyčkali na nafukovacích plavidlech.",en,"In Japan, a rescue helicopter crashed into the sea, three dead",Three people died after Monday in Japan in Nagasaki prefecture collapsed into the sea of ​​the air rescue helicopter. The AP reports that the remaining three passengers survived. They managed to get out of the helicopter and waited for inflatable vessels to help.,2025-04-07 18:29:13
cz,"Padouchovi gratuloval i Pastrňák. Ovečkinův rekord rozděluje. Sportovně bomba, ale...","Kýžená meta padla. Národní hokejová liga žije nadšením okolo Alexe Ovečkina a jeho střeleckého rekordu, který stanovil 895. trefou v nedělním utkání s Islanders. Fanoušci, odborníci i hráči v zámoří odstřihli lidské nedostatky gólového velikána, který zároveň slouží jako jedna z velkých tváří propagace režimu diktátora Vladimira Putina. Ke gratulantům se přidaly i české hvězdy David Pastrňák a Radko Gudas. „Pro mou kariéru bylo skvělé, že jsem proti tobě hrál,“ řekl útočník Bostonu.",en,"Pastouch was also congratulated by Pastrňák. Ovechkin's record divides. Sports bomb, but ...","The desired meta fell. The National Hockey League lives with enthusiasm around Alex Ovechkin and his shooting record, which set the 895. He hit the Sunday match with Icelanders. Fans, experts and players overseas have cut off human shortcomings of a goal giant, who also serves as one of the great faces of promoting the regime of dictator Vladimir Putin. Czech stars David Pastrňák and Radko Gudas also joined the congratulators. ""It was great for my career that I was playing against you,"" Boston said.",2025-04-07 18:29:00
cz,ONLINE: Jihlava - Zlín 1:0. Dukla hraje o barážový mečbol. Do vedení ji poslal Menšík,Boj o postup do baráže o hokejovou Tipsport extraligu nabízí již čtvrtý duel finálové série Maxa ligy mezi Jihlavou a Zlínem. Dukla chce za stavu 2:1 v pelhřimovském azylu navázat na nedělní skalp Beranů a navýšit vedení. Povede se svěřencům kouče Viktora Ujčíka udělat další krok k cestě zpět do nejvyšší soutěže? ONLINE přenos utkání sledujte od 19:00 na webu iSport.,en,Online: Jihlava - Zlín 1: 0. Dukla plays for relegation sword. It was sent to the leadership by Menšík,The fight to advance to the hockey Tipsport Extraliga offers the fourth duel of the final series Maxa League between Jihlava and Zlín. Dukla wants to follow the Sunday scalp of the ram and increase the leadership in Pelhřimov asylum. Will the coaches of Viktor Ujčík lead to take another step back to the highest competition? Follow the online transfer of the match from 19:00 on the iBSport website.,2025-04-07 18:28:00
